AutoSchedule/Outputs/Ansor/tw_1024_1024_1024_ts128_spar90_1024_float32_gpu_trails2000.json
{"i": [["[\"tw_kernel\", 1024, 1024, 102, 128, 8, \"float32\"]", "cuda -keys=cuda,gpu -arch=sm_70 -max_num_threads=1024 -model=unknown -thread_warp_size=32", [-1, 16, 64, 49152, 2147483647, 1024, 8, 32], "", 0, ["mask_k"]], [[], [["CHW", 4, "local"], ["SP", 4, 0, 8, [1, 4, 1, 2], 1], ["SP", 4, 5, 128, [1, 2, 8, 1], 1], ["SP", 4, 10, 1024, [8, 64, 2, 1], 1], ["SP", 4, 15, 102, [1, 1], 1], ["RE", 4, [0, 5, 10, 1, 6, 11, 2, 7, 12, 15, 16, 3, 8, 13, 17, 4, 9, 14]], ["FSP", 5, 0, 1, 3], ["FSP", 5, 4, 2, 3], ["FSP", 5, 8, 3, 3], ["RE", 5, [0, 4, 8, 1, 5, 9, 2, 6, 10, 3, 7, 11]], ["CA", 4, 5, 8], ["CHR", 3, "shared", [4]], ["CA", 4, 5, 9], ["CHR", 2, "shared", [5]], ["CA", 3, 6, 9], ["CI", 2], ["FU", 7, [0, 1, 2]], ["AN", 7, 0, 5], ["FU", 7, [1, 2, 3]], ["AN", 7, 1, 4], ["FU", 7, [2, 3, 4]], ["AN", 7, 2, 6], ["FU", 5, [0, 1, 2]], ["SP", 5, 0, 128, [1], 1], ["AN", 5, 1, 2], ["FFSP", 5, 0, [3, 2, 1], 1, 1], ["AN", 5, 1, 6], ["FU", 3, [0, 1, 2]], ["SP", 3, 0, 16, [1], 1], ["AN", 3, 1, 2], ["FFSP", 3, 0, [3, 2, 1], 1, 1], ["AN", 3, 1, 6], ["PR", 6, 0, "auto_unroll_max_step$16"]]]], "r": [[0.00197819], 0, 2.45253, 1678617342], "v": "v0.6"}
{"i": [["[\"tw_kernel\", 1024, 1024, 102, 128, 8, \"float32\"]", "cuda -keys=cuda,gpu -arch=sm_70 -max_num_threads=1024 -model=unknown -thread_warp_size=32", [-1, 16, 64, 49152, 2147483647, 1024, 8, 32], "", 0, ["mask_k"]], [[], [["CHW", 4, "local"], ["SP", 4, 0, 8, [1, 4, 1, 1], 1], ["SP", 4, 5, 128, [4, 1, 1, 1], 1], ["SP", 4, 10, 1024, [2, 16, 2, 1], 1], ["SP", 4, 15, 102, [2, 1], 1], ["RE", 4, [0, 5, 10, 1, 6, 11, 2, 7, 12, 15, 16, 3, 8, 13, 17, 4, 9, 14]], ["FSP", 5, 0, 1, 3], ["FSP", 5, 4, 2, 3], ["FSP", 5, 8, 3, 3], ["RE", 5, [0, 4, 8, 1, 5, 9, 2, 6, 10, 3, 7, 11]], ["CA", 4, 5, 8], ["CHR", 3, "shared", [4]], ["CA", 4, 5, 9], ["CHR", 2, "shared", [5]], ["CA", 3, 6, 9], ["CI", 2], ["FU", 7, [0, 1, 2]], ["AN", 7, 0, 5], ["FU", 7, [1, 2, 3]], ["AN", 7, 1, 4], ["FU", 7, [2, 3, 4]], ["AN", 7, 2, 6], ["FU", 5, [0, 1, 2]], ["SP", 5, 0, 1, [1], 1], ["AN", 5, 1, 2], ["FFSP", 5, 0, [3, 2, 1], 1, 1], ["AN", 5, 1, 6], ["FU", 3, [0, 1, 2]], ["SP", 3, 0, 2, [1], 1], ["AN", 3, 1, 2], ["FFSP", 3, 0, [3, 2, 1], 1, 1], ["AN", 3, 1, 6], ["PR", 6, 0, "auto_unroll_max_step$1024"]]]], "r": [[6.92558e-05], 0, 1.69754, 1678617342], "v": "v0.6"}
{"i": [["[\"tw_kernel\", 1024, 1024, 102, 128, 8, \"float32\"]", "cuda -keys=cuda,gpu -arch=sm_70 -max_num_threads=1024 -model=unknown -thread_warp_size=32", [-1, 16, 64, 49152, 2147483647, 1024, 8, 32], "", 0, ["mask_k"]], [[], [["CHW", 4, "local"], ["SP", 4, 0, 8, [1, 1, 1, 1], 1], ["SP", 4, 5, 128, [4, 2, 1, 1], 1], ["SP", 4, 10, 1024, [2, 8, 2, 1], 1], ["SP", 4, 15, 102, [1, 1], 1], ["RE", 4, [0, 5, 10, 1, 6, 11, 2, 7, 12, 15, 16, 3, 8, 13, 17, 4, 9, 14]], ["FSP", 5, 0, 1, 3], ["FSP", 5, 4, 2, 3], ["FSP", 5, 8, 3, 3], ["RE", 5, [0, 4, 8, 1, 5, 9, 2, 6, 10, 3, 7, 11]], ["CA", 4, 5, 8], ["CHR", 3, "shared", [4]], ["CA", 4, 5, 9], ["CHR", 2, "shared", [5]], ["CA", 3, 6, 9], ["CI", 2], ["FU", 7, [0, 1, 2]], ["AN", 7, 0, 5], ["FU", 7, [1, 2, 3]], ["AN", 7, 1, 4], ["FU", 7, [2, 3, 4]], ["AN", 7, 2, 6], ["FU", 5, [0, 1, 2]], ["SP", 5, 0, 2, [1], 1], ["AN", 5, 1, 2], ["FFSP", 5, 0, [3, 2, 1], 1, 1], ["AN", 5, 1, 6], ["FU", 3, [0, 1, 2]], ["SP", 3, 0, 2, [1], 1], ["AN", 3, 1, 2], ["FFSP", 3, 0, [3, 2, 1], 1, 1], ["AN", 3, 1, 6], ["PR", 6, 0, "auto_unroll_max_step$512"]]]], "r": [[0.000114305], 0, 1.40302, 1678617342], "v": "v0.6"}
{"i": [["[\"tw_kernel\", 1024, 1024, 102, 128, 8, \"float32\"]", "cuda -keys=cuda,gpu -arch=sm_70 -max_num_threads=1024 -model=unknown -thread_warp_size=32", [-1, 16, 64, 49152, 2147483647, 1024, 8, 32], "", 0, ["mask_k"]], [[], [["CHW", 4, "local"], ["SP", 4, 0, 8, [1, 1, 2, 1], 1], ["SP", 4, 5, 128, [4, 32, 1, 1], 1], ["SP", 4, 10, 1024, [1, 1, 256, 2], 1], ["SP", 4, 15, 102, [1, 1], 1], ["RE", 4, [0, 5, 10, 1, 6, 11, 2, 7, 12, 15, 16, 3, 8, 13, 17, 4, 9, 14]], ["FSP", 5, 0, 1, 3], ["FSP", 5, 4, 2, 3], ["FSP", 5, 8, 3, 3], ["RE", 5, [0, 4, 8, 1, 5, 9, 2, 6, 10, 3, 7, 11]], ["CA", 4, 5, 8], ["CHR", 3, "shared", [4]], ["CA", 4, 5, 9], ["CHR", 2, "shared", [5]], ["CA", 3, 6, 9], ["CI", 2], ["FU", 7, [0, 1, 2]], ["AN", 7, 0, 5], ["FU", 7, [1, 2, 3]], ["AN", 7, 1, 4], ["FU", 7, [2, 3, 4]], ["AN", 7, 2, 6], ["FU", 5, [0, 1, 2]], ["SP", 5, 0, 2, [1], 1], ["AN", 5, 1, 2], ["FFSP", 5, 0, [3, 2, 1], 1, 1], ["AN", 5, 1, 6], ["FU", 3, [0, 1, 2]], ["SP", 3, 0, 256, [1], 1], ["AN", 3, 1, 2], ["FFSP", 3, 0, [3, 2, 1], 1, 1], ["AN", 3, 1, 6], ["PR", 6, 0, "auto_unroll_max_step$1024"]]]], "r": [[0.00571512], 0, 2.1845, 1678617343], "v": "v0.6"}
{"i": [["[\"tw_kernel\", 1024, 1024, 102, 128, 8, \"float32\"]", "cuda -keys=cuda,gpu -arch=sm_70 -max_num_threads=1024 -model=unknown -thread_warp_size=32", [-1, 16, 64, 49152, 2147483647, 1024, 8, 32], "", 0, ["mask_k"]], [[], [["CHW", 4, "local"], ["SP", 4, 0, 8, [1, 1, 2, 2], 1], ["SP", 4, 5, 128, [2, 2, 8, 1], 1], ["SP", 4, 10, 1024, [2, 32, 1, 2], 1], ["SP", 4, 15, 102, [2, 3], 1], ["RE", 4, [0, 5, 10, 1, 6, 11, 2, 7, 12, 15, 16, 3, 8, 13, 17, 4, 9, 14]], ["FSP", 5, 0, 1, 3], ["FSP", 5, 4, 2, 3], ["FSP", 5, 8, 3, 3], ["RE", 5, [0, 4, 8, 1, 5, 9, 2, 6, 10, 3, 7, 11]], ["CA", 4, 5, 8], ["CHR", 3, "shared", [4]], ["CA", 4, 5, 9], ["CHR", 2, "shared", [5]], ["CA", 3, 6, 9], ["CI", 2], ["FU", 7, [0, 1, 2]], ["AN", 7, 0, 5], ["FU", 7, [1, 2, 3]], ["AN", 7, 1, 4], ["FU", 7, [2, 3, 4]], ["AN", 7, 2, 6], ["FU", 5, [0, 1, 2]], ["SP", 5, 0, 192, [32], 1], ["AN", 5, 1, 2], ["FFSP", 5, 0, [3, 2, 1], 1, 1], ["AN", 5, 1, 6], ["FU", 3, [0, 1, 2]], ["SP", 3, 0, 48, [1], 1], ["AN", 3, 1, 2], ["FFSP", 3, 0, [3, 2, 1], 1, 1], ["AN", 3, 1, 6], ["PR", 6, 0, "auto_unroll_max_step$64"]]]], "r": [[0.000209949], 0, 4.16804, 1678617343], "v": "v0.6"}
{"i": [["[\"tw_kernel\", 1024, 1024, 102, 128, 8, \"float32\"]", "cuda -keys=cuda,gpu -arch=sm_70 -max_num_threads=1024 -model=unknown -thread_warp_size=32", [-1, 16, 64, 49152, 2147483647, 1024, 8, 32], "", 0, ["mask_k"]], [[], [["CHW", 4, "local"], ["SP", 4, 0, 8, [1, 4, 1, 1], 1], ["SP", 4, 5, 128, [1, 16, 1, 2], 1], ["SP", 4, 10, 1024, [2, 8, 1, 4], 1], ["SP", 4, 15, 102, [3, 1], 1], ["RE", 4, [0, 5, 10, 1, 6, 11, 2, 7, 12, 15, 16, 3, 8, 13, 17, 4, 9, 14]], ["FSP", 5, 0, 1, 3], ["FSP", 5, 4, 2, 3], ["FSP", 5, 8, 3, 3], ["RE", 5, [0, 4, 8, 1, 5, 9, 2, 6, 10, 3, 7, 11]], ["CA", 4, 5, 8], ["CHR", 3, "shared", [4]], ["CA", 4, 5, 9], ["CHR", 2, "shared", [5]], ["CA", 3, 6, 9], ["CI", 2], ["FU", 7, [0, 1, 2]], ["AN", 7, 0, 5], ["FU", 7, [1, 2, 3]], ["AN", 7, 1, 4], ["FU", 7, [2, 3, 4]], ["AN", 7, 2, 6], ["FU", 5, [0, 1, 2]], ["SP", 5, 0, 6, [1], 1], ["AN", 5, 1, 2], ["FFSP", 5, 0, [3, 2, 1], 1, 1], ["AN", 5, 1, 6], ["FU", 3, [0, 1, 2]], ["SP", 3, 0, 96, [1], 1], ["AN", 3, 1, 2], ["FFSP", 3, 0, [3, 2, 1], 1, 1], ["AN", 3, 1, 6], ["PR", 6, 0, "auto_unroll_max_step$64"]]]], "r": [[6.51684e-05], 0, 1.73511, 1678617343], "v": "v0.6"}
{"i": [["[\"tw_kernel\", 1024, 1024, 102, 128, 8, \"float32\"]", "cuda -keys=cuda,gpu -arch=sm_70 -max_num_threads=1024 -model=unknown -thread_warp_size=32", [-1, 16, 64, 49152, 2147483647, 1024, 8, 32], "", 0, ["mask_k"]], [[], [["CHW", 4, "local"], ["SP", 4, 0, 8, [1, 1, 2, 2], 1], ["SP", 4, 5, 128, [1, 32, 1, 4], 1], ["SP", 4, 10, 1024, [1, 2, 16, 8], 1], ["SP", 4, 15, 102, [1, 1], 1], ["RE", 4, [0, 5, 10, 1, 6, 11, 2, 7, 12, 15, 16, 3, 8, 13, 17, 4, 9, 14]], ["FSP", 5, 0, 1, 3], ["FSP", 5, 4, 2, 3], ["FSP", 5, 8, 3, 3], ["RE", 5, [0, 4, 8, 1, 5, 9, 2, 6, 10, 3, 7, 11]], ["CA", 4, 5, 8], ["CHR", 3, "shared", [4]], ["CA", 4, 5, 9], ["CHR", 2, "shared", [5]], ["CA", 3, 6, 9], ["CI", 2], ["FU", 7, [0, 1, 2]], ["AN", 7, 0, 5], ["FU", 7, [1, 2, 3]], ["AN", 7, 1, 4], ["FU", 7, [2, 3, 4]], ["AN", 7, 2, 6], ["FU", 5, [0, 1, 2]], ["SP", 5, 0, 16, [1], 1], ["AN", 5, 1, 2], ["FFSP", 5, 0, [3, 2, 1], 1, 1], ["AN", 5, 1, 6], ["FU", 3, [0, 1, 2]], ["SP", 3, 0, 1024, [4], 1], ["AN", 3, 1, 2], ["FFSP", 3, 0, [3, 2, 1], 1, 1], ["AN", 3, 1, 6], ["PR", 6, 0, "auto_unroll_max_step$0"]]]], "r": [[0.00270568], 0, 2.17259, 1678617344], "v": "v0.6"}
{"i": [["[\"tw_kernel\", 1024, 1024, 102, 128, 8, \"float32\"]", "cuda -keys=cuda,gpu -arch=sm_70 -max_num_threads=1024 -model=unknown -thread_warp_size=32", [-1, 16, 64, 49152, 2147483647, 1024, 8, 32], "", 0, ["mask_k"]], [[], [["CHW", 4, "local"], ["SP", 4, 0, 8, [1, 1, 2, 2], 1], ["SP", 4, 5, 128, [1, 32, 2, 1], 1], ["SP", 4, 10, 1024, [1, 2, 16, 8], 1], ["SP", 4, 15, 102, [1, 6], 1], ["RE", 4, [0, 5, 10, 1, 6, 11, 2, 7, 12, 15, 16, 3, 8, 13, 17, 4, 9, 14]], ["FSP", 5, 0, 1, 3], ["FSP", 5, 4, 2, 3], ["FSP", 5, 8, 3, 3], ["RE", 5, [0, 4, 8, 1, 5, 9, 2, 6, 10, 3, 7, 11]], ["CA", 4, 5, 8], ["CHR", 3, "shared", [4]], ["CA", 4, 5, 9], ["CHR", 2, "shared", [5]], ["CA", 3, 6, 9], ["CI", 2], ["FU", 7, [0, 1, 2]], ["AN", 7, 0, 5], ["FU", 7, [1, 2, 3]], ["AN", 7, 1, 4], ["FU", 7, [2, 3, 4]], ["AN", 7, 2, 6], ["FU", 5, [0, 1, 2]], ["SP", 5, 0, 16, [1], 1], ["AN", 5, 1, 2], ["FFSP", 5, 0, [3, 2, 1], 1, 1], ["AN", 5, 1, 6], ["FU", 3, [0, 1, 2]], ["SP", 3, 0, 1024, [1], 1], ["AN", 3, 1, 2], ["FFSP", 3, 0, [3, 2, 1], 1, 1], ["AN", 3, 1, 6], ["PR", 6, 0, "auto_unroll_max_step$64"]]]], "r": [[0.000727926], 0, 4.13039, 1678617344], "v": "v0.6"}
{"i": [["[\"tw_kernel\", 1024, 1024, 102, 128, 8, \"float32\"]", "cuda -keys=cuda,gpu -arch=sm_70 -max_num_threads=1024 -model=unknown -thread_warp_size=32", [-1, 16, 64, 49152, 2147483647, 1024, 8, 32], "", 0, ["mask_k"]], [[], [["CHW", 4, "local"], ["SP", 4, 0, 8, [1, 4, 1, 1], 1], ["SP", 4, 5, 128, [8, 4, 2, 1], 1], ["SP", 4, 10, 1024, [1, 2, 1, 4], 1], ["SP", 4, 15, 102, [1, 1], 1], ["RE", 4, [0, 5, 10, 1, 6, 11, 2, 7, 12, 15, 16, 3, 8, 13, 17, 4, 9, 14]], ["FSP", 5, 0, 1, 3], ["FSP", 5, 4, 2, 3], ["FSP", 5, 8, 3, 3], ["RE", 5, [0, 4, 8, 1, 5, 9, 2, 6, 10, 3, 7, 11]], ["CA", 4, 5, 8], ["CHR", 3, "shared", [4]], ["CA", 4, 5, 9], ["CHR", 2, "shared", [5]], ["CA", 3, 6, 9], ["CI", 2], ["FU", 7, [0, 1, 2]], ["AN", 7, 0, 5], ["FU", 7, [1, 2, 3]], ["AN", 7, 1, 4], ["FU", 7, [2, 3, 4]], ["AN", 7, 2, 6], ["FU", 5, [0, 1, 2]], ["SP", 5, 0, 16, [1], 1], ["AN", 5, 1, 2], ["FFSP", 5, 0, [3, 2, 1], 1, 1], ["AN", 5, 1, 6], ["FU", 3, [0, 1, 2]], ["SP", 3, 0, 8, [1], 1], ["AN", 3, 1, 2], ["FFSP", 3, 0, [3, 2, 1], 1, 1], ["AN", 3, 1, 6], ["PR", 6, 0, "auto_unroll_max_step$1024"]]]], "r": [[0.000169181], 0, 1.62244, 1678617344], "v": "v0.6"}
{"i": [["[\"tw_kernel\", 1024, 1024, 102, 128, 8, \"float32\"]", "cuda -keys=cuda,gpu -arch=sm_70 -max_num_threads=1024 -model=unknown -thread_warp_size=32", [-1, 16, 64, 49152, 2147483647, 1024, 8, 32], "", 0, ["mask_k"]], [[], [["CHW", 4, "local"], ["SP", 4, 0, 8, [1, 2, 1, 1], 1], ["SP", 4, 5, 128, [4, 8, 4, 1], 1], ["SP", 4, 10, 1024, [2, 2, 256, 1], 1], ["SP", 4, 15, 102, [2, 1], 1], ["RE", 4, [0, 5, 10, 1, 6, 11, 2, 7, 12, 15, 16, 3, 8, 13, 17, 4, 9, 14]], ["FSP", 5, 0, 1, 3], ["FSP", 5, 4, 2, 3], ["FSP", 5, 8, 3, 3], ["RE", 5, [0, 4, 8, 1, 5, 9, 2, 6, 10, 3, 7, 11]], ["CA", 4, 5, 8], ["CHR", 3, "shared", [4]], ["CA", 4, 5, 9], ["CHR", 2, "shared", [5]], ["CA", 3, 6, 9], ["CI", 2], ["FU", 7, [0, 1, 2]], ["AN", 7, 0, 5], ["FU", 7, [1, 2, 3]], ["AN", 7, 1, 4], ["FU", 7, [2, 3, 4]], ["AN", 7, 2, 6], ["FU", 5, [0, 1, 2]], ["SP", 5, 0, 8, [1], 1], ["AN", 5, 1, 2], ["FFSP", 5, 0, [3, 2, 1], 1, 1], ["AN", 5, 1, 6], ["FU", 3, [0, 1, 2]], ["SP", 3, 0, 512, [1], 1], ["AN", 3, 1, 2], ["FFSP", 3, 0, [3, 2, 1], 1, 1], ["AN", 3, 1, 6], ["PR", 6, 0, "auto_unroll_max_step$64"]]]], "r": [[0.0139486], 0, 2.01859, 1678617345], "v": "v0.6"}
{"i": [["[\"tw_kernel\", 1024, 1024, 102, 128, 8, \"float32\"]", "cuda -keys=cuda,gpu -arch=sm_70 -max_num_threads=1024 -model=unknown -thread_warp_size=32", [-1, 16, 64, 49152, 2147483647, 1024, 8, 32], "", 0, ["mask_k"]], [[], [["CHW", 4, "local"], ["SP", 4, 0, 8, [1, 2, 4, 1], 1], ["SP", 4, 5, 128, [2, 16, 4, 1], 1], ["SP", 4, 10, 1024, [1, 1, 16, 16], 1], ["SP", 4, 15, 102, [1, 1], 1], ["RE", 4, [0, 5, 10, 1, 6, 11, 2, 7, 12, 15, 16, 3, 8, 13, 17, 4, 9, 14]], ["FSP", 5, 0, 1, 3], ["FSP", 5, 4, 2, 3], ["FSP", 5, 8, 3, 3], ["RE", 5, [0, 4, 8, 1, 5, 9, 2, 6, 10, 3, 7, 11]], ["CA", 4, 5, 8], ["CHR", 3, "shared", [4]], ["CA", 4, 5, 9], ["CHR", 2, "shared", [5]], ["CA", 3, 6, 9], ["CI", 2], ["FU", 7, [0, 1, 2]], ["AN", 7, 0, 5], ["FU", 7, [1, 2, 3]], ["AN", 7, 1, 4], ["FU", 7, [2, 3, 4]], ["AN", 7, 2, 6], ["FU", 5, [0, 1, 2]], ["SP", 5, 0, 16, [1], 1], ["AN", 5, 1, 2], ["FFSP", 5, 0, [3, 2, 1], 1, 1], ["AN", 5, 1, 6], ["FU", 3, [0, 1, 2]], ["SP", 3, 0, 512, [1], 1], ["AN", 3, 1, 2], ["FFSP", 3, 0, [3, 2, 1], 1, 1], ["AN", 3, 1, 6], ["PR", 6, 0, "auto_unroll_max_step$0"]]]], "r": [[0.0100955], 0, 3.8387, 1678617345], "v": "v0.6"}
{"i": [["[\"tw_kernel\", 1024, 1024, 102, 128, 8, \"float32\"]", "cuda -keys=cuda,gpu -arch=sm_70 -max_num_threads=1024 -model=unknown -thread_warp_size=32", [-1, 16, 64, 49152, 2147483647, 1024, 8, 32], "", 0, ["mask_k"]], [[], [["CHW", 4, "local"], ["SP", 4, 0, 8, [1, 1, 1, 2], 1], ["SP", 4, 5, 128, [1, 8, 8, 1], 1], ["SP", 4, 10, 1024, [1, 8, 1, 2], 1], ["SP", 4, 15, 102, [2, 3], 1], ["RE", 4, [0, 5, 10, 1, 6, 11, 2, 7, 12, 15, 16, 3, 8, 13, 17, 4, 9, 14]], ["FSP", 5, 0, 1, 3], ["FSP", 5, 4, 2, 3], ["FSP", 5, 8, 3, 3], ["RE", 5, [0, 4, 8, 1, 5, 9, 2, 6, 10, 3, 7, 11]], ["CA", 4, 5, 8], ["CHR", 3, "shared", [4]], ["CA", 4, 5, 9], ["CHR", 2, "shared", [5]], ["CA", 3, 6, 9], ["CI", 2], ["FU", 7, [0, 1, 2]], ["AN", 7, 0, 5], ["FU", 7, [1, 2, 3]], ["AN", 7, 1, 4], ["FU", 7, [2, 3, 4]], ["AN", 7, 2, 6], ["FU", 5, [0, 1, 2]], ["SP", 5, 0, 192, [1], 1], ["AN", 5, 1, 2], ["FFSP", 5, 0, [3, 2, 1], 1, 1], ["AN", 5, 1, 6], ["FU", 3, [0, 1, 2]], ["SP", 3, 0, 48, [1], 1], ["AN", 3, 1, 2], ["FFSP", 3, 0, [3, 2, 1], 1, 1], ["AN", 3, 1, 6], ["PR", 6, 0, "auto_unroll_max_step$64"]]]], "r": [[4.786e-05], 0, 1.36905, 1678617345], "v": "v0.6"}
{"i": [["[\"tw_kernel\", 1024, 1024, 102, 128, 8, \"float32\"]", "cuda -keys=cuda,gpu -arch=sm_70 -max_num_threads=1024 -model=unknown -thread_warp_size=32", [-1, 16, 64, 49152, 2147483647, 1024, 8, 32], "", 0, ["mask_k"]], [[], [["CHW", 4, "local"], ["SP", 4, 0, 8, [2, 1, 1, 2], 1], ["SP", 4, 5, 128, [2, 2, 4, 4], 1], ["SP", 4, 10, 1024, [1, 64, 2, 2], 1], ["SP", 4, 15, 102, [1, 1], 1], ["RE", 4, [0, 5, 10, 1, 6, 11, 2, 7, 12, 15, 16, 3, 8, 13, 17, 4, 9, 14]], ["FSP", 5, 0, 1, 3], ["FSP", 5, 4, 2, 3], ["FSP", 5, 8, 3, 3], ["RE", 5, [0, 4, 8, 1, 5, 9, 2, 6, 10, 3, 7, 11]], ["CA", 4, 5, 8], ["CHR", 3, "shared", [4]], ["CA", 4, 5, 9], ["CHR", 2, "shared", [5]], ["CA", 3, 6, 9], ["CI", 2], ["FU", 7, [0, 1, 2]], ["AN", 7, 0, 5], ["FU", 7, [1, 2, 3]], ["AN", 7, 1, 4], ["FU", 7, [2, 3, 4]], ["AN", 7, 2, 6], ["FU", 5, [0, 1, 2]], ["SP", 5, 0, 32, [4], 1], ["AN", 5, 1, 2], ["FFSP", 5, 0, [3, 2, 1], 1, 1], ["AN", 5, 1, 6], ["FU", 3, [0, 1, 2]], ["SP", 3, 0, 8, [2], 1], ["AN", 3, 1, 2], ["FFSP", 3, 0, [3, 2, 1], 1, 1], ["AN", 3, 1, 6], ["PR", 6, 0, "auto_unroll_max_step$1024"]]]], "r": [[0.0025654], 0, 4.4633, 1678617346], "v": "v0.6"}
{"i": [["[\"tw_kernel\", 1024, 1024, 102, 128, 8, \"float32\"]", "cuda -keys=cuda,gpu -arch=sm_70 -max_num_threads=1024 -model=unknown -thread_warp_size=32", [-1, 16, 64, 49152, 2147483647, 1024, 8, 32], "", 0, ["mask_k"]], [[], [["CHW", 4, "local"], ["SP", 4, 0, 8, [2, 4, 1, 1], 1], ["SP", 4, 5, 128, [1, 32, 1, 2], 1], ["SP", 4, 10, 1024, [2, 1, 2, 1], 1], ["SP", 4, 15, 102, [1, 6], 1], ["RE", 4, [0, 5, 10, 1, 6, 11, 2, 7, 12, 15, 16, 3, 8, 13, 17, 4, 9, 14]], ["FSP", 5, 0, 1, 3], ["FSP", 5, 4, 2, 3], ["FSP", 5, 8, 3, 3], ["RE", 5, [0, 4, 8, 1, 5, 9, 2, 6, 10, 3, 7, 11]], ["CA", 4, 5, 8], ["CHR", 3, "shared", [4]], ["CA", 4, 5, 9], ["CHR", 2, "shared", [5]], ["CA", 3, 6, 9], ["CI", 2], ["FU", 7, [0, 1, 2]], ["AN", 7, 0, 5], ["FU", 7, [1, 2, 3]], ["AN", 7, 1, 4], ["FU", 7, [2, 3, 4]], ["AN", 7, 2, 6], ["FU", 5, [0, 1, 2]], ["SP", 5, 0, 3, [1], 1], ["AN", 5, 1, 2], ["FFSP", 5, 0, [3, 2, 1], 1, 1], ["AN", 5, 1, 6], ["FU", 3, [0, 1, 2]], ["SP", 3, 0, 6, [1], 1], ["AN", 3, 1, 2], ["FFSP", 3, 0, [3, 2, 1], 1, 1], ["AN", 3, 1, 6], ["PR", 6, 0, "auto_unroll_max_step$64"]]]], "r": [[0.00016221], 0, 1.29321, 1678617346], "v": "v0.6"}
{"i": [["[\"tw_kernel\", 1024, 1024, 102, 128, 8, \"float32\"]", "cuda -keys=cuda,gpu -arch=sm_70 -max_num_threads=1024 -model=unknown -thread_warp_size=32", [-1, 16, 64, 49152, 2147483647, 1024, 8, 32], "", 0, ["mask_k"]], [[], [["CHW", 4, "local"], ["SP", 4, 0, 8, [1, 8, 1, 1], 1], ["SP", 4, 5, 128, [1, 2, 4, 1], 1], ["SP", 4, 10, 1024, [1, 8, 1, 1], 1], ["SP", 4, 15, 102, [6, 1], 1], ["RE", 4, [0, 5, 10, 1, 6, 11, 2, 7, 12, 15, 16, 3, 8, 13, 17, 4, 9, 14]], ["FSP", 5, 0, 1, 3], ["FSP", 5, 4, 2, 3], ["FSP", 5, 8, 3, 3], ["RE", 5, [0, 4, 8, 1, 5, 9, 2, 6, 10, 3, 7, 11]], ["CA", 4, 5, 8], ["CHR", 3, "shared", [4]], ["CA", 4, 5, 9], ["CHR", 2, "shared", [5]], ["CA", 3, 6, 9], ["CI", 2], ["FU", 7, [0, 1, 2]], ["AN", 7, 0, 5], ["FU", 7, [1, 2, 3]], ["AN", 7, 1, 4], ["FU", 7, [2, 3, 4]], ["AN", 7, 2, 6], ["FU", 5, [0, 1, 2]], ["SP", 5, 0, 24, [8], 1], ["AN", 5, 1, 2], ["FFSP", 5, 0, [3, 2, 1], 1, 1], ["AN", 5, 1, 6], ["FU", 3, [0, 1, 2]], ["SP", 3, 0, 6, [1], 1], ["AN", 3, 1, 2], ["FFSP", 3, 0, [3, 2, 1], 1, 1], ["AN", 3, 1, 6], ["PR", 6, 0, "auto_unroll_max_step$0"]]]], "r": [[0.000155381], 0, 1.227, 1678617346], "v": "v0.6"}
{"i": [["[\"tw_kernel\", 1024, 1024, 102, 128, 8, \"float32\"]", "cuda -keys=cuda,gpu -arch=sm_70 -max_num_threads=1024 -model=unknown -thread_warp_size=32", [-1, 16, 64, 49152, 2147483647, 1024, 8, 32], "", 0, ["mask_k"]], [[], [["CHW", 4, "local"], ["SP", 4, 0, 8, [2, 1, 1, 1], 1], ["SP", 4, 5, 128, [2, 16, 1, 2], 1], ["SP", 4, 10, 1024, [1, 64, 4, 1], 1], ["SP", 4, 15, 102, [3, 1], 1], ["RE", 4, [0, 5, 10, 1, 6, 11, 2, 7, 12, 15, 16, 3, 8, 13, 17, 4, 9, 14]], ["FSP", 5, 0, 1, 3], ["FSP", 5, 4, 2, 3], ["FSP", 5, 8, 3, 3], ["RE", 5, [0, 4, 8, 1, 5, 9, 2, 6, 10, 3, 7, 11]], ["CA", 4, 5, 8], ["CHR", 3, "shared", [4]], ["CA", 4, 5, 9], ["CHR", 2, "shared", [5]], ["CA", 3, 6, 9], ["CI", 2], ["FU", 7, [0, 1, 2]], ["AN", 7, 0, 5], ["FU", 7, [1, 2, 3]], ["AN", 7, 1, 4], ["FU", 7, [2, 3, 4]], ["AN", 7, 2, 6], ["FU", 5, [0, 1, 2]], ["SP", 5, 0, 6, [1], 1], ["AN", 5, 1, 2], ["FFSP", 5, 0, [3, 2, 1], 1, 1], ["AN", 5, 1, 6], ["FU", 3, [0, 1, 2]], ["SP", 3, 0, 3, [3], 1], ["AN", 3, 1, 2], ["FFSP", 3, 0, [3, 2, 1], 1, 1], ["AN", 3, 1, 6], ["PR", 6, 0, "auto_unroll_max_step$512"]]]], "r": [[0.00010854], 0, 1.27436, 1678617347], "v": "v0.6"}
{"i": [["[\"tw_kernel\", 1024, 1024, 102, 128, 8, \"float32\"]", "cuda -keys=cuda,gpu -arch=sm_70 -max_num_threads=1024 -model=unknown -thread_warp_size=32", [-1, 16, 64, 49152, 2147483647, 1024, 8, 32], "", 0, ["mask_k"]], [[], [["CHW", 4, "local"], ["SP", 4, 0, 8, [2, 2, 1, 1], 1], ["SP", 4, 5, 128, [2, 2, 4, 8], 1], ["SP", 4, 10, 1024, [1, 64, 4, 2], 1], ["SP", 4, 15, 102, [3, 1], 1], ["RE", 4, [0, 5, 10, 1, 6, 11, 2, 7, 12, 15, 16, 3, 8, 13, 17, 4, 9, 14]], ["FSP", 5, 0, 1, 3], ["FSP", 5, 4, 2, 3], ["FSP", 5, 8, 3, 3], ["RE", 5, [0, 4, 8, 1, 5, 9, 2, 6, 10, 3, 7, 11]], ["CA", 4, 5, 8], ["CHR", 3, "shared", [4]], ["CA", 4, 5, 9], ["CHR", 2, "shared", [5]], ["CA", 3, 6, 9], ["CI", 2], ["FU", 7, [0, 1, 2]], ["AN", 7, 0, 5], ["FU", 7, [1, 2, 3]], ["AN", 7, 1, 4], ["FU", 7, [2, 3, 4]], ["AN", 7, 2, 6], ["FU", 5, [0, 1, 2]], ["SP", 5, 0, 192, [64], 1], ["AN", 5, 1, 2], ["FFSP", 5, 0, [3, 2, 1], 1, 1], ["AN", 5, 1, 6], ["FU", 3, [0, 1, 2]], ["SP", 3, 0, 48, [1], 1], ["AN", 3, 1, 2], ["FFSP", 3, 0, [3, 2, 1], 1, 1], ["AN", 3, 1, 6], ["PR", 6, 0, "auto_unroll_max_step$1024"]]]], "r": [[0.00565712], 0, 9.14841, 1678617347], "v": "v0.6"}
{"i": [["[\"tw_kernel\", 1024, 1024, 102, 128, 8, \"float32\"]", "cuda -keys=cuda,gpu -arch=sm_70 -max_num_threads=1024 -model=unknown -thread_warp_size=32", [-1, 16, 64, 49152, 2147483647, 1024, 8, 32], "", 0, ["mask_k"]], [[], [["CHW", 4, "local"], ["SP", 4, 0, 8, [1, 1, 2, 4], 1], ["SP", 4, 5, 128, [1, 4, 8, 1], 1], ["SP", 4, 10, 1024, [2, 8, 1, 2], 1], ["SP", 4, 15, 102, [2, 3], 1], ["RE", 4, [0, 5, 10, 1, 6, 11, 2, 7, 12, 15, 16, 3, 8, 13, 17, 4, 9, 14]], ["FSP", 5, 0, 1, 3], ["FSP", 5, 4, 2, 3], ["FSP", 5, 8, 3, 3], ["RE", 5, [0, 4, 8, 1, 5, 9, 2, 6, 10, 3, 7, 11]], ["CA", 4, 5, 8], ["CHR", 3, "shared", [4]], ["CA", 4, 5, 9], ["CHR", 2, "shared", [5]], ["CA", 3, 6, 9], ["CI", 2], ["FU", 7, [0, 1, 2]], ["AN", 7, 0, 5], ["FU", 7, [1, 2, 3]], ["AN", 7, 1, 4], ["FU", 7, [2, 3, 4]], ["AN", 7, 2, 6], ["FU", 5, [0, 1, 2]], ["SP", 5, 0, 192, [3], 1], ["AN", 5, 1, 2], ["FFSP", 5, 0, [3, 2, 1], 1, 1], ["AN", 5, 1, 6], ["FU", 3, [0, 1, 2]], ["SP", 3, 0, 48, [1], 1], ["AN", 3, 1, 2], ["FFSP", 3, 0, [3, 2, 1], 1, 1], ["AN", 3, 1, 6], ["PR", 6, 0, "auto_unroll_max_step$64"]]]], "r": [[0.000447011], 0, 3.34288, 1678617347], "v": "v0.6"}
{"i": [["[\"tw_kernel\", 1024, 1024, 102, 128, 8, \"float32\"]", "cuda -keys=cuda,gpu -arch=sm_70 -max_num_threads=1024 -model=unknown -thread_warp_size=32", [-1, 16, 64, 49152, 2147483647, 1024, 8, 32], "", 0, ["mask_k"]], [[], [["CHW", 4, "local"], ["SP", 4, 0, 8, [1, 2, 1, 1], 1], ["SP", 4, 5, 128, [1, 16, 1, 8], 1], ["SP", 4, 10, 1024, [2, 1, 4, 1], 1], ["SP", 4, 15, 102, [1, 1], 1], ["RE", 4, [0, 5, 10, 1, 6, 11, 2, 7, 12, 15, 16, 3, 8, 13, 17, 4, 9, 14]], ["FSP", 5, 0, 1, 3], ["FSP", 5, 4, 2, 3], ["FSP", 5, 8, 3, 3], ["RE", 5, [0, 4, 8, 1, 5, 9, 2, 6, 10, 3, 7, 11]], ["CA", 4, 5, 8], ["CHR", 3, "shared", [4]], ["CA", 4, 5, 9], ["CHR", 2, "shared", [5]], ["CA", 3, 6, 9], ["CI", 2], ["FU", 7, [0, 1, 2]], ["AN", 7, 0, 5], ["FU", 7, [1, 2, 3]], ["AN", 7, 1, 4], ["FU", 7, [2, 3, 4]], ["AN", 7, 2, 6], ["FU", 5, [0, 1, 2]], ["SP", 5, 0, 8, [1], 1], ["AN", 5, 1, 2], ["FFSP", 5, 0, [3, 2, 1], 1, 1], ["AN", 5, 1, 6], ["FU", 3, [0, 1, 2]], ["SP", 3, 0, 1, [1], 1], ["AN", 3, 1, 2], ["FFSP", 3, 0, [3, 2, 1], 1, 1], ["AN", 3, 1, 6], ["PR", 6, 0, "auto_unroll_max_step$1024"]]]], "r": [[0.000182741], 0, 1.61376, 1678617348], "v": "v0.6"}
{"i": [["[\"tw_kernel\", 1024, 1024, 102, 128, 8, \"float32\"]", "cuda -keys=cuda,gpu -arch=sm_70 -max_num_threads=1024 -model=unknown -thread_warp_size=32", [-1, 16, 64, 49152, 2147483647, 1024, 8, 32], "", 0, ["mask_k"]], [[], [["CHW", 4, "local"], ["SP", 4, 0, 8, [1, 8, 1, 1], 1], ["SP", 4, 5, 128, [1, 2, 4, 1], 1], ["SP", 4, 10, 1024, [1, 8, 1, 1], 1], ["SP", 4, 15, 102, [6, 1], 1], ["RE", 4, [0, 5, 10, 1, 6, 11, 2, 7, 12, 15, 16, 3, 8, 13, 17, 4, 9, 14]], ["FSP", 5, 0, 1, 3], ["FSP", 5, 4, 2, 3], ["FSP", 5, 8, 3, 3], ["RE", 5, [0, 4, 8, 1, 5, 9, 2, 6, 10, 3, 7, 11]], ["CA", 4, 5, 8], ["CHR", 3, "shared", [4]], ["CA", 4, 5, 9], ["CHR", 2, "shared", [5]], ["CA", 3, 6, 9], ["CI", 2], ["FU", 7, [0, 1, 2]], ["AN", 7, 0, 5], ["FU", 7, [1, 2, 3]], ["AN", 7, 1, 4], ["FU", 7, [2, 3, 4]], ["AN", 7, 2, 6], ["FU", 5, [0, 1, 2]], ["SP", 5, 0, 24, [1], 1], ["AN", 5, 1, 2], ["FFSP", 5, 0, [3, 2, 1], 1, 1], ["AN", 5, 1, 6], ["FU", 3, [0, 1, 2]], ["SP", 3, 0, 6, [1], 1], ["AN", 3, 1, 2], ["FFSP", 3, 0, [3, 2, 1], 1, 1], ["AN", 3, 1, 6], ["PR", 6, 0, "auto_unroll_max_step$0"]]]], "r": [[8.11273e-05], 0, 1.25184, 1678617348], "v": "v0.6"}
{"i": [["[\"tw_kernel\", 1024, 1024, 102, 128, 8, \"float32\"]", "cuda -keys=cuda,gpu -arch=sm_70 -max_num_threads=1024 -model=unknown -thread_warp_size=32", [-1, 16, 64, 49152, 2147483647, 1024, 8, 32], "", 0, ["mask_k"]], [[], [["CHW", 4, "local"], ["SP", 4, 0, 8, [2, 1, 2, 2], 1], ["SP", 4, 5, 128, [4, 16, 1, 2], 1], ["SP", 4, 10, 1024, [1, 16, 2, 2], 1], ["SP", 4, 15, 102, [1, 3], 1], ["RE", 4, [0, 5, 10, 1, 6, 11, 2, 7, 12, 15, 16, 3, 8, 13, 17, 4, 9, 14]], ["FSP", 5, 0, 1, 3], ["FSP", 5, 4, 2, 3], ["FSP", 5, 8, 3, 3], ["RE", 5, [0, 4, 8, 1, 5, 9, 2, 6, 10, 3, 7, 11]], ["CA", 4, 5, 8], ["CHR", 3, "shared", [4]], ["CA", 4, 5, 9], ["CHR", 2, "shared", [5]], ["CA", 3, 6, 9], ["CI", 2], ["FU", 7, [0, 1, 2]], ["AN", 7, 0, 5], ["FU", 7, [1, 2, 3]], ["AN", 7, 1, 4], ["FU", 7, [2, 3, 4]], ["AN", 7, 2, 6], ["FU", 5, [0, 1, 2]], ["SP", 5, 0, 24, [1], 1], ["AN", 5, 1, 2], ["FFSP", 5, 0, [3, 2, 1], 1, 1], ["AN", 5, 1, 6], ["FU", 3, [0, 1, 2]], ["SP", 3, 0, 48, [1], 1], ["AN", 3, 1, 2], ["FFSP", 3, 0, [3, 2, 1], 1, 1], ["AN", 3, 1, 6], ["PR", 6, 0, "auto_unroll_max_step$512"]]]], "r": [[0.000209364], 0, 6.82502, 1678617348], "v": "v0.6"}
{"i": [["[\"tw_kernel\", 1024, 1024, 102, 128, 8, \"float32\"]", "cuda -keys=cuda,gpu -arch=sm_70 -max_num_threads=1024 -model=unknown -thread_warp_size=32", [-1, 16, 64, 49152, 2147483647, 1024, 8, 32], "", 0, ["mask_k"]], [[], [["CHW", 4, "local"], ["SP", 4, 0, 8, [1, 1, 1, 2], 1], ["SP", 4, 5, 128, [1, 64, 1, 2], 1], ["SP", 4, 10, 1024, [8, 1, 1, 8], 1], ["SP", 4, 15, 102, [1, 1], 1], ["RE", 4, [0, 5, 10, 1, 6, 11, 2, 7, 12, 15, 16, 3, 8, 13, 17, 4, 9, 14]], ["FSP", 5, 0, 1, 3], ["FSP", 5, 4, 2, 3], ["FSP", 5, 8, 3, 3], ["RE", 5, [0, 4, 8, 1, 5, 9, 2, 6, 10, 3, 7, 11]], ["CA", 4, 5, 8], ["CHR", 3, "shared", [4]], ["CA", 4, 5, 9], ["CHR", 2, "shared", [5]], ["CA", 3, 6, 9], ["CI", 2], ["FU", 7, [0, 1, 2]], ["AN", 7, 0, 5], ["FU", 7, [1, 2, 3]], ["AN", 7, 1, 4], ["FU", 7, [2, 3, 4]], ["AN", 7, 2, 6], ["FU", 5, [0, 1, 2]], ["SP", 5, 0, 68, [1], 1], ["AN", 5, 1, 2], ["FFSP", 5, 0, [3, 2, 1], 1, 1], ["AN", 5, 1, 6], ["FU", 3, [0, 1, 2]], ["SP", 3, 0, 272, [1], 1], ["AN", 3, 1, 2], ["FFSP", 3, 0, [3, 2, 1], 1, 1], ["AN", 3, 1, 6], ["PR", 6, 0, "auto_unroll_max_step$512"]]]], "r": [[0.000185835], 0, 2.04212, 1678617349], "v": "v0.6"}
{"i": [["[\"tw_kernel\", 1024, 1024, 102, 128, 8, \"float32\"]", "cuda -keys=cuda,gpu -arch=sm_70 -max_num_threads=1024 -model=unknown -thread_warp_size=32", [-1, 16, 64, 49152, 2147483647, 1024, 8, 32], "", 0, ["mask_k"]], [[], [["CHW", 4, "local"], ["SP", 4, 0, 8, [1, 1, 2, 4], 1], ["SP", 4, 5, 128, [1, 4, 4, 1], 1], ["SP", 4, 10, 1024, [1, 16, 8, 4], 1], ["SP", 4, 15, 102, [1, 1], 1], ["RE", 4, [0, 5, 10, 1, 6, 11, 2, 7, 12, 15, 16, 3, 8, 13, 17, 4, 9, 14]], ["FSP", 5, 0, 1, 3], ["FSP", 5, 4, 2, 3], ["FSP", 5, 8, 3, 3], ["RE", 5, [0, 4, 8, 1, 5, 9, 2, 6, 10, 3, 7, 11]], ["CA", 4, 5, 8], ["CHR", 3, "shared", [4]], ["CA", 4, 5, 9], ["CHR", 2, "shared", [5]], ["CA", 3, 6, 9], ["CI", 2], ["FU", 7, [0, 1, 2]], ["AN", 7, 0, 5], ["FU", 7, [1, 2, 3]], ["AN", 7, 1, 4], ["FU", 7, [2, 3, 4]], ["AN", 7, 2, 6], ["FU", 5, [0, 1, 2]], ["SP", 5, 0, 64, [1], 1], ["AN", 5, 1, 2], ["FFSP", 5, 0, [3, 2, 1], 1, 1], ["AN", 5, 1, 6], ["FU", 3, [0, 1, 2]], ["SP", 3, 0, 256, [1], 1], ["AN", 3, 1, 2], ["FFSP", 3, 0, [3, 2, 1], 1, 1], ["AN", 3, 1, 6], ["PR", 6, 0, "auto_unroll_max_step$64"]]]], "r": [[0.00260216], 0, 4.17752, 1678617349], "v": "v0.6"}
{"i": [["[\"tw_kernel\", 1024, 1024, 102, 128, 8, \"float32\"]", "cuda -keys=cuda,gpu -arch=sm_70 -max_num_threads=1024 -model=unknown -thread_warp_size=32", [-1, 16, 64, 49152, 2147483647, 1024, 8, 32], "", 0, ["mask_k"]], [[], [["CHW", 4, "local"], ["SP", 4, 0, 8, [2, 4, 1, 1], 1], ["SP", 4, 5, 128, [1, 8, 16, 1], 1], ["SP", 4, 10, 1024, [4, 1, 1, 16], 1], ["SP", 4, 15, 102, [1, 1], 1], ["RE", 4, [0, 5, 10, 1, 6, 11, 2, 7, 12, 15, 16, 3, 8, 13, 17, 4, 9, 14]], ["FSP", 5, 0, 1, 3], ["FSP", 5, 4, 2, 3], ["FSP", 5, 8, 3, 3], ["RE", 5, [0, 4, 8, 1, 5, 9, 2, 6, 10, 3, 7, 11]], ["CA", 4, 5, 8], ["CHR", 3, "shared", [4]], ["CA", 4, 5, 9], ["CHR", 2, "shared", [5]], ["CA", 3, 6, 9], ["CI", 2], ["FU", 7, [0, 1, 2]], ["AN", 7, 0, 5], ["FU", 7, [1, 2, 3]], ["AN", 7, 1, 4], ["FU", 7, [2, 3, 4]], ["AN", 7, 2, 6], ["FU", 5, [0, 1, 2]], ["SP", 5, 0, 1, [1], 1], ["AN", 5, 1, 2], ["FFSP", 5, 0, [3, 2, 1], 1, 1], ["AN", 5, 1, 6], ["FU", 3, [0, 1, 2]], ["SP", 3, 0, 16, [4], 1], ["AN", 3, 1, 2], ["FFSP", 3, 0, [3, 2, 1], 1, 1], ["AN", 3, 1, 6], ["PR", 6, 0, "auto_unroll_max_step$64"]]]], "r": [[0.00292629], 0, 1.83018, 1678617349], "v": "v0.6"}
{"i": [["[\"tw_kernel\", 1024, 1024, 102, 128, 8, \"float32\"]", "cuda -keys=cuda,gpu -arch=sm_70 -max_num_threads=1024 -model=unknown -thread_warp_size=32", [-1, 16, 64, 49152, 2147483647, 1024, 8, 32], "", 0, ["mask_k"]], [[], [["CHW", 4, "local"], ["SP", 4, 0, 8, [2, 4, 1, 1], 1], ["SP", 4, 5, 128, [1, 64, 1, 2], 1], ["SP", 4, 10, 1024, [4, 1, 1, 16], 1], ["SP", 4, 15, 102, [1, 1], 1], ["RE", 4, [0, 5, 10, 1, 6, 11, 2, 7, 12, 15, 16, 3, 8, 13, 17, 4, 9, 14]], ["FSP", 5, 0, 1, 3], ["FSP", 5, 4, 2, 3], ["FSP", 5, 8, 3, 3], ["RE", 5, [0, 4, 8, 1, 5, 9, 2, 6, 10, 3, 7, 11]], ["CA", 4, 5, 8], ["CHR", 3, "shared", [4]], ["CA", 4, 5, 9], ["CHR", 2, "shared", [5]], ["CA", 3, 6, 9], ["CI", 2], ["FU", 7, [0, 1, 2]], ["AN", 7, 0, 5], ["FU", 7, [1, 2, 3]], ["AN", 7, 1, 4], ["FU", 7, [2, 3, 4]], ["AN", 7, 2, 6], ["FU", 5, [0, 1, 2]], ["SP", 5, 0, 1, [1], 1], ["AN", 5, 1, 2], ["FFSP", 5, 0, [3, 2, 1], 1, 1], ["AN", 5, 1, 6], ["FU", 3, [0, 1, 2]], ["SP", 3, 0, 16, [1], 1], ["AN", 3, 1, 2], ["FFSP", 3, 0, [3, 2, 1], 1, 1], ["AN", 3, 1, 6], ["PR", 6, 0, "auto_unroll_max_step$64"]]]], "r": [[0.000389235], 0, 1.46518, 1678617350], "v": "v0.6"}
{"i": [["[\"tw_kernel\", 1024, 1024, 102, 128, 8, \"float32\"]", "cuda -keys=cuda,gpu -arch=sm_70 -max_num_threads=1024 -model=unknown -thread_warp_size=32", [-1, 16, 64, 49152, 2147483647, 1024, 8, 32], "", 0, ["mask_k"]], [[], [["CHW", 4, "local"], ["SP", 4, 0, 8, [2, 2, 1, 1], 1], ["SP", 4, 5, 128, [1, 1, 4, 8], 1], ["SP", 4, 10, 1024, [4, 64, 1, 1], 1], ["SP", 4, 15, 102, [2, 3], 1], ["RE", 4, [0, 5, 10, 1, 6, 11, 2, 7, 12, 15, 16, 3, 8, 13, 17, 4, 9, 14]], ["FSP", 5, 0, 1, 3], ["FSP", 5, 4, 2, 3], ["FSP", 5, 8, 3, 3], ["RE", 5, [0, 4, 8, 1, 5, 9, 2, 6, 10, 3, 7, 11]], ["CA", 4, 5, 8], ["CHR", 3, "shared", [4]], ["CA", 4, 5, 9], ["CHR", 2, "shared", [5]], ["CA", 3, 6, 9], ["CI", 2], ["FU", 7, [0, 1, 2]], ["AN", 7, 0, 5], ["FU", 7, [1, 2, 3]], ["AN", 7, 1, 4], ["FU", 7, [2, 3, 4]], ["AN", 7, 2, 6], ["FU", 5, [0, 1, 2]], ["SP", 5, 0, 192, [1], 1], ["AN", 5, 1, 2], ["FFSP", 5, 0, [3, 2, 1], 1, 1], ["AN", 5, 1, 6], ["FU", 3, [0, 1, 2]], ["SP", 3, 0, 6, [1], 1], ["AN", 3, 1, 2], ["FFSP", 3, 0, [3, 2, 1], 1, 1], ["AN", 3, 1, 6], ["PR", 6, 0, "auto_unroll_max_step$512"]]]], "r": [[0.000272327], 0, 4.12186, 1678617350], "v": "v0.6"}
{"i": [["[\"tw_kernel\", 1024, 1024, 102, 128, 8, \"float32\"]", "cuda -keys=cuda,gpu -arch=sm_70 -max_num_threads=1024 -model=unknown -thread_warp_size=32", [-1, 16, 64, 49152, 2147483647, 1024, 8, 32], "", 0, ["mask_k"]], [[], [["CHW", 4, "local"], ["SP", 4, 0, 8, [1, 2, 4, 1], 1], ["SP", 4, 5, 128, [1, 16, 8, 1], 1], ["SP", 4, 10, 1024, [1, 2, 8, 16], 1], ["SP", 4, 15, 102, [1, 1], 1], ["RE", 4, [0, 5, 10, 1, 6, 11, 2, 7, 12, 15, 16, 3, 8, 13, 17, 4, 9, 14]], ["FSP", 5, 0, 1, 3], ["FSP", 5, 4, 2, 3], ["FSP", 5, 8, 3, 3], ["RE", 5, [0, 4, 8, 1, 5, 9, 2, 6, 10, 3, 7, 11]], ["CA", 4, 5, 8], ["CHR", 3, "shared", [4]], ["CA", 4, 5, 9], ["CHR", 2, "shared", [5]], ["CA", 3, 6, 9], ["CI", 2], ["FU", 7, [0, 1, 2]], ["AN", 7, 0, 5], ["FU", 7, [1, 2, 3]], ["AN", 7, 1, 4], ["FU", 7, [2, 3, 4]], ["AN", 7, 2, 6], ["FU", 5, [0, 1, 2]], ["SP", 5, 0, 16, [1], 1], ["AN", 5, 1, 2], ["FFSP", 5, 0, [3, 2, 1], 1, 1], ["AN", 5, 1, 6], ["FU", 3, [0, 1, 2]], ["SP", 3, 0, 512, [4], 1], ["AN", 3, 1, 2], ["FFSP", 3, 0, [3, 2, 1], 1, 1], ["AN", 3, 1, 6], ["PR", 6, 0, "auto_unroll_max_step$0"]]]], "r": [[0.00607339], 0, 2.67845, 1678617350], "v": "v0.6"}
{"i": [["[\"tw_kernel\", 1024, 1024, 102, 128, 8, \"float32\"]", "cuda -keys=cuda,gpu -arch=sm_70 -max_num_threads=1024 -model=unknown -thread_warp_size=32", [-1, 16, 64, 49152, 2147483647, 1024, 8, 32], "", 0, ["mask_k"]], [[], [["CHW", 4, "local"], ["SP", 4, 0, 8, [1, 8, 1, 1], 1], ["SP", 4, 5, 128, [2, 8, 1, 8], 1], ["SP", 4, 10, 1024, [4, 1, 1, 1], 1], ["SP", 4, 15, 102, [1, 3], 1], ["RE", 4, [0, 5, 10, 1, 6, 11, 2, 7, 12, 15, 16, 3, 8, 13, 17, 4, 9, 14]], ["FSP", 5, 0, 1, 3], ["FSP", 5, 4, 2, 3], ["FSP", 5, 8, 3, 3], ["RE", 5, [0, 4, 8, 1, 5, 9, 2, 6, 10, 3, 7, 11]], ["CA", 4, 5, 8], ["CHR", 3, "shared", [4]], ["CA", 4, 5, 9], ["CHR", 2, "shared", [5]], ["CA", 3, 6, 9], ["CI", 2], ["FU", 7, [0, 1, 2]], ["AN", 7, 0, 5], ["FU", 7, [1, 2, 3]], ["AN", 7, 1, 4], ["FU", 7, [2, 3, 4]], ["AN", 7, 2, 6], ["FU", 5, [0, 1, 2]], ["SP", 5, 0, 6, [2], 1], ["AN", 5, 1, 2], ["FFSP", 5, 0, [3, 2, 1], 1, 1], ["AN", 5, 1, 6], ["FU", 3, [0, 1, 2]], ["SP", 3, 0, 3, [1], 1], ["AN", 3, 1, 2], ["FFSP", 3, 0, [3, 2, 1], 1, 1], ["AN", 3, 1, 6], ["PR", 6, 0, "auto_unroll_max_step$0"]]]], "r": [[0.000275399], 0, 1.1473, 1678617350], "v": "v0.6"}
{"i": [["[\"tw_kernel\", 1024, 1024, 102, 128, 8, \"float32\"]", "cuda -keys=cuda,gpu -arch=sm_70 -max_num_threads=1024 -model=unknown -thread_warp_size=32", [-1, 16, 64, 49152, 2147483647, 1024, 8, 32], "", 0, ["mask_k"]], [[], [["CHW", 4, "local"], ["SP", 4, 0, 8, [1, 1, 2, 2], 1], ["SP", 4, 5, 128, [1, 32, 1, 2], 1], ["SP", 4, 10, 1024, [1, 8, 4, 8], 1], ["SP", 4, 15, 102, [1, 2], 1], ["RE", 4, [0, 5, 10, 1, 6, 11, 2, 7, 12, 15, 16, 3, 8, 13, 17, 4, 9, 14]], ["FSP", 5, 0, 1, 3], ["FSP", 5, 4, 2, 3], ["FSP", 5, 8, 3, 3], ["RE", 5, [0, 4, 8, 1, 5, 9, 2, 6, 10, 3, 7, 11]], ["CA", 4, 5, 8], ["CHR", 3, "shared", [4]], ["CA", 4, 5, 9], ["CHR", 2, "shared", [5]], ["CA", 3, 6, 9], ["CI", 2], ["FU", 7, [0, 1, 2]], ["AN", 7, 0, 5], ["FU", 7, [1, 2, 3]], ["AN", 7, 1, 4], ["FU", 7, [2, 3, 4]], ["AN", 7, 2, 6], ["FU", 5, [0, 1, 2]], ["SP", 5, 0, 16, [1], 1], ["AN", 5, 1, 2], ["FFSP", 5, 0, [3, 2, 1], 1, 1], ["AN", 5, 1, 6], ["FU", 3, [0, 1, 2]], ["SP", 3, 0, 1024, [1], 1], ["AN", 3, 1, 2], ["FFSP", 3, 0, [3, 2, 1], 1, 1], ["AN", 3, 1, 6], ["PR", 6, 0, "auto_unroll_max_step$0"]]]], "r": [[0.000910058], 0, 2.24332, 1678617351], "v": "v0.6"}
{"i": [["[\"tw_kernel\", 1024, 1024, 102, 128, 8, \"float32\"]", "cuda -keys=cuda,gpu -arch=sm_70 -max_num_threads=1024 -model=unknown -thread_warp_size=32", [-1, 16, 64, 49152, 2147483647, 1024, 8, 32], "", 0, ["mask_k"]], [[], [["CHW", 4, "local"], ["SP", 4, 0, 8, [1, 1, 4, 1], 1], ["SP", 4, 5, 128, [2, 16, 1, 1], 1], ["SP", 4, 10, 1024, [1, 4, 8, 2], 1], ["SP", 4, 15, 102, [2, 3], 1], ["RE", 4, [0, 5, 10, 1, 6, 11, 2, 7, 12, 15, 16, 3, 8, 13, 17, 4, 9, 14]], ["FSP", 5, 0, 1, 3], ["FSP", 5, 4, 2, 3], ["FSP", 5, 8, 3, 3], ["RE", 5, [0, 4, 8, 1, 5, 9, 2, 6, 10, 3, 7, 11]], ["CA", 4, 5, 8], ["CHR", 3, "shared", [4]], ["CA", 4, 5, 9], ["CHR", 2, "shared", [5]], ["CA", 3, 6, 9], ["CI", 2], ["FU", 7, [0, 1, 2]], ["AN", 7, 0, 5], ["FU", 7, [1, 2, 3]], ["AN", 7, 1, 4], ["FU", 7, [2, 3, 4]], ["AN", 7, 2, 6], ["FU", 5, [0, 1, 2]], ["SP", 5, 0, 48, [1], 1], ["AN", 5, 1, 2], ["FFSP", 5, 0, [3, 2, 1], 1, 1], ["AN", 5, 1, 6], ["FU", 3, [0, 1, 2]], ["SP", 3, 0, 384, [1], 1], ["AN", 3, 1, 2], ["FFSP", 3, 0, [3, 2, 1], 1, 1], ["AN", 3, 1, 6], ["PR", 6, 0, "auto_unroll_max_step$64"]]]], "r": [[0.00010406], 0, 2.10107, 1678617351], "v": "v0.6"}
{"i": [["[\"tw_kernel\", 1024, 1024, 102, 128, 8, \"float32\"]", "cuda -keys=cuda,gpu -arch=sm_70 -max_num_threads=1024 -model=unknown -thread_warp_size=32", [-1, 16, 64, 49152, 2147483647, 1024, 8, 32], "", 0, ["mask_k"]], [[], [["CHW", 4, "local"], ["SP", 4, 0, 8, [1, 4, 2, 1], 1], ["SP", 4, 5, 128, [2, 8, 1, 2], 1], ["SP", 4, 10, 1024, [4, 1, 1, 1], 1], ["SP", 4, 15, 102, [1, 3], 1], ["RE", 4, [0, 5, 10, 1, 6, 11, 2, 7, 12, 15, 16, 3, 8, 13, 17, 4, 9, 14]], ["FSP", 5, 0, 1, 3], ["FSP", 5, 4, 2, 3], ["FSP", 5, 8, 3, 3], ["RE", 5, [0, 4, 8, 1, 5, 9, 2, 6, 10, 3, 7, 11]], ["CA", 4, 5, 8], ["CHR", 3, "shared", [4]], ["CA", 4, 5, 9], ["CHR", 2, "shared", [5]], ["CA", 3, 6, 9], ["CI", 2], ["FU", 7, [0, 1, 2]], ["AN", 7, 0, 5], ["FU", 7, [1, 2, 3]], ["AN", 7, 1, 4], ["FU", 7, [2, 3, 4]], ["AN", 7, 2, 6], ["FU", 5, [0, 1, 2]], ["SP", 5, 0, 6, [2], 1], ["AN", 5, 1, 2], ["FFSP", 5, 0, [3, 2, 1], 1, 1], ["AN", 5, 1, 6], ["FU", 3, [0, 1, 2]], ["SP", 3, 0, 3, [3], 1], ["AN", 3, 1, 2], ["FFSP", 3, 0, [3, 2, 1], 1, 1], ["AN", 3, 1, 6], ["PR", 6, 0, "auto_unroll_max_step$0"]]]], "r": [[0.000236015], 0, 1.41038, 1678617351], "v": "v0.6"}
{"i": [["[\"tw_kernel\", 1024, 1024, 102, 128, 8, \"float32\"]", "cuda -keys=cuda,gpu -arch=sm_70 -max_num_threads=1024 -model=unknown -thread_warp_size=32", [-1, 16, 64, 49152, 2147483647, 1024, 8, 32], "", 0, ["mask_k"]], [[], [["CHW", 4, "local"], ["SP", 4, 0, 8, [2, 1, 1, 2], 1], ["SP", 4, 5, 128, [1, 2, 32, 1], 1], ["SP", 4, 10, 1024, [1, 128, 1, 1], 1], ["SP", 4, 15, 102, [1, 6], 1], ["RE", 4, [0, 5, 10, 1, 6, 11, 2, 7, 12, 15, 16, 3, 8, 13, 17, 4, 9, 14]], ["FSP", 5, 0, 1, 3], ["FSP", 5, 4, 2, 3], ["FSP", 5, 8, 3, 3], ["RE", 5, [0, 4, 8, 1, 5, 9, 2, 6, 10, 3, 7, 11]], ["CA", 4, 5, 8], ["CHR", 3, "shared", [4]], ["CA", 4, 5, 9], ["CHR", 2, "shared", [5]], ["CA", 3, 6, 9], ["CI", 2], ["FU", 7, [0, 1, 2]], ["AN", 7, 0, 5], ["FU", 7, [1, 2, 3]], ["AN", 7, 1, 4], ["FU", 7, [2, 3, 4]], ["AN", 7, 2, 6], ["FU", 5, [0, 1, 2]], ["SP", 5, 0, 768, [1], 1], ["AN", 5, 1, 2], ["FFSP", 5, 0, [3, 2, 1], 1, 1], ["AN", 5, 1, 6], ["FU", 3, [0, 1, 2]], ["SP", 3, 0, 24, [1], 1], ["AN", 3, 1, 2], ["FFSP", 3, 0, [3, 2, 1], 1, 1], ["AN", 3, 1, 6], ["PR", 6, 0, "auto_unroll_max_step$1024"]]]], "r": [[7.39758e-05], 0, 4.57979, 1678617352], "v": "v0.6"}
{"i": [["[\"tw_kernel\", 1024, 1024, 102, 128, 8, \"float32\"]", "cuda -keys=cuda,gpu -arch=sm_70 -max_num_threads=1024 -model=unknown -thread_warp_size=32", [-1, 16, 64, 49152, 2147483647, 1024, 8, 32], "", 0, ["mask_k"]], [[], [["CHW", 4, "local"], ["SP", 4, 0, 8, [1, 4, 1, 2], 1], ["SP", 4, 5, 128, [1, 32, 1, 2], 1], ["SP", 4, 10, 1024, [2, 1, 2, 1], 1], ["SP", 4, 15, 102, [1, 3], 1], ["RE", 4, [0, 5, 10, 1, 6, 11, 2, 7, 12, 15, 16, 3, 8, 13, 17, 4, 9, 14]], ["FSP", 5, 0, 1, 3], ["FSP", 5, 4, 2, 3], ["FSP", 5, 8, 3, 3], ["RE", 5, [0, 4, 8, 1, 5, 9, 2, 6, 10, 3, 7, 11]], ["CA", 4, 5, 8], ["CHR", 3, "shared", [4]], ["CA", 4, 5, 9], ["CHR", 2, "shared", [5]], ["CA", 3, 6, 9], ["CI", 2], ["FU", 7, [0, 1, 2]], ["AN", 7, 0, 5], ["FU", 7, [1, 2, 3]], ["AN", 7, 1, 4], ["FU", 7, [2, 3, 4]], ["AN", 7, 2, 6], ["FU", 5, [0, 1, 2]], ["SP", 5, 0, 3, [1], 1], ["AN", 5, 1, 2], ["FFSP", 5, 0, [3, 2, 1], 1, 1], ["AN", 5, 1, 6], ["FU", 3, [0, 1, 2]], ["SP", 3, 0, 6, [1], 1], ["AN", 3, 1, 2], ["FFSP", 3, 0, [3, 2, 1], 1, 1], ["AN", 3, 1, 6], ["PR", 6, 0, "auto_unroll_max_step$64"]]]], "r": [[0.000222575], 0, 1.26305, 1678617352], "v": "v0.6"}
{"i": [["[\"tw_kernel\", 1024, 1024, 102, 128, 8, \"float32\"]", "cuda -keys=cuda,gpu -arch=sm_70 -max_num_threads=1024 -model=unknown -thread_warp_size=32", [-1, 16, 64, 49152, 2147483647, 1024, 8, 32], "", 0, ["mask_k"]], [[], [["CHW", 4, "local"], ["SP", 4, 0, 8, [1, 2, 4, 1], 1], ["SP", 4, 5, 128, [2, 16, 4, 1], 1], ["SP", 4, 10, 1024, [1, 2, 8, 16], 1], ["SP", 4, 15, 102, [1, 3], 1], ["RE", 4, [0, 5, 10, 1, 6, 11, 2, 7, 12, 15, 16, 3, 8, 13, 17, 4, 9, 14]], ["FSP", 5, 0, 1, 3], ["FSP", 5, 4, 2, 3], ["FSP", 5, 8, 3, 3], ["RE", 5, [0, 4, 8, 1, 5, 9, 2, 6, 10, 3, 7, 11]], ["CA", 4, 5, 8], ["CHR", 3, "shared", [4]], ["CA", 4, 5, 9], ["CHR", 2, "shared", [5]], ["CA", 3, 6, 9], ["CI", 2], ["FU", 7, [0, 1, 2]], ["AN", 7, 0, 5], ["FU", 7, [1, 2, 3]], ["AN", 7, 1, 4], ["FU", 7, [2, 3, 4]], ["AN", 7, 2, 6], ["FU", 5, [0, 1, 2]], ["SP", 5, 0, 16, [4], 1], ["AN", 5, 1, 2], ["FFSP", 5, 0, [3, 2, 1], 1, 1], ["AN", 5, 1, 6], ["FU", 3, [0, 1, 2]], ["SP", 3, 0, 512, [1], 1], ["AN", 3, 1, 2], ["FFSP", 3, 0, [3, 2, 1], 1, 1], ["AN", 3, 1, 6], ["PR", 6, 0, "auto_unroll_max_step$0"]]]], "r": [[0.00374994], 0, 3.43587, 1678617352], "v": "v0.6"}
{"i": [["[\"tw_kernel\", 1024, 1024, 102, 128, 8, \"float32\"]", "cuda -keys=cuda,gpu -arch=sm_70 -max_num_threads=1024 -model=unknown -thread_warp_size=32", [-1, 16, 64, 49152, 2147483647, 1024, 8, 32], "", 0, ["mask_k"]], [[], [["CHW", 4, "local"], ["SP", 4, 0, 8, [2, 1, 1, 2], 1], ["SP", 4, 5, 128, [1, 16, 4, 2], 1], ["SP", 4, 10, 1024, [1, 1, 8, 1], 1], ["SP", 4, 15, 102, [1, 17], 1], ["RE", 4, [0, 5, 10, 1, 6, 11, 2, 7, 12, 15, 16, 3, 8, 13, 17, 4, 9, 14]], ["FSP", 5, 0, 1, 3], ["FSP", 5, 4, 2, 3], ["FSP", 5, 8, 3, 3], ["RE", 5, [0, 4, 8, 1, 5, 9, 2, 6, 10, 3, 7, 11]], ["CA", 4, 5, 8], ["CHR", 3, "shared", [4]], ["CA", 4, 5, 9], ["CHR", 2, "shared", [5]], ["CA", 3, 6, 9], ["CI", 2], ["FU", 7, [0, 1, 2]], ["AN", 7, 0, 5], ["FU", 7, [1, 2, 3]], ["AN", 7, 1, 4], ["FU", 7, [2, 3, 4]], ["AN", 7, 2, 6], ["FU", 5, [0, 1, 2]], ["SP", 5, 0, 272, [1], 1], ["AN", 5, 1, 2], ["FFSP", 5, 0, [3, 2, 1], 1, 1], ["AN", 5, 1, 6], ["FU", 3, [0, 1, 2]], ["SP", 3, 0, 136, [1], 1], ["AN", 3, 1, 2], ["FFSP", 3, 0, [3, 2, 1], 1, 1], ["AN", 3, 1, 6], ["PR", 6, 0, "auto_unroll_max_step$16"]]]], "r": [[0.00073441], 0, 2.02251, 1678617353], "v": "v0.6"}
{"i": [["[\"tw_kernel\", 1024, 1024, 102, 128, 8, \"float32\"]", "cuda -keys=cuda,gpu -arch=sm_70 -max_num_threads=1024 -model=unknown -thread_warp_size=32", [-1, 16, 64, 49152, 2147483647, 1024, 8, 32], "", 0, ["mask_k"]], [[], [["CHW", 4, "local"], ["SP", 4, 0, 8, [1, 2, 4, 1], 1], ["SP", 4, 5, 128, [1, 16, 8, 1], 1], ["SP", 4, 10, 1024, [1, 2, 2, 16], 1], ["SP", 4, 15, 102, [1, 1], 1], ["RE", 4, [0, 5, 10, 1, 6, 11, 2, 7, 12, 15, 16, 3, 8, 13, 17, 4, 9, 14]], ["FSP", 5, 0, 1, 3], ["FSP", 5, 4, 2, 3], ["FSP", 5, 8, 3, 3], ["RE", 5, [0, 4, 8, 1, 5, 9, 2, 6, 10, 3, 7, 11]], ["CA", 4, 5, 8], ["CHR", 3, "shared", [4]], ["CA", 4, 5, 9], ["CHR", 2, "shared", [5]], ["CA", 3, 6, 9], ["CI", 2], ["FU", 7, [0, 1, 2]], ["AN", 7, 0, 5], ["FU", 7, [1, 2, 3]], ["AN", 7, 1, 4], ["FU", 7, [2, 3, 4]], ["AN", 7, 2, 6], ["FU", 5, [0, 1, 2]], ["SP", 5, 0, 16, [1], 1], ["AN", 5, 1, 2], ["FFSP", 5, 0, [3, 2, 1], 1, 1], ["AN", 5, 1, 6], ["FU", 3, [0, 1, 2]], ["SP", 3, 0, 512, [1], 1], ["AN", 3, 1, 2], ["FFSP", 3, 0, [3, 2, 1], 1, 1], ["AN", 3, 1, 6], ["PR", 6, 0, "auto_unroll_max_step$0"]]]], "r": [[0.00199321], 0, 3.17744, 1678617353], "v": "v0.6"}
{"i": [["[\"tw_kernel\", 1024, 1024, 102, 128, 8, \"float32\"]", "cuda -keys=cuda,gpu -arch=sm_70 -max_num_threads=1024 -model=unknown -thread_warp_size=32", [-1, 16, 64, 49152, 2147483647, 1024, 8, 32], "", 0, ["mask_k"]], [[], [["CHW", 4, "local"], ["SP", 4, 0, 8, [1, 2, 4, 1], 1], ["SP", 4, 5, 128, [1, 32, 2, 2], 1], ["SP", 4, 10, 1024, [2, 16, 16, 1], 1], ["SP", 4, 15, 102, [2, 1], 1], ["RE", 4, [0, 5, 10, 1, 6, 11, 2, 7, 12, 15, 16, 3, 8, 13, 17, 4, 9, 14]], ["FSP", 5, 0, 1, 3], ["FSP", 5, 4, 2, 3], ["FSP", 5, 8, 3, 3], ["RE", 5, [0, 4, 8, 1, 5, 9, 2, 6, 10, 3, 7, 11]], ["CA", 4, 5, 8], ["CHR", 3, "shared", [4]], ["CA", 4, 5, 9], ["CHR", 2, "shared", [5]], ["CA", 3, 6, 9], ["CI", 2], ["FU", 7, [0, 1, 2]], ["AN", 7, 0, 5], ["FU", 7, [1, 2, 3]], ["AN", 7, 1, 4], ["FU", 7, [2, 3, 4]], ["AN", 7, 2, 6], ["FU", 5, [0, 1, 2]], ["SP", 5, 0, 64, [1], 1], ["AN", 5, 1, 2], ["FFSP", 5, 0, [3, 2, 1], 1, 1], ["AN", 5, 1, 6], ["FU", 3, [0, 1, 2]], ["SP", 3, 0, 256, [1], 1], ["AN", 3, 1, 2], ["FFSP", 3, 0, [3, 2, 1], 1, 1], ["AN", 3, 1, 6], ["PR", 6, 0, "auto_unroll_max_step$1024"]]]], "r": [[0.0129418], 0, 6.2604, 1678617353], "v": "v0.6"}
{"i": [["[\"tw_kernel\", 1024, 1024, 102, 128, 8, \"float32\"]", "cuda -keys=cuda,gpu -arch=sm_70 -max_num_threads=1024 -model=unknown -thread_warp_size=32", [-1, 16, 64, 49152, 2147483647, 1024, 8, 32], "", 0, ["mask_k"]], [[], [["CHW", 4, "local"], ["SP", 4, 0, 8, [2, 1, 1, 2], 1], ["SP", 4, 5, 128, [2, 2, 2, 8], 1], ["SP", 4, 10, 1024, [1, 64, 2, 2], 1], ["SP", 4, 15, 102, [1, 1], 1], ["RE", 4, [0, 5, 10, 1, 6, 11, 2, 7, 12, 15, 16, 3, 8, 13, 17, 4, 9, 14]], ["FSP", 5, 0, 1, 3], ["FSP", 5, 4, 2, 3], ["FSP", 5, 8, 3, 3], ["RE", 5, [0, 4, 8, 1, 5, 9, 2, 6, 10, 3, 7, 11]], ["CA", 4, 5, 8], ["CHR", 3, "shared", [4]], ["CA", 4, 5, 9], ["CHR", 2, "shared", [5]], ["CA", 3, 6, 9], ["CI", 2], ["FU", 7, [0, 1, 2]], ["AN", 7, 0, 5], ["FU", 7, [1, 2, 3]], ["AN", 7, 1, 4], ["FU", 7, [2, 3, 4]], ["AN", 7, 2, 6], ["FU", 5, [0, 1, 2]], ["SP", 5, 0, 32, [1], 1], ["AN", 5, 1, 2], ["FFSP", 5, 0, [3, 2, 1], 1, 1], ["AN", 5, 1, 6], ["FU", 3, [0, 1, 2]], ["SP", 3, 0, 8, [1], 1], ["AN", 3, 1, 2], ["FFSP", 3, 0, [3, 2, 1], 1, 1], ["AN", 3, 1, 6], ["PR", 6, 0, "auto_unroll_max_step$64"]]]], "r": [[0.00142655], 0, 2.75059, 1678617354], "v": "v0.6"}
{"i": [["[\"tw_kernel\", 1024, 1024, 102, 128, 8, \"float32\"]", "cuda -keys=cuda,gpu -arch=sm_70 -max_num_threads=1024 -model=unknown -thread_warp_size=32", [-1, 16, 64, 49152, 2147483647, 1024, 8, 32], "", 0, ["mask_k"]], [[], [["CHW", 4, "local"], ["SP", 4, 0, 8, [1, 8, 1, 1], 1], ["SP", 4, 5, 128, [1, 2, 1, 4], 1], ["SP", 4, 10, 1024, [1, 8, 1, 1], 1], ["SP", 4, 15, 102, [6, 1], 1], ["RE", 4, [0, 5, 10, 1, 6, 11, 2, 7, 12, 15, 16, 3, 8, 13, 17, 4, 9, 14]], ["FSP", 5, 0, 1, 3], ["FSP", 5, 4, 2, 3], ["FSP", 5, 8, 3, 3], ["RE", 5, [0, 4, 8, 1, 5, 9, 2, 6, 10, 3, 7, 11]], ["CA", 4, 5, 8], ["CHR", 3, "shared", [4]], ["CA", 4, 5, 9], ["CHR", 2, "shared", [5]], ["CA", 3, 6, 9], ["CI", 2], ["FU", 7, [0, 1, 2]], ["AN", 7, 0, 5], ["FU", 7, [1, 2, 3]], ["AN", 7, 1, 4], ["FU", 7, [2, 3, 4]], ["AN", 7, 2, 6], ["FU", 5, [0, 1, 2]], ["SP", 5, 0, 24, [1], 1], ["AN", 5, 1, 2], ["FFSP", 5, 0, [3, 2, 1], 1, 1], ["AN", 5, 1, 6], ["FU", 3, [0, 1, 2]], ["SP", 3, 0, 6, [1], 1], ["AN", 3, 1, 2], ["FFSP", 3, 0, [3, 2, 1], 1, 1], ["AN", 3, 1, 6], ["PR", 6, 0, "auto_unroll_max_step$0"]]]], "r": [[8.26086e-05], 0, 1.35715, 1678617376], "v": "v0.6"}
{"i": [["[\"tw_kernel\", 1024, 1024, 102, 128, 8, \"float32\"]", "cuda -keys=cuda,gpu -arch=sm_70 -max_num_threads=1024 -model=unknown -thread_warp_size=32", [-1, 16, 64, 49152, 2147483647, 1024, 8, 32], "", 0, ["mask_k"]], [[], [["CHW", 4, "local"], ["SP", 4, 0, 8, [1, 2, 2, 2], 1], ["SP", 4, 5, 128, [1, 4, 16, 1], 1], ["SP", 4, 10, 1024, [2, 16, 1, 1], 1], ["SP", 4, 15, 102, [2, 3], 1], ["RE", 4, [0, 5, 10, 1, 6, 11, 2, 7, 12, 15, 16, 3, 8, 13, 17, 4, 9, 14]], ["FSP", 5, 0, 1, 3], ["FSP", 5, 4, 2, 3], ["FSP", 5, 8, 3, 3], ["RE", 5, [0, 4, 8, 1, 5, 9, 2, 6, 10, 3, 7, 11]], ["CA", 4, 5, 8], ["CHR", 3, "shared", [4]], ["CA", 4, 5, 9], ["CHR", 2, "shared", [5]], ["CA", 3, 6, 9], ["CI", 2], ["FU", 7, [0, 1, 2]], ["AN", 7, 0, 5], ["FU", 7, [1, 2, 3]], ["AN", 7, 1, 4], ["FU", 7, [2, 3, 4]], ["AN", 7, 2, 6], ["FU", 5, [0, 1, 2]], ["SP", 5, 0, 192, [1], 1], ["AN", 5, 1, 2], ["FFSP", 5, 0, [3, 2, 1], 1, 1], ["AN", 5, 1, 6], ["FU", 3, [0, 1, 2]], ["SP", 3, 0, 12, [1], 1], ["AN", 3, 1, 2], ["FFSP", 3, 0, [3, 2, 1], 1, 1], ["AN", 3, 1, 6], ["PR", 6, 0, "auto_unroll_max_step$1024"]]]], "r": [[6.75689e-05], 0, 5.51997, 1678617376], "v": "v0.6"}
{"i": [["[\"tw_kernel\", 1024, 1024, 102, 128, 8, \"float32\"]", "cuda -keys=cuda,gpu -arch=sm_70 -max_num_threads=1024 -model=unknown -thread_warp_size=32", [-1, 16, 64, 49152, 2147483647, 1024, 8, 32], "", 0, ["mask_k"]], [[], [["CHW", 4, "local"], ["SP", 4, 0, 8, [1, 1, 1, 4], 1], ["SP", 4, 5, 128, [2, 4, 2, 4], 1], ["SP", 4, 10, 1024, [1, 16, 4, 2], 1], ["SP", 4, 15, 102, [3, 2], 1], ["RE", 4, [0, 5, 10, 1, 6, 11, 2, 7, 12, 15, 16, 3, 8, 13, 17, 4, 9, 14]], ["FSP", 5, 0, 1, 3], ["FSP", 5, 4, 2, 3], ["FSP", 5, 8, 3, 3], ["RE", 5, [0, 4, 8, 1, 5, 9, 2, 6, 10, 3, 7, 11]], ["CA", 4, 5, 8], ["CHR", 3, "shared", [4]], ["CA", 4, 5, 9], ["CHR", 2, "shared", [5]], ["CA", 3, 6, 9], ["CI", 2], ["FU", 7, [0, 1, 2]], ["AN", 7, 0, 5], ["FU", 7, [1, 2, 3]], ["AN", 7, 1, 4], ["FU", 7, [2, 3, 4]], ["AN", 7, 2, 6], ["FU", 5, [0, 1, 2]], ["SP", 5, 0, 96, [1], 1], ["AN", 5, 1, 2], ["FFSP", 5, 0, [3, 2, 1], 1, 1], ["AN", 5, 1, 6], ["FU", 3, [0, 1, 2]], ["SP", 3, 0, 96, [1], 1], ["AN", 3, 1, 2], ["FFSP", 3, 0, [3, 2, 1], 1, 1], ["AN", 3, 1, 6], ["PR", 6, 0, "auto_unroll_max_step$0"]]]], "r": [[0.000615279], 0, 3.4727, 1678617377], "v": "v0.6"}
{"i": [["[\"tw_kernel\", 1024, 1024, 102, 128, 8, \"float32\"]", "cuda -keys=cuda,gpu -arch=sm_70 -max_num_threads=1024 -model=unknown -thread_warp_size=32", [-1, 16, 64, 49152, 2147483647, 1024, 8, 32], "", 0, ["mask_k"]], [[], [["CHW", 4, "local"], ["SP", 4, 0, 8, [2, 1, 4, 1], 1], ["SP", 4, 5, 128, [2, 4, 1, 8], 1], ["SP", 4, 10, 1024, [1, 128, 1, 1], 1], ["SP", 4, 15, 102, [2, 3], 1], ["RE", 4, [0, 5, 10, 1, 6, 11, 2, 7, 12, 15, 16, 3, 8, 13, 17, 4, 9, 14]], ["FSP", 5, 0, 1, 3], ["FSP", 5, 4, 2, 3], ["FSP", 5, 8, 3, 3], ["RE", 5, [0, 4, 8, 1, 5, 9, 2, 6, 10, 3, 7, 11]], ["CA", 4, 5, 8], ["CHR", 3, "shared", [4]], ["CA", 4, 5, 9], ["CHR", 2, "shared", [5]], ["CA", 3, 6, 9], ["CI", 2], ["FU", 7, [0, 1, 2]], ["AN", 7, 0, 5], ["FU", 7, [1, 2, 3]], ["AN", 7, 1, 4], ["FU", 7, [2, 3, 4]], ["AN", 7, 2, 6], ["FU", 5, [0, 1, 2]], ["SP", 5, 0, 192, [1], 1], ["AN", 5, 1, 2], ["FFSP", 5, 0, [3, 2, 1], 1, 1], ["AN", 5, 1, 6], ["FU", 3, [0, 1, 2]], ["SP", 3, 0, 24, [24], 1], ["AN", 3, 1, 2], ["FFSP", 3, 0, [3, 2, 1], 1, 1], ["AN", 3, 1, 6], ["PR", 6, 0, "auto_unroll_max_step$16"]]]], "r": [[0.000425996], 0, 2.49104, 1678617377], "v": "v0.6"}
{"i": [["[\"tw_kernel\", 1024, 1024, 102, 128, 8, \"float32\"]", "cuda -keys=cuda,gpu -arch=sm_70 -max_num_threads=1024 -model=unknown -thread_warp_size=32", [-1, 16, 64, 49152, 2147483647, 1024, 8, 32], "", 0, ["mask_k"]], [[], [["CHW", 4, "local"], ["SP", 4, 0, 8, [2, 1, 2, 1], 1], ["SP", 4, 5, 128, [4, 8, 1, 1], 1], ["SP", 4, 10, 1024, [1, 4, 128, 1], 1], ["SP", 4, 15, 102, [1, 3], 1], ["RE", 4, [0, 5, 10, 1, 6, 11, 2, 7, 12, 15, 16, 3, 8, 13, 17, 4, 9, 14]], ["FSP", 5, 0, 1, 3], ["FSP", 5, 4, 2, 3], ["FSP", 5, 8, 3, 3], ["RE", 5, [0, 4, 8, 1, 5, 9, 2, 6, 10, 3, 7, 11]], ["CA", 4, 5, 8], ["CHR", 3, "shared", [4]], ["CA", 4, 5, 9], ["CHR", 2, "shared", [5]], ["CA", 3, 6, 9], ["CI", 2], ["FU", 7, [0, 1, 2]], ["AN", 7, 0, 5], ["FU", 7, [1, 2, 3]], ["AN", 7, 1, 4], ["FU", 7, [2, 3, 4]], ["AN", 7, 2, 6], ["FU", 5, [0, 1, 2]], ["SP", 5, 0, 6, [1], 1], ["AN", 5, 1, 2], ["FFSP", 5, 0, [3, 2, 1], 1, 1], ["AN", 5, 1, 6], ["FU", 3, [0, 1, 2]], ["SP", 3, 0, 768, [3], 1], ["AN", 3, 1, 2], ["FFSP", 3, 0, [3, 2, 1], 1, 1], ["AN", 3, 1, 6], ["PR", 6, 0, "auto_unroll_max_step$1024"]]]], "r": [[0.00368813], 0, 10.5945, 1678617377], "v": "v0.6"}
{"i": [["[\"tw_kernel\", 1024, 1024, 102, 128, 8, \"float32\"]", "cuda -keys=cuda,gpu -arch=sm_70 -max_num_threads=1024 -model=unknown -thread_warp_size=32", [-1, 16, 64, 49152, 2147483647, 1024, 8, 32], "", 0, ["mask_k"]], [[], [["CHW", 4, "local"], ["SP", 4, 0, 8, [1, 1, 2, 2], 1], ["SP", 4, 5, 128, [1, 32, 1, 2], 1], ["SP", 4, 10, 1024, [1, 2, 16, 8], 1], ["SP", 4, 15, 102, [1, 2], 1], ["RE", 4, [0, 5, 10, 1, 6, 11, 2, 7, 12, 15, 16, 3, 8, 13, 17, 4, 9, 14]], ["FSP", 5, 0, 1, 3], ["FSP", 5, 4, 2, 3], ["FSP", 5, 8, 3, 3], ["RE", 5, [0, 4, 8, 1, 5, 9, 2, 6, 10, 3, 7, 11]], ["CA", 4, 5, 8], ["CHR", 3, "shared", [4]], ["CA", 4, 5, 9], ["CHR", 2, "shared", [5]], ["CA", 3, 6, 9], ["CI", 2], ["FU", 7, [0, 1, 2]], ["AN", 7, 0, 5], ["FU", 7, [1, 2, 3]], ["AN", 7, 1, 4], ["FU", 7, [2, 3, 4]], ["AN", 7, 2, 6], ["FU", 5, [0, 1, 2]], ["SP", 5, 0, 16, [4], 1], ["AN", 5, 1, 2], ["FFSP", 5, 0, [3, 2, 1], 1, 1], ["AN", 5, 1, 6], ["FU", 3, [0, 1, 2]], ["SP", 3, 0, 1024, [1], 1], ["AN", 3, 1, 2], ["FFSP", 3, 0, [3, 2, 1], 1, 1], ["AN", 3, 1, 6], ["PR", 6, 0, "auto_unroll_max_step$16"]]]], "r": [[0.00111601], 0, 3.8317, 1678617377], "v": "v0.6"}
{"i": [["[\"tw_kernel\", 1024, 1024, 102, 128, 8, \"float32\"]", "cuda -keys=cuda,gpu -arch=sm_70 -max_num_threads=1024 -model=unknown -thread_warp_size=32", [-1, 16, 64, 49152, 2147483647, 1024, 8, 32], "", 0, ["mask_k"]], [[], [["CHW", 4, "local"], ["SP", 4, 0, 8, [8, 1, 1, 1], 1], ["SP", 4, 5, 128, [1, 2, 2, 16], 1], ["SP", 4, 10, 1024, [1, 128, 4, 1], 1], ["SP", 4, 15, 102, [1, 2], 1], ["RE", 4, [0, 5, 10, 1, 6, 11, 2, 7, 12, 15, 16, 3, 8, 13, 17, 4, 9, 14]], ["FSP", 5, 0, 1, 3], ["FSP", 5, 4, 2, 3], ["FSP", 5, 8, 3, 3], ["RE", 5, [0, 4, 8, 1, 5, 9, 2, 6, 10, 3, 7, 11]], ["CA", 4, 5, 8], ["CHR", 3, "shared", [4]], ["CA", 4, 5, 9], ["CHR", 2, "shared", [5]], ["CA", 3, 6, 9], ["CI", 2], ["FU", 7, [0, 1, 2]], ["AN", 7, 0, 5], ["FU", 7, [1, 2, 3]], ["AN", 7, 1, 4], ["FU", 7, [2, 3, 4]], ["AN", 7, 2, 6], ["FU", 5, [0, 1, 2]], ["SP", 5, 0, 128, [1], 1], ["AN", 5, 1, 2], ["FFSP", 5, 0, [3, 2, 1], 1, 1], ["AN", 5, 1, 6], ["FU", 3, [0, 1, 2]], ["SP", 3, 0, 16, [1], 1], ["AN", 3, 1, 2], ["FFSP", 3, 0, [3, 2, 1], 1, 1], ["AN", 3, 1, 6], ["PR", 6, 0, "auto_unroll_max_step$16"]]]], "r": [[0.00357136], 0, 4.00254, 1678617378], "v": "v0.6"}
{"i": [["[\"tw_kernel\", 1024, 1024, 102, 128, 8, \"float32\"]", "cuda -keys=cuda,gpu -arch=sm_70 -max_num_threads=1024 -model=unknown -thread_warp_size=32", [-1, 16, 64, 49152, 2147483647, 1024, 8, 32], "", 0, ["mask_k"]], [[], [["CHW", 4, "local"], ["SP", 4, 0, 8, [1, 1, 1, 1], 1], ["SP", 4, 5, 128, [4, 8, 1, 1], 1], ["SP", 4, 10, 1024, [1, 4, 8, 2], 1], ["SP", 4, 15, 102, [2, 3], 1], ["RE", 4, [0, 5, 10, 1, 6, 11, 2, 7, 12, 15, 16, 3, 8, 13, 17, 4, 9, 14]], ["FSP", 5, 0, 1, 3], ["FSP", 5, 4, 2, 3], ["FSP", 5, 8, 3, 3], ["RE", 5, [0, 4, 8, 1, 5, 9, 2, 6, 10, 3, 7, 11]], ["CA", 4, 5, 8], ["CHR", 3, "shared", [4]], ["CA", 4, 5, 9], ["CHR", 2, "shared", [5]], ["CA", 3, 6, 9], ["CI", 2], ["FU", 7, [0, 1, 2]], ["AN", 7, 0, 5], ["FU", 7, [1, 2, 3]], ["AN", 7, 1, 4], ["FU", 7, [2, 3, 4]], ["AN", 7, 2, 6], ["FU", 5, [0, 1, 2]], ["SP", 5, 0, 48, [1], 1], ["AN", 5, 1, 2], ["FFSP", 5, 0, [3, 2, 1], 1, 1], ["AN", 5, 1, 6], ["FU", 3, [0, 1, 2]], ["SP", 3, 0, 384, [1], 1], ["AN", 3, 1, 2], ["FFSP", 3, 0, [3, 2, 1], 1, 1], ["AN", 3, 1, 6], ["PR", 6, 0, "auto_unroll_max_step$64"]]]], "r": [[6.21079e-05], 0, 1.86063, 1678617378], "v": "v0.6"}
{"i": [["[\"tw_kernel\", 1024, 1024, 102, 128, 8, \"float32\"]", "cuda -keys=cuda,gpu -arch=sm_70 -max_num_threads=1024 -model=unknown -thread_warp_size=32", [-1, 16, 64, 49152, 2147483647, 1024, 8, 32], "", 0, ["mask_k"]], [[], [["CHW", 4, "local"], ["SP", 4, 0, 8, [2, 1, 1, 2], 1], ["SP", 4, 5, 128, [1, 1, 1, 8], 1], ["SP", 4, 10, 1024, [4, 8, 1, 32], 1], ["SP", 4, 15, 102, [1, 2], 1], ["RE", 4, [0, 5, 10, 1, 6, 11, 2, 7, 12, 15, 16, 3, 8, 13, 17, 4, 9, 14]], ["FSP", 5, 0, 1, 3], ["FSP", 5, 4, 2, 3], ["FSP", 5, 8, 3, 3], ["RE", 5, [0, 4, 8, 1, 5, 9, 2, 6, 10, 3, 7, 11]], ["CA", 4, 5, 8], ["CHR", 3, "shared", [4]], ["CA", 4, 5, 9], ["CHR", 2, "shared", [5]], ["CA", 3, 6, 9], ["CI", 2], ["FU", 7, [0, 1, 2]], ["AN", 7, 0, 5], ["FU", 7, [1, 2, 3]], ["AN", 7, 1, 4], ["FU", 7, [2, 3, 4]], ["AN", 7, 2, 6], ["FU", 5, [0, 1, 2]], ["SP", 5, 0, 8, [1], 1], ["AN", 5, 1, 2], ["FFSP", 5, 0, [3, 2, 1], 1, 1], ["AN", 5, 1, 6], ["FU", 3, [0, 1, 2]], ["SP", 3, 0, 256, [1], 1], ["AN", 3, 1, 2], ["FFSP", 3, 0, [3, 2, 1], 1, 1], ["AN", 3, 1, 6], ["PR", 6, 0, "auto_unroll_max_step$0"]]]], "r": [[0.017767], 0, 4.43895, 1678617378], "v": "v0.6"}
{"i": [["[\"tw_kernel\", 1024, 1024, 102, 128, 8, \"float32\"]", "cuda -keys=cuda,gpu -arch=sm_70 -max_num_threads=1024 -model=unknown -thread_warp_size=32", [-1, 16, 64, 49152, 2147483647, 1024, 8, 32], "", 0, ["mask_k"]], [[], [["CHW", 4, "local"], ["SP", 4, 0, 8, [1, 8, 1, 1], 1], ["SP", 4, 5, 128, [4, 2, 8, 2], 1], ["SP", 4, 10, 1024, [1, 4, 1, 32], 1], ["SP", 4, 15, 102, [1, 1], 1], ["RE", 4, [0, 5, 10, 1, 6, 11, 2, 7, 12, 15, 16, 3, 8, 13, 17, 4, 9, 14]], ["FSP", 5, 0, 1, 3], ["FSP", 5, 4, 2, 3], ["FSP", 5, 8, 3, 3], ["RE", 5, [0, 4, 8, 1, 5, 9, 2, 6, 10, 3, 7, 11]], ["CA", 4, 5, 8], ["CHR", 3, "shared", [4]], ["CA", 4, 5, 9], ["CHR", 2, "shared", [5]], ["CA", 3, 6, 9], ["CI", 2], ["FU", 7, [0, 1, 2]], ["AN", 7, 0, 5], ["FU", 7, [1, 2, 3]], ["AN", 7, 1, 4], ["FU", 7, [2, 3, 4]], ["AN", 7, 2, 6], ["FU", 5, [0, 1, 2]], ["SP", 5, 0, 16, [1], 1], ["AN", 5, 1, 2], ["FFSP", 5, 0, [3, 2, 1], 1, 1], ["AN", 5, 1, 6], ["FU", 3, [0, 1, 2]], ["SP", 3, 0, 32, [1], 1], ["AN", 3, 1, 2], ["FFSP", 3, 0, [3, 2, 1], 1, 1], ["AN", 3, 1, 6], ["PR", 6, 0, "auto_unroll_max_step$64"]]]], "r": [[0.00283794], 0, 2.61849, 1678617379], "v": "v0.6"}
{"i": [["[\"tw_kernel\", 1024, 1024, 102, 128, 8, \"float32\"]", "cuda -keys=cuda,gpu -arch=sm_70 -max_num_threads=1024 -model=unknown -thread_warp_size=32", [-1, 16, 64, 49152, 2147483647, 1024, 8, 32], "", 0, ["mask_k"]], [[], [["CHW", 4, "local"], ["SP", 4, 0, 8, [8, 1, 1, 1], 1], ["SP", 4, 5, 128, [1, 32, 1, 1], 1], ["SP", 4, 10, 1024, [1, 8, 16, 4], 1], ["SP", 4, 15, 102, [1, 1], 1], ["RE", 4, [0, 5, 10, 1, 6, 11, 2, 7, 12, 15, 16, 3, 8, 13, 17, 4, 9, 14]], ["FSP", 5, 0, 1, 3], ["FSP", 5, 4, 2, 3], ["FSP", 5, 8, 3, 3], ["RE", 5, [0, 4, 8, 1, 5, 9, 2, 6, 10, 3, 7, 11]], ["CA", 4, 5, 8], ["CHR", 3, "shared", [4]], ["CA", 4, 5, 9], ["CHR", 2, "shared", [5]], ["CA", 3, 6, 9], ["CI", 2], ["FU", 7, [0, 1, 2]], ["AN", 7, 0, 5], ["FU", 7, [1, 2, 3]], ["AN", 7, 1, 4], ["FU", 7, [2, 3, 4]], ["AN", 7, 2, 6], ["FU", 5, [0, 1, 2]], ["SP", 5, 0, 1, [1], 1], ["AN", 5, 1, 2], ["FFSP", 5, 0, [3, 2, 1], 1, 1], ["AN", 5, 1, 6], ["FU", 3, [0, 1, 2]], ["SP", 3, 0, 64, [1], 1], ["AN", 3, 1, 2], ["FFSP", 3, 0, [3, 2, 1], 1, 1], ["AN", 3, 1, 6], ["PR", 6, 0, "auto_unroll_max_step$64"]]]], "r": [[0.00428349], 0, 1.81429, 1678617379], "v": "v0.6"}
{"i": [["[\"tw_kernel\", 1024, 1024, 102, 128, 8, \"float32\"]", "cuda -keys=cuda,gpu -arch=sm_70 -max_num_threads=1024 -model=unknown -thread_warp_size=32", [-1, 16, 64, 49152, 2147483647, 1024, 8, 32], "", 0, ["mask_k"]], [[], [["CHW", 4, "local"], ["SP", 4, 0, 8, [2, 1, 2, 1], 1], ["SP", 4, 5, 128, [1, 32, 1, 4], 1], ["SP", 4, 10, 1024, [1, 4, 64, 2], 1], ["SP", 4, 15, 102, [1, 1], 1], ["RE", 4, [0, 5, 10, 1, 6, 11, 2, 7, 12, 15, 16, 3, 8, 13, 17, 4, 9, 14]], ["FSP", 5, 0, 1, 3], ["FSP", 5, 4, 2, 3], ["FSP", 5, 8, 3, 3], ["RE", 5, [0, 4, 8, 1, 5, 9, 2, 6, 10, 3, 7, 11]], ["CA", 4, 5, 8], ["CHR", 3, "shared", [4]], ["CA", 4, 5, 9], ["CHR", 2, "shared", [5]], ["CA", 3, 6, 9], ["CI", 2], ["FU", 7, [0, 1, 2]], ["AN", 7, 0, 5], ["FU", 7, [1, 2, 3]], ["AN", 7, 1, 4], ["FU", 7, [2, 3, 4]], ["AN", 7, 2, 6], ["FU", 5, [0, 1, 2]], ["SP", 5, 0, 2, [1], 1], ["AN", 5, 1, 2], ["FFSP", 5, 0, [3, 2, 1], 1, 1], ["AN", 5, 1, 6], ["FU", 3, [0, 1, 2]], ["SP", 3, 0, 256, [1], 1], ["AN", 3, 1, 2], ["FFSP", 3, 0, [3, 2, 1], 1, 1], ["AN", 3, 1, 6], ["PR", 6, 0, "auto_unroll_max_step$0"]]]], "r": [[0.00467203], 0, 2.09756, 1678617379], "v": "v0.6"}
{"i": [["[\"tw_kernel\", 1024, 1024, 102, 128, 8, \"float32\"]", "cuda -keys=cuda,gpu -arch=sm_70 -max_num_threads=1024 -model=unknown -thread_warp_size=32", [-1, 16, 64, 49152, 2147483647, 1024, 8, 32], "", 0, ["mask_k"]], [[], [["CHW", 4, "local"], ["SP", 4, 0, 8, [1, 1, 1, 2], 1], ["SP", 4, 5, 128, [1, 4, 32, 1], 1], ["SP", 4, 10, 1024, [1, 1, 8, 2], 1], ["SP", 4, 15, 102, [1, 17], 1], ["RE", 4, [0, 5, 10, 1, 6, 11, 2, 7, 12, 15, 16, 3, 8, 13, 17, 4, 9, 14]], ["FSP", 5, 0, 1, 3], ["FSP", 5, 4, 2, 3], ["FSP", 5, 8, 3, 3], ["RE", 5, [0, 4, 8, 1, 5, 9, 2, 6, 10, 3, 7, 11]], ["CA", 4, 5, 8], ["CHR", 3, "shared", [4]], ["CA", 4, 5, 9], ["CHR", 2, "shared", [5]], ["CA", 3, 6, 9], ["CI", 2], ["FU", 7, [0, 1, 2]], ["AN", 7, 0, 5], ["FU", 7, [1, 2, 3]], ["AN", 7, 1, 4], ["FU", 7, [2, 3, 4]], ["AN", 7, 2, 6], ["FU", 5, [0, 1, 2]], ["SP", 5, 0, 136, [1], 1], ["AN", 5, 1, 2], ["FFSP", 5, 0, [3, 2, 1], 1, 1], ["AN", 5, 1, 6], ["FU", 3, [0, 1, 2]], ["SP", 3, 0, 544, [1], 1], ["AN", 3, 1, 2], ["FFSP", 3, 0, [3, 2, 1], 1, 1], ["AN", 3, 1, 6], ["PR", 6, 0, "auto_unroll_max_step$64"]]]], "r": [[0.00130164], 0, 1.46986, 1678617380], "v": "v0.6"}
{"i": [["[\"tw_kernel\", 1024, 1024, 102, 128, 8, \"float32\"]", "cuda -keys=cuda,gpu -arch=sm_70 -max_num_threads=1024 -model=unknown -thread_warp_size=32", [-1, 16, 64, 49152, 2147483647, 1024, 8, 32], "", 0, ["mask_k"]], [[], [["CHW", 4, "local"], ["SP", 4, 0, 8, [1, 2, 4, 1], 1], ["SP", 4, 5, 128, [2, 32, 2, 1], 1], ["SP", 4, 10, 1024, [1, 1, 8, 64], 1], ["SP", 4, 15, 102, [1, 1], 1], ["RE", 4, [0, 5, 10, 1, 6, 11, 2, 7, 12, 15, 16, 3, 8, 13, 17, 4, 9, 14]], ["FSP", 5, 0, 1, 3], ["FSP", 5, 4, 2, 3], ["FSP", 5, 8, 3, 3], ["RE", 5, [0, 4, 8, 1, 5, 9, 2, 6, 10, 3, 7, 11]], ["CA", 4, 5, 8], ["CHR", 3, "shared", [4]], ["CA", 4, 5, 9], ["CHR", 2, "shared", [5]], ["CA", 3, 6, 9], ["CI", 2], ["FU", 7, [0, 1, 2]], ["AN", 7, 0, 5], ["FU", 7, [1, 2, 3]], ["AN", 7, 1, 4], ["FU", 7, [2, 3, 4]], ["AN", 7, 2, 6], ["FU", 5, [0, 1, 2]], ["SP", 5, 0, 16, [1], 1], ["AN", 5, 1, 2], ["FFSP", 5, 0, [3, 2, 1], 1, 1], ["AN", 5, 1, 6], ["FU", 3, [0, 1, 2]], ["SP", 3, 0, 512, [1], 1], ["AN", 3, 1, 2], ["FFSP", 3, 0, [3, 2, 1], 1, 1], ["AN", 3, 1, 6], ["PR", 6, 0, "auto_unroll_max_step$0"]]]], "r": [[0.0102298], 0, 2.54137, 1678617380], "v": "v0.6"}
{"i": [["[\"tw_kernel\", 1024, 1024, 102, 128, 8, \"float32\"]", "cuda -keys=cuda,gpu -arch=sm_70 -max_num_threads=1024 -model=unknown -thread_warp_size=32", [-1, 16, 64, 49152, 2147483647, 1024, 8, 32], "", 0, ["mask_k"]], [[], [["CHW", 4, "local"], ["SP", 4, 0, 8, [1, 2, 4, 1], 1], ["SP", 4, 5, 128, [2, 16, 4, 1], 1], ["SP", 4, 10, 1024, [1, 2, 8, 16], 1], ["SP", 4, 15, 102, [1, 1], 1], ["RE", 4, [0, 5, 10, 1, 6, 11, 2, 7, 12, 15, 16, 3, 8, 13, 17, 4, 9, 14]], ["FSP", 5, 0, 1, 3], ["FSP", 5, 4, 2, 3], ["FSP", 5, 8, 3, 3], ["RE", 5, [0, 4, 8, 1, 5, 9, 2, 6, 10, 3, 7, 11]], ["CA", 4, 5, 8], ["CHR", 3, "shared", [4]], ["CA", 4, 5, 9], ["CHR", 2, "shared", [5]], ["CA", 3, 6, 9], ["CI", 2], ["FU", 7, [0, 1, 2]], ["AN", 7, 0, 5], ["FU", 7, [1, 2, 3]], ["AN", 7, 1, 4], ["FU", 7, [2, 3, 4]], ["AN", 7, 2, 6], ["FU", 5, [0, 1, 2]], ["SP", 5, 0, 16, [2], 1], ["AN", 5, 1, 2], ["FFSP", 5, 0, [3, 2, 1], 1, 1], ["AN", 5, 1, 6], ["FU", 3, [0, 1, 2]], ["SP", 3, 0, 512, [1], 1], ["AN", 3, 1, 2], ["FFSP", 3, 0, [3, 2, 1], 1, 1], ["AN", 3, 1, 6], ["PR", 6, 0, "auto_unroll_max_step$0"]]]], "r": [[0.0061143], 0, 4.30445, 1678617380], "v": "v0.6"}
{"i": [["[\"tw_kernel\", 1024, 1024, 102, 128, 8, \"float32\"]", "cuda -keys=cuda,gpu -arch=sm_70 -max_num_threads=1024 -model=unknown -thread_warp_size=32", [-1, 16, 64, 49152, 2147483647, 1024, 8, 32], "", 0, ["mask_k"]], [[], [["CHW", 4, "local"], ["SP", 4, 0, 8, [2, 1, 1, 1], 1], ["SP", 4, 5, 128, [1, 32, 1, 1], 1], ["SP", 4, 10, 1024, [1, 8, 16, 4], 1], ["SP", 4, 15, 102, [1, 1], 1], ["RE", 4, [0, 5, 10, 1, 6, 11, 2, 7, 12, 15, 16, 3, 8, 13, 17, 4, 9, 14]], ["FSP", 5, 0, 1, 3], ["FSP", 5, 4, 2, 3], ["FSP", 5, 8, 3, 3], ["RE", 5, [0, 4, 8, 1, 5, 9, 2, 6, 10, 3, 7, 11]], ["CA", 4, 5, 8], ["CHR", 3, "shared", [4]], ["CA", 4, 5, 9], ["CHR", 2, "shared", [5]], ["CA", 3, 6, 9], ["CI", 2], ["FU", 7, [0, 1, 2]], ["AN", 7, 0, 5], ["FU", 7, [1, 2, 3]], ["AN", 7, 1, 4], ["FU", 7, [2, 3, 4]], ["AN", 7, 2, 6], ["FU", 5, [0, 1, 2]], ["SP", 5, 0, 1, [1], 1], ["AN", 5, 1, 2], ["FFSP", 5, 0, [3, 2, 1], 1, 1], ["AN", 5, 1, 6], ["FU", 3, [0, 1, 2]], ["SP", 3, 0, 64, [2], 1], ["AN", 3, 1, 2], ["FFSP", 3, 0, [3, 2, 1], 1, 1], ["AN", 3, 1, 6], ["PR", 6, 0, "auto_unroll_max_step$64"]]]], "r": [[0.000716493], 0, 1.15172, 1678617380], "v": "v0.6"}
{"i": [["[\"tw_kernel\", 1024, 1024, 102, 128, 8, \"float32\"]", "cuda -keys=cuda,gpu -arch=sm_70 -max_num_threads=1024 -model=unknown -thread_warp_size=32", [-1, 16, 64, 49152, 2147483647, 1024, 8, 32], "", 0, ["mask_k"]], [[], [["CHW", 4, "local"], ["SP", 4, 0, 8, [1, 4, 1, 1], 1], ["SP", 4, 5, 128, [1, 16, 2, 1], 1], ["SP", 4, 10, 1024, [2, 1, 1, 32], 1], ["SP", 4, 15, 102, [3, 1], 1], ["RE", 4, [0, 5, 10, 1, 6, 11, 2, 7, 12, 15, 16, 3, 8, 13, 17, 4, 9, 14]], ["FSP", 5, 0, 1, 3], ["FSP", 5, 4, 2, 3], ["FSP", 5, 8, 3, 3], ["RE", 5, [0, 4, 8, 1, 5, 9, 2, 6, 10, 3, 7, 11]], ["CA", 4, 5, 8], ["CHR", 3, "shared", [4]], ["CA", 4, 5, 9], ["CHR", 2, "shared", [5]], ["CA", 3, 6, 9], ["CI", 2], ["FU", 7, [0, 1, 2]], ["AN", 7, 0, 5], ["FU", 7, [1, 2, 3]], ["AN", 7, 1, 4], ["FU", 7, [2, 3, 4]], ["AN", 7, 2, 6], ["FU", 5, [0, 1, 2]], ["SP", 5, 0, 6, [1], 1], ["AN", 5, 1, 2], ["FFSP", 5, 0, [3, 2, 1], 1, 1], ["AN", 5, 1, 6], ["FU", 3, [0, 1, 2]], ["SP", 3, 0, 96, [3], 1], ["AN", 3, 1, 2], ["FFSP", 3, 0, [3, 2, 1], 1, 1], ["AN", 3, 1, 6], ["PR", 6, 0, "auto_unroll_max_step$64"]]]], "r": [[0.000116619], 0, 2.02092, 1678617381], "v": "v0.6"}
