AutoSchedule/Outputs/Ansor/tw_1024_1024_1024_ts128_spar65_1024_float32_gpu_trails2000.json
{"i": [["[\"tw_kernel\", 1024, 1024, 358, 128, 8, \"float32\"]", "cuda -keys=cuda,gpu -arch=sm_70 -max_num_threads=1024 -model=unknown -thread_warp_size=32", [-1, 16, 64, 49152, 2147483647, 1024, 8, 32], "", 0, ["mask_k"]], [[], [["CHW", 4, "local"], ["SP", 4, 0, 8, [2, 1, 1, 1], 1], ["SP", 4, 5, 128, [1, 8, 1, 1], 1], ["SP", 4, 10, 1024, [2, 8, 2, 32], 1], ["SP", 4, 15, 358, [1, 1], 1], ["RE", 4, [0, 5, 10, 1, 6, 11, 2, 7, 12, 15, 16, 3, 8, 13, 17, 4, 9, 14]], ["FSP", 5, 0, 1, 3], ["FSP", 5, 4, 2, 3], ["FSP", 5, 8, 3, 3], ["RE", 5, [0, 4, 8, 1, 5, 9, 2, 6, 10, 3, 7, 11]], ["CA", 4, 5, 8], ["CHR", 3, "shared", [4]], ["CA", 4, 5, 9], ["CHR", 2, "shared", [5]], ["CA", 3, 6, 9], ["CI", 2], ["FU", 7, [0, 1, 2]], ["AN", 7, 0, 5], ["FU", 7, [1, 2, 3]], ["AN", 7, 1, 4], ["FU", 7, [2, 3, 4]], ["AN", 7, 2, 6], ["FU", 5, [0, 1, 2]], ["SP", 5, 0, 2, [1], 1], ["AN", 5, 1, 2], ["FFSP", 5, 0, [3, 2, 1], 1, 1], ["AN", 5, 1, 6], ["FU", 3, [0, 1, 2]], ["SP", 3, 0, 128, [1], 1], ["AN", 3, 1, 2], ["FFSP", 3, 0, [3, 2, 1], 1, 1], ["AN", 3, 1, 6], ["PR", 6, 0, "auto_unroll_max_step$0"]]]], "r": [[0.00192457], 0, 2.72629, 1678602042], "v": "v0.6"}
{"i": [["[\"tw_kernel\", 1024, 1024, 358, 128, 8, \"float32\"]", "cuda -keys=cuda,gpu -arch=sm_70 -max_num_threads=1024 -model=unknown -thread_warp_size=32", [-1, 16, 64, 49152, 2147483647, 1024, 8, 32], "", 0, ["mask_k"]], [[], [["CHW", 4, "local"], ["SP", 4, 0, 8, [1, 4, 1, 2], 1], ["SP", 4, 5, 128, [1, 1, 64, 1], 1], ["SP", 4, 10, 1024, [4, 8, 1, 2], 1], ["SP", 4, 15, 358, [1, 1], 1], ["RE", 4, [0, 5, 10, 1, 6, 11, 2, 7, 12, 15, 16, 3, 8, 13, 17, 4, 9, 14]], ["FSP", 5, 0, 1, 3], ["FSP", 5, 4, 2, 3], ["FSP", 5, 8, 3, 3], ["RE", 5, [0, 4, 8, 1, 5, 9, 2, 6, 10, 3, 7, 11]], ["CA", 4, 5, 8], ["CHR", 3, "shared", [4]], ["CA", 4, 5, 9], ["CHR", 2, "shared", [5]], ["CA", 3, 6, 9], ["CI", 2], ["FU", 7, [0, 1, 2]], ["AN", 7, 0, 5], ["FU", 7, [1, 2, 3]], ["AN", 7, 1, 4], ["FU", 7, [2, 3, 4]], ["AN", 7, 2, 6], ["FU", 5, [0, 1, 2]], ["SP", 5, 0, 256, [1], 1], ["AN", 5, 1, 2], ["FFSP", 5, 0, [3, 2, 1], 1, 1], ["AN", 5, 1, 6], ["FU", 3, [0, 1, 2]], ["SP", 3, 0, 8, [1], 1], ["AN", 3, 1, 2], ["FFSP", 3, 0, [3, 2, 1], 1, 1], ["AN", 3, 1, 6], ["PR", 6, 0, "auto_unroll_max_step$16"]]]], "r": [[0.00517474], 0, 1.94486, 1678602042], "v": "v0.6"}
{"i": [["[\"tw_kernel\", 1024, 1024, 358, 128, 8, \"float32\"]", "cuda -keys=cuda,gpu -arch=sm_70 -max_num_threads=1024 -model=unknown -thread_warp_size=32", [-1, 16, 64, 49152, 2147483647, 1024, 8, 32], "", 0, ["mask_k"]], [[], [["CHW", 4, "local"], ["SP", 4, 0, 8, [1, 1, 1, 1], 1], ["SP", 4, 5, 128, [1, 4, 32, 1], 1], ["SP", 4, 10, 1024, [8, 1, 2, 4], 1], ["SP", 4, 15, 358, [1, 2], 1], ["RE", 4, [0, 5, 10, 1, 6, 11, 2, 7, 12, 15, 16, 3, 8, 13, 17, 4, 9, 14]], ["FSP", 5, 0, 1, 3], ["FSP", 5, 4, 2, 3], ["FSP", 5, 8, 3, 3], ["RE", 5, [0, 4, 8, 1, 5, 9, 2, 6, 10, 3, 7, 11]], ["CA", 4, 5, 8], ["CHR", 3, "shared", [4]], ["CA", 4, 5, 9], ["CHR", 2, "shared", [5]], ["CA", 3, 6, 9], ["CI", 2], ["FU", 7, [0, 1, 2]], ["AN", 7, 0, 5], ["FU", 7, [1, 2, 3]], ["AN", 7, 1, 4], ["FU", 7, [2, 3, 4]], ["AN", 7, 2, 6], ["FU", 5, [0, 1, 2]], ["SP", 5, 0, 8, [1], 1], ["AN", 5, 1, 2], ["FFSP", 5, 0, [3, 2, 1], 1, 1], ["AN", 5, 1, 6], ["FU", 3, [0, 1, 2]], ["SP", 3, 0, 8, [1], 1], ["AN", 3, 1, 2], ["FFSP", 3, 0, [3, 2, 1], 1, 1], ["AN", 3, 1, 6], ["PR", 6, 0, "auto_unroll_max_step$16"]]]], "r": [[0.0155828], 0, 2.21985, 1678602042], "v": "v0.6"}
{"i": [["[\"tw_kernel\", 1024, 1024, 358, 128, 8, \"float32\"]", "cuda -keys=cuda,gpu -arch=sm_70 -max_num_threads=1024 -model=unknown -thread_warp_size=32", [-1, 16, 64, 49152, 2147483647, 1024, 8, 32], "", 0, ["mask_k"]], [[], [["CHW", 4, "local"], ["SP", 4, 0, 8, [1, 1, 1, 4], 1], ["SP", 4, 5, 128, [2, 2, 1, 32], 1], ["SP", 4, 10, 1024, [1, 8, 8, 4], 1], ["SP", 4, 15, 358, [1, 1], 1], ["RE", 4, [0, 5, 10, 1, 6, 11, 2, 7, 12, 15, 16, 3, 8, 13, 17, 4, 9, 14]], ["FSP", 5, 0, 1, 3], ["FSP", 5, 4, 2, 3], ["FSP", 5, 8, 3, 3], ["RE", 5, [0, 4, 8, 1, 5, 9, 2, 6, 10, 3, 7, 11]], ["CA", 4, 5, 8], ["CHR", 3, "shared", [4]], ["CA", 4, 5, 9], ["CHR", 2, "shared", [5]], ["CA", 3, 6, 9], ["CI", 2], ["FU", 7, [0, 1, 2]], ["AN", 7, 0, 5], ["FU", 7, [1, 2, 3]], ["AN", 7, 1, 4], ["FU", 7, [2, 3, 4]], ["AN", 7, 2, 6], ["FU", 5, [0, 1, 2]], ["SP", 5, 0, 16, [1], 1], ["AN", 5, 1, 2], ["FFSP", 5, 0, [3, 2, 1], 1, 1], ["AN", 5, 1, 6], ["FU", 3, [0, 1, 2]], ["SP", 3, 0, 64, [2], 1], ["AN", 3, 1, 2], ["FFSP", 3, 0, [3, 2, 1], 1, 1], ["AN", 3, 1, 6], ["PR", 6, 0, "auto_unroll_max_step$0"]]]], "r": [[0.0281532], 0, 3.97719, 1678602043], "v": "v0.6"}
{"i": [["[\"tw_kernel\", 1024, 1024, 358, 128, 8, \"float32\"]", "cuda -keys=cuda,gpu -arch=sm_70 -max_num_threads=1024 -model=unknown -thread_warp_size=32", [-1, 16, 64, 49152, 2147483647, 1024, 8, 32], "", 0, ["mask_k"]], [[], [["CHW", 4, "local"], ["SP", 4, 0, 8, [1, 1, 1, 4], 1], ["SP", 4, 5, 128, [1, 1, 128, 1], 1], ["SP", 4, 10, 1024, [1, 16, 8, 4], 1], ["SP", 4, 15, 358, [1, 1], 1], ["RE", 4, [0, 5, 10, 1, 6, 11, 2, 7, 12, 15, 16, 3, 8, 13, 17, 4, 9, 14]], ["FSP", 5, 0, 1, 3], ["FSP", 5, 4, 2, 3], ["FSP", 5, 8, 3, 3], ["RE", 5, [0, 4, 8, 1, 5, 9, 2, 6, 10, 3, 7, 11]], ["CA", 4, 5, 8], ["CHR", 3, "shared", [4]], ["CA", 4, 5, 9], ["CHR", 2, "shared", [5]], ["CA", 3, 6, 9], ["CI", 2], ["FU", 7, [0, 1, 2]], ["AN", 7, 0, 5], ["FU", 7, [1, 2, 3]], ["AN", 7, 1, 4], ["FU", 7, [2, 3, 4]], ["AN", 7, 2, 6], ["FU", 5, [0, 1, 2]], ["SP", 5, 0, 512, [1], 1], ["AN", 5, 1, 2], ["FFSP", 5, 0, [3, 2, 1], 1, 1], ["AN", 5, 1, 6], ["FU", 3, [0, 1, 2]], ["SP", 3, 0, 64, [1], 1], ["AN", 3, 1, 2], ["FFSP", 3, 0, [3, 2, 1], 1, 1], ["AN", 3, 1, 6], ["PR", 6, 0, "auto_unroll_max_step$0"]]]], "r": [[0.13442], 0, 2.73934, 1678602043], "v": "v0.6"}
{"i": [["[\"tw_kernel\", 1024, 1024, 358, 128, 8, \"float32\"]", "cuda -keys=cuda,gpu -arch=sm_70 -max_num_threads=1024 -model=unknown -thread_warp_size=32", [-1, 16, 64, 49152, 2147483647, 1024, 8, 32], "", 0, ["mask_k"]], [[], [["CHW", 4, "local"], ["SP", 4, 0, 8, [1, 1, 1, 8], 1], ["SP", 4, 5, 128, [2, 8, 1, 1], 1], ["SP", 4, 10, 1024, [2, 4, 2, 16], 1], ["SP", 4, 15, 358, [2, 1], 1], ["RE", 4, [0, 5, 10, 1, 6, 11, 2, 7, 12, 15, 16, 3, 8, 13, 17, 4, 9, 14]], ["FSP", 5, 0, 1, 3], ["FSP", 5, 4, 2, 3], ["FSP", 5, 8, 3, 3], ["RE", 5, [0, 4, 8, 1, 5, 9, 2, 6, 10, 3, 7, 11]], ["CA", 4, 5, 8], ["CHR", 3, "shared", [4]], ["CA", 4, 5, 9], ["CHR", 2, "shared", [5]], ["CA", 3, 6, 9], ["CI", 2], ["FU", 7, [0, 1, 2]], ["AN", 7, 0, 5], ["FU", 7, [1, 2, 3]], ["AN", 7, 1, 4], ["FU", 7, [2, 3, 4]], ["AN", 7, 2, 6], ["FU", 5, [0, 1, 2]], ["SP", 5, 0, 16, [1], 1], ["AN", 5, 1, 2], ["FFSP", 5, 0, [3, 2, 1], 1, 1], ["AN", 5, 1, 6], ["FU", 3, [0, 1, 2]], ["SP", 3, 0, 512, [1], 1], ["AN", 3, 1, 2], ["FFSP", 3, 0, [3, 2, 1], 1, 1], ["AN", 3, 1, 6], ["PR", 6, 0, "auto_unroll_max_step$0"]]]], "r": [[0.00446243], 0, 3.68166, 1678602044], "v": "v0.6"}
{"i": [["[\"tw_kernel\", 1024, 1024, 358, 128, 8, \"float32\"]", "cuda -keys=cuda,gpu -arch=sm_70 -max_num_threads=1024 -model=unknown -thread_warp_size=32", [-1, 16, 64, 49152, 2147483647, 1024, 8, 32], "", 0, ["mask_k"]], [[], [["CHW", 4, "local"], ["SP", 4, 0, 8, [1, 8, 1, 1], 1], ["SP", 4, 5, 128, [1, 2, 1, 1], 1], ["SP", 4, 10, 1024, [1, 4, 8, 16], 1], ["SP", 4, 15, 358, [1, 1], 1], ["RE", 4, [0, 5, 10, 1, 6, 11, 2, 7, 12, 15, 16, 3, 8, 13, 17, 4, 9, 14]], ["FSP", 5, 0, 1, 3], ["FSP", 5, 4, 2, 3], ["FSP", 5, 8, 3, 3], ["RE", 5, [0, 4, 8, 1, 5, 9, 2, 6, 10, 3, 7, 11]], ["CA", 4, 5, 8], ["CHR", 3, "shared", [4]], ["CA", 4, 5, 9], ["CHR", 2, "shared", [5]], ["CA", 3, 6, 9], ["CI", 2], ["FU", 7, [0, 1, 2]], ["AN", 7, 0, 5], ["FU", 7, [1, 2, 3]], ["AN", 7, 1, 4], ["FU", 7, [2, 3, 4]], ["AN", 7, 2, 6], ["FU", 5, [0, 1, 2]], ["SP", 5, 0, 1, [1], 1], ["AN", 5, 1, 2], ["FFSP", 5, 0, [3, 2, 1], 1, 1], ["AN", 5, 1, 6], ["FU", 3, [0, 1, 2]], ["SP", 3, 0, 128, [4], 1], ["AN", 3, 1, 2], ["FFSP", 3, 0, [3, 2, 1], 1, 1], ["AN", 3, 1, 6], ["PR", 6, 0, "auto_unroll_max_step$512"]]]], "r": [[0.000994253], 0, 2.01223, 1678602044], "v": "v0.6"}
{"i": [["[\"tw_kernel\", 1024, 1024, 358, 128, 8, \"float32\"]", "cuda -keys=cuda,gpu -arch=sm_70 -max_num_threads=1024 -model=unknown -thread_warp_size=32", [-1, 16, 64, 49152, 2147483647, 1024, 8, 32], "", 0, ["mask_k"]], [[], [["CHW", 4, "local"], ["SP", 4, 0, 8, [1, 4, 2, 1], 1], ["SP", 4, 5, 128, [2, 8, 1, 8], 1], ["SP", 4, 10, 1024, [1, 1, 64, 1], 1], ["SP", 4, 15, 358, [1, 2], 1], ["RE", 4, [0, 5, 10, 1, 6, 11, 2, 7, 12, 15, 16, 3, 8, 13, 17, 4, 9, 14]], ["FSP", 5, 0, 1, 3], ["FSP", 5, 4, 2, 3], ["FSP", 5, 8, 3, 3], ["RE", 5, [0, 4, 8, 1, 5, 9, 2, 6, 10, 3, 7, 11]], ["CA", 4, 5, 8], ["CHR", 3, "shared", [4]], ["CA", 4, 5, 9], ["CHR", 2, "shared", [5]], ["CA", 3, 6, 9], ["CI", 2], ["FU", 7, [0, 1, 2]], ["AN", 7, 0, 5], ["FU", 7, [1, 2, 3]], ["AN", 7, 1, 4], ["FU", 7, [2, 3, 4]], ["AN", 7, 2, 6], ["FU", 5, [0, 1, 2]], ["SP", 5, 0, 32, [1], 1], ["AN", 5, 1, 2], ["FFSP", 5, 0, [3, 2, 1], 1, 1], ["AN", 5, 1, 6], ["FU", 3, [0, 1, 2]], ["SP", 3, 0, 256, [1], 1], ["AN", 3, 1, 2], ["FFSP", 3, 0, [3, 2, 1], 1, 1], ["AN", 3, 1, 6], ["PR", 6, 0, "auto_unroll_max_step$0"]]]], "r": [[0.00749114], 0, 2.62234, 1678602044], "v": "v0.6"}
{"i": [["[\"tw_kernel\", 1024, 1024, 358, 128, 8, \"float32\"]", "cuda -keys=cuda,gpu -arch=sm_70 -max_num_threads=1024 -model=unknown -thread_warp_size=32", [-1, 16, 64, 49152, 2147483647, 1024, 8, 32], "", 0, ["mask_k"]], [[], [["CHW", 4, "local"], ["SP", 4, 0, 8, [1, 4, 2, 1], 1], ["SP", 4, 5, 128, [1, 2, 4, 8], 1], ["SP", 4, 10, 1024, [1, 16, 1, 1], 1], ["SP", 4, 15, 358, [1, 2], 1], ["RE", 4, [0, 5, 10, 1, 6, 11, 2, 7, 12, 15, 16, 3, 8, 13, 17, 4, 9, 14]], ["FSP", 5, 0, 1, 3], ["FSP", 5, 4, 2, 3], ["FSP", 5, 8, 3, 3], ["RE", 5, [0, 4, 8, 1, 5, 9, 2, 6, 10, 3, 7, 11]], ["CA", 4, 5, 8], ["CHR", 3, "shared", [4]], ["CA", 4, 5, 9], ["CHR", 2, "shared", [5]], ["CA", 3, 6, 9], ["CI", 2], ["FU", 7, [0, 1, 2]], ["AN", 7, 0, 5], ["FU", 7, [1, 2, 3]], ["AN", 7, 1, 4], ["FU", 7, [2, 3, 4]], ["AN", 7, 2, 6], ["FU", 5, [0, 1, 2]], ["SP", 5, 0, 256, [1], 1], ["AN", 5, 1, 2], ["FFSP", 5, 0, [3, 2, 1], 1, 1], ["AN", 5, 1, 6], ["FU", 3, [0, 1, 2]], ["SP", 3, 0, 8, [1], 1], ["AN", 3, 1, 2], ["FFSP", 3, 0, [3, 2, 1], 1, 1], ["AN", 3, 1, 6], ["PR", 6, 0, "auto_unroll_max_step$16"]]]], "r": [[0.000253984], 0, 1.57323, 1678602045], "v": "v0.6"}
{"i": [["[\"tw_kernel\", 1024, 1024, 358, 128, 8, \"float32\"]", "cuda -keys=cuda,gpu -arch=sm_70 -max_num_threads=1024 -model=unknown -thread_warp_size=32", [-1, 16, 64, 49152, 2147483647, 1024, 8, 32], "", 0, ["mask_k"]], [[], [["CHW", 4, "local"], ["SP", 4, 0, 8, [1, 1, 4, 2], 1], ["SP", 4, 5, 128, [1, 1, 128, 1], 1], ["SP", 4, 10, 1024, [2, 64, 2, 2], 1], ["SP", 4, 15, 358, [2, 1], 1], ["RE", 4, [0, 5, 10, 1, 6, 11, 2, 7, 12, 15, 16, 3, 8, 13, 17, 4, 9, 14]], ["FSP", 5, 0, 1, 3], ["FSP", 5, 4, 2, 3], ["FSP", 5, 8, 3, 3], ["RE", 5, [0, 4, 8, 1, 5, 9, 2, 6, 10, 3, 7, 11]], ["CA", 4, 5, 8], ["CHR", 3, "shared", [4]], ["CA", 4, 5, 9], ["CHR", 2, "shared", [5]], ["CA", 3, 6, 9], ["CI", 2], ["FU", 7, [0, 1, 2]], ["AN", 7, 0, 5], ["FU", 7, [1, 2, 3]], ["AN", 7, 1, 4], ["FU", 7, [2, 3, 4]], ["AN", 7, 2, 6], ["FU", 5, [0, 1, 2]], ["SP", 5, 0, 256, [1], 1], ["AN", 5, 1, 2], ["FFSP", 5, 0, [3, 2, 1], 1, 1], ["AN", 5, 1, 6], ["FU", 3, [0, 1, 2]], ["SP", 3, 0, 16, [1], 1], ["AN", 3, 1, 2], ["FFSP", 3, 0, [3, 2, 1], 1, 1], ["AN", 3, 1, 6], ["PR", 6, 0, "auto_unroll_max_step$1024"]]]], "r": [[0.0468658], 0, 2.99461, 1678602045], "v": "v0.6"}
{"i": [["[\"tw_kernel\", 1024, 1024, 358, 128, 8, \"float32\"]", "cuda -keys=cuda,gpu -arch=sm_70 -max_num_threads=1024 -model=unknown -thread_warp_size=32", [-1, 16, 64, 49152, 2147483647, 1024, 8, 32], "", 0, ["mask_k"]], [[], [["CHW", 4, "local"], ["SP", 4, 0, 8, [2, 1, 1, 4], 1], ["SP", 4, 5, 128, [1, 8, 4, 4], 1], ["SP", 4, 10, 1024, [1, 64, 1, 8], 1], ["SP", 4, 15, 358, [1, 1], 1], ["RE", 4, [0, 5, 10, 1, 6, 11, 2, 7, 12, 15, 16, 3, 8, 13, 17, 4, 9, 14]], ["FSP", 5, 0, 1, 3], ["FSP", 5, 4, 2, 3], ["FSP", 5, 8, 3, 3], ["RE", 5, [0, 4, 8, 1, 5, 9, 2, 6, 10, 3, 7, 11]], ["CA", 4, 5, 8], ["CHR", 3, "shared", [4]], ["CA", 4, 5, 9], ["CHR", 2, "shared", [5]], ["CA", 3, 6, 9], ["CI", 2], ["FU", 7, [0, 1, 2]], ["AN", 7, 0, 5], ["FU", 7, [1, 2, 3]], ["AN", 7, 1, 4], ["FU", 7, [2, 3, 4]], ["AN", 7, 2, 6], ["FU", 5, [0, 1, 2]], ["SP", 5, 0, 64, [1], 1], ["AN", 5, 1, 2], ["FFSP", 5, 0, [3, 2, 1], 1, 1], ["AN", 5, 1, 6], ["FU", 3, [0, 1, 2]], ["SP", 3, 0, 64, [1], 1], ["AN", 3, 1, 2], ["FFSP", 3, 0, [3, 2, 1], 1, 1], ["AN", 3, 1, 6], ["PR", 6, 0, "auto_unroll_max_step$1024"]]]], "r": [[0.0258355], 0, 7.51027, 1678602045], "v": "v0.6"}
{"i": [["[\"tw_kernel\", 1024, 1024, 358, 128, 8, \"float32\"]", "cuda -keys=cuda,gpu -arch=sm_70 -max_num_threads=1024 -model=unknown -thread_warp_size=32", [-1, 16, 64, 49152, 2147483647, 1024, 8, 32], "", 0, ["mask_k"]], [[], [["CHW", 4, "local"], ["SP", 4, 0, 8, [1, 1, 4, 2], 1], ["SP", 4, 5, 128, [2, 2, 2, 1], 1], ["SP", 4, 10, 1024, [1, 4, 1, 1], 1], ["SP", 4, 15, 358, [2, 1], 1], ["RE", 4, [0, 5, 10, 1, 6, 11, 2, 7, 12, 15, 16, 3, 8, 13, 17, 4, 9, 14]], ["FSP", 5, 0, 1, 3], ["FSP", 5, 4, 2, 3], ["FSP", 5, 8, 3, 3], ["RE", 5, [0, 4, 8, 1, 5, 9, 2, 6, 10, 3, 7, 11]], ["CA", 4, 5, 8], ["CHR", 3, "shared", [4]], ["CA", 4, 5, 9], ["CHR", 2, "shared", [5]], ["CA", 3, 6, 9], ["CI", 2], ["FU", 7, [0, 1, 2]], ["AN", 7, 0, 5], ["FU", 7, [1, 2, 3]], ["AN", 7, 1, 4], ["FU", 7, [2, 3, 4]], ["AN", 7, 2, 6], ["FU", 5, [0, 1, 2]], ["SP", 5, 0, 8, [2], 1], ["AN", 5, 1, 2], ["FFSP", 5, 0, [3, 2, 1], 1, 1], ["AN", 5, 1, 6], ["FU", 3, [0, 1, 2]], ["SP", 3, 0, 4, [1], 1], ["AN", 3, 1, 2], ["FFSP", 3, 0, [3, 2, 1], 1, 1], ["AN", 3, 1, 6], ["PR", 6, 0, "auto_unroll_max_step$1024"]]]], "r": [[0.00108841], 0, 1.0089, 1678602046], "v": "v0.6"}
{"i": [["[\"tw_kernel\", 1024, 1024, 358, 128, 8, \"float32\"]", "cuda -keys=cuda,gpu -arch=sm_70 -max_num_threads=1024 -model=unknown -thread_warp_size=32", [-1, 16, 64, 49152, 2147483647, 1024, 8, 32], "", 0, ["mask_k"]], [[], [["CHW", 4, "local"], ["SP", 4, 0, 8, [1, 2, 1, 1], 1], ["SP", 4, 5, 128, [2, 2, 1, 8], 1], ["SP", 4, 10, 1024, [2, 64, 2, 4], 1], ["SP", 4, 15, 358, [2, 1], 1], ["RE", 4, [0, 5, 10, 1, 6, 11, 2, 7, 12, 15, 16, 3, 8, 13, 17, 4, 9, 14]], ["FSP", 5, 0, 1, 3], ["FSP", 5, 4, 2, 3], ["FSP", 5, 8, 3, 3], ["RE", 5, [0, 4, 8, 1, 5, 9, 2, 6, 10, 3, 7, 11]], ["CA", 4, 5, 8], ["CHR", 3, "shared", [4]], ["CA", 4, 5, 9], ["CHR", 2, "shared", [5]], ["CA", 3, 6, 9], ["CI", 2], ["FU", 7, [0, 1, 2]], ["AN", 7, 0, 5], ["FU", 7, [1, 2, 3]], ["AN", 7, 1, 4], ["FU", 7, [2, 3, 4]], ["AN", 7, 2, 6], ["FU", 5, [0, 1, 2]], ["SP", 5, 0, 16, [1], 1], ["AN", 5, 1, 2], ["FFSP", 5, 0, [3, 2, 1], 1, 1], ["AN", 5, 1, 6], ["FU", 3, [0, 1, 2]], ["SP", 3, 0, 16, [2], 1], ["AN", 3, 1, 2], ["FFSP", 3, 0, [3, 2, 1], 1, 1], ["AN", 3, 1, 6], ["PR", 6, 0, "auto_unroll_max_step$16"]]]], "r": [[0.000819041], 0, 1.59742, 1678602046], "v": "v0.6"}
{"i": [["[\"tw_kernel\", 1024, 1024, 358, 128, 8, \"float32\"]", "cuda -keys=cuda,gpu -arch=sm_70 -max_num_threads=1024 -model=unknown -thread_warp_size=32", [-1, 16, 64, 49152, 2147483647, 1024, 8, 32], "", 0, ["mask_k"]], [[], [["CHW", 4, "local"], ["SP", 4, 0, 8, [4, 1, 1, 2], 1], ["SP", 4, 5, 128, [2, 16, 1, 2], 1], ["SP", 4, 10, 1024, [1, 4, 8, 4], 1], ["SP", 4, 15, 358, [2, 1], 1], ["RE", 4, [0, 5, 10, 1, 6, 11, 2, 7, 12, 15, 16, 3, 8, 13, 17, 4, 9, 14]], ["FSP", 5, 0, 1, 3], ["FSP", 5, 4, 2, 3], ["FSP", 5, 8, 3, 3], ["RE", 5, [0, 4, 8, 1, 5, 9, 2, 6, 10, 3, 7, 11]], ["CA", 4, 5, 8], ["CHR", 3, "shared", [4]], ["CA", 4, 5, 9], ["CHR", 2, "shared", [5]], ["CA", 3, 6, 9], ["CI", 2], ["FU", 7, [0, 1, 2]], ["AN", 7, 0, 5], ["FU", 7, [1, 2, 3]], ["AN", 7, 1, 4], ["FU", 7, [2, 3, 4]], ["AN", 7, 2, 6], ["FU", 5, [0, 1, 2]], ["SP", 5, 0, 16, [4], 1], ["AN", 5, 1, 2], ["FFSP", 5, 0, [3, 2, 1], 1, 1], ["AN", 5, 1, 6], ["FU", 3, [0, 1, 2]], ["SP", 3, 0, 128, [1], 1], ["AN", 3, 1, 2], ["FFSP", 3, 0, [3, 2, 1], 1, 1], ["AN", 3, 1, 6], ["PR", 6, 0, "auto_unroll_max_step$16"]]]], "r": [[0.00569675], 0, 3.0105, 1678602046], "v": "v0.6"}
{"i": [["[\"tw_kernel\", 1024, 1024, 358, 128, 8, \"float32\"]", "cuda -keys=cuda,gpu -arch=sm_70 -max_num_threads=1024 -model=unknown -thread_warp_size=32", [-1, 16, 64, 49152, 2147483647, 1024, 8, 32], "", 0, ["mask_k"]], [[], [["CHW", 4, "local"], ["SP", 4, 0, 8, [1, 2, 2, 1], 1], ["SP", 4, 5, 128, [1, 1, 16, 1], 1], ["SP", 4, 10, 1024, [2, 256, 1, 2], 1], ["SP", 4, 15, 358, [1, 2], 1], ["RE", 4, [0, 5, 10, 1, 6, 11, 2, 7, 12, 15, 16, 3, 8, 13, 17, 4, 9, 14]], ["FSP", 5, 0, 1, 3], ["FSP", 5, 4, 2, 3], ["FSP", 5, 8, 3, 3], ["RE", 5, [0, 4, 8, 1, 5, 9, 2, 6, 10, 3, 7, 11]], ["CA", 4, 5, 8], ["CHR", 3, "shared", [4]], ["CA", 4, 5, 9], ["CHR", 2, "shared", [5]], ["CA", 3, 6, 9], ["CI", 2], ["FU", 7, [0, 1, 2]], ["AN", 7, 0, 5], ["FU", 7, [1, 2, 3]], ["AN", 7, 1, 4], ["FU", 7, [2, 3, 4]], ["AN", 7, 2, 6], ["FU", 5, [0, 1, 2]], ["SP", 5, 0, 64, [1], 1], ["AN", 5, 1, 2], ["FFSP", 5, 0, [3, 2, 1], 1, 1], ["AN", 5, 1, 6], ["FU", 3, [0, 1, 2]], ["SP", 3, 0, 8, [4], 1], ["AN", 3, 1, 2], ["FFSP", 3, 0, [3, 2, 1], 1, 1], ["AN", 3, 1, 6], ["PR", 6, 0, "auto_unroll_max_step$16"]]]], "r": [[0.000767469], 0, 1.26289, 1678602047], "v": "v0.6"}
{"i": [["[\"tw_kernel\", 1024, 1024, 358, 128, 8, \"float32\"]", "cuda -keys=cuda,gpu -arch=sm_70 -max_num_threads=1024 -model=unknown -thread_warp_size=32", [-1, 16, 64, 49152, 2147483647, 1024, 8, 32], "", 0, ["mask_k"]], [[], [["CHW", 4, "local"], ["SP", 4, 0, 8, [2, 2, 2, 1], 1], ["SP", 4, 5, 128, [2, 1, 32, 2], 1], ["SP", 4, 10, 1024, [1, 32, 1, 4], 1], ["SP", 4, 15, 358, [1, 1], 1], ["RE", 4, [0, 5, 10, 1, 6, 11, 2, 7, 12, 15, 16, 3, 8, 13, 17, 4, 9, 14]], ["FSP", 5, 0, 1, 3], ["FSP", 5, 4, 2, 3], ["FSP", 5, 8, 3, 3], ["RE", 5, [0, 4, 8, 1, 5, 9, 2, 6, 10, 3, 7, 11]], ["CA", 4, 5, 8], ["CHR", 3, "shared", [4]], ["CA", 4, 5, 9], ["CHR", 2, "shared", [5]], ["CA", 3, 6, 9], ["CI", 2], ["FU", 7, [0, 1, 2]], ["AN", 7, 0, 5], ["FU", 7, [1, 2, 3]], ["AN", 7, 1, 4], ["FU", 7, [2, 3, 4]], ["AN", 7, 2, 6], ["FU", 5, [0, 1, 2]], ["SP", 5, 0, 128, [1], 1], ["AN", 5, 1, 2], ["FFSP", 5, 0, [3, 2, 1], 1, 1], ["AN", 5, 1, 6], ["FU", 3, [0, 1, 2]], ["SP", 3, 0, 8, [1], 1], ["AN", 3, 1, 2], ["FFSP", 3, 0, [3, 2, 1], 1, 1], ["AN", 3, 1, 6], ["PR", 6, 0, "auto_unroll_max_step$16"]]]], "r": [[0.0104467], 0, 1.40025, 1678602047], "v": "v0.6"}
{"i": [["[\"tw_kernel\", 1024, 1024, 358, 128, 8, \"float32\"]", "cuda -keys=cuda,gpu -arch=sm_70 -max_num_threads=1024 -model=unknown -thread_warp_size=32", [-1, 16, 64, 49152, 2147483647, 1024, 8, 32], "", 0, ["mask_k"]], [[], [["CHW", 4, "local"], ["SP", 4, 0, 8, [2, 2, 2, 1], 1], ["SP", 4, 5, 128, [4, 1, 1, 2], 1], ["SP", 4, 10, 1024, [1, 32, 4, 1], 1], ["SP", 4, 15, 358, [1, 2], 1], ["RE", 4, [0, 5, 10, 1, 6, 11, 2, 7, 12, 15, 16, 3, 8, 13, 17, 4, 9, 14]], ["FSP", 5, 0, 1, 3], ["FSP", 5, 4, 2, 3], ["FSP", 5, 8, 3, 3], ["RE", 5, [0, 4, 8, 1, 5, 9, 2, 6, 10, 3, 7, 11]], ["CA", 4, 5, 8], ["CHR", 3, "shared", [4]], ["CA", 4, 5, 9], ["CHR", 2, "shared", [5]], ["CA", 3, 6, 9], ["CI", 2], ["FU", 7, [0, 1, 2]], ["AN", 7, 0, 5], ["FU", 7, [1, 2, 3]], ["AN", 7, 1, 4], ["FU", 7, [2, 3, 4]], ["AN", 7, 2, 6], ["FU", 5, [0, 1, 2]], ["SP", 5, 0, 8, [1], 1], ["AN", 5, 1, 2], ["FFSP", 5, 0, [3, 2, 1], 1, 1], ["AN", 5, 1, 6], ["FU", 3, [0, 1, 2]], ["SP", 3, 0, 32, [1], 1], ["AN", 3, 1, 2], ["FFSP", 3, 0, [3, 2, 1], 1, 1], ["AN", 3, 1, 6], ["PR", 6, 0, "auto_unroll_max_step$512"]]]], "r": [[0.000323665], 0, 2.00598, 1678602047], "v": "v0.6"}
{"i": [["[\"tw_kernel\", 1024, 1024, 358, 128, 8, \"float32\"]", "cuda -keys=cuda,gpu -arch=sm_70 -max_num_threads=1024 -model=unknown -thread_warp_size=32", [-1, 16, 64, 49152, 2147483647, 1024, 8, 32], "", 0, ["mask_k"]], [[], [["CHW", 4, "local"], ["SP", 4, 0, 8, [2, 2, 1, 1], 1], ["SP", 4, 5, 128, [2, 4, 4, 4], 1], ["SP", 4, 10, 1024, [1, 128, 1, 2], 1], ["SP", 4, 15, 358, [2, 1], 1], ["RE", 4, [0, 5, 10, 1, 6, 11, 2, 7, 12, 15, 16, 3, 8, 13, 17, 4, 9, 14]], ["FSP", 5, 0, 1, 3], ["FSP", 5, 4, 2, 3], ["FSP", 5, 8, 3, 3], ["RE", 5, [0, 4, 8, 1, 5, 9, 2, 6, 10, 3, 7, 11]], ["CA", 4, 5, 8], ["CHR", 3, "shared", [4]], ["CA", 4, 5, 9], ["CHR", 2, "shared", [5]], ["CA", 3, 6, 9], ["CI", 2], ["FU", 7, [0, 1, 2]], ["AN", 7, 0, 5], ["FU", 7, [1, 2, 3]], ["AN", 7, 1, 4], ["FU", 7, [2, 3, 4]], ["AN", 7, 2, 6], ["FU", 5, [0, 1, 2]], ["SP", 5, 0, 32, [1], 1], ["AN", 5, 1, 2], ["FFSP", 5, 0, [3, 2, 1], 1, 1], ["AN", 5, 1, 6], ["FU", 3, [0, 1, 2]], ["SP", 3, 0, 4, [1], 1], ["AN", 3, 1, 2], ["FFSP", 3, 0, [3, 2, 1], 1, 1], ["AN", 3, 1, 6], ["PR", 6, 0, "auto_unroll_max_step$64"]]]], "r": [[0.00601419], 0, 1.46908, 1678602048], "v": "v0.6"}
{"i": [["[\"tw_kernel\", 1024, 1024, 358, 128, 8, \"float32\"]", "cuda -keys=cuda,gpu -arch=sm_70 -max_num_threads=1024 -model=unknown -thread_warp_size=32", [-1, 16, 64, 49152, 2147483647, 1024, 8, 32], "", 0, ["mask_k"]], [[], [["CHW", 4, "local"], ["SP", 4, 0, 8, [1, 2, 1, 1], 1], ["SP", 4, 5, 128, [2, 2, 1, 8], 1], ["SP", 4, 10, 1024, [2, 64, 2, 4], 1], ["SP", 4, 15, 358, [1, 1], 1], ["RE", 4, [0, 5, 10, 1, 6, 11, 2, 7, 12, 15, 16, 3, 8, 13, 17, 4, 9, 14]], ["FSP", 5, 0, 1, 3], ["FSP", 5, 4, 2, 3], ["FSP", 5, 8, 3, 3], ["RE", 5, [0, 4, 8, 1, 5, 9, 2, 6, 10, 3, 7, 11]], ["CA", 4, 5, 8], ["CHR", 3, "shared", [4]], ["CA", 4, 5, 9], ["CHR", 2, "shared", [5]], ["CA", 3, 6, 9], ["CI", 2], ["FU", 7, [0, 1, 2]], ["AN", 7, 0, 5], ["FU", 7, [1, 2, 3]], ["AN", 7, 1, 4], ["FU", 7, [2, 3, 4]], ["AN", 7, 2, 6], ["FU", 5, [0, 1, 2]], ["SP", 5, 0, 16, [1], 1], ["AN", 5, 1, 2], ["FFSP", 5, 0, [3, 2, 1], 1, 1], ["AN", 5, 1, 6], ["FU", 3, [0, 1, 2]], ["SP", 3, 0, 16, [2], 1], ["AN", 3, 1, 2], ["FFSP", 3, 0, [3, 2, 1], 1, 1], ["AN", 3, 1, 6], ["PR", 6, 0, "auto_unroll_max_step$16"]]]], "r": [[0.000790445], 0, 1.44517, 1678602048], "v": "v0.6"}
{"i": [["[\"tw_kernel\", 1024, 1024, 358, 128, 8, \"float32\"]", "cuda -keys=cuda,gpu -arch=sm_70 -max_num_threads=1024 -model=unknown -thread_warp_size=32", [-1, 16, 64, 49152, 2147483647, 1024, 8, 32], "", 0, ["mask_k"]], [[], [["CHW", 4, "local"], ["SP", 4, 0, 8, [2, 1, 4, 1], 1], ["SP", 4, 5, 128, [1, 8, 4, 2], 1], ["SP", 4, 10, 1024, [2, 16, 2, 1], 1], ["SP", 4, 15, 358, [2, 1], 1], ["RE", 4, [0, 5, 10, 1, 6, 11, 2, 7, 12, 15, 16, 3, 8, 13, 17, 4, 9, 14]], ["FSP", 5, 0, 1, 3], ["FSP", 5, 4, 2, 3], ["FSP", 5, 8, 3, 3], ["RE", 5, [0, 4, 8, 1, 5, 9, 2, 6, 10, 3, 7, 11]], ["CA", 4, 5, 8], ["CHR", 3, "shared", [4]], ["CA", 4, 5, 9], ["CHR", 2, "shared", [5]], ["CA", 3, 6, 9], ["CI", 2], ["FU", 7, [0, 1, 2]], ["AN", 7, 0, 5], ["FU", 7, [1, 2, 3]], ["AN", 7, 1, 4], ["FU", 7, [2, 3, 4]], ["AN", 7, 2, 6], ["FU", 5, [0, 1, 2]], ["SP", 5, 0, 64, [2], 1], ["AN", 5, 1, 2], ["FFSP", 5, 0, [3, 2, 1], 1, 1], ["AN", 5, 1, 6], ["FU", 3, [0, 1, 2]], ["SP", 3, 0, 128, [1], 1], ["AN", 3, 1, 2], ["FFSP", 3, 0, [3, 2, 1], 1, 1], ["AN", 3, 1, 6], ["PR", 6, 0, "auto_unroll_max_step$512"]]]], "r": [[0.00056699], 0, 2.88755, 1678602048], "v": "v0.6"}
{"i": [["[\"tw_kernel\", 1024, 1024, 358, 128, 8, \"float32\"]", "cuda -keys=cuda,gpu -arch=sm_70 -max_num_threads=1024 -model=unknown -thread_warp_size=32", [-1, 16, 64, 49152, 2147483647, 1024, 8, 32], "", 0, ["mask_k"]], [[], [["CHW", 4, "local"], ["SP", 4, 0, 8, [1, 4, 2, 1], 1], ["SP", 4, 5, 128, [1, 2, 4, 16], 1], ["SP", 4, 10, 1024, [1, 16, 4, 16], 1], ["SP", 4, 15, 358, [1, 1], 1], ["RE", 4, [0, 5, 10, 1, 6, 11, 2, 7, 12, 15, 16, 3, 8, 13, 17, 4, 9, 14]], ["FSP", 5, 0, 1, 3], ["FSP", 5, 4, 2, 3], ["FSP", 5, 8, 3, 3], ["RE", 5, [0, 4, 8, 1, 5, 9, 2, 6, 10, 3, 7, 11]], ["CA", 4, 5, 8], ["CHR", 3, "shared", [4]], ["CA", 4, 5, 9], ["CHR", 2, "shared", [5]], ["CA", 3, 6, 9], ["CI", 2], ["FU", 7, [0, 1, 2]], ["AN", 7, 0, 5], ["FU", 7, [1, 2, 3]], ["AN", 7, 1, 4], ["FU", 7, [2, 3, 4]], ["AN", 7, 2, 6], ["FU", 5, [0, 1, 2]], ["SP", 5, 0, 32, [1], 1], ["AN", 5, 1, 2], ["FFSP", 5, 0, [3, 2, 1], 1, 1], ["AN", 5, 1, 6], ["FU", 3, [0, 1, 2]], ["SP", 3, 0, 64, [1], 1], ["AN", 3, 1, 2], ["FFSP", 3, 0, [3, 2, 1], 1, 1], ["AN", 3, 1, 6], ["PR", 6, 0, "auto_unroll_max_step$0"]]]], "r": [[0.0624655], 0, 3.54814, 1678602049], "v": "v0.6"}
{"i": [["[\"tw_kernel\", 1024, 1024, 358, 128, 8, \"float32\"]", "cuda -keys=cuda,gpu -arch=sm_70 -max_num_threads=1024 -model=unknown -thread_warp_size=32", [-1, 16, 64, 49152, 2147483647, 1024, 8, 32], "", 0, ["mask_k"]], [[], [["CHW", 4, "local"], ["SP", 4, 0, 8, [2, 1, 1, 4], 1], ["SP", 4, 5, 128, [1, 64, 2, 1], 1], ["SP", 4, 10, 1024, [2, 1, 1, 16], 1], ["SP", 4, 15, 358, [1, 2], 1], ["RE", 4, [0, 5, 10, 1, 6, 11, 2, 7, 12, 15, 16, 3, 8, 13, 17, 4, 9, 14]], ["FSP", 5, 0, 1, 3], ["FSP", 5, 4, 2, 3], ["FSP", 5, 8, 3, 3], ["RE", 5, [0, 4, 8, 1, 5, 9, 2, 6, 10, 3, 7, 11]], ["CA", 4, 5, 8], ["CHR", 3, "shared", [4]], ["CA", 4, 5, 9], ["CHR", 2, "shared", [5]], ["CA", 3, 6, 9], ["CI", 2], ["FU", 7, [0, 1, 2]], ["AN", 7, 0, 5], ["FU", 7, [1, 2, 3]], ["AN", 7, 1, 4], ["FU", 7, [2, 3, 4]], ["AN", 7, 2, 6], ["FU", 5, [0, 1, 2]], ["SP", 5, 0, 16, [4], 1], ["AN", 5, 1, 2], ["FFSP", 5, 0, [3, 2, 1], 1, 1], ["AN", 5, 1, 6], ["FU", 3, [0, 1, 2]], ["SP", 3, 0, 128, [4], 1], ["AN", 3, 1, 2], ["FFSP", 3, 0, [3, 2, 1], 1, 1], ["AN", 3, 1, 6], ["PR", 6, 0, "auto_unroll_max_step$16"]]]], "r": [[0.00330881], 0, 3.79833, 1678602049], "v": "v0.6"}
{"i": [["[\"tw_kernel\", 1024, 1024, 358, 128, 8, \"float32\"]", "cuda -keys=cuda,gpu -arch=sm_70 -max_num_threads=1024 -model=unknown -thread_warp_size=32", [-1, 16, 64, 49152, 2147483647, 1024, 8, 32], "", 0, ["mask_k"]], [[], [["CHW", 4, "local"], ["SP", 4, 0, 8, [1, 2, 1, 4], 1], ["SP", 4, 5, 128, [1, 2, 32, 1], 1], ["SP", 4, 10, 1024, [1, 8, 1, 16], 1], ["SP", 4, 15, 358, [1, 1], 1], ["RE", 4, [0, 5, 10, 1, 6, 11, 2, 7, 12, 15, 16, 3, 8, 13, 17, 4, 9, 14]], ["FSP", 5, 0, 1, 3], ["FSP", 5, 4, 2, 3], ["FSP", 5, 8, 3, 3], ["RE", 5, [0, 4, 8, 1, 5, 9, 2, 6, 10, 3, 7, 11]], ["CA", 4, 5, 8], ["CHR", 3, "shared", [4]], ["CA", 4, 5, 9], ["CHR", 2, "shared", [5]], ["CA", 3, 6, 9], ["CI", 2], ["FU", 7, [0, 1, 2]], ["AN", 7, 0, 5], ["FU", 7, [1, 2, 3]], ["AN", 7, 1, 4], ["FU", 7, [2, 3, 4]], ["AN", 7, 2, 6], ["FU", 5, [0, 1, 2]], ["SP", 5, 0, 64, [1], 1], ["AN", 5, 1, 2], ["FFSP", 5, 0, [3, 2, 1], 1, 1], ["AN", 5, 1, 6], ["FU", 3, [0, 1, 2]], ["SP", 3, 0, 32, [1], 1], ["AN", 3, 1, 2], ["FFSP", 3, 0, [3, 2, 1], 1, 1], ["AN", 3, 1, 6], ["PR", 6, 0, "auto_unroll_max_step$1024"]]]], "r": [[0.00924391], 0, 2.35239, 1678602049], "v": "v0.6"}
{"i": [["[\"tw_kernel\", 1024, 1024, 358, 128, 8, \"float32\"]", "cuda -keys=cuda,gpu -arch=sm_70 -max_num_threads=1024 -model=unknown -thread_warp_size=32", [-1, 16, 64, 49152, 2147483647, 1024, 8, 32], "", 0, ["mask_k"]], [[], [["CHW", 4, "local"], ["SP", 4, 0, 8, [1, 4, 2, 1], 1], ["SP", 4, 5, 128, [1, 2, 4, 4], 1], ["SP", 4, 10, 1024, [1, 16, 4, 16], 1], ["SP", 4, 15, 358, [1, 1], 1], ["RE", 4, [0, 5, 10, 1, 6, 11, 2, 7, 12, 15, 16, 3, 8, 13, 17, 4, 9, 14]], ["FSP", 5, 0, 1, 3], ["FSP", 5, 4, 2, 3], ["FSP", 5, 8, 3, 3], ["RE", 5, [0, 4, 8, 1, 5, 9, 2, 6, 10, 3, 7, 11]], ["CA", 4, 5, 8], ["CHR", 3, "shared", [4]], ["CA", 4, 5, 9], ["CHR", 2, "shared", [5]], ["CA", 3, 6, 9], ["CI", 2], ["FU", 7, [0, 1, 2]], ["AN", 7, 0, 5], ["FU", 7, [1, 2, 3]], ["AN", 7, 1, 4], ["FU", 7, [2, 3, 4]], ["AN", 7, 2, 6], ["FU", 5, [0, 1, 2]], ["SP", 5, 0, 32, [1], 1], ["AN", 5, 1, 2], ["FFSP", 5, 0, [3, 2, 1], 1, 1], ["AN", 5, 1, 6], ["FU", 3, [0, 1, 2]], ["SP", 3, 0, 64, [1], 1], ["AN", 3, 1, 2], ["FFSP", 3, 0, [3, 2, 1], 1, 1], ["AN", 3, 1, 6], ["PR", 6, 0, "auto_unroll_max_step$0"]]]], "r": [[0.0153814], 0, 3.09599, 1678602049], "v": "v0.6"}
{"i": [["[\"tw_kernel\", 1024, 1024, 358, 128, 8, \"float32\"]", "cuda -keys=cuda,gpu -arch=sm_70 -max_num_threads=1024 -model=unknown -thread_warp_size=32", [-1, 16, 64, 49152, 2147483647, 1024, 8, 32], "", 0, ["mask_k"]], [[], [["CHW", 4, "local"], ["SP", 4, 0, 8, [1, 2, 1, 1], 1], ["SP", 4, 5, 128, [1, 16, 8, 1], 1], ["SP", 4, 10, 1024, [8, 1, 8, 4], 1], ["SP", 4, 15, 358, [1, 2], 1], ["RE", 4, [0, 5, 10, 1, 6, 11, 2, 7, 12, 15, 16, 3, 8, 13, 17, 4, 9, 14]], ["FSP", 5, 0, 1, 3], ["FSP", 5, 4, 2, 3], ["FSP", 5, 8, 3, 3], ["RE", 5, [0, 4, 8, 1, 5, 9, 2, 6, 10, 3, 7, 11]], ["CA", 4, 5, 8], ["CHR", 3, "shared", [4]], ["CA", 4, 5, 9], ["CHR", 2, "shared", [5]], ["CA", 3, 6, 9], ["CI", 2], ["FU", 7, [0, 1, 2]], ["AN", 7, 0, 5], ["FU", 7, [1, 2, 3]], ["AN", 7, 1, 4], ["FU", 7, [2, 3, 4]], ["AN", 7, 2, 6], ["FU", 5, [0, 1, 2]], ["SP", 5, 0, 8, [1], 1], ["AN", 5, 1, 2], ["FFSP", 5, 0, [3, 2, 1], 1, 1], ["AN", 5, 1, 6], ["FU", 3, [0, 1, 2]], ["SP", 3, 0, 8, [1], 1], ["AN", 3, 1, 2], ["FFSP", 3, 0, [3, 2, 1], 1, 1], ["AN", 3, 1, 6], ["PR", 6, 0, "auto_unroll_max_step$0"]]]], "r": [[0.00361033], 0, 2.60252, 1678602050], "v": "v0.6"}
{"i": [["[\"tw_kernel\", 1024, 1024, 358, 128, 8, \"float32\"]", "cuda -keys=cuda,gpu -arch=sm_70 -max_num_threads=1024 -model=unknown -thread_warp_size=32", [-1, 16, 64, 49152, 2147483647, 1024, 8, 32], "", 0, ["mask_k"]], [[], [["CHW", 4, "local"], ["SP", 4, 0, 8, [1, 1, 2, 1], 1], ["SP", 4, 5, 128, [1, 1, 1, 64], 1], ["SP", 4, 10, 1024, [1, 32, 4, 2], 1], ["SP", 4, 15, 358, [2, 1], 1], ["RE", 4, [0, 5, 10, 1, 6, 11, 2, 7, 12, 15, 16, 3, 8, 13, 17, 4, 9, 14]], ["FSP", 5, 0, 1, 3], ["FSP", 5, 4, 2, 3], ["FSP", 5, 8, 3, 3], ["RE", 5, [0, 4, 8, 1, 5, 9, 2, 6, 10, 3, 7, 11]], ["CA", 4, 5, 8], ["CHR", 3, "shared", [4]], ["CA", 4, 5, 9], ["CHR", 2, "shared", [5]], ["CA", 3, 6, 9], ["CI", 2], ["FU", 7, [0, 1, 2]], ["AN", 7, 0, 5], ["FU", 7, [1, 2, 3]], ["AN", 7, 1, 4], ["FU", 7, [2, 3, 4]], ["AN", 7, 2, 6], ["FU", 5, [0, 1, 2]], ["SP", 5, 0, 512, [2], 1], ["AN", 5, 1, 2], ["FFSP", 5, 0, [3, 2, 1], 1, 1], ["AN", 5, 1, 6], ["FU", 3, [0, 1, 2]], ["SP", 3, 0, 32, [1], 1], ["AN", 3, 1, 2], ["FFSP", 3, 0, [3, 2, 1], 1, 1], ["AN", 3, 1, 6], ["PR", 6, 0, "auto_unroll_max_step$0"]]]], "r": [[0.0135055], 0, 2.63991, 1678602050], "v": "v0.6"}
{"i": [["[\"tw_kernel\", 1024, 1024, 358, 128, 8, \"float32\"]", "cuda -keys=cuda,gpu -arch=sm_70 -max_num_threads=1024 -model=unknown -thread_warp_size=32", [-1, 16, 64, 49152, 2147483647, 1024, 8, 32], "", 0, ["mask_k"]], [[], [["CHW", 4, "local"], ["SP", 4, 0, 8, [1, 1, 1, 2], 1], ["SP", 4, 5, 128, [1, 8, 1, 16], 1], ["SP", 4, 10, 1024, [1, 4, 32, 4], 1], ["SP", 4, 15, 358, [2, 1], 1], ["RE", 4, [0, 5, 10, 1, 6, 11, 2, 7, 12, 15, 16, 3, 8, 13, 17, 4, 9, 14]], ["FSP", 5, 0, 1, 3], ["FSP", 5, 4, 2, 3], ["FSP", 5, 8, 3, 3], ["RE", 5, [0, 4, 8, 1, 5, 9, 2, 6, 10, 3, 7, 11]], ["CA", 4, 5, 8], ["CHR", 3, "shared", [4]], ["CA", 4, 5, 9], ["CHR", 2, "shared", [5]], ["CA", 3, 6, 9], ["CI", 2], ["FU", 7, [0, 1, 2]], ["AN", 7, 0, 5], ["FU", 7, [1, 2, 3]], ["AN", 7, 1, 4], ["FU", 7, [2, 3, 4]], ["AN", 7, 2, 6], ["FU", 5, [0, 1, 2]], ["SP", 5, 0, 64, [1], 1], ["AN", 5, 1, 2], ["FFSP", 5, 0, [3, 2, 1], 1, 1], ["AN", 5, 1, 6], ["FU", 3, [0, 1, 2]], ["SP", 3, 0, 256, [4], 1], ["AN", 3, 1, 2], ["FFSP", 3, 0, [3, 2, 1], 1, 1], ["AN", 3, 1, 6], ["PR", 6, 0, "auto_unroll_max_step$16"]]]], "r": [[0.0125519], 0, 2.62633, 1678602050], "v": "v0.6"}
{"i": [["[\"tw_kernel\", 1024, 1024, 358, 128, 8, \"float32\"]", "cuda -keys=cuda,gpu -arch=sm_70 -max_num_threads=1024 -model=unknown -thread_warp_size=32", [-1, 16, 64, 49152, 2147483647, 1024, 8, 32], "", 0, ["mask_k"]], [[], [["CHW", 4, "local"], ["SP", 4, 0, 8, [2, 1, 1, 2], 1], ["SP", 4, 5, 128, [2, 1, 4, 2], 1], ["SP", 4, 10, 1024, [1, 32, 1, 8], 1], ["SP", 4, 15, 358, [1, 2], 1], ["RE", 4, [0, 5, 10, 1, 6, 11, 2, 7, 12, 15, 16, 3, 8, 13, 17, 4, 9, 14]], ["FSP", 5, 0, 1, 3], ["FSP", 5, 4, 2, 3], ["FSP", 5, 8, 3, 3], ["RE", 5, [0, 4, 8, 1, 5, 9, 2, 6, 10, 3, 7, 11]], ["CA", 4, 5, 8], ["CHR", 3, "shared", [4]], ["CA", 4, 5, 9], ["CHR", 2, "shared", [5]], ["CA", 3, 6, 9], ["CI", 2], ["FU", 7, [0, 1, 2]], ["AN", 7, 0, 5], ["FU", 7, [1, 2, 3]], ["AN", 7, 1, 4], ["FU", 7, [2, 3, 4]], ["AN", 7, 2, 6], ["FU", 5, [0, 1, 2]], ["SP", 5, 0, 16, [1], 1], ["AN", 5, 1, 2], ["FFSP", 5, 0, [3, 2, 1], 1, 1], ["AN", 5, 1, 6], ["FU", 3, [0, 1, 2]], ["SP", 3, 0, 32, [1], 1], ["AN", 3, 1, 2], ["FFSP", 3, 0, [3, 2, 1], 1, 1], ["AN", 3, 1, 6], ["PR", 6, 0, "auto_unroll_max_step$16"]]]], "r": [[0.0012747], 0, 2.68028, 1678602050], "v": "v0.6"}
{"i": [["[\"tw_kernel\", 1024, 1024, 358, 128, 8, \"float32\"]", "cuda -keys=cuda,gpu -arch=sm_70 -max_num_threads=1024 -model=unknown -thread_warp_size=32", [-1, 16, 64, 49152, 2147483647, 1024, 8, 32], "", 0, ["mask_k"]], [[], [["CHW", 4, "local"], ["SP", 4, 0, 8, [2, 1, 1, 2], 1], ["SP", 4, 5, 128, [1, 2, 1, 2], 1], ["SP", 4, 10, 1024, [1, 128, 2, 2], 1], ["SP", 4, 15, 358, [2, 1], 1], ["RE", 4, [0, 5, 10, 1, 6, 11, 2, 7, 12, 15, 16, 3, 8, 13, 17, 4, 9, 14]], ["FSP", 5, 0, 1, 3], ["FSP", 5, 4, 2, 3], ["FSP", 5, 8, 3, 3], ["RE", 5, [0, 4, 8, 1, 5, 9, 2, 6, 10, 3, 7, 11]], ["CA", 4, 5, 8], ["CHR", 3, "shared", [4]], ["CA", 4, 5, 9], ["CHR", 2, "shared", [5]], ["CA", 3, 6, 9], ["CI", 2], ["FU", 7, [0, 1, 2]], ["AN", 7, 0, 5], ["FU", 7, [1, 2, 3]], ["AN", 7, 1, 4], ["FU", 7, [2, 3, 4]], ["AN", 7, 2, 6], ["FU", 5, [0, 1, 2]], ["SP", 5, 0, 8, [1], 1], ["AN", 5, 1, 2], ["FFSP", 5, 0, [3, 2, 1], 1, 1], ["AN", 5, 1, 6], ["FU", 3, [0, 1, 2]], ["SP", 3, 0, 16, [1], 1], ["AN", 3, 1, 2], ["FFSP", 3, 0, [3, 2, 1], 1, 1], ["AN", 3, 1, 6], ["PR", 6, 0, "auto_unroll_max_step$1024"]]]], "r": [[0.000293531], 0, 1.19264, 1678602051], "v": "v0.6"}
{"i": [["[\"tw_kernel\", 1024, 1024, 358, 128, 8, \"float32\"]", "cuda -keys=cuda,gpu -arch=sm_70 -max_num_threads=1024 -model=unknown -thread_warp_size=32", [-1, 16, 64, 49152, 2147483647, 1024, 8, 32], "", 0, ["mask_k"]], [[], [["CHW", 4, "local"], ["SP", 4, 0, 8, [1, 2, 1, 1], 1], ["SP", 4, 5, 128, [1, 1, 32, 1], 1], ["SP", 4, 10, 1024, [1, 8, 1, 16], 1], ["SP", 4, 15, 358, [2, 1], 1], ["RE", 4, [0, 5, 10, 1, 6, 11, 2, 7, 12, 15, 16, 3, 8, 13, 17, 4, 9, 14]], ["FSP", 5, 0, 1, 3], ["FSP", 5, 4, 2, 3], ["FSP", 5, 8, 3, 3], ["RE", 5, [0, 4, 8, 1, 5, 9, 2, 6, 10, 3, 7, 11]], ["CA", 4, 5, 8], ["CHR", 3, "shared", [4]], ["CA", 4, 5, 9], ["CHR", 2, "shared", [5]], ["CA", 3, 6, 9], ["CI", 2], ["FU", 7, [0, 1, 2]], ["AN", 7, 0, 5], ["FU", 7, [1, 2, 3]], ["AN", 7, 1, 4], ["FU", 7, [2, 3, 4]], ["AN", 7, 2, 6], ["FU", 5, [0, 1, 2]], ["SP", 5, 0, 64, [1], 1], ["AN", 5, 1, 2], ["FFSP", 5, 0, [3, 2, 1], 1, 1], ["AN", 5, 1, 6], ["FU", 3, [0, 1, 2]], ["SP", 3, 0, 32, [1], 1], ["AN", 3, 1, 2], ["FFSP", 3, 0, [3, 2, 1], 1, 1], ["AN", 3, 1, 6], ["PR", 6, 0, "auto_unroll_max_step$16"]]]], "r": [[0.00660995], 0, 1.61101, 1678602051], "v": "v0.6"}
{"i": [["[\"tw_kernel\", 1024, 1024, 358, 128, 8, \"float32\"]", "cuda -keys=cuda,gpu -arch=sm_70 -max_num_threads=1024 -model=unknown -thread_warp_size=32", [-1, 16, 64, 49152, 2147483647, 1024, 8, 32], "", 0, ["mask_k"]], [[], [["CHW", 4, "local"], ["SP", 4, 0, 8, [2, 1, 1, 4], 1], ["SP", 4, 5, 128, [1, 4, 8, 1], 1], ["SP", 4, 10, 1024, [2, 2, 64, 2], 1], ["SP", 4, 15, 358, [1, 1], 1], ["RE", 4, [0, 5, 10, 1, 6, 11, 2, 7, 12, 15, 16, 3, 8, 13, 17, 4, 9, 14]], ["FSP", 5, 0, 1, 3], ["FSP", 5, 4, 2, 3], ["FSP", 5, 8, 3, 3], ["RE", 5, [0, 4, 8, 1, 5, 9, 2, 6, 10, 3, 7, 11]], ["CA", 4, 5, 8], ["CHR", 3, "shared", [4]], ["CA", 4, 5, 9], ["CHR", 2, "shared", [5]], ["CA", 3, 6, 9], ["CI", 2], ["FU", 7, [0, 1, 2]], ["AN", 7, 0, 5], ["FU", 7, [1, 2, 3]], ["AN", 7, 1, 4], ["FU", 7, [2, 3, 4]], ["AN", 7, 2, 6], ["FU", 5, [0, 1, 2]], ["SP", 5, 0, 64, [1], 1], ["AN", 5, 1, 2], ["FFSP", 5, 0, [3, 2, 1], 1, 1], ["AN", 5, 1, 6], ["FU", 3, [0, 1, 2]], ["SP", 3, 0, 64, [2], 1], ["AN", 3, 1, 2], ["FFSP", 3, 0, [3, 2, 1], 1, 1], ["AN", 3, 1, 6], ["PR", 6, 0, "auto_unroll_max_step$64"]]]], "r": [[0.122196], 0, 3.12033, 1678602052], "v": "v0.6"}
{"i": [["[\"tw_kernel\", 1024, 1024, 358, 128, 8, \"float32\"]", "cuda -keys=cuda,gpu -arch=sm_70 -max_num_threads=1024 -model=unknown -thread_warp_size=32", [-1, 16, 64, 49152, 2147483647, 1024, 8, 32], "", 0, ["mask_k"]], [[], [["CHW", 4, "local"], ["SP", 4, 0, 8, [1, 1, 4, 2], 1], ["SP", 4, 5, 128, [1, 1, 4, 16], 1], ["SP", 4, 10, 1024, [2, 128, 1, 1], 1], ["SP", 4, 15, 358, [1, 1], 1], ["RE", 4, [0, 5, 10, 1, 6, 11, 2, 7, 12, 15, 16, 3, 8, 13, 17, 4, 9, 14]], ["FSP", 5, 0, 1, 3], ["FSP", 5, 4, 2, 3], ["FSP", 5, 8, 3, 3], ["RE", 5, [0, 4, 8, 1, 5, 9, 2, 6, 10, 3, 7, 11]], ["CA", 4, 5, 8], ["CHR", 3, "shared", [4]], ["CA", 4, 5, 9], ["CHR", 2, "shared", [5]], ["CA", 3, 6, 9], ["CI", 2], ["FU", 7, [0, 1, 2]], ["AN", 7, 0, 5], ["FU", 7, [1, 2, 3]], ["AN", 7, 1, 4], ["FU", 7, [2, 3, 4]], ["AN", 7, 2, 6], ["FU", 5, [0, 1, 2]], ["SP", 5, 0, 256, [1], 1], ["AN", 5, 1, 2], ["FFSP", 5, 0, [3, 2, 1], 1, 1], ["AN", 5, 1, 6], ["FU", 3, [0, 1, 2]], ["SP", 3, 0, 4, [2], 1], ["AN", 3, 1, 2], ["FFSP", 3, 0, [3, 2, 1], 1, 1], ["AN", 3, 1, 6], ["PR", 6, 0, "auto_unroll_max_step$64"]]]], "r": [[0.00751352], 0, 2.31323, 1678602052], "v": "v0.6"}
{"i": [["[\"tw_kernel\", 1024, 1024, 358, 128, 8, \"float32\"]", "cuda -keys=cuda,gpu -arch=sm_70 -max_num_threads=1024 -model=unknown -thread_warp_size=32", [-1, 16, 64, 49152, 2147483647, 1024, 8, 32], "", 0, ["mask_k"]], [[], [["CHW", 4, "local"], ["SP", 4, 0, 8, [1, 2, 4, 1], 1], ["SP", 4, 5, 128, [4, 1, 1, 2], 1], ["SP", 4, 10, 1024, [1, 16, 8, 1], 1], ["SP", 4, 15, 358, [1, 2], 1], ["RE", 4, [0, 5, 10, 1, 6, 11, 2, 7, 12, 15, 16, 3, 8, 13, 17, 4, 9, 14]], ["FSP", 5, 0, 1, 3], ["FSP", 5, 4, 2, 3], ["FSP", 5, 8, 3, 3], ["RE", 5, [0, 4, 8, 1, 5, 9, 2, 6, 10, 3, 7, 11]], ["CA", 4, 5, 8], ["CHR", 3, "shared", [4]], ["CA", 4, 5, 9], ["CHR", 2, "shared", [5]], ["CA", 3, 6, 9], ["CI", 2], ["FU", 7, [0, 1, 2]], ["AN", 7, 0, 5], ["FU", 7, [1, 2, 3]], ["AN", 7, 1, 4], ["FU", 7, [2, 3, 4]], ["AN", 7, 2, 6], ["FU", 5, [0, 1, 2]], ["SP", 5, 0, 16, [1], 1], ["AN", 5, 1, 2], ["FFSP", 5, 0, [3, 2, 1], 1, 1], ["AN", 5, 1, 6], ["FU", 3, [0, 1, 2]], ["SP", 3, 0, 64, [2], 1], ["AN", 3, 1, 2], ["FFSP", 3, 0, [3, 2, 1], 1, 1], ["AN", 3, 1, 6], ["PR", 6, 0, "auto_unroll_max_step$512"]]]], "r": [[0.000724969], 0, 2.90534, 1678602052], "v": "v0.6"}
{"i": [["[\"tw_kernel\", 1024, 1024, 358, 128, 8, \"float32\"]", "cuda -keys=cuda,gpu -arch=sm_70 -max_num_threads=1024 -model=unknown -thread_warp_size=32", [-1, 16, 64, 49152, 2147483647, 1024, 8, 32], "", 0, ["mask_k"]], [[], [["CHW", 4, "local"], ["SP", 4, 0, 8, [2, 1, 1, 4], 1], ["SP", 4, 5, 128, [1, 4, 8, 1], 1], ["SP", 4, 10, 1024, [2, 32, 4, 2], 1], ["SP", 4, 15, 358, [1, 2], 1], ["RE", 4, [0, 5, 10, 1, 6, 11, 2, 7, 12, 15, 16, 3, 8, 13, 17, 4, 9, 14]], ["FSP", 5, 0, 1, 3], ["FSP", 5, 4, 2, 3], ["FSP", 5, 8, 3, 3], ["RE", 5, [0, 4, 8, 1, 5, 9, 2, 6, 10, 3, 7, 11]], ["CA", 4, 5, 8], ["CHR", 3, "shared", [4]], ["CA", 4, 5, 9], ["CHR", 2, "shared", [5]], ["CA", 3, 6, 9], ["CI", 2], ["FU", 7, [0, 1, 2]], ["AN", 7, 0, 5], ["FU", 7, [1, 2, 3]], ["AN", 7, 1, 4], ["FU", 7, [2, 3, 4]], ["AN", 7, 2, 6], ["FU", 5, [0, 1, 2]], ["SP", 5, 0, 64, [1], 1], ["AN", 5, 1, 2], ["FFSP", 5, 0, [3, 2, 1], 1, 1], ["AN", 5, 1, 6], ["FU", 3, [0, 1, 2]], ["SP", 3, 0, 64, [1], 1], ["AN", 3, 1, 2], ["FFSP", 3, 0, [3, 2, 1], 1, 1], ["AN", 3, 1, 6], ["PR", 6, 0, "auto_unroll_max_step$0"]]]], "r": [[0.00739163], 0, 2.34429, 1678602052], "v": "v0.6"}
{"i": [["[\"tw_kernel\", 1024, 1024, 358, 128, 8, \"float32\"]", "cuda -keys=cuda,gpu -arch=sm_70 -max_num_threads=1024 -model=unknown -thread_warp_size=32", [-1, 16, 64, 49152, 2147483647, 1024, 8, 32], "", 0, ["mask_k"]], [[], [["CHW", 4, "local"], ["SP", 4, 0, 8, [1, 1, 8, 1], 1], ["SP", 4, 5, 128, [1, 4, 8, 4], 1], ["SP", 4, 10, 1024, [2, 2, 8, 8], 1], ["SP", 4, 15, 358, [1, 2], 1], ["RE", 4, [0, 5, 10, 1, 6, 11, 2, 7, 12, 15, 16, 3, 8, 13, 17, 4, 9, 14]], ["FSP", 5, 0, 1, 3], ["FSP", 5, 4, 2, 3], ["FSP", 5, 8, 3, 3], ["RE", 5, [0, 4, 8, 1, 5, 9, 2, 6, 10, 3, 7, 11]], ["CA", 4, 5, 8], ["CHR", 3, "shared", [4]], ["CA", 4, 5, 9], ["CHR", 2, "shared", [5]], ["CA", 3, 6, 9], ["CI", 2], ["FU", 7, [0, 1, 2]], ["AN", 7, 0, 5], ["FU", 7, [1, 2, 3]], ["AN", 7, 1, 4], ["FU", 7, [2, 3, 4]], ["AN", 7, 2, 6], ["FU", 5, [0, 1, 2]], ["SP", 5, 0, 64, [1], 1], ["AN", 5, 1, 2], ["FFSP", 5, 0, [3, 2, 1], 1, 1], ["AN", 5, 1, 6], ["FU", 3, [0, 1, 2]], ["SP", 3, 0, 128, [1], 1], ["AN", 3, 1, 2], ["FFSP", 3, 0, [3, 2, 1], 1, 1], ["AN", 3, 1, 6], ["PR", 6, 0, "auto_unroll_max_step$512"]]]], "r": [[0.0837744], 0, 7.7615, 1678602053], "v": "v0.6"}
{"i": [["[\"tw_kernel\", 1024, 1024, 358, 128, 8, \"float32\"]", "cuda -keys=cuda,gpu -arch=sm_70 -max_num_threads=1024 -model=unknown -thread_warp_size=32", [-1, 16, 64, 49152, 2147483647, 1024, 8, 32], "", 0, ["mask_k"]], [[], [["CHW", 4, "local"], ["SP", 4, 0, 8, [1, 8, 1, 1], 1], ["SP", 4, 5, 128, [1, 4, 2, 2], 1], ["SP", 4, 10, 1024, [4, 1, 16, 16], 1], ["SP", 4, 15, 358, [1, 1], 1], ["RE", 4, [0, 5, 10, 1, 6, 11, 2, 7, 12, 15, 16, 3, 8, 13, 17, 4, 9, 14]], ["FSP", 5, 0, 1, 3], ["FSP", 5, 4, 2, 3], ["FSP", 5, 8, 3, 3], ["RE", 5, [0, 4, 8, 1, 5, 9, 2, 6, 10, 3, 7, 11]], ["CA", 4, 5, 8], ["CHR", 3, "shared", [4]], ["CA", 4, 5, 9], ["CHR", 2, "shared", [5]], ["CA", 3, 6, 9], ["CI", 2], ["FU", 7, [0, 1, 2]], ["AN", 7, 0, 5], ["FU", 7, [1, 2, 3]], ["AN", 7, 1, 4], ["FU", 7, [2, 3, 4]], ["AN", 7, 2, 6], ["FU", 5, [0, 1, 2]], ["SP", 5, 0, 4, [2], 1], ["AN", 5, 1, 2], ["FFSP", 5, 0, [3, 2, 1], 1, 1], ["AN", 5, 1, 6], ["FU", 3, [0, 1, 2]], ["SP", 3, 0, 256, [1], 1], ["AN", 3, 1, 2], ["FFSP", 3, 0, [3, 2, 1], 1, 1], ["AN", 3, 1, 6], ["PR", 6, 0, "auto_unroll_max_step$1024"]]]], "r": [[0.0145812], 0, 3.66644, 1678602053], "v": "v0.6"}
{"i": [["[\"tw_kernel\", 1024, 1024, 358, 128, 8, \"float32\"]", "cuda -keys=cuda,gpu -arch=sm_70 -max_num_threads=1024 -model=unknown -thread_warp_size=32", [-1, 16, 64, 49152, 2147483647, 1024, 8, 32], "", 0, ["mask_k"]], [[], [["CHW", 4, "local"], ["SP", 4, 0, 8, [1, 1, 2, 4], 1], ["SP", 4, 5, 128, [1, 8, 8, 2], 1], ["SP", 4, 10, 1024, [1, 4, 32, 2], 1], ["SP", 4, 15, 358, [1, 2], 1], ["RE", 4, [0, 5, 10, 1, 6, 11, 2, 7, 12, 15, 16, 3, 8, 13, 17, 4, 9, 14]], ["FSP", 5, 0, 1, 3], ["FSP", 5, 4, 2, 3], ["FSP", 5, 8, 3, 3], ["RE", 5, [0, 4, 8, 1, 5, 9, 2, 6, 10, 3, 7, 11]], ["CA", 4, 5, 8], ["CHR", 3, "shared", [4]], ["CA", 4, 5, 9], ["CHR", 2, "shared", [5]], ["CA", 3, 6, 9], ["CI", 2], ["FU", 7, [0, 1, 2]], ["AN", 7, 0, 5], ["FU", 7, [1, 2, 3]], ["AN", 7, 1, 4], ["FU", 7, [2, 3, 4]], ["AN", 7, 2, 6], ["FU", 5, [0, 1, 2]], ["SP", 5, 0, 256, [4], 1], ["AN", 5, 1, 2], ["FFSP", 5, 0, [3, 2, 1], 1, 1], ["AN", 5, 1, 6], ["FU", 3, [0, 1, 2]], ["SP", 3, 0, 1024, [1], 1], ["AN", 3, 1, 2], ["FFSP", 3, 0, [3, 2, 1], 1, 1], ["AN", 3, 1, 6], ["PR", 6, 0, "auto_unroll_max_step$512"]]]], "r": [[0.0272344], 0, 3.62475, 1678602054], "v": "v0.6"}
{"i": [["[\"tw_kernel\", 1024, 1024, 358, 128, 8, \"float32\"]", "cuda -keys=cuda,gpu -arch=sm_70 -max_num_threads=1024 -model=unknown -thread_warp_size=32", [-1, 16, 64, 49152, 2147483647, 1024, 8, 32], "", 0, ["mask_k"]], [[], [["CHW", 4, "local"], ["SP", 4, 0, 8, [1, 4, 2, 1], 1], ["SP", 4, 5, 128, [8, 4, 4, 1], 1], ["SP", 4, 10, 1024, [1, 16, 8, 2], 1], ["SP", 4, 15, 358, [2, 1], 1], ["RE", 4, [0, 5, 10, 1, 6, 11, 2, 7, 12, 15, 16, 3, 8, 13, 17, 4, 9, 14]], ["FSP", 5, 0, 1, 3], ["FSP", 5, 4, 2, 3], ["FSP", 5, 8, 3, 3], ["RE", 5, [0, 4, 8, 1, 5, 9, 2, 6, 10, 3, 7, 11]], ["CA", 4, 5, 8], ["CHR", 3, "shared", [4]], ["CA", 4, 5, 9], ["CHR", 2, "shared", [5]], ["CA", 3, 6, 9], ["CI", 2], ["FU", 7, [0, 1, 2]], ["AN", 7, 0, 5], ["FU", 7, [1, 2, 3]], ["AN", 7, 1, 4], ["FU", 7, [2, 3, 4]], ["AN", 7, 2, 6], ["FU", 5, [0, 1, 2]], ["SP", 5, 0, 64, [1], 1], ["AN", 5, 1, 2], ["FFSP", 5, 0, [3, 2, 1], 1, 1], ["AN", 5, 1, 6], ["FU", 3, [0, 1, 2]], ["SP", 3, 0, 256, [1], 1], ["AN", 3, 1, 2], ["FFSP", 3, 0, [3, 2, 1], 1, 1], ["AN", 3, 1, 6], ["PR", 6, 0, "auto_unroll_max_step$16"]]]], "r": [[0.0135795], 0, 2.87341, 1678602054], "v": "v0.6"}
{"i": [["[\"tw_kernel\", 1024, 1024, 358, 128, 8, \"float32\"]", "cuda -keys=cuda,gpu -arch=sm_70 -max_num_threads=1024 -model=unknown -thread_warp_size=32", [-1, 16, 64, 49152, 2147483647, 1024, 8, 32], "", 0, ["mask_k"]], [[], [["CHW", 4, "local"], ["SP", 4, 0, 8, [4, 1, 1, 1], 1], ["SP", 4, 5, 128, [1, 1, 1, 4], 1], ["SP", 4, 10, 1024, [2, 128, 4, 1], 1], ["SP", 4, 15, 358, [1, 2], 1], ["RE", 4, [0, 5, 10, 1, 6, 11, 2, 7, 12, 15, 16, 3, 8, 13, 17, 4, 9, 14]], ["FSP", 5, 0, 1, 3], ["FSP", 5, 4, 2, 3], ["FSP", 5, 8, 3, 3], ["RE", 5, [0, 4, 8, 1, 5, 9, 2, 6, 10, 3, 7, 11]], ["CA", 4, 5, 8], ["CHR", 3, "shared", [4]], ["CA", 4, 5, 9], ["CHR", 2, "shared", [5]], ["CA", 3, 6, 9], ["CI", 2], ["FU", 7, [0, 1, 2]], ["AN", 7, 0, 5], ["FU", 7, [1, 2, 3]], ["AN", 7, 1, 4], ["FU", 7, [2, 3, 4]], ["AN", 7, 2, 6], ["FU", 5, [0, 1, 2]], ["SP", 5, 0, 4, [1], 1], ["AN", 5, 1, 2], ["FFSP", 5, 0, [3, 2, 1], 1, 1], ["AN", 5, 1, 6], ["FU", 3, [0, 1, 2]], ["SP", 3, 0, 8, [1], 1], ["AN", 3, 1, 2], ["FFSP", 3, 0, [3, 2, 1], 1, 1], ["AN", 3, 1, 6], ["PR", 6, 0, "auto_unroll_max_step$64"]]]], "r": [[0.000409782], 0, 1.95966, 1678602076], "v": "v0.6"}
{"i": [["[\"tw_kernel\", 1024, 1024, 358, 128, 8, \"float32\"]", "cuda -keys=cuda,gpu -arch=sm_70 -max_num_threads=1024 -model=unknown -thread_warp_size=32", [-1, 16, 64, 49152, 2147483647, 1024, 8, 32], "", 0, ["mask_k"]], [[], [["CHW", 4, "local"], ["SP", 4, 0, 8, [2, 1, 1, 1], 1], ["SP", 4, 5, 128, [1, 16, 8, 1], 1], ["SP", 4, 10, 1024, [1, 1, 8, 64], 1], ["SP", 4, 15, 358, [1, 1], 1], ["RE", 4, [0, 5, 10, 1, 6, 11, 2, 7, 12, 15, 16, 3, 8, 13, 17, 4, 9, 14]], ["FSP", 5, 0, 1, 3], ["FSP", 5, 4, 2, 3], ["FSP", 5, 8, 3, 3], ["RE", 5, [0, 4, 8, 1, 5, 9, 2, 6, 10, 3, 7, 11]], ["CA", 4, 5, 8], ["CHR", 3, "shared", [4]], ["CA", 4, 5, 9], ["CHR", 2, "shared", [5]], ["CA", 3, 6, 9], ["CI", 2], ["FU", 7, [0, 1, 2]], ["AN", 7, 0, 5], ["FU", 7, [1, 2, 3]], ["AN", 7, 1, 4], ["FU", 7, [2, 3, 4]], ["AN", 7, 2, 6], ["FU", 5, [0, 1, 2]], ["SP", 5, 0, 32, [1], 1], ["AN", 5, 1, 2], ["FFSP", 5, 0, [3, 2, 1], 1, 1], ["AN", 5, 1, 6], ["FU", 3, [0, 1, 2]], ["SP", 3, 0, 256, [1], 1], ["AN", 3, 1, 2], ["FFSP", 3, 0, [3, 2, 1], 1, 1], ["AN", 3, 1, 6], ["PR", 6, 0, "auto_unroll_max_step$0"]]]], "r": [[0.0345226], 0, 3.49222, 1678602076], "v": "v0.6"}
{"i": [["[\"tw_kernel\", 1024, 1024, 358, 128, 8, \"float32\"]", "cuda -keys=cuda,gpu -arch=sm_70 -max_num_threads=1024 -model=unknown -thread_warp_size=32", [-1, 16, 64, 49152, 2147483647, 1024, 8, 32], "", 0, ["mask_k"]], [[], [["CHW", 4, "local"], ["SP", 4, 0, 8, [2, 1, 1, 1], 1], ["SP", 4, 5, 128, [1, 8, 1, 1], 1], ["SP", 4, 10, 1024, [2, 8, 8, 8], 1], ["SP", 4, 15, 358, [1, 1], 1], ["RE", 4, [0, 5, 10, 1, 6, 11, 2, 7, 12, 15, 16, 3, 8, 13, 17, 4, 9, 14]], ["FSP", 5, 0, 1, 3], ["FSP", 5, 4, 2, 3], ["FSP", 5, 8, 3, 3], ["RE", 5, [0, 4, 8, 1, 5, 9, 2, 6, 10, 3, 7, 11]], ["CA", 4, 5, 8], ["CHR", 3, "shared", [4]], ["CA", 4, 5, 9], ["CHR", 2, "shared", [5]], ["CA", 3, 6, 9], ["CI", 2], ["FU", 7, [0, 1, 2]], ["AN", 7, 0, 5], ["FU", 7, [1, 2, 3]], ["AN", 7, 1, 4], ["FU", 7, [2, 3, 4]], ["AN", 7, 2, 6], ["FU", 5, [0, 1, 2]], ["SP", 5, 0, 2, [1], 1], ["AN", 5, 1, 2], ["FFSP", 5, 0, [3, 2, 1], 1, 1], ["AN", 5, 1, 6], ["FU", 3, [0, 1, 2]], ["SP", 3, 0, 128, [1], 1], ["AN", 3, 1, 2], ["FFSP", 3, 0, [3, 2, 1], 1, 1], ["AN", 3, 1, 6], ["PR", 6, 0, "auto_unroll_max_step$64"]]]], "r": [[0.00173224], 0, 2.78047, 1678602076], "v": "v0.6"}
{"i": [["[\"tw_kernel\", 1024, 1024, 358, 128, 8, \"float32\"]", "cuda -keys=cuda,gpu -arch=sm_70 -max_num_threads=1024 -model=unknown -thread_warp_size=32", [-1, 16, 64, 49152, 2147483647, 1024, 8, 32], "", 0, ["mask_k"]], [[], [["CHW", 4, "local"], ["SP", 4, 0, 8, [2, 4, 1, 1], 1], ["SP", 4, 5, 128, [4, 8, 4, 1], 1], ["SP", 4, 10, 1024, [1, 32, 4, 4], 1], ["SP", 4, 15, 358, [2, 1], 1], ["RE", 4, [0, 5, 10, 1, 6, 11, 2, 7, 12, 15, 16, 3, 8, 13, 17, 4, 9, 14]], ["FSP", 5, 0, 1, 3], ["FSP", 5, 4, 2, 3], ["FSP", 5, 8, 3, 3], ["RE", 5, [0, 4, 8, 1, 5, 9, 2, 6, 10, 3, 7, 11]], ["CA", 4, 5, 8], ["CHR", 3, "shared", [4]], ["CA", 4, 5, 9], ["CHR", 2, "shared", [5]], ["CA", 3, 6, 9], ["CI", 2], ["FU", 7, [0, 1, 2]], ["AN", 7, 0, 5], ["FU", 7, [1, 2, 3]], ["AN", 7, 1, 4], ["FU", 7, [2, 3, 4]], ["AN", 7, 2, 6], ["FU", 5, [0, 1, 2]], ["SP", 5, 0, 4, [4], 1], ["AN", 5, 1, 2], ["FFSP", 5, 0, [3, 2, 1], 1, 1], ["AN", 5, 1, 6], ["FU", 3, [0, 1, 2]], ["SP", 3, 0, 16, [1], 1], ["AN", 3, 1, 2], ["FFSP", 3, 0, [3, 2, 1], 1, 1], ["AN", 3, 1, 6], ["PR", 6, 0, "auto_unroll_max_step$16"]]]], "r": [[0.0263926], 0, 3.06814, 1678602077], "v": "v0.6"}
{"i": [["[\"tw_kernel\", 1024, 1024, 358, 128, 8, \"float32\"]", "cuda -keys=cuda,gpu -arch=sm_70 -max_num_threads=1024 -model=unknown -thread_warp_size=32", [-1, 16, 64, 49152, 2147483647, 1024, 8, 32], "", 0, ["mask_k"]], [[], [["CHW", 4, "local"], ["SP", 4, 0, 8, [1, 1, 1, 8], 1], ["SP", 4, 5, 128, [2, 8, 1, 1], 1], ["SP", 4, 10, 1024, [2, 8, 1, 16], 1], ["SP", 4, 15, 358, [2, 1], 1], ["RE", 4, [0, 5, 10, 1, 6, 11, 2, 7, 12, 15, 16, 3, 8, 13, 17, 4, 9, 14]], ["FSP", 5, 0, 1, 3], ["FSP", 5, 4, 2, 3], ["FSP", 5, 8, 3, 3], ["RE", 5, [0, 4, 8, 1, 5, 9, 2, 6, 10, 3, 7, 11]], ["CA", 4, 5, 8], ["CHR", 3, "shared", [4]], ["CA", 4, 5, 9], ["CHR", 2, "shared", [5]], ["CA", 3, 6, 9], ["CI", 2], ["FU", 7, [0, 1, 2]], ["AN", 7, 0, 5], ["FU", 7, [1, 2, 3]], ["AN", 7, 1, 4], ["FU", 7, [2, 3, 4]], ["AN", 7, 2, 6], ["FU", 5, [0, 1, 2]], ["SP", 5, 0, 16, [1], 1], ["AN", 5, 1, 2], ["FFSP", 5, 0, [3, 2, 1], 1, 1], ["AN", 5, 1, 6], ["FU", 3, [0, 1, 2]], ["SP", 3, 0, 512, [1], 1], ["AN", 3, 1, 2], ["FFSP", 3, 0, [3, 2, 1], 1, 1], ["AN", 3, 1, 6], ["PR", 6, 0, "auto_unroll_max_step$512"]]]], "r": [[0.00639627], 0, 5.0621, 1678602077], "v": "v0.6"}
{"i": [["[\"tw_kernel\", 1024, 1024, 358, 128, 8, \"float32\"]", "cuda -keys=cuda,gpu -arch=sm_70 -max_num_threads=1024 -model=unknown -thread_warp_size=32", [-1, 16, 64, 49152, 2147483647, 1024, 8, 32], "", 0, ["mask_k"]], [[], [["CHW", 4, "local"], ["SP", 4, 0, 8, [1, 1, 2, 1], 1], ["SP", 4, 5, 128, [1, 1, 2, 64], 1], ["SP", 4, 10, 1024, [2, 32, 4, 1], 1], ["SP", 4, 15, 358, [2, 1], 1], ["RE", 4, [0, 5, 10, 1, 6, 11, 2, 7, 12, 15, 16, 3, 8, 13, 17, 4, 9, 14]], ["FSP", 5, 0, 1, 3], ["FSP", 5, 4, 2, 3], ["FSP", 5, 8, 3, 3], ["RE", 5, [0, 4, 8, 1, 5, 9, 2, 6, 10, 3, 7, 11]], ["CA", 4, 5, 8], ["CHR", 3, "shared", [4]], ["CA", 4, 5, 9], ["CHR", 2, "shared", [5]], ["CA", 3, 6, 9], ["CI", 2], ["FU", 7, [0, 1, 2]], ["AN", 7, 0, 5], ["FU", 7, [1, 2, 3]], ["AN", 7, 1, 4], ["FU", 7, [2, 3, 4]], ["AN", 7, 2, 6], ["FU", 5, [0, 1, 2]], ["SP", 5, 0, 512, [1], 1], ["AN", 5, 1, 2], ["FFSP", 5, 0, [3, 2, 1], 1, 1], ["AN", 5, 1, 6], ["FU", 3, [0, 1, 2]], ["SP", 3, 0, 32, [1], 1], ["AN", 3, 1, 2], ["FFSP", 3, 0, [3, 2, 1], 1, 1], ["AN", 3, 1, 6], ["PR", 6, 0, "auto_unroll_max_step$0"]]]], "r": [[0.00875979], 0, 3.88044, 1678602077], "v": "v0.6"}
{"i": [["[\"tw_kernel\", 1024, 1024, 358, 128, 8, \"float32\"]", "cuda -keys=cuda,gpu -arch=sm_70 -max_num_threads=1024 -model=unknown -thread_warp_size=32", [-1, 16, 64, 49152, 2147483647, 1024, 8, 32], "", 0, ["mask_k"]], [[], [["CHW", 4, "local"], ["SP", 4, 0, 8, [1, 2, 2, 1], 1], ["SP", 4, 5, 128, [2, 2, 2, 1], 1], ["SP", 4, 10, 1024, [1, 4, 1, 1], 1], ["SP", 4, 15, 358, [2, 1], 1], ["RE", 4, [0, 5, 10, 1, 6, 11, 2, 7, 12, 15, 16, 3, 8, 13, 17, 4, 9, 14]], ["FSP", 5, 0, 1, 3], ["FSP", 5, 4, 2, 3], ["FSP", 5, 8, 3, 3], ["RE", 5, [0, 4, 8, 1, 5, 9, 2, 6, 10, 3, 7, 11]], ["CA", 4, 5, 8], ["CHR", 3, "shared", [4]], ["CA", 4, 5, 9], ["CHR", 2, "shared", [5]], ["CA", 3, 6, 9], ["CI", 2], ["FU", 7, [0, 1, 2]], ["AN", 7, 0, 5], ["FU", 7, [1, 2, 3]], ["AN", 7, 1, 4], ["FU", 7, [2, 3, 4]], ["AN", 7, 2, 6], ["FU", 5, [0, 1, 2]], ["SP", 5, 0, 8, [1], 1], ["AN", 5, 1, 2], ["FFSP", 5, 0, [3, 2, 1], 1, 1], ["AN", 5, 1, 6], ["FU", 3, [0, 1, 2]], ["SP", 3, 0, 4, [1], 1], ["AN", 3, 1, 2], ["FFSP", 3, 0, [3, 2, 1], 1, 1], ["AN", 3, 1, 6], ["PR", 6, 0, "auto_unroll_max_step$1024"]]]], "r": [[0.000817124], 0, 1.32837, 1678602077], "v": "v0.6"}
{"i": [["[\"tw_kernel\", 1024, 1024, 358, 128, 8, \"float32\"]", "cuda -keys=cuda,gpu -arch=sm_70 -max_num_threads=1024 -model=unknown -thread_warp_size=32", [-1, 16, 64, 49152, 2147483647, 1024, 8, 32], "", 0, ["mask_k"]], [[], [["CHW", 4, "local"], ["SP", 4, 0, 8, [1, 4, 2, 1], 1], ["SP", 4, 5, 128, [2, 2, 2, 1], 1], ["SP", 4, 10, 1024, [1, 4, 1, 1], 1], ["SP", 4, 15, 358, [2, 1], 1], ["RE", 4, [0, 5, 10, 1, 6, 11, 2, 7, 12, 15, 16, 3, 8, 13, 17, 4, 9, 14]], ["FSP", 5, 0, 1, 3], ["FSP", 5, 4, 2, 3], ["FSP", 5, 8, 3, 3], ["RE", 5, [0, 4, 8, 1, 5, 9, 2, 6, 10, 3, 7, 11]], ["CA", 4, 5, 8], ["CHR", 3, "shared", [4]], ["CA", 4, 5, 9], ["CHR", 2, "shared", [5]], ["CA", 3, 6, 9], ["CI", 2], ["FU", 7, [0, 1, 2]], ["AN", 7, 0, 5], ["FU", 7, [1, 2, 3]], ["AN", 7, 1, 4], ["FU", 7, [2, 3, 4]], ["AN", 7, 2, 6], ["FU", 5, [0, 1, 2]], ["SP", 5, 0, 8, [1], 1], ["AN", 5, 1, 2], ["FFSP", 5, 0, [3, 2, 1], 1, 1], ["AN", 5, 1, 6], ["FU", 3, [0, 1, 2]], ["SP", 3, 0, 4, [4], 1], ["AN", 3, 1, 2], ["FFSP", 3, 0, [3, 2, 1], 1, 1], ["AN", 3, 1, 6], ["PR", 6, 0, "auto_unroll_max_step$1024"]]]], "r": [[0.000768662], 0, 1.49437, 1678602078], "v": "v0.6"}
{"i": [["[\"tw_kernel\", 1024, 1024, 358, 128, 8, \"float32\"]", "cuda -keys=cuda,gpu -arch=sm_70 -max_num_threads=1024 -model=unknown -thread_warp_size=32", [-1, 16, 64, 49152, 2147483647, 1024, 8, 32], "", 0, ["mask_k"]], [[], [["CHW", 4, "local"], ["SP", 4, 0, 8, [1, 2, 1, 4], 1], ["SP", 4, 5, 128, [1, 8, 4, 4], 1], ["SP", 4, 10, 1024, [1, 32, 2, 8], 1], ["SP", 4, 15, 358, [1, 1], 1], ["RE", 4, [0, 5, 10, 1, 6, 11, 2, 7, 12, 15, 16, 3, 8, 13, 17, 4, 9, 14]], ["FSP", 5, 0, 1, 3], ["FSP", 5, 4, 2, 3], ["FSP", 5, 8, 3, 3], ["RE", 5, [0, 4, 8, 1, 5, 9, 2, 6, 10, 3, 7, 11]], ["CA", 4, 5, 8], ["CHR", 3, "shared", [4]], ["CA", 4, 5, 9], ["CHR", 2, "shared", [5]], ["CA", 3, 6, 9], ["CI", 2], ["FU", 7, [0, 1, 2]], ["AN", 7, 0, 5], ["FU", 7, [1, 2, 3]], ["AN", 7, 1, 4], ["FU", 7, [2, 3, 4]], ["AN", 7, 2, 6], ["FU", 5, [0, 1, 2]], ["SP", 5, 0, 64, [1], 1], ["AN", 5, 1, 2], ["FFSP", 5, 0, [3, 2, 1], 1, 1], ["AN", 5, 1, 6], ["FU", 3, [0, 1, 2]], ["SP", 3, 0, 64, [4], 1], ["AN", 3, 1, 2], ["FFSP", 3, 0, [3, 2, 1], 1, 1], ["AN", 3, 1, 6], ["PR", 6, 0, "auto_unroll_max_step$1024"]]]], "r": [[0.0388331], 0, 7.14171, 1678602078], "v": "v0.6"}
{"i": [["[\"tw_kernel\", 1024, 1024, 358, 128, 8, \"float32\"]", "cuda -keys=cuda,gpu -arch=sm_70 -max_num_threads=1024 -model=unknown -thread_warp_size=32", [-1, 16, 64, 49152, 2147483647, 1024, 8, 32], "", 0, ["mask_k"]], [[], [["CHW", 4, "local"], ["SP", 4, 0, 8, [1, 1, 2, 2], 1], ["SP", 4, 5, 128, [2, 4, 1, 1], 1], ["SP", 4, 10, 1024, [2, 16, 4, 1], 1], ["SP", 4, 15, 358, [1, 1], 1], ["RE", 4, [0, 5, 10, 1, 6, 11, 2, 7, 12, 15, 16, 3, 8, 13, 17, 4, 9, 14]], ["FSP", 5, 0, 1, 3], ["FSP", 5, 4, 2, 3], ["FSP", 5, 8, 3, 3], ["RE", 5, [0, 4, 8, 1, 5, 9, 2, 6, 10, 3, 7, 11]], ["CA", 4, 5, 8], ["CHR", 3, "shared", [4]], ["CA", 4, 5, 9], ["CHR", 2, "shared", [5]], ["CA", 3, 6, 9], ["CI", 2], ["FU", 7, [0, 1, 2]], ["AN", 7, 0, 5], ["FU", 7, [1, 2, 3]], ["AN", 7, 1, 4], ["FU", 7, [2, 3, 4]], ["AN", 7, 2, 6], ["FU", 5, [0, 1, 2]], ["SP", 5, 0, 2, [1], 1], ["AN", 5, 1, 2], ["FFSP", 5, 0, [3, 2, 1], 1, 1], ["AN", 5, 1, 6], ["FU", 3, [0, 1, 2]], ["SP", 3, 0, 8, [1], 1], ["AN", 3, 1, 2], ["FFSP", 3, 0, [3, 2, 1], 1, 1], ["AN", 3, 1, 6], ["PR", 6, 0, "auto_unroll_max_step$16"]]]], "r": [[0.000273573], 0, 1.39801, 1678602079], "v": "v0.6"}
{"i": [["[\"tw_kernel\", 1024, 1024, 358, 128, 8, \"float32\"]", "cuda -keys=cuda,gpu -arch=sm_70 -max_num_threads=1024 -model=unknown -thread_warp_size=32", [-1, 16, 64, 49152, 2147483647, 1024, 8, 32], "", 0, ["mask_k"]], [[], [["CHW", 4, "local"], ["SP", 4, 0, 8, [1, 4, 1, 2], 1], ["SP", 4, 5, 128, [1, 16, 4, 1], 1], ["SP", 4, 10, 1024, [1, 8, 4, 1], 1], ["SP", 4, 15, 358, [2, 1], 1], ["RE", 4, [0, 5, 10, 1, 6, 11, 2, 7, 12, 15, 16, 3, 8, 13, 17, 4, 9, 14]], ["FSP", 5, 0, 1, 3], ["FSP", 5, 4, 2, 3], ["FSP", 5, 8, 3, 3], ["RE", 5, [0, 4, 8, 1, 5, 9, 2, 6, 10, 3, 7, 11]], ["CA", 4, 5, 8], ["CHR", 3, "shared", [4]], ["CA", 4, 5, 9], ["CHR", 2, "shared", [5]], ["CA", 3, 6, 9], ["CI", 2], ["FU", 7, [0, 1, 2]], ["AN", 7, 0, 5], ["FU", 7, [1, 2, 3]], ["AN", 7, 1, 4], ["FU", 7, [2, 3, 4]], ["AN", 7, 2, 6], ["FU", 5, [0, 1, 2]], ["SP", 5, 0, 16, [1], 1], ["AN", 5, 1, 2], ["FFSP", 5, 0, [3, 2, 1], 1, 1], ["AN", 5, 1, 6], ["FU", 3, [0, 1, 2]], ["SP", 3, 0, 16, [1], 1], ["AN", 3, 1, 2], ["FFSP", 3, 0, [3, 2, 1], 1, 1], ["AN", 3, 1, 6], ["PR", 6, 0, "auto_unroll_max_step$1024"]]]], "r": [[0.000259522], 0, 1.15602, 1678602079], "v": "v0.6"}
{"i": [["[\"tw_kernel\", 1024, 1024, 358, 128, 8, \"float32\"]", "cuda -keys=cuda,gpu -arch=sm_70 -max_num_threads=1024 -model=unknown -thread_warp_size=32", [-1, 16, 64, 49152, 2147483647, 1024, 8, 32], "", 0, ["mask_k"]], [[], [["CHW", 4, "local"], ["SP", 4, 0, 8, [2, 4, 1, 1], 1], ["SP", 4, 5, 128, [2, 4, 1, 1], 1], ["SP", 4, 10, 1024, [1, 2, 1, 1], 1], ["SP", 4, 15, 358, [1, 2], 1], ["RE", 4, [0, 5, 10, 1, 6, 11, 2, 7, 12, 15, 16, 3, 8, 13, 17, 4, 9, 14]], ["FSP", 5, 0, 1, 3], ["FSP", 5, 4, 2, 3], ["FSP", 5, 8, 3, 3], ["RE", 5, [0, 4, 8, 1, 5, 9, 2, 6, 10, 3, 7, 11]], ["CA", 4, 5, 8], ["CHR", 3, "shared", [4]], ["CA", 4, 5, 9], ["CHR", 2, "shared", [5]], ["CA", 3, 6, 9], ["CI", 2], ["FU", 7, [0, 1, 2]], ["AN", 7, 0, 5], ["FU", 7, [1, 2, 3]], ["AN", 7, 1, 4], ["FU", 7, [2, 3, 4]], ["AN", 7, 2, 6], ["FU", 5, [0, 1, 2]], ["SP", 5, 0, 1, [1], 1], ["AN", 5, 1, 2], ["FFSP", 5, 0, [3, 2, 1], 1, 1], ["AN", 5, 1, 6], ["FU", 3, [0, 1, 2]], ["SP", 3, 0, 1, [1], 1], ["AN", 3, 1, 2], ["FFSP", 3, 0, [3, 2, 1], 1, 1], ["AN", 3, 1, 6], ["PR", 6, 0, "auto_unroll_max_step$512"]]]], "r": [[0.00124589], 0, 0.972456, 1678602079], "v": "v0.6"}
{"i": [["[\"tw_kernel\", 1024, 1024, 358, 128, 8, \"float32\"]", "cuda -keys=cuda,gpu -arch=sm_70 -max_num_threads=1024 -model=unknown -thread_warp_size=32", [-1, 16, 64, 49152, 2147483647, 1024, 8, 32], "", 0, ["mask_k"]], [[], [["CHW", 4, "local"], ["SP", 4, 0, 8, [1, 1, 2, 4], 1], ["SP", 4, 5, 128, [1, 16, 2, 2], 1], ["SP", 4, 10, 1024, [8, 8, 2, 2], 1], ["SP", 4, 15, 358, [1, 2], 1], ["RE", 4, [0, 5, 10, 1, 6, 11, 2, 7, 12, 15, 16, 3, 8, 13, 17, 4, 9, 14]], ["FSP", 5, 0, 1, 3], ["FSP", 5, 4, 2, 3], ["FSP", 5, 8, 3, 3], ["RE", 5, [0, 4, 8, 1, 5, 9, 2, 6, 10, 3, 7, 11]], ["CA", 4, 5, 8], ["CHR", 3, "shared", [4]], ["CA", 4, 5, 9], ["CHR", 2, "shared", [5]], ["CA", 3, 6, 9], ["CI", 2], ["FU", 7, [0, 1, 2]], ["AN", 7, 0, 5], ["FU", 7, [1, 2, 3]], ["AN", 7, 1, 4], ["FU", 7, [2, 3, 4]], ["AN", 7, 2, 6], ["FU", 5, [0, 1, 2]], ["SP", 5, 0, 64, [1], 1], ["AN", 5, 1, 2], ["FFSP", 5, 0, [3, 2, 1], 1, 1], ["AN", 5, 1, 6], ["FU", 3, [0, 1, 2]], ["SP", 3, 0, 256, [1], 1], ["AN", 3, 1, 2], ["FFSP", 3, 0, [3, 2, 1], 1, 1], ["AN", 3, 1, 6], ["PR", 6, 0, "auto_unroll_max_step$0"]]]], "r": [[0.00383183], 0, 2.92782, 1678602079], "v": "v0.6"}
{"i": [["[\"tw_kernel\", 1024, 1024, 358, 128, 8, \"float32\"]", "cuda -keys=cuda,gpu -arch=sm_70 -max_num_threads=1024 -model=unknown -thread_warp_size=32", [-1, 16, 64, 49152, 2147483647, 1024, 8, 32], "", 0, ["mask_k"]], [[], [["CHW", 4, "local"], ["SP", 4, 0, 8, [1, 1, 2, 1], 1], ["SP", 4, 5, 128, [1, 1, 2, 64], 1], ["SP", 4, 10, 1024, [1, 64, 2, 2], 1], ["SP", 4, 15, 358, [2, 1], 1], ["RE", 4, [0, 5, 10, 1, 6, 11, 2, 7, 12, 15, 16, 3, 8, 13, 17, 4, 9, 14]], ["FSP", 5, 0, 1, 3], ["FSP", 5, 4, 2, 3], ["FSP", 5, 8, 3, 3], ["RE", 5, [0, 4, 8, 1, 5, 9, 2, 6, 10, 3, 7, 11]], ["CA", 4, 5, 8], ["CHR", 3, "shared", [4]], ["CA", 4, 5, 9], ["CHR", 2, "shared", [5]], ["CA", 3, 6, 9], ["CI", 2], ["FU", 7, [0, 1, 2]], ["AN", 7, 0, 5], ["FU", 7, [1, 2, 3]], ["AN", 7, 1, 4], ["FU", 7, [2, 3, 4]], ["AN", 7, 2, 6], ["FU", 5, [0, 1, 2]], ["SP", 5, 0, 512, [1], 1], ["AN", 5, 1, 2], ["FFSP", 5, 0, [3, 2, 1], 1, 1], ["AN", 5, 1, 6], ["FU", 3, [0, 1, 2]], ["SP", 3, 0, 32, [1], 1], ["AN", 3, 1, 2], ["FFSP", 3, 0, [3, 2, 1], 1, 1], ["AN", 3, 1, 6], ["PR", 6, 0, "auto_unroll_max_step$0"]]]], "r": [[0.0128631], 0, 2.15013, 1678602080], "v": "v0.6"}
{"i": [["[\"tw_kernel\", 1024, 1024, 358, 128, 8, \"float32\"]", "cuda -keys=cuda,gpu -arch=sm_70 -max_num_threads=1024 -model=unknown -thread_warp_size=32", [-1, 16, 64, 49152, 2147483647, 1024, 8, 32], "", 0, ["mask_k"]], [[], [["CHW", 4, "local"], ["SP", 4, 0, 8, [1, 2, 2, 2], 1], ["SP", 4, 5, 128, [1, 1, 4, 16], 1], ["SP", 4, 10, 1024, [2, 128, 1, 4], 1], ["SP", 4, 15, 358, [1, 1], 1], ["RE", 4, [0, 5, 10, 1, 6, 11, 2, 7, 12, 15, 16, 3, 8, 13, 17, 4, 9, 14]], ["FSP", 5, 0, 1, 3], ["FSP", 5, 4, 2, 3], ["FSP", 5, 8, 3, 3], ["RE", 5, [0, 4, 8, 1, 5, 9, 2, 6, 10, 3, 7, 11]], ["CA", 4, 5, 8], ["CHR", 3, "shared", [4]], ["CA", 4, 5, 9], ["CHR", 2, "shared", [5]], ["CA", 3, 6, 9], ["CI", 2], ["FU", 7, [0, 1, 2]], ["AN", 7, 0, 5], ["FU", 7, [1, 2, 3]], ["AN", 7, 1, 4], ["FU", 7, [2, 3, 4]], ["AN", 7, 2, 6], ["FU", 5, [0, 1, 2]], ["SP", 5, 0, 256, [1], 1], ["AN", 5, 1, 2], ["FFSP", 5, 0, [3, 2, 1], 1, 1], ["AN", 5, 1, 6], ["FU", 3, [0, 1, 2]], ["SP", 3, 0, 4, [2], 1], ["AN", 3, 1, 2], ["FFSP", 3, 0, [3, 2, 1], 1, 1], ["AN", 3, 1, 6], ["PR", 6, 0, "auto_unroll_max_step$64"]]]], "r": [[0.025903], 0, 2.17936, 1678602080], "v": "v0.6"}
{"i": [["[\"tw_kernel\", 1024, 1024, 358, 128, 8, \"float32\"]", "cuda -keys=cuda,gpu -arch=sm_70 -max_num_threads=1024 -model=unknown -thread_warp_size=32", [-1, 16, 64, 49152, 2147483647, 1024, 8, 32], "", 0, ["mask_k"]], [[], [["CHW", 4, "local"], ["SP", 4, 0, 8, [1, 1, 2, 2], 1], ["SP", 4, 5, 128, [1, 2, 1, 8], 1], ["SP", 4, 10, 1024, [2, 32, 2, 2], 1], ["SP", 4, 15, 358, [2, 1], 1], ["RE", 4, [0, 5, 10, 1, 6, 11, 2, 7, 12, 15, 16, 3, 8, 13, 17, 4, 9, 14]], ["FSP", 5, 0, 1, 3], ["FSP", 5, 4, 2, 3], ["FSP", 5, 8, 3, 3], ["RE", 5, [0, 4, 8, 1, 5, 9, 2, 6, 10, 3, 7, 11]], ["CA", 4, 5, 8], ["CHR", 3, "shared", [4]], ["CA", 4, 5, 9], ["CHR", 2, "shared", [5]], ["CA", 3, 6, 9], ["CI", 2], ["FU", 7, [0, 1, 2]], ["AN", 7, 0, 5], ["FU", 7, [1, 2, 3]], ["AN", 7, 1, 4], ["FU", 7, [2, 3, 4]], ["AN", 7, 2, 6], ["FU", 5, [0, 1, 2]], ["SP", 5, 0, 64, [1], 1], ["AN", 5, 1, 2], ["FFSP", 5, 0, [3, 2, 1], 1, 1], ["AN", 5, 1, 6], ["FU", 3, [0, 1, 2]], ["SP", 3, 0, 32, [1], 1], ["AN", 3, 1, 2], ["FFSP", 3, 0, [3, 2, 1], 1, 1], ["AN", 3, 1, 6], ["PR", 6, 0, "auto_unroll_max_step$16"]]]], "r": [[0.000463151], 0, 1.23891, 1678602080], "v": "v0.6"}
{"i": [["[\"tw_kernel\", 1024, 1024, 358, 128, 8, \"float32\"]", "cuda -keys=cuda,gpu -arch=sm_70 -max_num_threads=1024 -model=unknown -thread_warp_size=32", [-1, 16, 64, 49152, 2147483647, 1024, 8, 32], "", 0, ["mask_k"]], [[], [["CHW", 4, "local"], ["SP", 4, 0, 8, [1, 1, 2, 1], 1], ["SP", 4, 5, 128, [1, 1, 4, 2], 1], ["SP", 4, 10, 1024, [1, 256, 1, 1], 1], ["SP", 4, 15, 358, [1, 1], 1], ["RE", 4, [0, 5, 10, 1, 6, 11, 2, 7, 12, 15, 16, 3, 8, 13, 17, 4, 9, 14]], ["FSP", 5, 0, 1, 3], ["FSP", 5, 4, 2, 3], ["FSP", 5, 8, 3, 3], ["RE", 5, [0, 4, 8, 1, 5, 9, 2, 6, 10, 3, 7, 11]], ["CA", 4, 5, 8], ["CHR", 3, "shared", [4]], ["CA", 4, 5, 9], ["CHR", 2, "shared", [5]], ["CA", 3, 6, 9], ["CI", 2], ["FU", 7, [0, 1, 2]], ["AN", 7, 0, 5], ["FU", 7, [1, 2, 3]], ["AN", 7, 1, 4], ["FU", 7, [2, 3, 4]], ["AN", 7, 2, 6], ["FU", 5, [0, 1, 2]], ["SP", 5, 0, 64, [1], 1], ["AN", 5, 1, 2], ["FFSP", 5, 0, [3, 2, 1], 1, 1], ["AN", 5, 1, 6], ["FU", 3, [0, 1, 2]], ["SP", 3, 0, 8, [1], 1], ["AN", 3, 1, 2], ["FFSP", 3, 0, [3, 2, 1], 1, 1], ["AN", 3, 1, 6], ["PR", 6, 0, "auto_unroll_max_step$0"]]]], "r": [[0.000192988], 0, 0.912959, 1678602081], "v": "v0.6"}
