AutoSchedule/Outputs/Ansor/tw_1024_1024_1024_ts64_spar60_1024_float32_gpu_trails2000.json
{"i": [["[\"tw_kernel\", 1024, 1024, 409, 64, 16, \"float32\"]", "cuda -keys=cuda,gpu -arch=sm_70 -max_num_threads=1024 -model=unknown -thread_warp_size=32", [-1, 16, 64, 49152, 2147483647, 1024, 8, 32], "", 0, ["mask_k"]], [[], [["CHW", 4, "local"], ["SP", 4, 0, 16, [2, 1, 1, 1], 1], ["SP", 4, 5, 64, [1, 16, 4, 1], 1], ["SP", 4, 10, 1024, [1, 2, 4, 16], 1], ["SP", 4, 15, 409, [1, 1], 1], ["RE", 4, [0, 5, 10, 1, 6, 11, 2, 7, 12, 15, 16, 3, 8, 13, 17, 4, 9, 14]], ["FSP", 5, 0, 1, 3], ["FSP", 5, 4, 2, 3], ["FSP", 5, 8, 3, 3], ["RE", 5, [0, 4, 8, 1, 5, 9, 2, 6, 10, 3, 7, 11]], ["CA", 4, 5, 8], ["CHR", 3, "shared", [4]], ["CA", 4, 5, 9], ["CHR", 2, "shared", [5]], ["CA", 3, 6, 9], ["CI", 2], ["FU", 7, [0, 1, 2]], ["AN", 7, 0, 5], ["FU", 7, [1, 2, 3]], ["AN", 7, 1, 4], ["FU", 7, [2, 3, 4]], ["AN", 7, 2, 6], ["FU", 5, [0, 1, 2]], ["SP", 5, 0, 4, [1], 1], ["AN", 5, 1, 2], ["FFSP", 5, 0, [3, 2, 1], 1, 1], ["AN", 5, 1, 6], ["FU", 3, [0, 1, 2]], ["SP", 3, 0, 64, [1], 1], ["AN", 3, 1, 2], ["FFSP", 3, 0, [3, 2, 1], 1, 1], ["AN", 3, 1, 6], ["PR", 6, 0, "auto_unroll_max_step$1024"]]]], "r": [[0.00211911], 0, 4.99305, 1678568667], "v": "v0.6"}
{"i": [["[\"tw_kernel\", 1024, 1024, 409, 64, 16, \"float32\"]", "cuda -keys=cuda,gpu -arch=sm_70 -max_num_threads=1024 -model=unknown -thread_warp_size=32", [-1, 16, 64, 49152, 2147483647, 1024, 8, 32], "", 0, ["mask_k"]], [[], [["CHW", 4, "local"], ["SP", 4, 0, 16, [1, 1, 2, 1], 1], ["SP", 4, 5, 64, [1, 16, 4, 1], 1], ["SP", 4, 10, 1024, [1, 2, 4, 16], 1], ["SP", 4, 15, 409, [1, 1], 1], ["RE", 4, [0, 5, 10, 1, 6, 11, 2, 7, 12, 15, 16, 3, 8, 13, 17, 4, 9, 14]], ["FSP", 5, 0, 1, 3], ["FSP", 5, 4, 2, 3], ["FSP", 5, 8, 3, 3], ["RE", 5, [0, 4, 8, 1, 5, 9, 2, 6, 10, 3, 7, 11]], ["CA", 4, 5, 8], ["CHR", 3, "shared", [4]], ["CA", 4, 5, 9], ["CHR", 2, "shared", [5]], ["CA", 3, 6, 9], ["CI", 2], ["FU", 7, [0, 1, 2]], ["AN", 7, 0, 5], ["FU", 7, [1, 2, 3]], ["AN", 7, 1, 4], ["FU", 7, [2, 3, 4]], ["AN", 7, 2, 6], ["FU", 5, [0, 1, 2]], ["SP", 5, 0, 4, [1], 1], ["AN", 5, 1, 2], ["FFSP", 5, 0, [3, 2, 1], 1, 1], ["AN", 5, 1, 6], ["FU", 3, [0, 1, 2]], ["SP", 3, 0, 64, [1], 1], ["AN", 3, 1, 2], ["FFSP", 3, 0, [3, 2, 1], 1, 1], ["AN", 3, 1, 6], ["PR", 6, 0, "auto_unroll_max_step$512"]]]], "r": [[0.00197229], 0, 5.1995, 1678568668], "v": "v0.6"}
{"i": [["[\"tw_kernel\", 1024, 1024, 409, 64, 16, \"float32\"]", "cuda -keys=cuda,gpu -arch=sm_70 -max_num_threads=1024 -model=unknown -thread_warp_size=32", [-1, 16, 64, 49152, 2147483647, 1024, 8, 32], "", 0, ["mask_k"]], [[], [["CHW", 4, "local"], ["SP", 4, 0, 16, [1, 2, 8, 1], 1], ["SP", 4, 5, 64, [1, 1, 1, 4], 1], ["SP", 4, 10, 1024, [2, 64, 1, 1], 1], ["SP", 4, 15, 409, [1, 1], 1], ["RE", 4, [0, 5, 10, 1, 6, 11, 2, 7, 12, 15, 16, 3, 8, 13, 17, 4, 9, 14]], ["FSP", 5, 0, 1, 3], ["FSP", 5, 4, 2, 3], ["FSP", 5, 8, 3, 3], ["RE", 5, [0, 4, 8, 1, 5, 9, 2, 6, 10, 3, 7, 11]], ["CA", 4, 5, 8], ["CHR", 3, "shared", [4]], ["CA", 4, 5, 9], ["CHR", 2, "shared", [5]], ["CA", 3, 6, 9], ["CI", 2], ["FU", 7, [0, 1, 2]], ["AN", 7, 0, 5], ["FU", 7, [1, 2, 3]], ["AN", 7, 1, 4], ["FU", 7, [2, 3, 4]], ["AN", 7, 2, 6], ["FU", 5, [0, 1, 2]], ["SP", 5, 0, 64, [4], 1], ["AN", 5, 1, 2], ["FFSP", 5, 0, [3, 2, 1], 1, 1], ["AN", 5, 1, 6], ["FU", 3, [0, 1, 2]], ["SP", 3, 0, 16, [1], 1], ["AN", 3, 1, 2], ["FFSP", 3, 0, [3, 2, 1], 1, 1], ["AN", 3, 1, 6], ["PR", 6, 0, "auto_unroll_max_step$16"]]]], "r": [[0.000463158], 0, 1.51176, 1678568668], "v": "v0.6"}
{"i": [["[\"tw_kernel\", 1024, 1024, 409, 64, 16, \"float32\"]", "cuda -keys=cuda,gpu -arch=sm_70 -max_num_threads=1024 -model=unknown -thread_warp_size=32", [-1, 16, 64, 49152, 2147483647, 1024, 8, 32], "", 0, ["mask_k"]], [[], [["CHW", 4, "local"], ["SP", 4, 0, 16, [1, 16, 1, 1], 1], ["SP", 4, 5, 64, [1, 8, 1, 1], 1], ["SP", 4, 10, 1024, [4, 1, 8, 16], 1], ["SP", 4, 15, 409, [1, 1], 1], ["RE", 4, [0, 5, 10, 1, 6, 11, 2, 7, 12, 15, 16, 3, 8, 13, 17, 4, 9, 14]], ["FSP", 5, 0, 1, 3], ["FSP", 5, 4, 2, 3], ["FSP", 5, 8, 3, 3], ["RE", 5, [0, 4, 8, 1, 5, 9, 2, 6, 10, 3, 7, 11]], ["CA", 4, 5, 8], ["CHR", 3, "shared", [4]], ["CA", 4, 5, 9], ["CHR", 2, "shared", [5]], ["CA", 3, 6, 9], ["CI", 2], ["FU", 7, [0, 1, 2]], ["AN", 7, 0, 5], ["FU", 7, [1, 2, 3]], ["AN", 7, 1, 4], ["FU", 7, [2, 3, 4]], ["AN", 7, 2, 6], ["FU", 5, [0, 1, 2]], ["SP", 5, 0, 2, [1], 1], ["AN", 5, 1, 2], ["FFSP", 5, 0, [3, 2, 1], 1, 1], ["AN", 5, 1, 6], ["FU", 3, [0, 1, 2]], ["SP", 3, 0, 128, [4], 1], ["AN", 3, 1, 2], ["FFSP", 3, 0, [3, 2, 1], 1, 1], ["AN", 3, 1, 6], ["PR", 6, 0, "auto_unroll_max_step$16"]]]], "r": [[0.00489196], 0, 2.22301, 1678568668], "v": "v0.6"}
{"i": [["[\"tw_kernel\", 1024, 1024, 409, 64, 16, \"float32\"]", "cuda -keys=cuda,gpu -arch=sm_70 -max_num_threads=1024 -model=unknown -thread_warp_size=32", [-1, 16, 64, 49152, 2147483647, 1024, 8, 32], "", 0, ["mask_k"]], [[], [["CHW", 4, "local"], ["SP", 4, 0, 16, [1, 1, 1, 1], 1], ["SP", 4, 5, 64, [1, 2, 1, 16], 1], ["SP", 4, 10, 1024, [1, 16, 2, 16], 1], ["SP", 4, 15, 409, [1, 1], 1], ["RE", 4, [0, 5, 10, 1, 6, 11, 2, 7, 12, 15, 16, 3, 8, 13, 17, 4, 9, 14]], ["FSP", 5, 0, 1, 3], ["FSP", 5, 4, 2, 3], ["FSP", 5, 8, 3, 3], ["RE", 5, [0, 4, 8, 1, 5, 9, 2, 6, 10, 3, 7, 11]], ["CA", 4, 5, 8], ["CHR", 3, "shared", [4]], ["CA", 4, 5, 9], ["CHR", 2, "shared", [5]], ["CA", 3, 6, 9], ["CI", 2], ["FU", 7, [0, 1, 2]], ["AN", 7, 0, 5], ["FU", 7, [1, 2, 3]], ["AN", 7, 1, 4], ["FU", 7, [2, 3, 4]], ["AN", 7, 2, 6], ["FU", 5, [0, 1, 2]], ["SP", 5, 0, 16, [1], 1], ["AN", 5, 1, 2], ["FFSP", 5, 0, [3, 2, 1], 1, 1], ["AN", 5, 1, 6], ["FU", 3, [0, 1, 2]], ["SP", 3, 0, 32, [1], 1], ["AN", 3, 1, 2], ["FFSP", 3, 0, [3, 2, 1], 1, 1], ["AN", 3, 1, 6], ["PR", 6, 0, "auto_unroll_max_step$64"]]]], "r": [[0.00303111], 0, 2.64076, 1678568668], "v": "v0.6"}
{"i": [["[\"tw_kernel\", 1024, 1024, 409, 64, 16, \"float32\"]", "cuda -keys=cuda,gpu -arch=sm_70 -max_num_threads=1024 -model=unknown -thread_warp_size=32", [-1, 16, 64, 49152, 2147483647, 1024, 8, 32], "", 0, ["mask_k"]], [[], [["CHW", 4, "local"], ["SP", 4, 0, 16, [8, 1, 1, 2], 1], ["SP", 4, 5, 64, [1, 16, 2, 1], 1], ["SP", 4, 10, 1024, [1, 16, 1, 8], 1], ["SP", 4, 15, 409, [1, 1], 1], ["RE", 4, [0, 5, 10, 1, 6, 11, 2, 7, 12, 15, 16, 3, 8, 13, 17, 4, 9, 14]], ["FSP", 5, 0, 1, 3], ["FSP", 5, 4, 2, 3], ["FSP", 5, 8, 3, 3], ["RE", 5, [0, 4, 8, 1, 5, 9, 2, 6, 10, 3, 7, 11]], ["CA", 4, 5, 8], ["CHR", 3, "shared", [4]], ["CA", 4, 5, 9], ["CHR", 2, "shared", [5]], ["CA", 3, 6, 9], ["CI", 2], ["FU", 7, [0, 1, 2]], ["AN", 7, 0, 5], ["FU", 7, [1, 2, 3]], ["AN", 7, 1, 4], ["FU", 7, [2, 3, 4]], ["AN", 7, 2, 6], ["FU", 5, [0, 1, 2]], ["SP", 5, 0, 4, [1], 1], ["AN", 5, 1, 2], ["FFSP", 5, 0, [3, 2, 1], 1, 1], ["AN", 5, 1, 6], ["FU", 3, [0, 1, 2]], ["SP", 3, 0, 16, [1], 1], ["AN", 3, 1, 2], ["FFSP", 3, 0, [3, 2, 1], 1, 1], ["AN", 3, 1, 6], ["PR", 6, 0, "auto_unroll_max_step$64"]]]], "r": [[0.00146074], 0, 2.64157, 1678568669], "v": "v0.6"}
{"i": [["[\"tw_kernel\", 1024, 1024, 409, 64, 16, \"float32\"]", "cuda -keys=cuda,gpu -arch=sm_70 -max_num_threads=1024 -model=unknown -thread_warp_size=32", [-1, 16, 64, 49152, 2147483647, 1024, 8, 32], "", 0, ["mask_k"]], [[], [["CHW", 4, "local"], ["SP", 4, 0, 16, [1, 1, 1, 16], 1], ["SP", 4, 5, 64, [2, 4, 1, 1], 1], ["SP", 4, 10, 1024, [1, 8, 2, 2], 1], ["SP", 4, 15, 409, [1, 1], 1], ["RE", 4, [0, 5, 10, 1, 6, 11, 2, 7, 12, 15, 16, 3, 8, 13, 17, 4, 9, 14]], ["FSP", 5, 0, 1, 3], ["FSP", 5, 4, 2, 3], ["FSP", 5, 8, 3, 3], ["RE", 5, [0, 4, 8, 1, 5, 9, 2, 6, 10, 3, 7, 11]], ["CA", 4, 5, 8], ["CHR", 3, "shared", [4]], ["CA", 4, 5, 9], ["CHR", 2, "shared", [5]], ["CA", 3, 6, 9], ["CI", 2], ["FU", 7, [0, 1, 2]], ["AN", 7, 0, 5], ["FU", 7, [1, 2, 3]], ["AN", 7, 1, 4], ["FU", 7, [2, 3, 4]], ["AN", 7, 2, 6], ["FU", 5, [0, 1, 2]], ["SP", 5, 0, 16, [2], 1], ["AN", 5, 1, 2], ["FFSP", 5, 0, [3, 2, 1], 1, 1], ["AN", 5, 1, 6], ["FU", 3, [0, 1, 2]], ["SP", 3, 0, 64, [1], 1], ["AN", 3, 1, 2], ["FFSP", 3, 0, [3, 2, 1], 1, 1], ["AN", 3, 1, 6], ["PR", 6, 0, "auto_unroll_max_step$1024"]]]], "r": [[0.000512507], 0, 1.71279, 1678568669], "v": "v0.6"}
{"i": [["[\"tw_kernel\", 1024, 1024, 409, 64, 16, \"float32\"]", "cuda -keys=cuda,gpu -arch=sm_70 -max_num_threads=1024 -model=unknown -thread_warp_size=32", [-1, 16, 64, 49152, 2147483647, 1024, 8, 32], "", 0, ["mask_k"]], [[], [["CHW", 4, "local"], ["SP", 4, 0, 16, [2, 2, 2, 1], 1], ["SP", 4, 5, 64, [1, 1, 1, 32], 1], ["SP", 4, 10, 1024, [1, 16, 1, 4], 1], ["SP", 4, 15, 409, [1, 1], 1], ["RE", 4, [0, 5, 10, 1, 6, 11, 2, 7, 12, 15, 16, 3, 8, 13, 17, 4, 9, 14]], ["FSP", 5, 0, 1, 3], ["FSP", 5, 4, 2, 3], ["FSP", 5, 8, 3, 3], ["RE", 5, [0, 4, 8, 1, 5, 9, 2, 6, 10, 3, 7, 11]], ["CA", 4, 5, 8], ["CHR", 3, "shared", [4]], ["CA", 4, 5, 9], ["CHR", 2, "shared", [5]], ["CA", 3, 6, 9], ["CI", 2], ["FU", 7, [0, 1, 2]], ["AN", 7, 0, 5], ["FU", 7, [1, 2, 3]], ["AN", 7, 1, 4], ["FU", 7, [2, 3, 4]], ["AN", 7, 2, 6], ["FU", 5, [0, 1, 2]], ["SP", 5, 0, 8, [1], 1], ["AN", 5, 1, 2], ["FFSP", 5, 0, [3, 2, 1], 1, 1], ["AN", 5, 1, 6], ["FU", 3, [0, 1, 2]], ["SP", 3, 0, 8, [4], 1], ["AN", 3, 1, 2], ["FFSP", 3, 0, [3, 2, 1], 1, 1], ["AN", 3, 1, 6], ["PR", 6, 0, "auto_unroll_max_step$512"]]]], "r": [[0.00300395], 0, 4.93933, 1678568669], "v": "v0.6"}
{"i": [["[\"tw_kernel\", 1024, 1024, 409, 64, 16, \"float32\"]", "cuda -keys=cuda,gpu -arch=sm_70 -max_num_threads=1024 -model=unknown -thread_warp_size=32", [-1, 16, 64, 49152, 2147483647, 1024, 8, 32], "", 0, ["mask_k"]], [[], [["CHW", 4, "local"], ["SP", 4, 0, 16, [2, 1, 1, 1], 1], ["SP", 4, 5, 64, [1, 16, 4, 1], 1], ["SP", 4, 10, 1024, [1, 2, 16, 4], 1], ["SP", 4, 15, 409, [1, 1], 1], ["RE", 4, [0, 5, 10, 1, 6, 11, 2, 7, 12, 15, 16, 3, 8, 13, 17, 4, 9, 14]], ["FSP", 5, 0, 1, 3], ["FSP", 5, 4, 2, 3], ["FSP", 5, 8, 3, 3], ["RE", 5, [0, 4, 8, 1, 5, 9, 2, 6, 10, 3, 7, 11]], ["CA", 4, 5, 8], ["CHR", 3, "shared", [4]], ["CA", 4, 5, 9], ["CHR", 2, "shared", [5]], ["CA", 3, 6, 9], ["CI", 2], ["FU", 7, [0, 1, 2]], ["AN", 7, 0, 5], ["FU", 7, [1, 2, 3]], ["AN", 7, 1, 4], ["FU", 7, [2, 3, 4]], ["AN", 7, 2, 6], ["FU", 5, [0, 1, 2]], ["SP", 5, 0, 4, [2], 1], ["AN", 5, 1, 2], ["FFSP", 5, 0, [3, 2, 1], 1, 1], ["AN", 5, 1, 6], ["FU", 3, [0, 1, 2]], ["SP", 3, 0, 64, [1], 1], ["AN", 3, 1, 2], ["FFSP", 3, 0, [3, 2, 1], 1, 1], ["AN", 3, 1, 6], ["PR", 6, 0, "auto_unroll_max_step$1024"]]]], "r": [[0.00202955], 0, 4.26519, 1678568670], "v": "v0.6"}
{"i": [["[\"tw_kernel\", 1024, 1024, 409, 64, 16, \"float32\"]", "cuda -keys=cuda,gpu -arch=sm_70 -max_num_threads=1024 -model=unknown -thread_warp_size=32", [-1, 16, 64, 49152, 2147483647, 1024, 8, 32], "", 0, ["mask_k"]], [[], [["CHW", 4, "local"], ["SP", 4, 0, 16, [2, 1, 1, 2], 1], ["SP", 4, 5, 64, [4, 2, 2, 1], 1], ["SP", 4, 10, 1024, [1, 64, 1, 1], 1], ["SP", 4, 15, 409, [1, 1], 1], ["RE", 4, [0, 5, 10, 1, 6, 11, 2, 7, 12, 15, 16, 3, 8, 13, 17, 4, 9, 14]], ["FSP", 5, 0, 1, 3], ["FSP", 5, 4, 2, 3], ["FSP", 5, 8, 3, 3], ["RE", 5, [0, 4, 8, 1, 5, 9, 2, 6, 10, 3, 7, 11]], ["CA", 4, 5, 8], ["CHR", 3, "shared", [4]], ["CA", 4, 5, 9], ["CHR", 2, "shared", [5]], ["CA", 3, 6, 9], ["CI", 2], ["FU", 7, [0, 1, 2]], ["AN", 7, 0, 5], ["FU", 7, [1, 2, 3]], ["AN", 7, 1, 4], ["FU", 7, [2, 3, 4]], ["AN", 7, 2, 6], ["FU", 5, [0, 1, 2]], ["SP", 5, 0, 8, [1], 1], ["AN", 5, 1, 2], ["FFSP", 5, 0, [3, 2, 1], 1, 1], ["AN", 5, 1, 6], ["FU", 3, [0, 1, 2]], ["SP", 3, 0, 2, [1], 1], ["AN", 3, 1, 2], ["FFSP", 3, 0, [3, 2, 1], 1, 1], ["AN", 3, 1, 6], ["PR", 6, 0, "auto_unroll_max_step$1024"]]]], "r": [[0.000299707], 0, 1.41663, 1678568670], "v": "v0.6"}
{"i": [["[\"tw_kernel\", 1024, 1024, 409, 64, 16, \"float32\"]", "cuda -keys=cuda,gpu -arch=sm_70 -max_num_threads=1024 -model=unknown -thread_warp_size=32", [-1, 16, 64, 49152, 2147483647, 1024, 8, 32], "", 0, ["mask_k"]], [[], [["CHW", 4, "local"], ["SP", 4, 0, 16, [1, 2, 4, 2], 1], ["SP", 4, 5, 64, [4, 2, 4, 1], 1], ["SP", 4, 10, 1024, [1, 8, 1, 16], 1], ["SP", 4, 15, 409, [1, 1], 1], ["RE", 4, [0, 5, 10, 1, 6, 11, 2, 7, 12, 15, 16, 3, 8, 13, 17, 4, 9, 14]], ["FSP", 5, 0, 1, 3], ["FSP", 5, 4, 2, 3], ["FSP", 5, 8, 3, 3], ["RE", 5, [0, 4, 8, 1, 5, 9, 2, 6, 10, 3, 7, 11]], ["CA", 4, 5, 8], ["CHR", 3, "shared", [4]], ["CA", 4, 5, 9], ["CHR", 2, "shared", [5]], ["CA", 3, 6, 9], ["CI", 2], ["FU", 7, [0, 1, 2]], ["AN", 7, 0, 5], ["FU", 7, [1, 2, 3]], ["AN", 7, 1, 4], ["FU", 7, [2, 3, 4]], ["AN", 7, 2, 6], ["FU", 5, [0, 1, 2]], ["SP", 5, 0, 32, [4], 1], ["AN", 5, 1, 2], ["FFSP", 5, 0, [3, 2, 1], 1, 1], ["AN", 5, 1, 6], ["FU", 3, [0, 1, 2]], ["SP", 3, 0, 128, [1], 1], ["AN", 3, 1, 2], ["FFSP", 3, 0, [3, 2, 1], 1, 1], ["AN", 3, 1, 6], ["PR", 6, 0, "auto_unroll_max_step$16"]]]], "r": [[0.00775511], 0, 3.81577, 1678568670], "v": "v0.6"}
{"i": [["[\"tw_kernel\", 1024, 1024, 409, 64, 16, \"float32\"]", "cuda -keys=cuda,gpu -arch=sm_70 -max_num_threads=1024 -model=unknown -thread_warp_size=32", [-1, 16, 64, 49152, 2147483647, 1024, 8, 32], "", 0, ["mask_k"]], [[], [["CHW", 4, "local"], ["SP", 4, 0, 16, [1, 1, 8, 2], 1], ["SP", 4, 5, 64, [2, 2, 4, 4], 1], ["SP", 4, 10, 1024, [1, 16, 1, 4], 1], ["SP", 4, 15, 409, [1, 1], 1], ["RE", 4, [0, 5, 10, 1, 6, 11, 2, 7, 12, 15, 16, 3, 8, 13, 17, 4, 9, 14]], ["FSP", 5, 0, 1, 3], ["FSP", 5, 4, 2, 3], ["FSP", 5, 8, 3, 3], ["RE", 5, [0, 4, 8, 1, 5, 9, 2, 6, 10, 3, 7, 11]], ["CA", 4, 5, 8], ["CHR", 3, "shared", [4]], ["CA", 4, 5, 9], ["CHR", 2, "shared", [5]], ["CA", 3, 6, 9], ["CI", 2], ["FU", 7, [0, 1, 2]], ["AN", 7, 0, 5], ["FU", 7, [1, 2, 3]], ["AN", 7, 1, 4], ["FU", 7, [2, 3, 4]], ["AN", 7, 2, 6], ["FU", 5, [0, 1, 2]], ["SP", 5, 0, 128, [2], 1], ["AN", 5, 1, 2], ["FFSP", 5, 0, [3, 2, 1], 1, 1], ["AN", 5, 1, 6], ["FU", 3, [0, 1, 2]], ["SP", 3, 0, 32, [1], 1], ["AN", 3, 1, 2], ["FFSP", 3, 0, [3, 2, 1], 1, 1], ["AN", 3, 1, 6], ["PR", 6, 0, "auto_unroll_max_step$16"]]]], "r": [[0.00716591], 0, 2.7277, 1678568670], "v": "v0.6"}
{"i": [["[\"tw_kernel\", 1024, 1024, 409, 64, 16, \"float32\"]", "cuda -keys=cuda,gpu -arch=sm_70 -max_num_threads=1024 -model=unknown -thread_warp_size=32", [-1, 16, 64, 49152, 2147483647, 1024, 8, 32], "", 0, ["mask_k"]], [[], [["CHW", 4, "local"], ["SP", 4, 0, 16, [2, 2, 1, 2], 1], ["SP", 4, 5, 64, [2, 8, 2, 1], 1], ["SP", 4, 10, 1024, [1, 2, 4, 4], 1], ["SP", 4, 15, 409, [1, 1], 1], ["RE", 4, [0, 5, 10, 1, 6, 11, 2, 7, 12, 15, 16, 3, 8, 13, 17, 4, 9, 14]], ["FSP", 5, 0, 1, 3], ["FSP", 5, 4, 2, 3], ["FSP", 5, 8, 3, 3], ["RE", 5, [0, 4, 8, 1, 5, 9, 2, 6, 10, 3, 7, 11]], ["CA", 4, 5, 8], ["CHR", 3, "shared", [4]], ["CA", 4, 5, 9], ["CHR", 2, "shared", [5]], ["CA", 3, 6, 9], ["CI", 2], ["FU", 7, [0, 1, 2]], ["AN", 7, 0, 5], ["FU", 7, [1, 2, 3]], ["AN", 7, 1, 4], ["FU", 7, [2, 3, 4]], ["AN", 7, 2, 6], ["FU", 5, [0, 1, 2]], ["SP", 5, 0, 4, [1], 1], ["AN", 5, 1, 2], ["FFSP", 5, 0, [3, 2, 1], 1, 1], ["AN", 5, 1, 6], ["FU", 3, [0, 1, 2]], ["SP", 3, 0, 32, [4], 1], ["AN", 3, 1, 2], ["FFSP", 3, 0, [3, 2, 1], 1, 1], ["AN", 3, 1, 6], ["PR", 6, 0, "auto_unroll_max_step$512"]]]], "r": [[0.000755089], 0, 2.06468, 1678568671], "v": "v0.6"}
{"i": [["[\"tw_kernel\", 1024, 1024, 409, 64, 16, \"float32\"]", "cuda -keys=cuda,gpu -arch=sm_70 -max_num_threads=1024 -model=unknown -thread_warp_size=32", [-1, 16, 64, 49152, 2147483647, 1024, 8, 32], "", 0, ["mask_k"]], [[], [["CHW", 4, "local"], ["SP", 4, 0, 16, [1, 1, 4, 1], 1], ["SP", 4, 5, 64, [1, 1, 4, 8], 1], ["SP", 4, 10, 1024, [1, 512, 1, 1], 1], ["SP", 4, 15, 409, [1, 1], 1], ["RE", 4, [0, 5, 10, 1, 6, 11, 2, 7, 12, 15, 16, 3, 8, 13, 17, 4, 9, 14]], ["FSP", 5, 0, 1, 3], ["FSP", 5, 4, 2, 3], ["FSP", 5, 8, 3, 3], ["RE", 5, [0, 4, 8, 1, 5, 9, 2, 6, 10, 3, 7, 11]], ["CA", 4, 5, 8], ["CHR", 3, "shared", [4]], ["CA", 4, 5, 9], ["CHR", 2, "shared", [5]], ["CA", 3, 6, 9], ["CI", 2], ["FU", 7, [0, 1, 2]], ["AN", 7, 0, 5], ["FU", 7, [1, 2, 3]], ["AN", 7, 1, 4], ["FU", 7, [2, 3, 4]], ["AN", 7, 2, 6], ["FU", 5, [0, 1, 2]], ["SP", 5, 0, 64, [1], 1], ["AN", 5, 1, 2], ["FFSP", 5, 0, [3, 2, 1], 1, 1], ["AN", 5, 1, 6], ["FU", 3, [0, 1, 2]], ["SP", 3, 0, 4, [4], 1], ["AN", 3, 1, 2], ["FFSP", 3, 0, [3, 2, 1], 1, 1], ["AN", 3, 1, 6], ["PR", 6, 0, "auto_unroll_max_step$0"]]]], "r": [[0.000915533], 0, 1.0482, 1678568671], "v": "v0.6"}
{"i": [["[\"tw_kernel\", 1024, 1024, 409, 64, 16, \"float32\"]", "cuda -keys=cuda,gpu -arch=sm_70 -max_num_threads=1024 -model=unknown -thread_warp_size=32", [-1, 16, 64, 49152, 2147483647, 1024, 8, 32], "", 0, ["mask_k"]], [[], [["CHW", 4, "local"], ["SP", 4, 0, 16, [1, 1, 4, 1], 1], ["SP", 4, 5, 64, [1, 32, 1, 2], 1], ["SP", 4, 10, 1024, [2, 2, 1, 32], 1], ["SP", 4, 15, 409, [1, 1], 1], ["RE", 4, [0, 5, 10, 1, 6, 11, 2, 7, 12, 15, 16, 3, 8, 13, 17, 4, 9, 14]], ["FSP", 5, 0, 1, 3], ["FSP", 5, 4, 2, 3], ["FSP", 5, 8, 3, 3], ["RE", 5, [0, 4, 8, 1, 5, 9, 2, 6, 10, 3, 7, 11]], ["CA", 4, 5, 8], ["CHR", 3, "shared", [4]], ["CA", 4, 5, 9], ["CHR", 2, "shared", [5]], ["CA", 3, 6, 9], ["CI", 2], ["FU", 7, [0, 1, 2]], ["AN", 7, 0, 5], ["FU", 7, [1, 2, 3]], ["AN", 7, 1, 4], ["FU", 7, [2, 3, 4]], ["AN", 7, 2, 6], ["FU", 5, [0, 1, 2]], ["SP", 5, 0, 4, [2], 1], ["AN", 5, 1, 2], ["FFSP", 5, 0, [3, 2, 1], 1, 1], ["AN", 5, 1, 6], ["FU", 3, [0, 1, 2]], ["SP", 3, 0, 64, [1], 1], ["AN", 3, 1, 2], ["FFSP", 3, 0, [3, 2, 1], 1, 1], ["AN", 3, 1, 6], ["PR", 6, 0, "auto_unroll_max_step$16"]]]], "r": [[0.00320451], 0, 2.19189, 1678568671], "v": "v0.6"}
{"i": [["[\"tw_kernel\", 1024, 1024, 409, 64, 16, \"float32\"]", "cuda -keys=cuda,gpu -arch=sm_70 -max_num_threads=1024 -model=unknown -thread_warp_size=32", [-1, 16, 64, 49152, 2147483647, 1024, 8, 32], "", 0, ["mask_k"]], [[], [["CHW", 4, "local"], ["SP", 4, 0, 16, [1, 4, 1, 2], 1], ["SP", 4, 5, 64, [2, 4, 1, 8], 1], ["SP", 4, 10, 1024, [1, 8, 1, 1], 1], ["SP", 4, 15, 409, [1, 1], 1], ["RE", 4, [0, 5, 10, 1, 6, 11, 2, 7, 12, 15, 16, 3, 8, 13, 17, 4, 9, 14]], ["FSP", 5, 0, 1, 3], ["FSP", 5, 4, 2, 3], ["FSP", 5, 8, 3, 3], ["RE", 5, [0, 4, 8, 1, 5, 9, 2, 6, 10, 3, 7, 11]], ["CA", 4, 5, 8], ["CHR", 3, "shared", [4]], ["CA", 4, 5, 9], ["CHR", 2, "shared", [5]], ["CA", 3, 6, 9], ["CI", 2], ["FU", 7, [0, 1, 2]], ["AN", 7, 0, 5], ["FU", 7, [1, 2, 3]], ["AN", 7, 1, 4], ["FU", 7, [2, 3, 4]], ["AN", 7, 2, 6], ["FU", 5, [0, 1, 2]], ["SP", 5, 0, 16, [1], 1], ["AN", 5, 1, 2], ["FFSP", 5, 0, [3, 2, 1], 1, 1], ["AN", 5, 1, 6], ["FU", 3, [0, 1, 2]], ["SP", 3, 0, 2, [2], 1], ["AN", 3, 1, 2], ["FFSP", 3, 0, [3, 2, 1], 1, 1], ["AN", 3, 1, 6], ["PR", 6, 0, "auto_unroll_max_step$64"]]]], "r": [[0.000706785], 0, 1.0938, 1678568672], "v": "v0.6"}
{"i": [["[\"tw_kernel\", 1024, 1024, 409, 64, 16, \"float32\"]", "cuda -keys=cuda,gpu -arch=sm_70 -max_num_threads=1024 -model=unknown -thread_warp_size=32", [-1, 16, 64, 49152, 2147483647, 1024, 8, 32], "", 0, ["mask_k"]], [[], [["CHW", 4, "local"], ["SP", 4, 0, 16, [8, 1, 2, 1], 1], ["SP", 4, 5, 64, [1, 1, 16, 4], 1], ["SP", 4, 10, 1024, [1, 32, 1, 16], 1], ["SP", 4, 15, 409, [1, 1], 1], ["RE", 4, [0, 5, 10, 1, 6, 11, 2, 7, 12, 15, 16, 3, 8, 13, 17, 4, 9, 14]], ["FSP", 5, 0, 1, 3], ["FSP", 5, 4, 2, 3], ["FSP", 5, 8, 3, 3], ["RE", 5, [0, 4, 8, 1, 5, 9, 2, 6, 10, 3, 7, 11]], ["CA", 4, 5, 8], ["CHR", 3, "shared", [4]], ["CA", 4, 5, 9], ["CHR", 2, "shared", [5]], ["CA", 3, 6, 9], ["CI", 2], ["FU", 7, [0, 1, 2]], ["AN", 7, 0, 5], ["FU", 7, [1, 2, 3]], ["AN", 7, 1, 4], ["FU", 7, [2, 3, 4]], ["AN", 7, 2, 6], ["FU", 5, [0, 1, 2]], ["SP", 5, 0, 128, [1], 1], ["AN", 5, 1, 2], ["FFSP", 5, 0, [3, 2, 1], 1, 1], ["AN", 5, 1, 6], ["FU", 3, [0, 1, 2]], ["SP", 3, 0, 16, [1], 1], ["AN", 3, 1, 2], ["FFSP", 3, 0, [3, 2, 1], 1, 1], ["AN", 3, 1, 6], ["PR", 6, 0, "auto_unroll_max_step$64"]]]], "r": [[0.0599611], 0, 4.07632, 1678568672], "v": "v0.6"}
{"i": [["[\"tw_kernel\", 1024, 1024, 409, 64, 16, \"float32\"]", "cuda -keys=cuda,gpu -arch=sm_70 -max_num_threads=1024 -model=unknown -thread_warp_size=32", [-1, 16, 64, 49152, 2147483647, 1024, 8, 32], "", 0, ["mask_k"]], [[], [["CHW", 4, "local"], ["SP", 4, 0, 16, [1, 1, 1, 16], 1], ["SP", 4, 5, 64, [4, 1, 4, 1], 1], ["SP", 4, 10, 1024, [1, 32, 2, 4], 1], ["SP", 4, 15, 409, [1, 1], 1], ["RE", 4, [0, 5, 10, 1, 6, 11, 2, 7, 12, 15, 16, 3, 8, 13, 17, 4, 9, 14]], ["FSP", 5, 0, 1, 3], ["FSP", 5, 4, 2, 3], ["FSP", 5, 8, 3, 3], ["RE", 5, [0, 4, 8, 1, 5, 9, 2, 6, 10, 3, 7, 11]], ["CA", 4, 5, 8], ["CHR", 3, "shared", [4]], ["CA", 4, 5, 9], ["CHR", 2, "shared", [5]], ["CA", 3, 6, 9], ["CI", 2], ["FU", 7, [0, 1, 2]], ["AN", 7, 0, 5], ["FU", 7, [1, 2, 3]], ["AN", 7, 1, 4], ["FU", 7, [2, 3, 4]], ["AN", 7, 2, 6], ["FU", 5, [0, 1, 2]], ["SP", 5, 0, 64, [1], 1], ["AN", 5, 1, 2], ["FFSP", 5, 0, [3, 2, 1], 1, 1], ["AN", 5, 1, 6], ["FU", 3, [0, 1, 2]], ["SP", 3, 0, 128, [4], 1], ["AN", 3, 1, 2], ["FFSP", 3, 0, [3, 2, 1], 1, 1], ["AN", 3, 1, 6], ["PR", 6, 0, "auto_unroll_max_step$64"]]]], "r": [[0.00637383], 0, 3.25949, 1678568672], "v": "v0.6"}
{"i": [["[\"tw_kernel\", 1024, 1024, 409, 64, 16, \"float32\"]", "cuda -keys=cuda,gpu -arch=sm_70 -max_num_threads=1024 -model=unknown -thread_warp_size=32", [-1, 16, 64, 49152, 2147483647, 1024, 8, 32], "", 0, ["mask_k"]], [[], [["CHW", 4, "local"], ["SP", 4, 0, 16, [1, 4, 2, 2], 1], ["SP", 4, 5, 64, [1, 8, 2, 1], 1], ["SP", 4, 10, 1024, [1, 2, 16, 2], 1], ["SP", 4, 15, 409, [1, 1], 1], ["RE", 4, [0, 5, 10, 1, 6, 11, 2, 7, 12, 15, 16, 3, 8, 13, 17, 4, 9, 14]], ["FSP", 5, 0, 1, 3], ["FSP", 5, 4, 2, 3], ["FSP", 5, 8, 3, 3], ["RE", 5, [0, 4, 8, 1, 5, 9, 2, 6, 10, 3, 7, 11]], ["CA", 4, 5, 8], ["CHR", 3, "shared", [4]], ["CA", 4, 5, 9], ["CHR", 2, "shared", [5]], ["CA", 3, 6, 9], ["CI", 2], ["FU", 7, [0, 1, 2]], ["AN", 7, 0, 5], ["FU", 7, [1, 2, 3]], ["AN", 7, 1, 4], ["FU", 7, [2, 3, 4]], ["AN", 7, 2, 6], ["FU", 5, [0, 1, 2]], ["SP", 5, 0, 8, [1], 1], ["AN", 5, 1, 2], ["FFSP", 5, 0, [3, 2, 1], 1, 1], ["AN", 5, 1, 6], ["FU", 3, [0, 1, 2]], ["SP", 3, 0, 128, [1], 1], ["AN", 3, 1, 2], ["FFSP", 3, 0, [3, 2, 1], 1, 1], ["AN", 3, 1, 6], ["PR", 6, 0, "auto_unroll_max_step$0"]]]], "r": [[0.00083787], 0, 2.05755, 1678568673], "v": "v0.6"}
{"i": [["[\"tw_kernel\", 1024, 1024, 409, 64, 16, \"float32\"]", "cuda -keys=cuda,gpu -arch=sm_70 -max_num_threads=1024 -model=unknown -thread_warp_size=32", [-1, 16, 64, 49152, 2147483647, 1024, 8, 32], "", 0, ["mask_k"]], [[], [["CHW", 4, "local"], ["SP", 4, 0, 16, [2, 2, 2, 1], 1], ["SP", 4, 5, 64, [4, 1, 1, 4], 1], ["SP", 4, 10, 1024, [1, 16, 1, 4], 1], ["SP", 4, 15, 409, [1, 1], 1], ["RE", 4, [0, 5, 10, 1, 6, 11, 2, 7, 12, 15, 16, 3, 8, 13, 17, 4, 9, 14]], ["FSP", 5, 0, 1, 3], ["FSP", 5, 4, 2, 3], ["FSP", 5, 8, 3, 3], ["RE", 5, [0, 4, 8, 1, 5, 9, 2, 6, 10, 3, 7, 11]], ["CA", 4, 5, 8], ["CHR", 3, "shared", [4]], ["CA", 4, 5, 9], ["CHR", 2, "shared", [5]], ["CA", 3, 6, 9], ["CI", 2], ["FU", 7, [0, 1, 2]], ["AN", 7, 0, 5], ["FU", 7, [1, 2, 3]], ["AN", 7, 1, 4], ["FU", 7, [2, 3, 4]], ["AN", 7, 2, 6], ["FU", 5, [0, 1, 2]], ["SP", 5, 0, 8, [2], 1], ["AN", 5, 1, 2], ["FFSP", 5, 0, [3, 2, 1], 1, 1], ["AN", 5, 1, 6], ["FU", 3, [0, 1, 2]], ["SP", 3, 0, 8, [1], 1], ["AN", 3, 1, 2], ["FFSP", 3, 0, [3, 2, 1], 1, 1], ["AN", 3, 1, 6], ["PR", 6, 0, "auto_unroll_max_step$16"]]]], "r": [[0.000678143], 0, 1.94136, 1678568673], "v": "v0.6"}
{"i": [["[\"tw_kernel\", 1024, 1024, 409, 64, 16, \"float32\"]", "cuda -keys=cuda,gpu -arch=sm_70 -max_num_threads=1024 -model=unknown -thread_warp_size=32", [-1, 16, 64, 49152, 2147483647, 1024, 8, 32], "", 0, ["mask_k"]], [[], [["CHW", 4, "local"], ["SP", 4, 0, 16, [1, 2, 8, 1], 1], ["SP", 4, 5, 64, [1, 16, 4, 1], 1], ["SP", 4, 10, 1024, [4, 8, 1, 2], 1], ["SP", 4, 15, 409, [1, 1], 1], ["RE", 4, [0, 5, 10, 1, 6, 11, 2, 7, 12, 15, 16, 3, 8, 13, 17, 4, 9, 14]], ["FSP", 5, 0, 1, 3], ["FSP", 5, 4, 2, 3], ["FSP", 5, 8, 3, 3], ["RE", 5, [0, 4, 8, 1, 5, 9, 2, 6, 10, 3, 7, 11]], ["CA", 4, 5, 8], ["CHR", 3, "shared", [4]], ["CA", 4, 5, 9], ["CHR", 2, "shared", [5]], ["CA", 3, 6, 9], ["CI", 2], ["FU", 7, [0, 1, 2]], ["AN", 7, 0, 5], ["FU", 7, [1, 2, 3]], ["AN", 7, 1, 4], ["FU", 7, [2, 3, 4]], ["AN", 7, 2, 6], ["FU", 5, [0, 1, 2]], ["SP", 5, 0, 32, [1], 1], ["AN", 5, 1, 2], ["FFSP", 5, 0, [3, 2, 1], 1, 1], ["AN", 5, 1, 6], ["FU", 3, [0, 1, 2]], ["SP", 3, 0, 16, [1], 1], ["AN", 3, 1, 2], ["FFSP", 3, 0, [3, 2, 1], 1, 1], ["AN", 3, 1, 6], ["PR", 6, 0, "auto_unroll_max_step$64"]]]], "r": [[0.00112643], 0, 1.48717, 1678568673], "v": "v0.6"}
{"i": [["[\"tw_kernel\", 1024, 1024, 409, 64, 16, \"float32\"]", "cuda -keys=cuda,gpu -arch=sm_70 -max_num_threads=1024 -model=unknown -thread_warp_size=32", [-1, 16, 64, 49152, 2147483647, 1024, 8, 32], "", 0, ["mask_k"]], [[], [["CHW", 4, "local"], ["SP", 4, 0, 16, [1, 16, 1, 1], 1], ["SP", 4, 5, 64, [1, 4, 2, 1], 1], ["SP", 4, 10, 1024, [4, 1, 8, 16], 1], ["SP", 4, 15, 409, [1, 1], 1], ["RE", 4, [0, 5, 10, 1, 6, 11, 2, 7, 12, 15, 16, 3, 8, 13, 17, 4, 9, 14]], ["FSP", 5, 0, 1, 3], ["FSP", 5, 4, 2, 3], ["FSP", 5, 8, 3, 3], ["RE", 5, [0, 4, 8, 1, 5, 9, 2, 6, 10, 3, 7, 11]], ["CA", 4, 5, 8], ["CHR", 3, "shared", [4]], ["CA", 4, 5, 9], ["CHR", 2, "shared", [5]], ["CA", 3, 6, 9], ["CI", 2], ["FU", 7, [0, 1, 2]], ["AN", 7, 0, 5], ["FU", 7, [1, 2, 3]], ["AN", 7, 1, 4], ["FU", 7, [2, 3, 4]], ["AN", 7, 2, 6], ["FU", 5, [0, 1, 2]], ["SP", 5, 0, 2, [1], 1], ["AN", 5, 1, 2], ["FFSP", 5, 0, [3, 2, 1], 1, 1], ["AN", 5, 1, 6], ["FU", 3, [0, 1, 2]], ["SP", 3, 0, 128, [4], 1], ["AN", 3, 1, 2], ["FFSP", 3, 0, [3, 2, 1], 1, 1], ["AN", 3, 1, 6], ["PR", 6, 0, "auto_unroll_max_step$16"]]]], "r": [[0.0076421], 0, 2.8625, 1678568674], "v": "v0.6"}
{"i": [["[\"tw_kernel\", 1024, 1024, 409, 64, 16, \"float32\"]", "cuda -keys=cuda,gpu -arch=sm_70 -max_num_threads=1024 -model=unknown -thread_warp_size=32", [-1, 16, 64, 49152, 2147483647, 1024, 8, 32], "", 0, ["mask_k"]], [[], [["CHW", 4, "local"], ["SP", 4, 0, 16, [1, 1, 1, 1], 1], ["SP", 4, 5, 64, [8, 8, 1, 1], 1], ["SP", 4, 10, 1024, [1, 2, 1, 32], 1], ["SP", 4, 15, 409, [1, 1], 1], ["RE", 4, [0, 5, 10, 1, 6, 11, 2, 7, 12, 15, 16, 3, 8, 13, 17, 4, 9, 14]], ["FSP", 5, 0, 1, 3], ["FSP", 5, 4, 2, 3], ["FSP", 5, 8, 3, 3], ["RE", 5, [0, 4, 8, 1, 5, 9, 2, 6, 10, 3, 7, 11]], ["CA", 4, 5, 8], ["CHR", 3, "shared", [4]], ["CA", 4, 5, 9], ["CHR", 2, "shared", [5]], ["CA", 3, 6, 9], ["CI", 2], ["FU", 7, [0, 1, 2]], ["AN", 7, 0, 5], ["FU", 7, [1, 2, 3]], ["AN", 7, 1, 4], ["FU", 7, [2, 3, 4]], ["AN", 7, 2, 6], ["FU", 5, [0, 1, 2]], ["SP", 5, 0, 1, [1], 1], ["AN", 5, 1, 2], ["FFSP", 5, 0, [3, 2, 1], 1, 1], ["AN", 5, 1, 6], ["FU", 3, [0, 1, 2]], ["SP", 3, 0, 64, [1], 1], ["AN", 3, 1, 2], ["FFSP", 3, 0, [3, 2, 1], 1, 1], ["AN", 3, 1, 6], ["PR", 6, 0, "auto_unroll_max_step$64"]]]], "r": [[0.000594098], 0, 1.25188, 1678568674], "v": "v0.6"}
{"i": [["[\"tw_kernel\", 1024, 1024, 409, 64, 16, \"float32\"]", "cuda -keys=cuda,gpu -arch=sm_70 -max_num_threads=1024 -model=unknown -thread_warp_size=32", [-1, 16, 64, 49152, 2147483647, 1024, 8, 32], "", 0, ["mask_k"]], [[], [["CHW", 4, "local"], ["SP", 4, 0, 16, [1, 1, 2, 1], 1], ["SP", 4, 5, 64, [1, 1, 8, 2], 1], ["SP", 4, 10, 1024, [1, 64, 2, 4], 1], ["SP", 4, 15, 409, [1, 1], 1], ["RE", 4, [0, 5, 10, 1, 6, 11, 2, 7, 12, 15, 16, 3, 8, 13, 17, 4, 9, 14]], ["FSP", 5, 0, 1, 3], ["FSP", 5, 4, 2, 3], ["FSP", 5, 8, 3, 3], ["RE", 5, [0, 4, 8, 1, 5, 9, 2, 6, 10, 3, 7, 11]], ["CA", 4, 5, 8], ["CHR", 3, "shared", [4]], ["CA", 4, 5, 9], ["CHR", 2, "shared", [5]], ["CA", 3, 6, 9], ["CI", 2], ["FU", 7, [0, 1, 2]], ["AN", 7, 0, 5], ["FU", 7, [1, 2, 3]], ["AN", 7, 1, 4], ["FU", 7, [2, 3, 4]], ["AN", 7, 2, 6], ["FU", 5, [0, 1, 2]], ["SP", 5, 0, 4, [4], 1], ["AN", 5, 1, 2], ["FFSP", 5, 0, [3, 2, 1], 1, 1], ["AN", 5, 1, 6], ["FU", 3, [0, 1, 2]], ["SP", 3, 0, 16, [1], 1], ["AN", 3, 1, 2], ["FFSP", 3, 0, [3, 2, 1], 1, 1], ["AN", 3, 1, 6], ["PR", 6, 0, "auto_unroll_max_step$16"]]]], "r": [[0.000665203], 0, 1.29805, 1678568674], "v": "v0.6"}
{"i": [["[\"tw_kernel\", 1024, 1024, 409, 64, 16, \"float32\"]", "cuda -keys=cuda,gpu -arch=sm_70 -max_num_threads=1024 -model=unknown -thread_warp_size=32", [-1, 16, 64, 49152, 2147483647, 1024, 8, 32], "", 0, ["mask_k"]], [[], [["CHW", 4, "local"], ["SP", 4, 0, 16, [2, 4, 1, 1], 1], ["SP", 4, 5, 64, [2, 2, 4, 1], 1], ["SP", 4, 10, 1024, [1, 2, 2, 32], 1], ["SP", 4, 15, 409, [1, 1], 1], ["RE", 4, [0, 5, 10, 1, 6, 11, 2, 7, 12, 15, 16, 3, 8, 13, 17, 4, 9, 14]], ["FSP", 5, 0, 1, 3], ["FSP", 5, 4, 2, 3], ["FSP", 5, 8, 3, 3], ["RE", 5, [0, 4, 8, 1, 5, 9, 2, 6, 10, 3, 7, 11]], ["CA", 4, 5, 8], ["CHR", 3, "shared", [4]], ["CA", 4, 5, 9], ["CHR", 2, "shared", [5]], ["CA", 3, 6, 9], ["CI", 2], ["FU", 7, [0, 1, 2]], ["AN", 7, 0, 5], ["FU", 7, [1, 2, 3]], ["AN", 7, 1, 4], ["FU", 7, [2, 3, 4]], ["AN", 7, 2, 6], ["FU", 5, [0, 1, 2]], ["SP", 5, 0, 4, [4], 1], ["AN", 5, 1, 2], ["FFSP", 5, 0, [3, 2, 1], 1, 1], ["AN", 5, 1, 6], ["FU", 3, [0, 1, 2]], ["SP", 3, 0, 64, [4], 1], ["AN", 3, 1, 2], ["FFSP", 3, 0, [3, 2, 1], 1, 1], ["AN", 3, 1, 6], ["PR", 6, 0, "auto_unroll_max_step$64"]]]], "r": [[0.0141708], 0, 2.99843, 1678568674], "v": "v0.6"}
{"i": [["[\"tw_kernel\", 1024, 1024, 409, 64, 16, \"float32\"]", "cuda -keys=cuda,gpu -arch=sm_70 -max_num_threads=1024 -model=unknown -thread_warp_size=32", [-1, 16, 64, 49152, 2147483647, 1024, 8, 32], "", 0, ["mask_k"]], [[], [["CHW", 4, "local"], ["SP", 4, 0, 16, [2, 1, 1, 1], 1], ["SP", 4, 5, 64, [1, 1, 64, 1], 1], ["SP", 4, 10, 1024, [1, 2, 4, 16], 1], ["SP", 4, 15, 409, [1, 1], 1], ["RE", 4, [0, 5, 10, 1, 6, 11, 2, 7, 12, 15, 16, 3, 8, 13, 17, 4, 9, 14]], ["FSP", 5, 0, 1, 3], ["FSP", 5, 4, 2, 3], ["FSP", 5, 8, 3, 3], ["RE", 5, [0, 4, 8, 1, 5, 9, 2, 6, 10, 3, 7, 11]], ["CA", 4, 5, 8], ["CHR", 3, "shared", [4]], ["CA", 4, 5, 9], ["CHR", 2, "shared", [5]], ["CA", 3, 6, 9], ["CI", 2], ["FU", 7, [0, 1, 2]], ["AN", 7, 0, 5], ["FU", 7, [1, 2, 3]], ["AN", 7, 1, 4], ["FU", 7, [2, 3, 4]], ["AN", 7, 2, 6], ["FU", 5, [0, 1, 2]], ["SP", 5, 0, 4, [4], 1], ["AN", 5, 1, 2], ["FFSP", 5, 0, [3, 2, 1], 1, 1], ["AN", 5, 1, 6], ["FU", 3, [0, 1, 2]], ["SP", 3, 0, 64, [1], 1], ["AN", 3, 1, 2], ["FFSP", 3, 0, [3, 2, 1], 1, 1], ["AN", 3, 1, 6], ["PR", 6, 0, "auto_unroll_max_step$512"]]]], "r": [[0.10403], 0, 4.16116, 1678568675], "v": "v0.6"}
{"i": [["[\"tw_kernel\", 1024, 1024, 409, 64, 16, \"float32\"]", "cuda -keys=cuda,gpu -arch=sm_70 -max_num_threads=1024 -model=unknown -thread_warp_size=32", [-1, 16, 64, 49152, 2147483647, 1024, 8, 32], "", 0, ["mask_k"]], [[], [["CHW", 4, "local"], ["SP", 4, 0, 16, [1, 1, 4, 1], 1], ["SP", 4, 5, 64, [2, 4, 1, 8], 1], ["SP", 4, 10, 1024, [2, 128, 2, 1], 1], ["SP", 4, 15, 409, [1, 1], 1], ["RE", 4, [0, 5, 10, 1, 6, 11, 2, 7, 12, 15, 16, 3, 8, 13, 17, 4, 9, 14]], ["FSP", 5, 0, 1, 3], ["FSP", 5, 4, 2, 3], ["FSP", 5, 8, 3, 3], ["RE", 5, [0, 4, 8, 1, 5, 9, 2, 6, 10, 3, 7, 11]], ["CA", 4, 5, 8], ["CHR", 3, "shared", [4]], ["CA", 4, 5, 9], ["CHR", 2, "shared", [5]], ["CA", 3, 6, 9], ["CI", 2], ["FU", 7, [0, 1, 2]], ["AN", 7, 0, 5], ["FU", 7, [1, 2, 3]], ["AN", 7, 1, 4], ["FU", 7, [2, 3, 4]], ["AN", 7, 2, 6], ["FU", 5, [0, 1, 2]], ["SP", 5, 0, 16, [1], 1], ["AN", 5, 1, 2], ["FFSP", 5, 0, [3, 2, 1], 1, 1], ["AN", 5, 1, 6], ["FU", 3, [0, 1, 2]], ["SP", 3, 0, 4, [2], 1], ["AN", 3, 1, 2], ["FFSP", 3, 0, [3, 2, 1], 1, 1], ["AN", 3, 1, 6], ["PR", 6, 0, "auto_unroll_max_step$16"]]]], "r": [[0.00888639], 0, 1.34405, 1678568675], "v": "v0.6"}
{"i": [["[\"tw_kernel\", 1024, 1024, 409, 64, 16, \"float32\"]", "cuda -keys=cuda,gpu -arch=sm_70 -max_num_threads=1024 -model=unknown -thread_warp_size=32", [-1, 16, 64, 49152, 2147483647, 1024, 8, 32], "", 0, ["mask_k"]], [[], [["CHW", 4, "local"], ["SP", 4, 0, 16, [8, 1, 1, 1], 1], ["SP", 4, 5, 64, [1, 2, 1, 1], 1], ["SP", 4, 10, 1024, [1, 64, 1, 1], 1], ["SP", 4, 15, 409, [1, 1], 1], ["RE", 4, [0, 5, 10, 1, 6, 11, 2, 7, 12, 15, 16, 3, 8, 13, 17, 4, 9, 14]], ["FSP", 5, 0, 1, 3], ["FSP", 5, 4, 2, 3], ["FSP", 5, 8, 3, 3], ["RE", 5, [0, 4, 8, 1, 5, 9, 2, 6, 10, 3, 7, 11]], ["CA", 4, 5, 8], ["CHR", 3, "shared", [4]], ["CA", 4, 5, 9], ["CHR", 2, "shared", [5]], ["CA", 3, 6, 9], ["CI", 2], ["FU", 7, [0, 1, 2]], ["AN", 7, 0, 5], ["FU", 7, [1, 2, 3]], ["AN", 7, 1, 4], ["FU", 7, [2, 3, 4]], ["AN", 7, 2, 6], ["FU", 5, [0, 1, 2]], ["SP", 5, 0, 1, [1], 1], ["AN", 5, 1, 2], ["FFSP", 5, 0, [3, 2, 1], 1, 1], ["AN", 5, 1, 6], ["FU", 3, [0, 1, 2]], ["SP", 3, 0, 2, [2], 1], ["AN", 3, 1, 2], ["FFSP", 3, 0, [3, 2, 1], 1, 1], ["AN", 3, 1, 6], ["PR", 6, 0, "auto_unroll_max_step$0"]]]], "r": [[0.000538485], 0, 0.888258, 1678568676], "v": "v0.6"}
{"i": [["[\"tw_kernel\", 1024, 1024, 409, 64, 16, \"float32\"]", "cuda -keys=cuda,gpu -arch=sm_70 -max_num_threads=1024 -model=unknown -thread_warp_size=32", [-1, 16, 64, 49152, 2147483647, 1024, 8, 32], "", 0, ["mask_k"]], [[], [["CHW", 4, "local"], ["SP", 4, 0, 16, [1, 4, 1, 1], 1], ["SP", 4, 5, 64, [1, 4, 4, 4], 1], ["SP", 4, 10, 1024, [4, 32, 8, 1], 1], ["SP", 4, 15, 409, [1, 1], 1], ["RE", 4, [0, 5, 10, 1, 6, 11, 2, 7, 12, 15, 16, 3, 8, 13, 17, 4, 9, 14]], ["FSP", 5, 0, 1, 3], ["FSP", 5, 4, 2, 3], ["FSP", 5, 8, 3, 3], ["RE", 5, [0, 4, 8, 1, 5, 9, 2, 6, 10, 3, 7, 11]], ["CA", 4, 5, 8], ["CHR", 3, "shared", [4]], ["CA", 4, 5, 9], ["CHR", 2, "shared", [5]], ["CA", 3, 6, 9], ["CI", 2], ["FU", 7, [0, 1, 2]], ["AN", 7, 0, 5], ["FU", 7, [1, 2, 3]], ["AN", 7, 1, 4], ["FU", 7, [2, 3, 4]], ["AN", 7, 2, 6], ["FU", 5, [0, 1, 2]], ["SP", 5, 0, 16, [1], 1], ["AN", 5, 1, 2], ["FFSP", 5, 0, [3, 2, 1], 1, 1], ["AN", 5, 1, 6], ["FU", 3, [0, 1, 2]], ["SP", 3, 0, 8, [1], 1], ["AN", 3, 1, 2], ["FFSP", 3, 0, [3, 2, 1], 1, 1], ["AN", 3, 1, 6], ["PR", 6, 0, "auto_unroll_max_step$64"]]]], "r": [[0.0154264], 0, 1.60555, 1678568676], "v": "v0.6"}
{"i": [["[\"tw_kernel\", 1024, 1024, 409, 64, 16, \"float32\"]", "cuda -keys=cuda,gpu -arch=sm_70 -max_num_threads=1024 -model=unknown -thread_warp_size=32", [-1, 16, 64, 49152, 2147483647, 1024, 8, 32], "", 0, ["mask_k"]], [[], [["CHW", 4, "local"], ["SP", 4, 0, 16, [8, 1, 1, 1], 1], ["SP", 4, 5, 64, [1, 2, 1, 1], 1], ["SP", 4, 10, 1024, [1, 32, 2, 1], 1], ["SP", 4, 15, 409, [1, 1], 1], ["RE", 4, [0, 5, 10, 1, 6, 11, 2, 7, 12, 15, 16, 3, 8, 13, 17, 4, 9, 14]], ["FSP", 5, 0, 1, 3], ["FSP", 5, 4, 2, 3], ["FSP", 5, 8, 3, 3], ["RE", 5, [0, 4, 8, 1, 5, 9, 2, 6, 10, 3, 7, 11]], ["CA", 4, 5, 8], ["CHR", 3, "shared", [4]], ["CA", 4, 5, 9], ["CHR", 2, "shared", [5]], ["CA", 3, 6, 9], ["CI", 2], ["FU", 7, [0, 1, 2]], ["AN", 7, 0, 5], ["FU", 7, [1, 2, 3]], ["AN", 7, 1, 4], ["FU", 7, [2, 3, 4]], ["AN", 7, 2, 6], ["FU", 5, [0, 1, 2]], ["SP", 5, 0, 1, [1], 1], ["AN", 5, 1, 2], ["FFSP", 5, 0, [3, 2, 1], 1, 1], ["AN", 5, 1, 6], ["FU", 3, [0, 1, 2]], ["SP", 3, 0, 2, [1], 1], ["AN", 3, 1, 2], ["FFSP", 3, 0, [3, 2, 1], 1, 1], ["AN", 3, 1, 6], ["PR", 6, 0, "auto_unroll_max_step$1024"]]]], "r": [[0.000535664], 0, 1.0077, 1678568676], "v": "v0.6"}
{"i": [["[\"tw_kernel\", 1024, 1024, 409, 64, 16, \"float32\"]", "cuda -keys=cuda,gpu -arch=sm_70 -max_num_threads=1024 -model=unknown -thread_warp_size=32", [-1, 16, 64, 49152, 2147483647, 1024, 8, 32], "", 0, ["mask_k"]], [[], [["CHW", 4, "local"], ["SP", 4, 0, 16, [1, 1, 8, 2], 1], ["SP", 4, 5, 64, [8, 2, 1, 4], 1], ["SP", 4, 10, 1024, [1, 64, 4, 1], 1], ["SP", 4, 15, 409, [1, 1], 1], ["RE", 4, [0, 5, 10, 1, 6, 11, 2, 7, 12, 15, 16, 3, 8, 13, 17, 4, 9, 14]], ["FSP", 5, 0, 1, 3], ["FSP", 5, 4, 2, 3], ["FSP", 5, 8, 3, 3], ["RE", 5, [0, 4, 8, 1, 5, 9, 2, 6, 10, 3, 7, 11]], ["CA", 4, 5, 8], ["CHR", 3, "shared", [4]], ["CA", 4, 5, 9], ["CHR", 2, "shared", [5]], ["CA", 3, 6, 9], ["CI", 2], ["FU", 7, [0, 1, 2]], ["AN", 7, 0, 5], ["FU", 7, [1, 2, 3]], ["AN", 7, 1, 4], ["FU", 7, [2, 3, 4]], ["AN", 7, 2, 6], ["FU", 5, [0, 1, 2]], ["SP", 5, 0, 16, [1], 1], ["AN", 5, 1, 2], ["FFSP", 5, 0, [3, 2, 1], 1, 1], ["AN", 5, 1, 6], ["FU", 3, [0, 1, 2]], ["SP", 3, 0, 16, [1], 1], ["AN", 3, 1, 2], ["FFSP", 3, 0, [3, 2, 1], 1, 1], ["AN", 3, 1, 6], ["PR", 6, 0, "auto_unroll_max_step$64"]]]], "r": [[0.0166687], 0, 2.8113, 1678568677], "v": "v0.6"}
{"i": [["[\"tw_kernel\", 1024, 1024, 409, 64, 16, \"float32\"]", "cuda -keys=cuda,gpu -arch=sm_70 -max_num_threads=1024 -model=unknown -thread_warp_size=32", [-1, 16, 64, 49152, 2147483647, 1024, 8, 32], "", 0, ["mask_k"]], [[], [["CHW", 4, "local"], ["SP", 4, 0, 16, [1, 1, 2, 8], 1], ["SP", 4, 5, 64, [4, 1, 4, 1], 1], ["SP", 4, 10, 1024, [1, 128, 2, 1], 1], ["SP", 4, 15, 409, [1, 1], 1], ["RE", 4, [0, 5, 10, 1, 6, 11, 2, 7, 12, 15, 16, 3, 8, 13, 17, 4, 9, 14]], ["FSP", 5, 0, 1, 3], ["FSP", 5, 4, 2, 3], ["FSP", 5, 8, 3, 3], ["RE", 5, [0, 4, 8, 1, 5, 9, 2, 6, 10, 3, 7, 11]], ["CA", 4, 5, 8], ["CHR", 3, "shared", [4]], ["CA", 4, 5, 9], ["CHR", 2, "shared", [5]], ["CA", 3, 6, 9], ["CI", 2], ["FU", 7, [0, 1, 2]], ["AN", 7, 0, 5], ["FU", 7, [1, 2, 3]], ["AN", 7, 1, 4], ["FU", 7, [2, 3, 4]], ["AN", 7, 2, 6], ["FU", 5, [0, 1, 2]], ["SP", 5, 0, 64, [4], 1], ["AN", 5, 1, 2], ["FFSP", 5, 0, [3, 2, 1], 1, 1], ["AN", 5, 1, 6], ["FU", 3, [0, 1, 2]], ["SP", 3, 0, 128, [1], 1], ["AN", 3, 1, 2], ["FFSP", 3, 0, [3, 2, 1], 1, 1], ["AN", 3, 1, 6], ["PR", 6, 0, "auto_unroll_max_step$64"]]]], "r": [[0.00467098], 0, 2.38093, 1678568677], "v": "v0.6"}
{"i": [["[\"tw_kernel\", 1024, 1024, 409, 64, 16, \"float32\"]", "cuda -keys=cuda,gpu -arch=sm_70 -max_num_threads=1024 -model=unknown -thread_warp_size=32", [-1, 16, 64, 49152, 2147483647, 1024, 8, 32], "", 0, ["mask_k"]], [[], [["CHW", 4, "local"], ["SP", 4, 0, 16, [2, 1, 1, 1], 1], ["SP", 4, 5, 64, [4, 4, 1, 1], 1], ["SP", 4, 10, 1024, [1, 4, 1, 4], 1], ["SP", 4, 15, 409, [1, 1], 1], ["RE", 4, [0, 5, 10, 1, 6, 11, 2, 7, 12, 15, 16, 3, 8, 13, 17, 4, 9, 14]], ["FSP", 5, 0, 1, 3], ["FSP", 5, 4, 2, 3], ["FSP", 5, 8, 3, 3], ["RE", 5, [0, 4, 8, 1, 5, 9, 2, 6, 10, 3, 7, 11]], ["CA", 4, 5, 8], ["CHR", 3, "shared", [4]], ["CA", 4, 5, 9], ["CHR", 2, "shared", [5]], ["CA", 3, 6, 9], ["CI", 2], ["FU", 7, [0, 1, 2]], ["AN", 7, 0, 5], ["FU", 7, [1, 2, 3]], ["AN", 7, 1, 4], ["FU", 7, [2, 3, 4]], ["AN", 7, 2, 6], ["FU", 5, [0, 1, 2]], ["SP", 5, 0, 1, [1], 1], ["AN", 5, 1, 2], ["FFSP", 5, 0, [3, 2, 1], 1, 1], ["AN", 5, 1, 6], ["FU", 3, [0, 1, 2]], ["SP", 3, 0, 4, [1], 1], ["AN", 3, 1, 2], ["FFSP", 3, 0, [3, 2, 1], 1, 1], ["AN", 3, 1, 6], ["PR", 6, 0, "auto_unroll_max_step$0"]]]], "r": [[0.000393347], 0, 1.01359, 1678568677], "v": "v0.6"}
{"i": [["[\"tw_kernel\", 1024, 1024, 409, 64, 16, \"float32\"]", "cuda -keys=cuda,gpu -arch=sm_70 -max_num_threads=1024 -model=unknown -thread_warp_size=32", [-1, 16, 64, 49152, 2147483647, 1024, 8, 32], "", 0, ["mask_k"]], [[], [["CHW", 4, "local"], ["SP", 4, 0, 16, [1, 1, 1, 4], 1], ["SP", 4, 5, 64, [1, 2, 4, 4], 1], ["SP", 4, 10, 1024, [2, 16, 2, 1], 1], ["SP", 4, 15, 409, [1, 1], 1], ["RE", 4, [0, 5, 10, 1, 6, 11, 2, 7, 12, 15, 16, 3, 8, 13, 17, 4, 9, 14]], ["FSP", 5, 0, 1, 3], ["FSP", 5, 4, 2, 3], ["FSP", 5, 8, 3, 3], ["RE", 5, [0, 4, 8, 1, 5, 9, 2, 6, 10, 3, 7, 11]], ["CA", 4, 5, 8], ["CHR", 3, "shared", [4]], ["CA", 4, 5, 9], ["CHR", 2, "shared", [5]], ["CA", 3, 6, 9], ["CI", 2], ["FU", 7, [0, 1, 2]], ["AN", 7, 0, 5], ["FU", 7, [1, 2, 3]], ["AN", 7, 1, 4], ["FU", 7, [2, 3, 4]], ["AN", 7, 2, 6], ["FU", 5, [0, 1, 2]], ["SP", 5, 0, 64, [1], 1], ["AN", 5, 1, 2], ["FFSP", 5, 0, [3, 2, 1], 1, 1], ["AN", 5, 1, 6], ["FU", 3, [0, 1, 2]], ["SP", 3, 0, 8, [1], 1], ["AN", 3, 1, 2], ["FFSP", 3, 0, [3, 2, 1], 1, 1], ["AN", 3, 1, 6], ["PR", 6, 0, "auto_unroll_max_step$64"]]]], "r": [[0.000672251], 0, 1.53705, 1678568677], "v": "v0.6"}
{"i": [["[\"tw_kernel\", 1024, 1024, 409, 64, 16, \"float32\"]", "cuda -keys=cuda,gpu -arch=sm_70 -max_num_threads=1024 -model=unknown -thread_warp_size=32", [-1, 16, 64, 49152, 2147483647, 1024, 8, 32], "", 0, ["mask_k"]], [[], [["CHW", 4, "local"], ["SP", 4, 0, 16, [1, 4, 1, 2], 1], ["SP", 4, 5, 64, [2, 1, 4, 8], 1], ["SP", 4, 10, 1024, [1, 64, 1, 1], 1], ["SP", 4, 15, 409, [1, 1], 1], ["RE", 4, [0, 5, 10, 1, 6, 11, 2, 7, 12, 15, 16, 3, 8, 13, 17, 4, 9, 14]], ["FSP", 5, 0, 1, 3], ["FSP", 5, 4, 2, 3], ["FSP", 5, 8, 3, 3], ["RE", 5, [0, 4, 8, 1, 5, 9, 2, 6, 10, 3, 7, 11]], ["CA", 4, 5, 8], ["CHR", 3, "shared", [4]], ["CA", 4, 5, 9], ["CHR", 2, "shared", [5]], ["CA", 3, 6, 9], ["CI", 2], ["FU", 7, [0, 1, 2]], ["AN", 7, 0, 5], ["FU", 7, [1, 2, 3]], ["AN", 7, 1, 4], ["FU", 7, [2, 3, 4]], ["AN", 7, 2, 6], ["FU", 5, [0, 1, 2]], ["SP", 5, 0, 16, [1], 1], ["AN", 5, 1, 2], ["FFSP", 5, 0, [3, 2, 1], 1, 1], ["AN", 5, 1, 6], ["FU", 3, [0, 1, 2]], ["SP", 3, 0, 2, [2], 1], ["AN", 3, 1, 2], ["FFSP", 3, 0, [3, 2, 1], 1, 1], ["AN", 3, 1, 6], ["PR", 6, 0, "auto_unroll_max_step$64"]]]], "r": [[0.000470847], 0, 1.04793, 1678568678], "v": "v0.6"}
{"i": [["[\"tw_kernel\", 1024, 1024, 409, 64, 16, \"float32\"]", "cuda -keys=cuda,gpu -arch=sm_70 -max_num_threads=1024 -model=unknown -thread_warp_size=32", [-1, 16, 64, 49152, 2147483647, 1024, 8, 32], "", 0, ["mask_k"]], [[], [["CHW", 4, "local"], ["SP", 4, 0, 16, [1, 2, 2, 1], 1], ["SP", 4, 5, 64, [2, 4, 1, 2], 1], ["SP", 4, 10, 1024, [1, 16, 1, 2], 1], ["SP", 4, 15, 409, [1, 1], 1], ["RE", 4, [0, 5, 10, 1, 6, 11, 2, 7, 12, 15, 16, 3, 8, 13, 17, 4, 9, 14]], ["FSP", 5, 0, 1, 3], ["FSP", 5, 4, 2, 3], ["FSP", 5, 8, 3, 3], ["RE", 5, [0, 4, 8, 1, 5, 9, 2, 6, 10, 3, 7, 11]], ["CA", 4, 5, 8], ["CHR", 3, "shared", [4]], ["CA", 4, 5, 9], ["CHR", 2, "shared", [5]], ["CA", 3, 6, 9], ["CI", 2], ["FU", 7, [0, 1, 2]], ["AN", 7, 0, 5], ["FU", 7, [1, 2, 3]], ["AN", 7, 1, 4], ["FU", 7, [2, 3, 4]], ["AN", 7, 2, 6], ["FU", 5, [0, 1, 2]], ["SP", 5, 0, 4, [1], 1], ["AN", 5, 1, 2], ["FFSP", 5, 0, [3, 2, 1], 1, 1], ["AN", 5, 1, 6], ["FU", 3, [0, 1, 2]], ["SP", 3, 0, 4, [1], 1], ["AN", 3, 1, 2], ["FFSP", 3, 0, [3, 2, 1], 1, 1], ["AN", 3, 1, 6], ["PR", 6, 0, "auto_unroll_max_step$512"]]]], "r": [[0.000245458], 0, 1.02081, 1678568678], "v": "v0.6"}
{"i": [["[\"tw_kernel\", 1024, 1024, 409, 64, 16, \"float32\"]", "cuda -keys=cuda,gpu -arch=sm_70 -max_num_threads=1024 -model=unknown -thread_warp_size=32", [-1, 16, 64, 49152, 2147483647, 1024, 8, 32], "", 0, ["mask_k"]], [[], [["CHW", 4, "local"], ["SP", 4, 0, 16, [1, 4, 1, 1], 1], ["SP", 4, 5, 64, [1, 2, 2, 4], 1], ["SP", 4, 10, 1024, [4, 32, 2, 2], 1], ["SP", 4, 15, 409, [1, 1], 1], ["RE", 4, [0, 5, 10, 1, 6, 11, 2, 7, 12, 15, 16, 3, 8, 13, 17, 4, 9, 14]], ["FSP", 5, 0, 1, 3], ["FSP", 5, 4, 2, 3], ["FSP", 5, 8, 3, 3], ["RE", 5, [0, 4, 8, 1, 5, 9, 2, 6, 10, 3, 7, 11]], ["CA", 4, 5, 8], ["CHR", 3, "shared", [4]], ["CA", 4, 5, 9], ["CHR", 2, "shared", [5]], ["CA", 3, 6, 9], ["CI", 2], ["FU", 7, [0, 1, 2]], ["AN", 7, 0, 5], ["FU", 7, [1, 2, 3]], ["AN", 7, 1, 4], ["FU", 7, [2, 3, 4]], ["AN", 7, 2, 6], ["FU", 5, [0, 1, 2]], ["SP", 5, 0, 16, [1], 1], ["AN", 5, 1, 2], ["FFSP", 5, 0, [3, 2, 1], 1, 1], ["AN", 5, 1, 6], ["FU", 3, [0, 1, 2]], ["SP", 3, 0, 4, [1], 1], ["AN", 3, 1, 2], ["FFSP", 3, 0, [3, 2, 1], 1, 1], ["AN", 3, 1, 6], ["PR", 6, 0, "auto_unroll_max_step$0"]]]], "r": [[0.000511894], 0, 1.16404, 1678568678], "v": "v0.6"}
{"i": [["[\"tw_kernel\", 1024, 1024, 409, 64, 16, \"float32\"]", "cuda -keys=cuda,gpu -arch=sm_70 -max_num_threads=1024 -model=unknown -thread_warp_size=32", [-1, 16, 64, 49152, 2147483647, 1024, 8, 32], "", 0, ["mask_k"]], [[], [["CHW", 4, "local"], ["SP", 4, 0, 16, [1, 2, 2, 1], 1], ["SP", 4, 5, 64, [4, 2, 1, 1], 1], ["SP", 4, 10, 1024, [2, 8, 1, 16], 1], ["SP", 4, 15, 409, [1, 1], 1], ["RE", 4, [0, 5, 10, 1, 6, 11, 2, 7, 12, 15, 16, 3, 8, 13, 17, 4, 9, 14]], ["FSP", 5, 0, 1, 3], ["FSP", 5, 4, 2, 3], ["FSP", 5, 8, 3, 3], ["RE", 5, [0, 4, 8, 1, 5, 9, 2, 6, 10, 3, 7, 11]], ["CA", 4, 5, 8], ["CHR", 3, "shared", [4]], ["CA", 4, 5, 9], ["CHR", 2, "shared", [5]], ["CA", 3, 6, 9], ["CI", 2], ["FU", 7, [0, 1, 2]], ["AN", 7, 0, 5], ["FU", 7, [1, 2, 3]], ["AN", 7, 1, 4], ["FU", 7, [2, 3, 4]], ["AN", 7, 2, 6], ["FU", 5, [0, 1, 2]], ["SP", 5, 0, 2, [1], 1], ["AN", 5, 1, 2], ["FFSP", 5, 0, [3, 2, 1], 1, 1], ["AN", 5, 1, 6], ["FU", 3, [0, 1, 2]], ["SP", 3, 0, 32, [4], 1], ["AN", 3, 1, 2], ["FFSP", 3, 0, [3, 2, 1], 1, 1], ["AN", 3, 1, 6], ["PR", 6, 0, "auto_unroll_max_step$0"]]]], "r": [[0.000811961], 0, 2.22329, 1678568699], "v": "v0.6"}
{"i": [["[\"tw_kernel\", 1024, 1024, 409, 64, 16, \"float32\"]", "cuda -keys=cuda,gpu -arch=sm_70 -max_num_threads=1024 -model=unknown -thread_warp_size=32", [-1, 16, 64, 49152, 2147483647, 1024, 8, 32], "", 0, ["mask_k"]], [[], [["CHW", 4, "local"], ["SP", 4, 0, 16, [1, 1, 8, 2], 1], ["SP", 4, 5, 64, [2, 1, 8, 1], 1], ["SP", 4, 10, 1024, [4, 128, 1, 1], 1], ["SP", 4, 15, 409, [1, 1], 1], ["RE", 4, [0, 5, 10, 1, 6, 11, 2, 7, 12, 15, 16, 3, 8, 13, 17, 4, 9, 14]], ["FSP", 5, 0, 1, 3], ["FSP", 5, 4, 2, 3], ["FSP", 5, 8, 3, 3], ["RE", 5, [0, 4, 8, 1, 5, 9, 2, 6, 10, 3, 7, 11]], ["CA", 4, 5, 8], ["CHR", 3, "shared", [4]], ["CA", 4, 5, 9], ["CHR", 2, "shared", [5]], ["CA", 3, 6, 9], ["CI", 2], ["FU", 7, [0, 1, 2]], ["AN", 7, 0, 5], ["FU", 7, [1, 2, 3]], ["AN", 7, 1, 4], ["FU", 7, [2, 3, 4]], ["AN", 7, 2, 6], ["FU", 5, [0, 1, 2]], ["SP", 5, 0, 32, [1], 1], ["AN", 5, 1, 2], ["FFSP", 5, 0, [3, 2, 1], 1, 1], ["AN", 5, 1, 6], ["FU", 3, [0, 1, 2]], ["SP", 3, 0, 4, [1], 1], ["AN", 3, 1, 2], ["FFSP", 3, 0, [3, 2, 1], 1, 1], ["AN", 3, 1, 6], ["PR", 6, 0, "auto_unroll_max_step$512"]]]], "r": [[0.00825598], 0, 4.23897, 1678568699], "v": "v0.6"}
{"i": [["[\"tw_kernel\", 1024, 1024, 409, 64, 16, \"float32\"]", "cuda -keys=cuda,gpu -arch=sm_70 -max_num_threads=1024 -model=unknown -thread_warp_size=32", [-1, 16, 64, 49152, 2147483647, 1024, 8, 32], "", 0, ["mask_k"]], [[], [["CHW", 4, "local"], ["SP", 4, 0, 16, [1, 1, 1, 16], 1], ["SP", 4, 5, 64, [1, 1, 1, 32], 1], ["SP", 4, 10, 1024, [1, 1, 32, 1], 1], ["SP", 4, 15, 409, [1, 1], 1], ["RE", 4, [0, 5, 10, 1, 6, 11, 2, 7, 12, 15, 16, 3, 8, 13, 17, 4, 9, 14]], ["FSP", 5, 0, 1, 3], ["FSP", 5, 4, 2, 3], ["FSP", 5, 8, 3, 3], ["RE", 5, [0, 4, 8, 1, 5, 9, 2, 6, 10, 3, 7, 11]], ["CA", 4, 5, 8], ["CHR", 3, "shared", [4]], ["CA", 4, 5, 9], ["CHR", 2, "shared", [5]], ["CA", 3, 6, 9], ["CI", 2], ["FU", 7, [0, 1, 2]], ["AN", 7, 0, 5], ["FU", 7, [1, 2, 3]], ["AN", 7, 1, 4], ["FU", 7, [2, 3, 4]], ["AN", 7, 2, 6], ["FU", 5, [0, 1, 2]], ["SP", 5, 0, 2, [1], 1], ["AN", 5, 1, 2], ["FFSP", 5, 0, [3, 2, 1], 1, 1], ["AN", 5, 1, 6], ["FU", 3, [0, 1, 2]], ["SP", 3, 0, 1, [1], 1], ["AN", 3, 1, 2], ["FFSP", 3, 0, [3, 2, 1], 1, 1], ["AN", 3, 1, 6], ["PR", 6, 0, "auto_unroll_max_step$64"]]]], "r": [[0.384788], 0, 5.44574, 1678568701], "v": "v0.6"}
{"i": [["[\"tw_kernel\", 1024, 1024, 409, 64, 16, \"float32\"]", "cuda -keys=cuda,gpu -arch=sm_70 -max_num_threads=1024 -model=unknown -thread_warp_size=32", [-1, 16, 64, 49152, 2147483647, 1024, 8, 32], "", 0, ["mask_k"]], [[], [["CHW", 4, "local"], ["SP", 4, 0, 16, [2, 4, 2, 1], 1], ["SP", 4, 5, 64, [1, 4, 4, 4], 1], ["SP", 4, 10, 1024, [1, 32, 1, 16], 1], ["SP", 4, 15, 409, [1, 1], 1], ["RE", 4, [0, 5, 10, 1, 6, 11, 2, 7, 12, 15, 16, 3, 8, 13, 17, 4, 9, 14]], ["FSP", 5, 0, 1, 3], ["FSP", 5, 4, 2, 3], ["FSP", 5, 8, 3, 3], ["RE", 5, [0, 4, 8, 1, 5, 9, 2, 6, 10, 3, 7, 11]], ["CA", 4, 5, 8], ["CHR", 3, "shared", [4]], ["CA", 4, 5, 9], ["CHR", 2, "shared", [5]], ["CA", 3, 6, 9], ["CI", 2], ["FU", 7, [0, 1, 2]], ["AN", 7, 0, 5], ["FU", 7, [1, 2, 3]], ["AN", 7, 1, 4], ["FU", 7, [2, 3, 4]], ["AN", 7, 2, 6], ["FU", 5, [0, 1, 2]], ["SP", 5, 0, 128, [1], 1], ["AN", 5, 1, 2], ["FFSP", 5, 0, [3, 2, 1], 1, 1], ["AN", 5, 1, 6], ["FU", 3, [0, 1, 2]], ["SP", 3, 0, 16, [1], 1], ["AN", 3, 1, 2], ["FFSP", 3, 0, [3, 2, 1], 1, 1], ["AN", 3, 1, 6], ["PR", 6, 0, "auto_unroll_max_step$1024"]]]], "r": [[0.0299142], 0, 7.96967, 1678568701], "v": "v0.6"}
{"i": [["[\"tw_kernel\", 1024, 1024, 409, 64, 16, \"float32\"]", "cuda -keys=cuda,gpu -arch=sm_70 -max_num_threads=1024 -model=unknown -thread_warp_size=32", [-1, 16, 64, 49152, 2147483647, 1024, 8, 32], "", 0, ["mask_k"]], [[], [["CHW", 4, "local"], ["SP", 4, 0, 16, [1, 2, 4, 2], 1], ["SP", 4, 5, 64, [4, 2, 4, 1], 1], ["SP", 4, 10, 1024, [1, 8, 1, 16], 1], ["SP", 4, 15, 409, [1, 1], 1], ["RE", 4, [0, 5, 10, 1, 6, 11, 2, 7, 12, 15, 16, 3, 8, 13, 17, 4, 9, 14]], ["FSP", 5, 0, 1, 3], ["FSP", 5, 4, 2, 3], ["FSP", 5, 8, 3, 3], ["RE", 5, [0, 4, 8, 1, 5, 9, 2, 6, 10, 3, 7, 11]], ["CA", 4, 5, 8], ["CHR", 3, "shared", [4]], ["CA", 4, 5, 9], ["CHR", 2, "shared", [5]], ["CA", 3, 6, 9], ["CI", 2], ["FU", 7, [0, 1, 2]], ["AN", 7, 0, 5], ["FU", 7, [1, 2, 3]], ["AN", 7, 1, 4], ["FU", 7, [2, 3, 4]], ["AN", 7, 2, 6], ["FU", 5, [0, 1, 2]], ["SP", 5, 0, 32, [1], 1], ["AN", 5, 1, 2], ["FFSP", 5, 0, [3, 2, 1], 1, 1], ["AN", 5, 1, 6], ["FU", 3, [0, 1, 2]], ["SP", 3, 0, 128, [1], 1], ["AN", 3, 1, 2], ["FFSP", 3, 0, [3, 2, 1], 1, 1], ["AN", 3, 1, 6], ["PR", 6, 0, "auto_unroll_max_step$16"]]]], "r": [[0.00767137], 0, 3.97082, 1678568702], "v": "v0.6"}
{"i": [["[\"tw_kernel\", 1024, 1024, 409, 64, 16, \"float32\"]", "cuda -keys=cuda,gpu -arch=sm_70 -max_num_threads=1024 -model=unknown -thread_warp_size=32", [-1, 16, 64, 49152, 2147483647, 1024, 8, 32], "", 0, ["mask_k"]], [[], [["CHW", 4, "local"], ["SP", 4, 0, 16, [1, 1, 1, 16], 1], ["SP", 4, 5, 64, [1, 16, 2, 2], 1], ["SP", 4, 10, 1024, [4, 2, 8, 8], 1], ["SP", 4, 15, 409, [1, 1], 1], ["RE", 4, [0, 5, 10, 1, 6, 11, 2, 7, 12, 15, 16, 3, 8, 13, 17, 4, 9, 14]], ["FSP", 5, 0, 1, 3], ["FSP", 5, 4, 2, 3], ["FSP", 5, 8, 3, 3], ["RE", 5, [0, 4, 8, 1, 5, 9, 2, 6, 10, 3, 7, 11]], ["CA", 4, 5, 8], ["CHR", 3, "shared", [4]], ["CA", 4, 5, 9], ["CHR", 2, "shared", [5]], ["CA", 3, 6, 9], ["CI", 2], ["FU", 7, [0, 1, 2]], ["AN", 7, 0, 5], ["FU", 7, [1, 2, 3]], ["AN", 7, 1, 4], ["FU", 7, [2, 3, 4]], ["AN", 7, 2, 6], ["FU", 5, [0, 1, 2]], ["SP", 5, 0, 8, [4], 1], ["AN", 5, 1, 2], ["FFSP", 5, 0, [3, 2, 1], 1, 1], ["AN", 5, 1, 6], ["FU", 3, [0, 1, 2]], ["SP", 3, 0, 128, [1], 1], ["AN", 3, 1, 2], ["FFSP", 3, 0, [3, 2, 1], 1, 1], ["AN", 3, 1, 6], ["PR", 6, 0, "auto_unroll_max_step$64"]]]], "r": [[0.0698657], 0, 5.23099, 1678568702], "v": "v0.6"}
{"i": [["[\"tw_kernel\", 1024, 1024, 409, 64, 16, \"float32\"]", "cuda -keys=cuda,gpu -arch=sm_70 -max_num_threads=1024 -model=unknown -thread_warp_size=32", [-1, 16, 64, 49152, 2147483647, 1024, 8, 32], "", 0, ["mask_k"]], [[], [["CHW", 4, "local"], ["SP", 4, 0, 16, [1, 4, 2, 2], 1], ["SP", 4, 5, 64, [1, 8, 2, 1], 1], ["SP", 4, 10, 1024, [1, 2, 16, 2], 1], ["SP", 4, 15, 409, [1, 1], 1], ["RE", 4, [0, 5, 10, 1, 6, 11, 2, 7, 12, 15, 16, 3, 8, 13, 17, 4, 9, 14]], ["FSP", 5, 0, 1, 3], ["FSP", 5, 4, 2, 3], ["FSP", 5, 8, 3, 3], ["RE", 5, [0, 4, 8, 1, 5, 9, 2, 6, 10, 3, 7, 11]], ["CA", 4, 5, 8], ["CHR", 3, "shared", [4]], ["CA", 4, 5, 9], ["CHR", 2, "shared", [5]], ["CA", 3, 6, 9], ["CI", 2], ["FU", 7, [0, 1, 2]], ["AN", 7, 0, 5], ["FU", 7, [1, 2, 3]], ["AN", 7, 1, 4], ["FU", 7, [2, 3, 4]], ["AN", 7, 2, 6], ["FU", 5, [0, 1, 2]], ["SP", 5, 0, 8, [4], 1], ["AN", 5, 1, 2], ["FFSP", 5, 0, [3, 2, 1], 1, 1], ["AN", 5, 1, 6], ["FU", 3, [0, 1, 2]], ["SP", 3, 0, 128, [4], 1], ["AN", 3, 1, 2], ["FFSP", 3, 0, [3, 2, 1], 1, 1], ["AN", 3, 1, 6], ["PR", 6, 0, "auto_unroll_max_step$1024"]]]], "r": [[0.000800405], 0, 2.45358, 1678568702], "v": "v0.6"}
{"i": [["[\"tw_kernel\", 1024, 1024, 409, 64, 16, \"float32\"]", "cuda -keys=cuda,gpu -arch=sm_70 -max_num_threads=1024 -model=unknown -thread_warp_size=32", [-1, 16, 64, 49152, 2147483647, 1024, 8, 32], "", 0, ["mask_k"]], [[], [["CHW", 4, "local"], ["SP", 4, 0, 16, [1, 2, 2, 1], 1], ["SP", 4, 5, 64, [1, 1, 4, 8], 1], ["SP", 4, 10, 1024, [4, 32, 2, 2], 1], ["SP", 4, 15, 409, [1, 1], 1], ["RE", 4, [0, 5, 10, 1, 6, 11, 2, 7, 12, 15, 16, 3, 8, 13, 17, 4, 9, 14]], ["FSP", 5, 0, 1, 3], ["FSP", 5, 4, 2, 3], ["FSP", 5, 8, 3, 3], ["RE", 5, [0, 4, 8, 1, 5, 9, 2, 6, 10, 3, 7, 11]], ["CA", 4, 5, 8], ["CHR", 3, "shared", [4]], ["CA", 4, 5, 9], ["CHR", 2, "shared", [5]], ["CA", 3, 6, 9], ["CI", 2], ["FU", 7, [0, 1, 2]], ["AN", 7, 0, 5], ["FU", 7, [1, 2, 3]], ["AN", 7, 1, 4], ["FU", 7, [2, 3, 4]], ["AN", 7, 2, 6], ["FU", 5, [0, 1, 2]], ["SP", 5, 0, 16, [1], 1], ["AN", 5, 1, 2], ["FFSP", 5, 0, [3, 2, 1], 1, 1], ["AN", 5, 1, 6], ["FU", 3, [0, 1, 2]], ["SP", 3, 0, 4, [1], 1], ["AN", 3, 1, 2], ["FFSP", 3, 0, [3, 2, 1], 1, 1], ["AN", 3, 1, 6], ["PR", 6, 0, "auto_unroll_max_step$64"]]]], "r": [[0.00716187], 0, 3.30022, 1678568702], "v": "v0.6"}
{"i": [["[\"tw_kernel\", 1024, 1024, 409, 64, 16, \"float32\"]", "cuda -keys=cuda,gpu -arch=sm_70 -max_num_threads=1024 -model=unknown -thread_warp_size=32", [-1, 16, 64, 49152, 2147483647, 1024, 8, 32], "", 0, ["mask_k"]], [[], [["CHW", 4, "local"], ["SP", 4, 0, 16, [1, 4, 1, 2], 1], ["SP", 4, 5, 64, [1, 8, 1, 8], 1], ["SP", 4, 10, 1024, [1, 16, 1, 1], 1], ["SP", 4, 15, 409, [1, 1], 1], ["RE", 4, [0, 5, 10, 1, 6, 11, 2, 7, 12, 15, 16, 3, 8, 13, 17, 4, 9, 14]], ["FSP", 5, 0, 1, 3], ["FSP", 5, 4, 2, 3], ["FSP", 5, 8, 3, 3], ["RE", 5, [0, 4, 8, 1, 5, 9, 2, 6, 10, 3, 7, 11]], ["CA", 4, 5, 8], ["CHR", 3, "shared", [4]], ["CA", 4, 5, 9], ["CHR", 2, "shared", [5]], ["CA", 3, 6, 9], ["CI", 2], ["FU", 7, [0, 1, 2]], ["AN", 7, 0, 5], ["FU", 7, [1, 2, 3]], ["AN", 7, 1, 4], ["FU", 7, [2, 3, 4]], ["AN", 7, 2, 6], ["FU", 5, [0, 1, 2]], ["SP", 5, 0, 16, [1], 1], ["AN", 5, 1, 2], ["FFSP", 5, 0, [3, 2, 1], 1, 1], ["AN", 5, 1, 6], ["FU", 3, [0, 1, 2]], ["SP", 3, 0, 2, [1], 1], ["AN", 3, 1, 2], ["FFSP", 3, 0, [3, 2, 1], 1, 1], ["AN", 3, 1, 6], ["PR", 6, 0, "auto_unroll_max_step$0"]]]], "r": [[0.000483435], 0, 1.08446, 1678568703], "v": "v0.6"}
{"i": [["[\"tw_kernel\", 1024, 1024, 409, 64, 16, \"float32\"]", "cuda -keys=cuda,gpu -arch=sm_70 -max_num_threads=1024 -model=unknown -thread_warp_size=32", [-1, 16, 64, 49152, 2147483647, 1024, 8, 32], "", 0, ["mask_k"]], [[], [["CHW", 4, "local"], ["SP", 4, 0, 16, [8, 1, 1, 1], 1], ["SP", 4, 5, 64, [1, 4, 2, 2], 1], ["SP", 4, 10, 1024, [1, 1, 4, 8], 1], ["SP", 4, 15, 409, [1, 1], 1], ["RE", 4, [0, 5, 10, 1, 6, 11, 2, 7, 12, 15, 16, 3, 8, 13, 17, 4, 9, 14]], ["FSP", 5, 0, 1, 3], ["FSP", 5, 4, 2, 3], ["FSP", 5, 8, 3, 3], ["RE", 5, [0, 4, 8, 1, 5, 9, 2, 6, 10, 3, 7, 11]], ["CA", 4, 5, 8], ["CHR", 3, "shared", [4]], ["CA", 4, 5, 9], ["CHR", 2, "shared", [5]], ["CA", 3, 6, 9], ["CI", 2], ["FU", 7, [0, 1, 2]], ["AN", 7, 0, 5], ["FU", 7, [1, 2, 3]], ["AN", 7, 1, 4], ["FU", 7, [2, 3, 4]], ["AN", 7, 2, 6], ["FU", 5, [0, 1, 2]], ["SP", 5, 0, 4, [1], 1], ["AN", 5, 1, 2], ["FFSP", 5, 0, [3, 2, 1], 1, 1], ["AN", 5, 1, 6], ["FU", 3, [0, 1, 2]], ["SP", 3, 0, 8, [2], 1], ["AN", 3, 1, 2], ["FFSP", 3, 0, [3, 2, 1], 1, 1], ["AN", 3, 1, 6], ["PR", 6, 0, "auto_unroll_max_step$0"]]]], "r": [[0.0285812], 0, 3.79412, 1678568703], "v": "v0.6"}
{"i": [["[\"tw_kernel\", 1024, 1024, 409, 64, 16, \"float32\"]", "cuda -keys=cuda,gpu -arch=sm_70 -max_num_threads=1024 -model=unknown -thread_warp_size=32", [-1, 16, 64, 49152, 2147483647, 1024, 8, 32], "", 0, ["mask_k"]], [[], [["CHW", 4, "local"], ["SP", 4, 0, 16, [2, 4, 1, 2], 1], ["SP", 4, 5, 64, [1, 8, 2, 1], 1], ["SP", 4, 10, 1024, [1, 2, 16, 2], 1], ["SP", 4, 15, 409, [1, 1], 1], ["RE", 4, [0, 5, 10, 1, 6, 11, 2, 7, 12, 15, 16, 3, 8, 13, 17, 4, 9, 14]], ["FSP", 5, 0, 1, 3], ["FSP", 5, 4, 2, 3], ["FSP", 5, 8, 3, 3], ["RE", 5, [0, 4, 8, 1, 5, 9, 2, 6, 10, 3, 7, 11]], ["CA", 4, 5, 8], ["CHR", 3, "shared", [4]], ["CA", 4, 5, 9], ["CHR", 2, "shared", [5]], ["CA", 3, 6, 9], ["CI", 2], ["FU", 7, [0, 1, 2]], ["AN", 7, 0, 5], ["FU", 7, [1, 2, 3]], ["AN", 7, 1, 4], ["FU", 7, [2, 3, 4]], ["AN", 7, 2, 6], ["FU", 5, [0, 1, 2]], ["SP", 5, 0, 8, [1], 1], ["AN", 5, 1, 2], ["FFSP", 5, 0, [3, 2, 1], 1, 1], ["AN", 5, 1, 6], ["FU", 3, [0, 1, 2]], ["SP", 3, 0, 128, [1], 1], ["AN", 3, 1, 2], ["FFSP", 3, 0, [3, 2, 1], 1, 1], ["AN", 3, 1, 6], ["PR", 6, 0, "auto_unroll_max_step$16"]]]], "r": [[0.000894725], 0, 1.6177, 1678568703], "v": "v0.6"}
{"i": [["[\"tw_kernel\", 1024, 1024, 409, 64, 16, \"float32\"]", "cuda -keys=cuda,gpu -arch=sm_70 -max_num_threads=1024 -model=unknown -thread_warp_size=32", [-1, 16, 64, 49152, 2147483647, 1024, 8, 32], "", 0, ["mask_k"]], [[], [["CHW", 4, "local"], ["SP", 4, 0, 16, [1, 4, 1, 4], 1], ["SP", 4, 5, 64, [1, 1, 4, 8], 1], ["SP", 4, 10, 1024, [4, 32, 2, 2], 1], ["SP", 4, 15, 409, [1, 1], 1], ["RE", 4, [0, 5, 10, 1, 6, 11, 2, 7, 12, 15, 16, 3, 8, 13, 17, 4, 9, 14]], ["FSP", 5, 0, 1, 3], ["FSP", 5, 4, 2, 3], ["FSP", 5, 8, 3, 3], ["RE", 5, [0, 4, 8, 1, 5, 9, 2, 6, 10, 3, 7, 11]], ["CA", 4, 5, 8], ["CHR", 3, "shared", [4]], ["CA", 4, 5, 9], ["CHR", 2, "shared", [5]], ["CA", 3, 6, 9], ["CI", 2], ["FU", 7, [0, 1, 2]], ["AN", 7, 0, 5], ["FU", 7, [1, 2, 3]], ["AN", 7, 1, 4], ["FU", 7, [2, 3, 4]], ["AN", 7, 2, 6], ["FU", 5, [0, 1, 2]], ["SP", 5, 0, 16, [1], 1], ["AN", 5, 1, 2], ["FFSP", 5, 0, [3, 2, 1], 1, 1], ["AN", 5, 1, 6], ["FU", 3, [0, 1, 2]], ["SP", 3, 0, 4, [1], 1], ["AN", 3, 1, 2], ["FFSP", 3, 0, [3, 2, 1], 1, 1], ["AN", 3, 1, 6], ["PR", 6, 0, "auto_unroll_max_step$0"]]]], "r": [[0.0183582], 0, 2.85924, 1678568704], "v": "v0.6"}
{"i": [["[\"tw_kernel\", 1024, 1024, 409, 64, 16, \"float32\"]", "cuda -keys=cuda,gpu -arch=sm_70 -max_num_threads=1024 -model=unknown -thread_warp_size=32", [-1, 16, 64, 49152, 2147483647, 1024, 8, 32], "", 0, ["mask_k"]], [[], [["CHW", 4, "local"], ["SP", 4, 0, 16, [1, 8, 2, 1], 1], ["SP", 4, 5, 64, [4, 2, 1, 1], 1], ["SP", 4, 10, 1024, [2, 8, 1, 16], 1], ["SP", 4, 15, 409, [1, 1], 1], ["RE", 4, [0, 5, 10, 1, 6, 11, 2, 7, 12, 15, 16, 3, 8, 13, 17, 4, 9, 14]], ["FSP", 5, 0, 1, 3], ["FSP", 5, 4, 2, 3], ["FSP", 5, 8, 3, 3], ["RE", 5, [0, 4, 8, 1, 5, 9, 2, 6, 10, 3, 7, 11]], ["CA", 4, 5, 8], ["CHR", 3, "shared", [4]], ["CA", 4, 5, 9], ["CHR", 2, "shared", [5]], ["CA", 3, 6, 9], ["CI", 2], ["FU", 7, [0, 1, 2]], ["AN", 7, 0, 5], ["FU", 7, [1, 2, 3]], ["AN", 7, 1, 4], ["FU", 7, [2, 3, 4]], ["AN", 7, 2, 6], ["FU", 5, [0, 1, 2]], ["SP", 5, 0, 2, [1], 1], ["AN", 5, 1, 2], ["FFSP", 5, 0, [3, 2, 1], 1, 1], ["AN", 5, 1, 6], ["FU", 3, [0, 1, 2]], ["SP", 3, 0, 32, [4], 1], ["AN", 3, 1, 2], ["FFSP", 3, 0, [3, 2, 1], 1, 1], ["AN", 3, 1, 6], ["PR", 6, 0, "auto_unroll_max_step$16"]]]], "r": [[0.00110378], 0, 1.43297, 1678568704], "v": "v0.6"}
{"i": [["[\"tw_kernel\", 1024, 1024, 409, 64, 16, \"float32\"]", "cuda -keys=cuda,gpu -arch=sm_70 -max_num_threads=1024 -model=unknown -thread_warp_size=32", [-1, 16, 64, 49152, 2147483647, 1024, 8, 32], "", 0, ["mask_k"]], [[], [["CHW", 4, "local"], ["SP", 4, 0, 16, [8, 1, 1, 1], 1], ["SP", 4, 5, 64, [1, 1, 2, 2], 1], ["SP", 4, 10, 1024, [1, 8, 1, 8], 1], ["SP", 4, 15, 409, [1, 1], 1], ["RE", 4, [0, 5, 10, 1, 6, 11, 2, 7, 12, 15, 16, 3, 8, 13, 17, 4, 9, 14]], ["FSP", 5, 0, 1, 3], ["FSP", 5, 4, 2, 3], ["FSP", 5, 8, 3, 3], ["RE", 5, [0, 4, 8, 1, 5, 9, 2, 6, 10, 3, 7, 11]], ["CA", 4, 5, 8], ["CHR", 3, "shared", [4]], ["CA", 4, 5, 9], ["CHR", 2, "shared", [5]], ["CA", 3, 6, 9], ["CI", 2], ["FU", 7, [0, 1, 2]], ["AN", 7, 0, 5], ["FU", 7, [1, 2, 3]], ["AN", 7, 1, 4], ["FU", 7, [2, 3, 4]], ["AN", 7, 2, 6], ["FU", 5, [0, 1, 2]], ["SP", 5, 0, 4, [1], 1], ["AN", 5, 1, 2], ["FFSP", 5, 0, [3, 2, 1], 1, 1], ["AN", 5, 1, 6], ["FU", 3, [0, 1, 2]], ["SP", 3, 0, 8, [1], 1], ["AN", 3, 1, 2], ["FFSP", 3, 0, [3, 2, 1], 1, 1], ["AN", 3, 1, 6], ["PR", 6, 0, "auto_unroll_max_step$64"]]]], "r": [[0.00108453], 0, 2.10315, 1678568704], "v": "v0.6"}
{"i": [["[\"tw_kernel\", 1024, 1024, 409, 64, 16, \"float32\"]", "cuda -keys=cuda,gpu -arch=sm_70 -max_num_threads=1024 -model=unknown -thread_warp_size=32", [-1, 16, 64, 49152, 2147483647, 1024, 8, 32], "", 0, ["mask_k"]], [[], [["CHW", 4, "local"], ["SP", 4, 0, 16, [1, 1, 2, 1], 1], ["SP", 4, 5, 64, [1, 2, 8, 1], 1], ["SP", 4, 10, 1024, [2, 64, 1, 2], 1], ["SP", 4, 15, 409, [1, 1], 1], ["RE", 4, [0, 5, 10, 1, 6, 11, 2, 7, 12, 15, 16, 3, 8, 13, 17, 4, 9, 14]], ["FSP", 5, 0, 1, 3], ["FSP", 5, 4, 2, 3], ["FSP", 5, 8, 3, 3], ["RE", 5, [0, 4, 8, 1, 5, 9, 2, 6, 10, 3, 7, 11]], ["CA", 4, 5, 8], ["CHR", 3, "shared", [4]], ["CA", 4, 5, 9], ["CHR", 2, "shared", [5]], ["CA", 3, 6, 9], ["CI", 2], ["FU", 7, [0, 1, 2]], ["AN", 7, 0, 5], ["FU", 7, [1, 2, 3]], ["AN", 7, 1, 4], ["FU", 7, [2, 3, 4]], ["AN", 7, 2, 6], ["FU", 5, [0, 1, 2]], ["SP", 5, 0, 128, [1], 1], ["AN", 5, 1, 2], ["FFSP", 5, 0, [3, 2, 1], 1, 1], ["AN", 5, 1, 6], ["FU", 3, [0, 1, 2]], ["SP", 3, 0, 32, [1], 1], ["AN", 3, 1, 2], ["FFSP", 3, 0, [3, 2, 1], 1, 1], ["AN", 3, 1, 6], ["PR", 6, 0, "auto_unroll_max_step$0"]]]], "r": [[0.000256751], 0, 1.05805, 1678568705], "v": "v0.6"}
{"i": [["[\"tw_kernel\", 1024, 1024, 409, 64, 16, \"float32\"]", "cuda -keys=cuda,gpu -arch=sm_70 -max_num_threads=1024 -model=unknown -thread_warp_size=32", [-1, 16, 64, 49152, 2147483647, 1024, 8, 32], "", 0, ["mask_k"]], [[], [["CHW", 4, "local"], ["SP", 4, 0, 16, [1, 2, 1, 2], 1], ["SP", 4, 5, 64, [1, 2, 4, 8], 1], ["SP", 4, 10, 1024, [2, 16, 4, 2], 1], ["SP", 4, 15, 409, [1, 1], 1], ["RE", 4, [0, 5, 10, 1, 6, 11, 2, 7, 12, 15, 16, 3, 8, 13, 17, 4, 9, 14]], ["FSP", 5, 0, 1, 3], ["FSP", 5, 4, 2, 3], ["FSP", 5, 8, 3, 3], ["RE", 5, [0, 4, 8, 1, 5, 9, 2, 6, 10, 3, 7, 11]], ["CA", 4, 5, 8], ["CHR", 3, "shared", [4]], ["CA", 4, 5, 9], ["CHR", 2, "shared", [5]], ["CA", 3, 6, 9], ["CI", 2], ["FU", 7, [0, 1, 2]], ["AN", 7, 0, 5], ["FU", 7, [1, 2, 3]], ["AN", 7, 1, 4], ["FU", 7, [2, 3, 4]], ["AN", 7, 2, 6], ["FU", 5, [0, 1, 2]], ["SP", 5, 0, 16, [1], 1], ["AN", 5, 1, 2], ["FFSP", 5, 0, [3, 2, 1], 1, 1], ["AN", 5, 1, 6], ["FU", 3, [0, 1, 2]], ["SP", 3, 0, 8, [1], 1], ["AN", 3, 1, 2], ["FFSP", 3, 0, [3, 2, 1], 1, 1], ["AN", 3, 1, 6], ["PR", 6, 0, "auto_unroll_max_step$16"]]]], "r": [[0.0142317], 0, 1.87204, 1678568705], "v": "v0.6"}
{"i": [["[\"tw_kernel\", 1024, 1024, 409, 64, 16, \"float32\"]", "cuda -keys=cuda,gpu -arch=sm_70 -max_num_threads=1024 -model=unknown -thread_warp_size=32", [-1, 16, 64, 49152, 2147483647, 1024, 8, 32], "", 0, ["mask_k"]], [[], [["CHW", 4, "local"], ["SP", 4, 0, 16, [1, 2, 2, 1], 1], ["SP", 4, 5, 64, [4, 1, 2, 8], 1], ["SP", 4, 10, 1024, [2, 128, 4, 1], 1], ["SP", 4, 15, 409, [1, 1], 1], ["RE", 4, [0, 5, 10, 1, 6, 11, 2, 7, 12, 15, 16, 3, 8, 13, 17, 4, 9, 14]], ["FSP", 5, 0, 1, 3], ["FSP", 5, 4, 2, 3], ["FSP", 5, 8, 3, 3], ["RE", 5, [0, 4, 8, 1, 5, 9, 2, 6, 10, 3, 7, 11]], ["CA", 4, 5, 8], ["CHR", 3, "shared", [4]], ["CA", 4, 5, 9], ["CHR", 2, "shared", [5]], ["CA", 3, 6, 9], ["CI", 2], ["FU", 7, [0, 1, 2]], ["AN", 7, 0, 5], ["FU", 7, [1, 2, 3]], ["AN", 7, 1, 4], ["FU", 7, [2, 3, 4]], ["AN", 7, 2, 6], ["FU", 5, [0, 1, 2]], ["SP", 5, 0, 64, [1], 1], ["AN", 5, 1, 2], ["FFSP", 5, 0, [3, 2, 1], 1, 1], ["AN", 5, 1, 6], ["FU", 3, [0, 1, 2]], ["SP", 3, 0, 16, [1], 1], ["AN", 3, 1, 2], ["FFSP", 3, 0, [3, 2, 1], 1, 1], ["AN", 3, 1, 6], ["PR", 6, 0, "auto_unroll_max_step$16"]]]], "r": [[0.0157713], 0, 2.66151, 1678568705], "v": "v0.6"}
{"i": [["[\"tw_kernel\", 1024, 1024, 409, 64, 16, \"float32\"]", "cuda -keys=cuda,gpu -arch=sm_70 -max_num_threads=1024 -model=unknown -thread_warp_size=32", [-1, 16, 64, 49152, 2147483647, 1024, 8, 32], "", 0, ["mask_k"]], [[], [["CHW", 4, "local"], ["SP", 4, 0, 16, [2, 1, 1, 2], 1], ["SP", 4, 5, 64, [2, 8, 1, 4], 1], ["SP", 4, 10, 1024, [2, 16, 4, 8], 1], ["SP", 4, 15, 409, [1, 1], 1], ["RE", 4, [0, 5, 10, 1, 6, 11, 2, 7, 12, 15, 16, 3, 8, 13, 17, 4, 9, 14]], ["FSP", 5, 0, 1, 3], ["FSP", 5, 4, 2, 3], ["FSP", 5, 8, 3, 3], ["RE", 5, [0, 4, 8, 1, 5, 9, 2, 6, 10, 3, 7, 11]], ["CA", 4, 5, 8], ["CHR", 3, "shared", [4]], ["CA", 4, 5, 9], ["CHR", 2, "shared", [5]], ["CA", 3, 6, 9], ["CI", 2], ["FU", 7, [0, 1, 2]], ["AN", 7, 0, 5], ["FU", 7, [1, 2, 3]], ["AN", 7, 1, 4], ["FU", 7, [2, 3, 4]], ["AN", 7, 2, 6], ["FU", 5, [0, 1, 2]], ["SP", 5, 0, 8, [1], 1], ["AN", 5, 1, 2], ["FFSP", 5, 0, [3, 2, 1], 1, 1], ["AN", 5, 1, 6], ["FU", 3, [0, 1, 2]], ["SP", 3, 0, 64, [1], 1], ["AN", 3, 1, 2], ["FFSP", 3, 0, [3, 2, 1], 1, 1], ["AN", 3, 1, 6], ["PR", 6, 0, "auto_unroll_max_step$64"]]]], "r": [[0.0159987], 0, 3.33265, 1678568705], "v": "v0.6"}
