AutoSchedule/Outputs/Ansor/tw_1024_1024_1024_ts8_spar50_1024_float32_gpu_trails2000.json
{"i": [["[\"tw_kernel\", 1024, 1024, 512, 8, 128, \"float32\"]", "cuda -keys=cuda,gpu -arch=sm_70 -max_num_threads=1024 -model=unknown -thread_warp_size=32", [-1, 16, 64, 49152, 2147483647, 1024, 8, 32], "", 0, ["mask_k"]], [[], [["CHW", 4, "local"], ["SP", 4, 0, 128, [2, 8, 1, 4], 1], ["SP", 4, 5, 8, [1, 1, 2, 1], 1], ["SP", 4, 10, 1024, [1, 4, 8, 1], 1], ["SP", 4, 15, 512, [1, 2], 1], ["RE", 4, [0, 5, 10, 1, 6, 11, 2, 7, 12, 15, 16, 3, 8, 13, 17, 4, 9, 14]], ["FSP", 5, 0, 1, 3], ["FSP", 5, 4, 2, 3], ["FSP", 5, 8, 3, 3], ["RE", 5, [0, 4, 8, 1, 5, 9, 2, 6, 10, 3, 7, 11]], ["CA", 4, 5, 8], ["CHR", 3, "shared", [4]], ["CA", 4, 5, 9], ["CHR", 2, "shared", [5]], ["CA", 3, 6, 9], ["CI", 2], ["FU", 7, [0, 1, 2]], ["AN", 7, 0, 5], ["FU", 7, [1, 2, 3]], ["AN", 7, 1, 4], ["FU", 7, [2, 3, 4]], ["AN", 7, 2, 6], ["FU", 5, [0, 1, 2]], ["SP", 5, 0, 64, [1], 1], ["AN", 5, 1, 2], ["FFSP", 5, 0, [3, 2, 1], 1, 1], ["AN", 5, 1, 6], ["FU", 3, [0, 1, 2]], ["SP", 3, 0, 256, [1], 1], ["AN", 3, 1, 2], ["FFSP", 3, 0, [3, 2, 1], 1, 1], ["AN", 3, 1, 6], ["PR", 6, 0, "auto_unroll_max_step$16"]]]], "r": [[0.00087863], 0, 1.7658, 1678474303], "v": "v0.6"}
{"i": [["[\"tw_kernel\", 1024, 1024, 512, 8, 128, \"float32\"]", "cuda -keys=cuda,gpu -arch=sm_70 -max_num_threads=1024 -model=unknown -thread_warp_size=32", [-1, 16, 64, 49152, 2147483647, 1024, 8, 32], "", 0, ["mask_k"]], [[], [["CHW", 4, "local"], ["SP", 4, 0, 128, [1, 32, 1, 1], 1], ["SP", 4, 5, 8, [2, 1, 1, 4], 1], ["SP", 4, 10, 1024, [1, 1, 2, 4], 1], ["SP", 4, 15, 512, [4, 1], 1], ["RE", 4, [0, 5, 10, 1, 6, 11, 2, 7, 12, 15, 16, 3, 8, 13, 17, 4, 9, 14]], ["FSP", 5, 0, 1, 3], ["FSP", 5, 4, 2, 3], ["FSP", 5, 8, 3, 3], ["RE", 5, [0, 4, 8, 1, 5, 9, 2, 6, 10, 3, 7, 11]], ["CA", 4, 5, 8], ["CHR", 3, "shared", [4]], ["CA", 4, 5, 9], ["CHR", 2, "shared", [5]], ["CA", 3, 6, 9], ["CI", 2], ["FU", 7, [0, 1, 2]], ["AN", 7, 0, 5], ["FU", 7, [1, 2, 3]], ["AN", 7, 1, 4], ["FU", 7, [2, 3, 4]], ["AN", 7, 2, 6], ["FU", 5, [0, 1, 2]], ["SP", 5, 0, 32, [1], 1], ["AN", 5, 1, 2], ["FFSP", 5, 0, [3, 2, 1], 1, 1], ["AN", 5, 1, 6], ["FU", 3, [0, 1, 2]], ["SP", 3, 0, 256, [1], 1], ["AN", 3, 1, 2], ["FFSP", 3, 0, [3, 2, 1], 1, 1], ["AN", 3, 1, 6], ["PR", 6, 0, "auto_unroll_max_step$1024"]]]], "r": [[0.000739227], 0, 1.8028, 1678474303], "v": "v0.6"}
{"i": [["[\"tw_kernel\", 1024, 1024, 512, 8, 128, \"float32\"]", "cuda -keys=cuda,gpu -arch=sm_70 -max_num_threads=1024 -model=unknown -thread_warp_size=32", [-1, 16, 64, 49152, 2147483647, 1024, 8, 32], "", 0, ["mask_k"]], [[], [["CHW", 4, "local"], ["SP", 4, 0, 128, [1, 4, 1, 2], 1], ["SP", 4, 5, 8, [2, 1, 2, 2], 1], ["SP", 4, 10, 1024, [1, 8, 4, 2], 1], ["SP", 4, 15, 512, [1, 2], 1], ["RE", 4, [0, 5, 10, 1, 6, 11, 2, 7, 12, 15, 16, 3, 8, 13, 17, 4, 9, 14]], ["FSP", 5, 0, 1, 3], ["FSP", 5, 4, 2, 3], ["FSP", 5, 8, 3, 3], ["RE", 5, [0, 4, 8, 1, 5, 9, 2, 6, 10, 3, 7, 11]], ["CA", 4, 5, 8], ["CHR", 3, "shared", [4]], ["CA", 4, 5, 9], ["CHR", 2, "shared", [5]], ["CA", 3, 6, 9], ["CI", 2], ["FU", 7, [0, 1, 2]], ["AN", 7, 0, 5], ["FU", 7, [1, 2, 3]], ["AN", 7, 1, 4], ["FU", 7, [2, 3, 4]], ["AN", 7, 2, 6], ["FU", 5, [0, 1, 2]], ["SP", 5, 0, 16, [1], 1], ["AN", 5, 1, 2], ["FFSP", 5, 0, [3, 2, 1], 1, 1], ["AN", 5, 1, 6], ["FU", 3, [0, 1, 2]], ["SP", 3, 0, 32, [2], 1], ["AN", 3, 1, 2], ["FFSP", 3, 0, [3, 2, 1], 1, 1], ["AN", 3, 1, 6], ["PR", 6, 0, "auto_unroll_max_step$64"]]]], "r": [[0.000330233], 0, 1.52541, 1678474303], "v": "v0.6"}
{"i": [["[\"tw_kernel\", 1024, 1024, 512, 8, 128, \"float32\"]", "cuda -keys=cuda,gpu -arch=sm_70 -max_num_threads=1024 -model=unknown -thread_warp_size=32", [-1, 16, 64, 49152, 2147483647, 1024, 8, 32], "", 0, ["mask_k"]], [[], [["CHW", 4, "local"], ["SP", 4, 0, 128, [2, 8, 2, 1], 1], ["SP", 4, 5, 8, [1, 4, 1, 1], 1], ["SP", 4, 10, 1024, [1, 32, 1, 1], 1], ["SP", 4, 15, 512, [1, 1], 1], ["RE", 4, [0, 5, 10, 1, 6, 11, 2, 7, 12, 15, 16, 3, 8, 13, 17, 4, 9, 14]], ["FSP", 5, 0, 1, 3], ["FSP", 5, 4, 2, 3], ["FSP", 5, 8, 3, 3], ["RE", 5, [0, 4, 8, 1, 5, 9, 2, 6, 10, 3, 7, 11]], ["CA", 4, 5, 8], ["CHR", 3, "shared", [4]], ["CA", 4, 5, 9], ["CHR", 2, "shared", [5]], ["CA", 3, 6, 9], ["CI", 2], ["FU", 7, [0, 1, 2]], ["AN", 7, 0, 5], ["FU", 7, [1, 2, 3]], ["AN", 7, 1, 4], ["FU", 7, [2, 3, 4]], ["AN", 7, 2, 6], ["FU", 5, [0, 1, 2]], ["SP", 5, 0, 2, [1], 1], ["AN", 5, 1, 2], ["FFSP", 5, 0, [3, 2, 1], 1, 1], ["AN", 5, 1, 6], ["FU", 3, [0, 1, 2]], ["SP", 3, 0, 2, [1], 1], ["AN", 3, 1, 2], ["FFSP", 3, 0, [3, 2, 1], 1, 1], ["AN", 3, 1, 6], ["PR", 6, 0, "auto_unroll_max_step$0"]]]], "r": [[0.000892107], 0, 1.00689, 1678474304], "v": "v0.6"}
{"i": [["[\"tw_kernel\", 1024, 1024, 512, 8, 128, \"float32\"]", "cuda -keys=cuda,gpu -arch=sm_70 -max_num_threads=1024 -model=unknown -thread_warp_size=32", [-1, 16, 64, 49152, 2147483647, 1024, 8, 32], "", 0, ["mask_k"]], [[], [["CHW", 4, "local"], ["SP", 4, 0, 128, [1, 2, 2, 8], 1], ["SP", 4, 5, 8, [1, 1, 4, 1], 1], ["SP", 4, 10, 1024, [2, 4, 1, 2], 1], ["SP", 4, 15, 512, [1, 4], 1], ["RE", 4, [0, 5, 10, 1, 6, 11, 2, 7, 12, 15, 16, 3, 8, 13, 17, 4, 9, 14]], ["FSP", 5, 0, 1, 3], ["FSP", 5, 4, 2, 3], ["FSP", 5, 8, 3, 3], ["RE", 5, [0, 4, 8, 1, 5, 9, 2, 6, 10, 3, 7, 11]], ["CA", 4, 5, 8], ["CHR", 3, "shared", [4]], ["CA", 4, 5, 9], ["CHR", 2, "shared", [5]], ["CA", 3, 6, 9], ["CI", 2], ["FU", 7, [0, 1, 2]], ["AN", 7, 0, 5], ["FU", 7, [1, 2, 3]], ["AN", 7, 1, 4], ["FU", 7, [2, 3, 4]], ["AN", 7, 2, 6], ["FU", 5, [0, 1, 2]], ["SP", 5, 0, 64, [1], 1], ["AN", 5, 1, 2], ["FFSP", 5, 0, [3, 2, 1], 1, 1], ["AN", 5, 1, 6], ["FU", 3, [0, 1, 2]], ["SP", 3, 0, 256, [2], 1], ["AN", 3, 1, 2], ["FFSP", 3, 0, [3, 2, 1], 1, 1], ["AN", 3, 1, 6], ["PR", 6, 0, "auto_unroll_max_step$512"]]]], "r": [[0.00445132], 0, 9.76664, 1678474304], "v": "v0.6"}
{"i": [["[\"tw_kernel\", 1024, 1024, 512, 8, 128, \"float32\"]", "cuda -keys=cuda,gpu -arch=sm_70 -max_num_threads=1024 -model=unknown -thread_warp_size=32", [-1, 16, 64, 49152, 2147483647, 1024, 8, 32], "", 0, ["mask_k"]], [[], [["CHW", 4, "local"], ["SP", 4, 0, 128, [2, 1, 4, 1], 1], ["SP", 4, 5, 8, [1, 4, 2, 1], 1], ["SP", 4, 10, 1024, [2, 64, 1, 4], 1], ["SP", 4, 15, 512, [2, 1], 1], ["RE", 4, [0, 5, 10, 1, 6, 11, 2, 7, 12, 15, 16, 3, 8, 13, 17, 4, 9, 14]], ["FSP", 5, 0, 1, 3], ["FSP", 5, 4, 2, 3], ["FSP", 5, 8, 3, 3], ["RE", 5, [0, 4, 8, 1, 5, 9, 2, 6, 10, 3, 7, 11]], ["CA", 4, 5, 8], ["CHR", 3, "shared", [4]], ["CA", 4, 5, 9], ["CHR", 2, "shared", [5]], ["CA", 3, 6, 9], ["CI", 2], ["FU", 7, [0, 1, 2]], ["AN", 7, 0, 5], ["FU", 7, [1, 2, 3]], ["AN", 7, 1, 4], ["FU", 7, [2, 3, 4]], ["AN", 7, 2, 6], ["FU", 5, [0, 1, 2]], ["SP", 5, 0, 16, [2], 1], ["AN", 5, 1, 2], ["FFSP", 5, 0, [3, 2, 1], 1, 1], ["AN", 5, 1, 6], ["FU", 3, [0, 1, 2]], ["SP", 3, 0, 32, [1], 1], ["AN", 3, 1, 2], ["FFSP", 3, 0, [3, 2, 1], 1, 1], ["AN", 3, 1, 6], ["PR", 6, 0, "auto_unroll_max_step$0"]]]], "r": [[0.000626307], 0, 1.17304, 1678474304], "v": "v0.6"}
{"i": [["[\"tw_kernel\", 1024, 1024, 512, 8, 128, \"float32\"]", "cuda -keys=cuda,gpu -arch=sm_70 -max_num_threads=1024 -model=unknown -thread_warp_size=32", [-1, 16, 64, 49152, 2147483647, 1024, 8, 32], "", 0, ["mask_k"]], [[], [["CHW", 4, "local"], ["SP", 4, 0, 128, [1, 4, 2, 4], 1], ["SP", 4, 5, 8, [2, 1, 1, 4], 1], ["SP", 4, 10, 1024, [1, 16, 1, 1], 1], ["SP", 4, 15, 512, [1, 1], 1], ["RE", 4, [0, 5, 10, 1, 6, 11, 2, 7, 12, 15, 16, 3, 8, 13, 17, 4, 9, 14]], ["FSP", 5, 0, 1, 3], ["FSP", 5, 4, 2, 3], ["FSP", 5, 8, 3, 3], ["RE", 5, [0, 4, 8, 1, 5, 9, 2, 6, 10, 3, 7, 11]], ["CA", 4, 5, 8], ["CHR", 3, "shared", [4]], ["CA", 4, 5, 9], ["CHR", 2, "shared", [5]], ["CA", 3, 6, 9], ["CI", 2], ["FU", 7, [0, 1, 2]], ["AN", 7, 0, 5], ["FU", 7, [1, 2, 3]], ["AN", 7, 1, 4], ["FU", 7, [2, 3, 4]], ["AN", 7, 2, 6], ["FU", 5, [0, 1, 2]], ["SP", 5, 0, 16, [1], 1], ["AN", 5, 1, 2], ["FFSP", 5, 0, [3, 2, 1], 1, 1], ["AN", 5, 1, 6], ["FU", 3, [0, 1, 2]], ["SP", 3, 0, 4, [1], 1], ["AN", 3, 1, 2], ["FFSP", 3, 0, [3, 2, 1], 1, 1], ["AN", 3, 1, 6], ["PR", 6, 0, "auto_unroll_max_step$16"]]]], "r": [[0.000838631], 0, 1.03157, 1678474304], "v": "v0.6"}
{"i": [["[\"tw_kernel\", 1024, 1024, 512, 8, 128, \"float32\"]", "cuda -keys=cuda,gpu -arch=sm_70 -max_num_threads=1024 -model=unknown -thread_warp_size=32", [-1, 16, 64, 49152, 2147483647, 1024, 8, 32], "", 0, ["mask_k"]], [[], [["CHW", 4, "local"], ["SP", 4, 0, 128, [1, 8, 2, 4], 1], ["SP", 4, 5, 8, [1, 1, 2, 1], 1], ["SP", 4, 10, 1024, [1, 8, 4, 1], 1], ["SP", 4, 15, 512, [1, 4], 1], ["RE", 4, [0, 5, 10, 1, 6, 11, 2, 7, 12, 15, 16, 3, 8, 13, 17, 4, 9, 14]], ["FSP", 5, 0, 1, 3], ["FSP", 5, 4, 2, 3], ["FSP", 5, 8, 3, 3], ["RE", 5, [0, 4, 8, 1, 5, 9, 2, 6, 10, 3, 7, 11]], ["CA", 4, 5, 8], ["CHR", 3, "shared", [4]], ["CA", 4, 5, 9], ["CHR", 2, "shared", [5]], ["CA", 3, 6, 9], ["CI", 2], ["FU", 7, [0, 1, 2]], ["AN", 7, 0, 5], ["FU", 7, [1, 2, 3]], ["AN", 7, 1, 4], ["FU", 7, [2, 3, 4]], ["AN", 7, 2, 6], ["FU", 5, [0, 1, 2]], ["SP", 5, 0, 64, [1], 1], ["AN", 5, 1, 2], ["FFSP", 5, 0, [3, 2, 1], 1, 1], ["AN", 5, 1, 6], ["FU", 3, [0, 1, 2]], ["SP", 3, 0, 256, [1], 1], ["AN", 3, 1, 2], ["FFSP", 3, 0, [3, 2, 1], 1, 1], ["AN", 3, 1, 6], ["PR", 6, 0, "auto_unroll_max_step$512"]]]], "r": [[0.000847513], 0, 2.75255, 1678474305], "v": "v0.6"}
{"i": [["[\"tw_kernel\", 1024, 1024, 512, 8, 128, \"float32\"]", "cuda -keys=cuda,gpu -arch=sm_70 -max_num_threads=1024 -model=unknown -thread_warp_size=32", [-1, 16, 64, 49152, 2147483647, 1024, 8, 32], "", 0, ["mask_k"]], [[], [["CHW", 4, "local"], ["SP", 4, 0, 128, [1, 16, 1, 1], 1], ["SP", 4, 5, 8, [1, 2, 4, 1], 1], ["SP", 4, 10, 1024, [1, 1, 2, 2], 1], ["SP", 4, 15, 512, [4, 2], 1], ["RE", 4, [0, 5, 10, 1, 6, 11, 2, 7, 12, 15, 16, 3, 8, 13, 17, 4, 9, 14]], ["FSP", 5, 0, 1, 3], ["FSP", 5, 4, 2, 3], ["FSP", 5, 8, 3, 3], ["RE", 5, [0, 4, 8, 1, 5, 9, 2, 6, 10, 3, 7, 11]], ["CA", 4, 5, 8], ["CHR", 3, "shared", [4]], ["CA", 4, 5, 9], ["CHR", 2, "shared", [5]], ["CA", 3, 6, 9], ["CI", 2], ["FU", 7, [0, 1, 2]], ["AN", 7, 0, 5], ["FU", 7, [1, 2, 3]], ["AN", 7, 1, 4], ["FU", 7, [2, 3, 4]], ["AN", 7, 2, 6], ["FU", 5, [0, 1, 2]], ["SP", 5, 0, 32, [1], 1], ["AN", 5, 1, 2], ["FFSP", 5, 0, [3, 2, 1], 1, 1], ["AN", 5, 1, 6], ["FU", 3, [0, 1, 2]], ["SP", 3, 0, 64, [1], 1], ["AN", 3, 1, 2], ["FFSP", 3, 0, [3, 2, 1], 1, 1], ["AN", 3, 1, 6], ["PR", 6, 0, "auto_unroll_max_step$16"]]]], "r": [[0.0010401], 0, 0.999233, 1678474305], "v": "v0.6"}
{"i": [["[\"tw_kernel\", 1024, 1024, 512, 8, 128, \"float32\"]", "cuda -keys=cuda,gpu -arch=sm_70 -max_num_threads=1024 -model=unknown -thread_warp_size=32", [-1, 16, 64, 49152, 2147483647, 1024, 8, 32], "", 0, ["mask_k"]], [[], [["CHW", 4, "local"], ["SP", 4, 0, 128, [1, 2, 1, 1], 1], ["SP", 4, 5, 8, [1, 1, 1, 8], 1], ["SP", 4, 10, 1024, [1, 32, 1, 8], 1], ["SP", 4, 15, 512, [2, 4], 1], ["RE", 4, [0, 5, 10, 1, 6, 11, 2, 7, 12, 15, 16, 3, 8, 13, 17, 4, 9, 14]], ["FSP", 5, 0, 1, 3], ["FSP", 5, 4, 2, 3], ["FSP", 5, 8, 3, 3], ["RE", 5, [0, 4, 8, 1, 5, 9, 2, 6, 10, 3, 7, 11]], ["CA", 4, 5, 8], ["CHR", 3, "shared", [4]], ["CA", 4, 5, 9], ["CHR", 2, "shared", [5]], ["CA", 3, 6, 9], ["CI", 2], ["FU", 7, [0, 1, 2]], ["AN", 7, 0, 5], ["FU", 7, [1, 2, 3]], ["AN", 7, 1, 4], ["FU", 7, [2, 3, 4]], ["AN", 7, 2, 6], ["FU", 5, [0, 1, 2]], ["SP", 5, 0, 64, [1], 1], ["AN", 5, 1, 2], ["FFSP", 5, 0, [3, 2, 1], 1, 1], ["AN", 5, 1, 6], ["FU", 3, [0, 1, 2]], ["SP", 3, 0, 64, [1], 1], ["AN", 3, 1, 2], ["FFSP", 3, 0, [3, 2, 1], 1, 1], ["AN", 3, 1, 6], ["PR", 6, 0, "auto_unroll_max_step$0"]]]], "r": [[0.000218307], 0, 1.19528, 1678474305], "v": "v0.6"}
{"i": [["[\"tw_kernel\", 1024, 1024, 512, 8, 128, \"float32\"]", "cuda -keys=cuda,gpu -arch=sm_70 -max_num_threads=1024 -model=unknown -thread_warp_size=32", [-1, 16, 64, 49152, 2147483647, 1024, 8, 32], "", 0, ["mask_k"]], [[], [["CHW", 4, "local"], ["SP", 4, 0, 128, [2, 2, 1, 1], 1], ["SP", 4, 5, 8, [1, 4, 1, 1], 1], ["SP", 4, 10, 1024, [1, 8, 8, 2], 1], ["SP", 4, 15, 512, [1, 4], 1], ["RE", 4, [0, 5, 10, 1, 6, 11, 2, 7, 12, 15, 16, 3, 8, 13, 17, 4, 9, 14]], ["FSP", 5, 0, 1, 3], ["FSP", 5, 4, 2, 3], ["FSP", 5, 8, 3, 3], ["RE", 5, [0, 4, 8, 1, 5, 9, 2, 6, 10, 3, 7, 11]], ["CA", 4, 5, 8], ["CHR", 3, "shared", [4]], ["CA", 4, 5, 9], ["CHR", 2, "shared", [5]], ["CA", 3, 6, 9], ["CI", 2], ["FU", 7, [0, 1, 2]], ["AN", 7, 0, 5], ["FU", 7, [1, 2, 3]], ["AN", 7, 1, 4], ["FU", 7, [2, 3, 4]], ["AN", 7, 2, 6], ["FU", 5, [0, 1, 2]], ["SP", 5, 0, 4, [1], 1], ["AN", 5, 1, 2], ["FFSP", 5, 0, [3, 2, 1], 1, 1], ["AN", 5, 1, 6], ["FU", 3, [0, 1, 2]], ["SP", 3, 0, 64, [1], 1], ["AN", 3, 1, 2], ["FFSP", 3, 0, [3, 2, 1], 1, 1], ["AN", 3, 1, 6], ["PR", 6, 0, "auto_unroll_max_step$16"]]]], "r": [[0.000837886], 0, 1.10202, 1678474306], "v": "v0.6"}
{"i": [["[\"tw_kernel\", 1024, 1024, 512, 8, 128, \"float32\"]", "cuda -keys=cuda,gpu -arch=sm_70 -max_num_threads=1024 -model=unknown -thread_warp_size=32", [-1, 16, 64, 49152, 2147483647, 1024, 8, 32], "", 0, ["mask_k"]], [[], [["CHW", 4, "local"], ["SP", 4, 0, 128, [1, 1, 2, 8], 1], ["SP", 4, 5, 8, [2, 1, 1, 1], 1], ["SP", 4, 10, 1024, [1, 32, 1, 1], 1], ["SP", 4, 15, 512, [4, 2], 1], ["RE", 4, [0, 5, 10, 1, 6, 11, 2, 7, 12, 15, 16, 3, 8, 13, 17, 4, 9, 14]], ["FSP", 5, 0, 1, 3], ["FSP", 5, 4, 2, 3], ["FSP", 5, 8, 3, 3], ["RE", 5, [0, 4, 8, 1, 5, 9, 2, 6, 10, 3, 7, 11]], ["CA", 4, 5, 8], ["CHR", 3, "shared", [4]], ["CA", 4, 5, 9], ["CHR", 2, "shared", [5]], ["CA", 3, 6, 9], ["CI", 2], ["FU", 7, [0, 1, 2]], ["AN", 7, 0, 5], ["FU", 7, [1, 2, 3]], ["AN", 7, 1, 4], ["FU", 7, [2, 3, 4]], ["AN", 7, 2, 6], ["FU", 5, [0, 1, 2]], ["SP", 5, 0, 64, [1], 1], ["AN", 5, 1, 2], ["FFSP", 5, 0, [3, 2, 1], 1, 1], ["AN", 5, 1, 6], ["FU", 3, [0, 1, 2]], ["SP", 3, 0, 16, [1], 1], ["AN", 3, 1, 2], ["FFSP", 3, 0, [3, 2, 1], 1, 1], ["AN", 3, 1, 6], ["PR", 6, 0, "auto_unroll_max_step$64"]]]], "r": [[0.00140254], 0, 1.1519, 1678474306], "v": "v0.6"}
{"i": [["[\"tw_kernel\", 1024, 1024, 512, 8, 128, \"float32\"]", "cuda -keys=cuda,gpu -arch=sm_70 -max_num_threads=1024 -model=unknown -thread_warp_size=32", [-1, 16, 64, 49152, 2147483647, 1024, 8, 32], "", 0, ["mask_k"]], [[], [["CHW", 4, "local"], ["SP", 4, 0, 128, [2, 1, 4, 1], 1], ["SP", 4, 5, 8, [2, 4, 1, 1], 1], ["SP", 4, 10, 1024, [1, 64, 1, 4], 1], ["SP", 4, 15, 512, [2, 1], 1], ["RE", 4, [0, 5, 10, 1, 6, 11, 2, 7, 12, 15, 16, 3, 8, 13, 17, 4, 9, 14]], ["FSP", 5, 0, 1, 3], ["FSP", 5, 4, 2, 3], ["FSP", 5, 8, 3, 3], ["RE", 5, [0, 4, 8, 1, 5, 9, 2, 6, 10, 3, 7, 11]], ["CA", 4, 5, 8], ["CHR", 3, "shared", [4]], ["CA", 4, 5, 9], ["CHR", 2, "shared", [5]], ["CA", 3, 6, 9], ["CI", 2], ["FU", 7, [0, 1, 2]], ["AN", 7, 0, 5], ["FU", 7, [1, 2, 3]], ["AN", 7, 1, 4], ["FU", 7, [2, 3, 4]], ["AN", 7, 2, 6], ["FU", 5, [0, 1, 2]], ["SP", 5, 0, 16, [1], 1], ["AN", 5, 1, 2], ["FFSP", 5, 0, [3, 2, 1], 1, 1], ["AN", 5, 1, 6], ["FU", 3, [0, 1, 2]], ["SP", 3, 0, 32, [1], 1], ["AN", 3, 1, 2], ["FFSP", 3, 0, [3, 2, 1], 1, 1], ["AN", 3, 1, 6], ["PR", 6, 0, "auto_unroll_max_step$0"]]]], "r": [[0.000343528], 0, 1.17974, 1678474306], "v": "v0.6"}
{"i": [["[\"tw_kernel\", 1024, 1024, 512, 8, 128, \"float32\"]", "cuda -keys=cuda,gpu -arch=sm_70 -max_num_threads=1024 -model=unknown -thread_warp_size=32", [-1, 16, 64, 49152, 2147483647, 1024, 8, 32], "", 0, ["mask_k"]], [[], [["CHW", 4, "local"], ["SP", 4, 0, 128, [2, 8, 1, 1], 1], ["SP", 4, 5, 8, [1, 1, 4, 2], 1], ["SP", 4, 10, 1024, [1, 32, 1, 1], 1], ["SP", 4, 15, 512, [4, 2], 1], ["RE", 4, [0, 5, 10, 1, 6, 11, 2, 7, 12, 15, 16, 3, 8, 13, 17, 4, 9, 14]], ["FSP", 5, 0, 1, 3], ["FSP", 5, 4, 2, 3], ["FSP", 5, 8, 3, 3], ["RE", 5, [0, 4, 8, 1, 5, 9, 2, 6, 10, 3, 7, 11]], ["CA", 4, 5, 8], ["CHR", 3, "shared", [4]], ["CA", 4, 5, 9], ["CHR", 2, "shared", [5]], ["CA", 3, 6, 9], ["CI", 2], ["FU", 7, [0, 1, 2]], ["AN", 7, 0, 5], ["FU", 7, [1, 2, 3]], ["AN", 7, 1, 4], ["FU", 7, [2, 3, 4]], ["AN", 7, 2, 6], ["FU", 5, [0, 1, 2]], ["SP", 5, 0, 32, [1], 1], ["AN", 5, 1, 2], ["FFSP", 5, 0, [3, 2, 1], 1, 1], ["AN", 5, 1, 6], ["FU", 3, [0, 1, 2]], ["SP", 3, 0, 8, [1], 1], ["AN", 3, 1, 2], ["FFSP", 3, 0, [3, 2, 1], 1, 1], ["AN", 3, 1, 6], ["PR", 6, 0, "auto_unroll_max_step$16"]]]], "r": [[0.000308536], 0, 1.21033, 1678474307], "v": "v0.6"}
{"i": [["[\"tw_kernel\", 1024, 1024, 512, 8, 128, \"float32\"]", "cuda -keys=cuda,gpu -arch=sm_70 -max_num_threads=1024 -model=unknown -thread_warp_size=32", [-1, 16, 64, 49152, 2147483647, 1024, 8, 32], "", 0, ["mask_k"]], [[], [["CHW", 4, "local"], ["SP", 4, 0, 128, [4, 8, 2, 1], 1], ["SP", 4, 5, 8, [2, 1, 1, 4], 1], ["SP", 4, 10, 1024, [1, 4, 8, 1], 1], ["SP", 4, 15, 512, [1, 4], 1], ["RE", 4, [0, 5, 10, 1, 6, 11, 2, 7, 12, 15, 16, 3, 8, 13, 17, 4, 9, 14]], ["FSP", 5, 0, 1, 3], ["FSP", 5, 4, 2, 3], ["FSP", 5, 8, 3, 3], ["RE", 5, [0, 4, 8, 1, 5, 9, 2, 6, 10, 3, 7, 11]], ["CA", 4, 5, 8], ["CHR", 3, "shared", [4]], ["CA", 4, 5, 9], ["CHR", 2, "shared", [5]], ["CA", 3, 6, 9], ["CI", 2], ["FU", 7, [0, 1, 2]], ["AN", 7, 0, 5], ["FU", 7, [1, 2, 3]], ["AN", 7, 1, 4], ["FU", 7, [2, 3, 4]], ["AN", 7, 2, 6], ["FU", 5, [0, 1, 2]], ["SP", 5, 0, 64, [4], 1], ["AN", 5, 1, 2], ["FFSP", 5, 0, [3, 2, 1], 1, 1], ["AN", 5, 1, 6], ["FU", 3, [0, 1, 2]], ["SP", 3, 0, 256, [1], 1], ["AN", 3, 1, 2], ["FFSP", 3, 0, [3, 2, 1], 1, 1], ["AN", 3, 1, 6], ["PR", 6, 0, "auto_unroll_max_step$16"]]]], "r": [[0.00284006], 0, 3.10623, 1678474307], "v": "v0.6"}
{"i": [["[\"tw_kernel\", 1024, 1024, 512, 8, 128, \"float32\"]", "cuda -keys=cuda,gpu -arch=sm_70 -max_num_threads=1024 -model=unknown -thread_warp_size=32", [-1, 16, 64, 49152, 2147483647, 1024, 8, 32], "", 0, ["mask_k"]], [[], [["CHW", 4, "local"], ["SP", 4, 0, 128, [1, 16, 1, 1], 1], ["SP", 4, 5, 8, [1, 1, 4, 1], 1], ["SP", 4, 10, 1024, [2, 4, 2, 1], 1], ["SP", 4, 15, 512, [4, 1], 1], ["RE", 4, [0, 5, 10, 1, 6, 11, 2, 7, 12, 15, 16, 3, 8, 13, 17, 4, 9, 14]], ["FSP", 5, 0, 1, 3], ["FSP", 5, 4, 2, 3], ["FSP", 5, 8, 3, 3], ["RE", 5, [0, 4, 8, 1, 5, 9, 2, 6, 10, 3, 7, 11]], ["CA", 4, 5, 8], ["CHR", 3, "shared", [4]], ["CA", 4, 5, 9], ["CHR", 2, "shared", [5]], ["CA", 3, 6, 9], ["CI", 2], ["FU", 7, [0, 1, 2]], ["AN", 7, 0, 5], ["FU", 7, [1, 2, 3]], ["AN", 7, 1, 4], ["FU", 7, [2, 3, 4]], ["AN", 7, 2, 6], ["FU", 5, [0, 1, 2]], ["SP", 5, 0, 16, [1], 1], ["AN", 5, 1, 2], ["FFSP", 5, 0, [3, 2, 1], 1, 1], ["AN", 5, 1, 6], ["FU", 3, [0, 1, 2]], ["SP", 3, 0, 8, [1], 1], ["AN", 3, 1, 2], ["FFSP", 3, 0, [3, 2, 1], 1, 1], ["AN", 3, 1, 6], ["PR", 6, 0, "auto_unroll_max_step$1024"]]]], "r": [[0.000520229], 0, 1.16903, 1678474307], "v": "v0.6"}
{"i": [["[\"tw_kernel\", 1024, 1024, 512, 8, 128, \"float32\"]", "cuda -keys=cuda,gpu -arch=sm_70 -max_num_threads=1024 -model=unknown -thread_warp_size=32", [-1, 16, 64, 49152, 2147483647, 1024, 8, 32], "", 0, ["mask_k"]], [[], [["CHW", 4, "local"], ["SP", 4, 0, 128, [1, 16, 2, 2], 1], ["SP", 4, 5, 8, [2, 2, 2, 1], 1], ["SP", 4, 10, 1024, [2, 4, 2, 1], 1], ["SP", 4, 15, 512, [2, 2], 1], ["RE", 4, [0, 5, 10, 1, 6, 11, 2, 7, 12, 15, 16, 3, 8, 13, 17, 4, 9, 14]], ["FSP", 5, 0, 1, 3], ["FSP", 5, 4, 2, 3], ["FSP", 5, 8, 3, 3], ["RE", 5, [0, 4, 8, 1, 5, 9, 2, 6, 10, 3, 7, 11]], ["CA", 4, 5, 8], ["CHR", 3, "shared", [4]], ["CA", 4, 5, 9], ["CHR", 2, "shared", [5]], ["CA", 3, 6, 9], ["CI", 2], ["FU", 7, [0, 1, 2]], ["AN", 7, 0, 5], ["FU", 7, [1, 2, 3]], ["AN", 7, 1, 4], ["FU", 7, [2, 3, 4]], ["AN", 7, 2, 6], ["FU", 5, [0, 1, 2]], ["SP", 5, 0, 16, [1], 1], ["AN", 5, 1, 2], ["FFSP", 5, 0, [3, 2, 1], 1, 1], ["AN", 5, 1, 6], ["FU", 3, [0, 1, 2]], ["SP", 3, 0, 32, [1], 1], ["AN", 3, 1, 2], ["FFSP", 3, 0, [3, 2, 1], 1, 1], ["AN", 3, 1, 6], ["PR", 6, 0, "auto_unroll_max_step$1024"]]]], "r": [[0.000424329], 0, 2.06555, 1678474308], "v": "v0.6"}
{"i": [["[\"tw_kernel\", 1024, 1024, 512, 8, 128, \"float32\"]", "cuda -keys=cuda,gpu -arch=sm_70 -max_num_threads=1024 -model=unknown -thread_warp_size=32", [-1, 16, 64, 49152, 2147483647, 1024, 8, 32], "", 0, ["mask_k"]], [[], [["CHW", 4, "local"], ["SP", 4, 0, 128, [1, 1, 4, 1], 1], ["SP", 4, 5, 8, [1, 1, 2, 4], 1], ["SP", 4, 10, 1024, [8, 4, 2, 4], 1], ["SP", 4, 15, 512, [2, 1], 1], ["RE", 4, [0, 5, 10, 1, 6, 11, 2, 7, 12, 15, 16, 3, 8, 13, 17, 4, 9, 14]], ["FSP", 5, 0, 1, 3], ["FSP", 5, 4, 2, 3], ["FSP", 5, 8, 3, 3], ["RE", 5, [0, 4, 8, 1, 5, 9, 2, 6, 10, 3, 7, 11]], ["CA", 4, 5, 8], ["CHR", 3, "shared", [4]], ["CA", 4, 5, 9], ["CHR", 2, "shared", [5]], ["CA", 3, 6, 9], ["CI", 2], ["FU", 7, [0, 1, 2]], ["AN", 7, 0, 5], ["FU", 7, [1, 2, 3]], ["AN", 7, 1, 4], ["FU", 7, [2, 3, 4]], ["AN", 7, 2, 6], ["FU", 5, [0, 1, 2]], ["SP", 5, 0, 16, [1], 1], ["AN", 5, 1, 2], ["FFSP", 5, 0, [3, 2, 1], 1, 1], ["AN", 5, 1, 6], ["FU", 3, [0, 1, 2]], ["SP", 3, 0, 16, [1], 1], ["AN", 3, 1, 2], ["FFSP", 3, 0, [3, 2, 1], 1, 1], ["AN", 3, 1, 6], ["PR", 6, 0, "auto_unroll_max_step$64"]]]], "r": [[0.0285821], 0, 3.61563, 1678474308], "v": "v0.6"}
{"i": [["[\"tw_kernel\", 1024, 1024, 512, 8, 128, \"float32\"]", "cuda -keys=cuda,gpu -arch=sm_70 -max_num_threads=1024 -model=unknown -thread_warp_size=32", [-1, 16, 64, 49152, 2147483647, 1024, 8, 32], "", 0, ["mask_k"]], [[], [["CHW", 4, "local"], ["SP", 4, 0, 128, [1, 8, 1, 16], 1], ["SP", 4, 5, 8, [1, 2, 1, 4], 1], ["SP", 4, 10, 1024, [1, 1, 2, 8], 1], ["SP", 4, 15, 512, [1, 2], 1], ["RE", 4, [0, 5, 10, 1, 6, 11, 2, 7, 12, 15, 16, 3, 8, 13, 17, 4, 9, 14]], ["FSP", 5, 0, 1, 3], ["FSP", 5, 4, 2, 3], ["FSP", 5, 8, 3, 3], ["RE", 5, [0, 4, 8, 1, 5, 9, 2, 6, 10, 3, 7, 11]], ["CA", 4, 5, 8], ["CHR", 3, "shared", [4]], ["CA", 4, 5, 9], ["CHR", 2, "shared", [5]], ["CA", 3, 6, 9], ["CI", 2], ["FU", 7, [0, 1, 2]], ["AN", 7, 0, 5], ["FU", 7, [1, 2, 3]], ["AN", 7, 1, 4], ["FU", 7, [2, 3, 4]], ["AN", 7, 2, 6], ["FU", 5, [0, 1, 2]], ["SP", 5, 0, 4, [2], 1], ["AN", 5, 1, 2], ["FFSP", 5, 0, [3, 2, 1], 1, 1], ["AN", 5, 1, 6], ["FU", 3, [0, 1, 2]], ["SP", 3, 0, 64, [1], 1], ["AN", 3, 1, 2], ["FFSP", 3, 0, [3, 2, 1], 1, 1], ["AN", 3, 1, 6], ["PR", 6, 0, "auto_unroll_max_step$64"]]]], "r": [[0.0111573], 0, 2.9895, 1678474309], "v": "v0.6"}
{"i": [["[\"tw_kernel\", 1024, 1024, 512, 8, 128, \"float32\"]", "cuda -keys=cuda,gpu -arch=sm_70 -max_num_threads=1024 -model=unknown -thread_warp_size=32", [-1, 16, 64, 49152, 2147483647, 1024, 8, 32], "", 0, ["mask_k"]], [[], [["CHW", 4, "local"], ["SP", 4, 0, 128, [1, 1, 1, 1], 1], ["SP", 4, 5, 8, [2, 2, 1, 2], 1], ["SP", 4, 10, 1024, [1, 64, 4, 1], 1], ["SP", 4, 15, 512, [4, 2], 1], ["RE", 4, [0, 5, 10, 1, 6, 11, 2, 7, 12, 15, 16, 3, 8, 13, 17, 4, 9, 14]], ["FSP", 5, 0, 1, 3], ["FSP", 5, 4, 2, 3], ["FSP", 5, 8, 3, 3], ["RE", 5, [0, 4, 8, 1, 5, 9, 2, 6, 10, 3, 7, 11]], ["CA", 4, 5, 8], ["CHR", 3, "shared", [4]], ["CA", 4, 5, 9], ["CHR", 2, "shared", [5]], ["CA", 3, 6, 9], ["CI", 2], ["FU", 7, [0, 1, 2]], ["AN", 7, 0, 5], ["FU", 7, [1, 2, 3]], ["AN", 7, 1, 4], ["FU", 7, [2, 3, 4]], ["AN", 7, 2, 6], ["FU", 5, [0, 1, 2]], ["SP", 5, 0, 16, [1], 1], ["AN", 5, 1, 2], ["FFSP", 5, 0, [3, 2, 1], 1, 1], ["AN", 5, 1, 6], ["FU", 3, [0, 1, 2]], ["SP", 3, 0, 32, [1], 1], ["AN", 3, 1, 2], ["FFSP", 3, 0, [3, 2, 1], 1, 1], ["AN", 3, 1, 6], ["PR", 6, 0, "auto_unroll_max_step$512"]]]], "r": [[0.000164114], 0, 1.14868, 1678474309], "v": "v0.6"}
{"i": [["[\"tw_kernel\", 1024, 1024, 512, 8, 128, \"float32\"]", "cuda -keys=cuda,gpu -arch=sm_70 -max_num_threads=1024 -model=unknown -thread_warp_size=32", [-1, 16, 64, 49152, 2147483647, 1024, 8, 32], "", 0, ["mask_k"]], [[], [["CHW", 4, "local"], ["SP", 4, 0, 128, [1, 16, 1, 2], 1], ["SP", 4, 5, 8, [2, 2, 1, 2], 1], ["SP", 4, 10, 1024, [2, 1, 1, 8], 1], ["SP", 4, 15, 512, [2, 1], 1], ["RE", 4, [0, 5, 10, 1, 6, 11, 2, 7, 12, 15, 16, 3, 8, 13, 17, 4, 9, 14]], ["FSP", 5, 0, 1, 3], ["FSP", 5, 4, 2, 3], ["FSP", 5, 8, 3, 3], ["RE", 5, [0, 4, 8, 1, 5, 9, 2, 6, 10, 3, 7, 11]], ["CA", 4, 5, 8], ["CHR", 3, "shared", [4]], ["CA", 4, 5, 9], ["CHR", 2, "shared", [5]], ["CA", 3, 6, 9], ["CI", 2], ["FU", 7, [0, 1, 2]], ["AN", 7, 0, 5], ["FU", 7, [1, 2, 3]], ["AN", 7, 1, 4], ["FU", 7, [2, 3, 4]], ["AN", 7, 2, 6], ["FU", 5, [0, 1, 2]], ["SP", 5, 0, 8, [1], 1], ["AN", 5, 1, 2], ["FFSP", 5, 0, [3, 2, 1], 1, 1], ["AN", 5, 1, 6], ["FU", 3, [0, 1, 2]], ["SP", 3, 0, 32, [1], 1], ["AN", 3, 1, 2], ["FFSP", 3, 0, [3, 2, 1], 1, 1], ["AN", 3, 1, 6], ["PR", 6, 0, "auto_unroll_max_step$64"]]]], "r": [[0.000675047], 0, 2.08301, 1678474309], "v": "v0.6"}
{"i": [["[\"tw_kernel\", 1024, 1024, 512, 8, 128, \"float32\"]", "cuda -keys=cuda,gpu -arch=sm_70 -max_num_threads=1024 -model=unknown -thread_warp_size=32", [-1, 16, 64, 49152, 2147483647, 1024, 8, 32], "", 0, ["mask_k"]], [[], [["CHW", 4, "local"], ["SP", 4, 0, 128, [1, 1, 1, 1], 1], ["SP", 4, 5, 8, [1, 2, 1, 2], 1], ["SP", 4, 10, 1024, [2, 32, 1, 8], 1], ["SP", 4, 15, 512, [4, 1], 1], ["RE", 4, [0, 5, 10, 1, 6, 11, 2, 7, 12, 15, 16, 3, 8, 13, 17, 4, 9, 14]], ["FSP", 5, 0, 1, 3], ["FSP", 5, 4, 2, 3], ["FSP", 5, 8, 3, 3], ["RE", 5, [0, 4, 8, 1, 5, 9, 2, 6, 10, 3, 7, 11]], ["CA", 4, 5, 8], ["CHR", 3, "shared", [4]], ["CA", 4, 5, 9], ["CHR", 2, "shared", [5]], ["CA", 3, 6, 9], ["CI", 2], ["FU", 7, [0, 1, 2]], ["AN", 7, 0, 5], ["FU", 7, [1, 2, 3]], ["AN", 7, 1, 4], ["FU", 7, [2, 3, 4]], ["AN", 7, 2, 6], ["FU", 5, [0, 1, 2]], ["SP", 5, 0, 2, [1], 1], ["AN", 5, 1, 2], ["FFSP", 5, 0, [3, 2, 1], 1, 1], ["AN", 5, 1, 6], ["FU", 3, [0, 1, 2]], ["SP", 3, 0, 16, [1], 1], ["AN", 3, 1, 2], ["FFSP", 3, 0, [3, 2, 1], 1, 1], ["AN", 3, 1, 6], ["PR", 6, 0, "auto_unroll_max_step$1024"]]]], "r": [[0.000331948], 0, 1.31414, 1678474310], "v": "v0.6"}
{"i": [["[\"tw_kernel\", 1024, 1024, 512, 8, 128, \"float32\"]", "cuda -keys=cuda,gpu -arch=sm_70 -max_num_threads=1024 -model=unknown -thread_warp_size=32", [-1, 16, 64, 49152, 2147483647, 1024, 8, 32], "", 0, ["mask_k"]], [[], [["CHW", 4, "local"], ["SP", 4, 0, 128, [2, 1, 1, 1], 1], ["SP", 4, 5, 8, [1, 1, 1, 4], 1], ["SP", 4, 10, 1024, [1, 1024, 1, 1], 1], ["SP", 4, 15, 512, [2, 2], 1], ["RE", 4, [0, 5, 10, 1, 6, 11, 2, 7, 12, 15, 16, 3, 8, 13, 17, 4, 9, 14]], ["FSP", 5, 0, 1, 3], ["FSP", 5, 4, 2, 3], ["FSP", 5, 8, 3, 3], ["RE", 5, [0, 4, 8, 1, 5, 9, 2, 6, 10, 3, 7, 11]], ["CA", 4, 5, 8], ["CHR", 3, "shared", [4]], ["CA", 4, 5, 9], ["CHR", 2, "shared", [5]], ["CA", 3, 6, 9], ["CI", 2], ["FU", 7, [0, 1, 2]], ["AN", 7, 0, 5], ["FU", 7, [1, 2, 3]], ["AN", 7, 1, 4], ["FU", 7, [2, 3, 4]], ["AN", 7, 2, 6], ["FU", 5, [0, 1, 2]], ["SP", 5, 0, 16, [1], 1], ["AN", 5, 1, 2], ["FFSP", 5, 0, [3, 2, 1], 1, 1], ["AN", 5, 1, 6], ["FU", 3, [0, 1, 2]], ["SP", 3, 0, 16, [1], 1], ["AN", 3, 1, 2], ["FFSP", 3, 0, [3, 2, 1], 1, 1], ["AN", 3, 1, 6], ["PR", 6, 0, "auto_unroll_max_step$0"]]]], "r": [[0.000497518], 0, 0.876586, 1678474310], "v": "v0.6"}
{"i": [["[\"tw_kernel\", 1024, 1024, 512, 8, 128, \"float32\"]", "cuda -keys=cuda,gpu -arch=sm_70 -max_num_threads=1024 -model=unknown -thread_warp_size=32", [-1, 16, 64, 49152, 2147483647, 1024, 8, 32], "", 0, ["mask_k"]], [[], [["CHW", 4, "local"], ["SP", 4, 0, 128, [1, 8, 1, 16], 1], ["SP", 4, 5, 8, [1, 1, 1, 4], 1], ["SP", 4, 10, 1024, [1, 1, 2, 8], 1], ["SP", 4, 15, 512, [1, 4], 1], ["RE", 4, [0, 5, 10, 1, 6, 11, 2, 7, 12, 15, 16, 3, 8, 13, 17, 4, 9, 14]], ["FSP", 5, 0, 1, 3], ["FSP", 5, 4, 2, 3], ["FSP", 5, 8, 3, 3], ["RE", 5, [0, 4, 8, 1, 5, 9, 2, 6, 10, 3, 7, 11]], ["CA", 4, 5, 8], ["CHR", 3, "shared", [4]], ["CA", 4, 5, 9], ["CHR", 2, "shared", [5]], ["CA", 3, 6, 9], ["CI", 2], ["FU", 7, [0, 1, 2]], ["AN", 7, 0, 5], ["FU", 7, [1, 2, 3]], ["AN", 7, 1, 4], ["FU", 7, [2, 3, 4]], ["AN", 7, 2, 6], ["FU", 5, [0, 1, 2]], ["SP", 5, 0, 4, [1], 1], ["AN", 5, 1, 2], ["FFSP", 5, 0, [3, 2, 1], 1, 1], ["AN", 5, 1, 6], ["FU", 3, [0, 1, 2]], ["SP", 3, 0, 64, [1], 1], ["AN", 3, 1, 2], ["FFSP", 3, 0, [3, 2, 1], 1, 1], ["AN", 3, 1, 6], ["PR", 6, 0, "auto_unroll_max_step$64"]]]], "r": [[0.015265], 0, 2.53066, 1678474310], "v": "v0.6"}
{"i": [["[\"tw_kernel\", 1024, 1024, 512, 8, 128, \"float32\"]", "cuda -keys=cuda,gpu -arch=sm_70 -max_num_threads=1024 -model=unknown -thread_warp_size=32", [-1, 16, 64, 49152, 2147483647, 1024, 8, 32], "", 0, ["mask_k"]], [[], [["CHW", 4, "local"], ["SP", 4, 0, 128, [1, 16, 1, 1], 1], ["SP", 4, 5, 8, [1, 2, 2, 2], 1], ["SP", 4, 10, 1024, [2, 1, 8, 2], 1], ["SP", 4, 15, 512, [1, 4], 1], ["RE", 4, [0, 5, 10, 1, 6, 11, 2, 7, 12, 15, 16, 3, 8, 13, 17, 4, 9, 14]], ["FSP", 5, 0, 1, 3], ["FSP", 5, 4, 2, 3], ["FSP", 5, 8, 3, 3], ["RE", 5, [0, 4, 8, 1, 5, 9, 2, 6, 10, 3, 7, 11]], ["CA", 4, 5, 8], ["CHR", 3, "shared", [4]], ["CA", 4, 5, 9], ["CHR", 2, "shared", [5]], ["CA", 3, 6, 9], ["CI", 2], ["FU", 7, [0, 1, 2]], ["AN", 7, 0, 5], ["FU", 7, [1, 2, 3]], ["AN", 7, 1, 4], ["FU", 7, [2, 3, 4]], ["AN", 7, 2, 6], ["FU", 5, [0, 1, 2]], ["SP", 5, 0, 64, [1], 1], ["AN", 5, 1, 2], ["FFSP", 5, 0, [3, 2, 1], 1, 1], ["AN", 5, 1, 6], ["FU", 3, [0, 1, 2]], ["SP", 3, 0, 256, [1], 1], ["AN", 3, 1, 2], ["FFSP", 3, 0, [3, 2, 1], 1, 1], ["AN", 3, 1, 6], ["PR", 6, 0, "auto_unroll_max_step$64"]]]], "r": [[0.000516245], 0, 2.05658, 1678474310], "v": "v0.6"}
{"i": [["[\"tw_kernel\", 1024, 1024, 512, 8, 128, \"float32\"]", "cuda -keys=cuda,gpu -arch=sm_70 -max_num_threads=1024 -model=unknown -thread_warp_size=32", [-1, 16, 64, 49152, 2147483647, 1024, 8, 32], "", 0, ["mask_k"]], [[], [["CHW", 4, "local"], ["SP", 4, 0, 128, [2, 2, 2, 1], 1], ["SP", 4, 5, 8, [1, 1, 1, 4], 1], ["SP", 4, 10, 1024, [2, 1, 4, 1], 1], ["SP", 4, 15, 512, [8, 1], 1], ["RE", 4, [0, 5, 10, 1, 6, 11, 2, 7, 12, 15, 16, 3, 8, 13, 17, 4, 9, 14]], ["FSP", 5, 0, 1, 3], ["FSP", 5, 4, 2, 3], ["FSP", 5, 8, 3, 3], ["RE", 5, [0, 4, 8, 1, 5, 9, 2, 6, 10, 3, 7, 11]], ["CA", 4, 5, 8], ["CHR", 3, "shared", [4]], ["CA", 4, 5, 9], ["CHR", 2, "shared", [5]], ["CA", 3, 6, 9], ["CI", 2], ["FU", 7, [0, 1, 2]], ["AN", 7, 0, 5], ["FU", 7, [1, 2, 3]], ["AN", 7, 1, 4], ["FU", 7, [2, 3, 4]], ["AN", 7, 2, 6], ["FU", 5, [0, 1, 2]], ["SP", 5, 0, 32, [1], 1], ["AN", 5, 1, 2], ["FFSP", 5, 0, [3, 2, 1], 1, 1], ["AN", 5, 1, 6], ["FU", 3, [0, 1, 2]], ["SP", 3, 0, 64, [1], 1], ["AN", 3, 1, 2], ["FFSP", 3, 0, [3, 2, 1], 1, 1], ["AN", 3, 1, 6], ["PR", 6, 0, "auto_unroll_max_step$512"]]]], "r": [[0.00375928], 0, 3.10624, 1678474311], "v": "v0.6"}
{"i": [["[\"tw_kernel\", 1024, 1024, 512, 8, 128, \"float32\"]", "cuda -keys=cuda,gpu -arch=sm_70 -max_num_threads=1024 -model=unknown -thread_warp_size=32", [-1, 16, 64, 49152, 2147483647, 1024, 8, 32], "", 0, ["mask_k"]], [[], [["CHW", 4, "local"], ["SP", 4, 0, 128, [8, 16, 1, 1], 1], ["SP", 4, 5, 8, [1, 2, 2, 2], 1], ["SP", 4, 10, 1024, [1, 1, 1, 8], 1], ["SP", 4, 15, 512, [1, 1], 1], ["RE", 4, [0, 5, 10, 1, 6, 11, 2, 7, 12, 15, 16, 3, 8, 13, 17, 4, 9, 14]], ["FSP", 5, 0, 1, 3], ["FSP", 5, 4, 2, 3], ["FSP", 5, 8, 3, 3], ["RE", 5, [0, 4, 8, 1, 5, 9, 2, 6, 10, 3, 7, 11]], ["CA", 4, 5, 8], ["CHR", 3, "shared", [4]], ["CA", 4, 5, 9], ["CHR", 2, "shared", [5]], ["CA", 3, 6, 9], ["CI", 2], ["FU", 7, [0, 1, 2]], ["AN", 7, 0, 5], ["FU", 7, [1, 2, 3]], ["AN", 7, 1, 4], ["FU", 7, [2, 3, 4]], ["AN", 7, 2, 6], ["FU", 5, [0, 1, 2]], ["SP", 5, 0, 4, [4], 1], ["AN", 5, 1, 2], ["FFSP", 5, 0, [3, 2, 1], 1, 1], ["AN", 5, 1, 6], ["FU", 3, [0, 1, 2]], ["SP", 3, 0, 4, [1], 1], ["AN", 3, 1, 2], ["FFSP", 3, 0, [3, 2, 1], 1, 1], ["AN", 3, 1, 6], ["PR", 6, 0, "auto_unroll_max_step$0"]]]], "r": [[0.00249354], 0, 1.46451, 1678474311], "v": "v0.6"}
{"i": [["[\"tw_kernel\", 1024, 1024, 512, 8, 128, \"float32\"]", "cuda -keys=cuda,gpu -arch=sm_70 -max_num_threads=1024 -model=unknown -thread_warp_size=32", [-1, 16, 64, 49152, 2147483647, 1024, 8, 32], "", 0, ["mask_k"]], [[], [["CHW", 4, "local"], ["SP", 4, 0, 128, [1, 4, 1, 2], 1], ["SP", 4, 5, 8, [4, 2, 1, 1], 1], ["SP", 4, 10, 1024, [1, 32, 1, 2], 1], ["SP", 4, 15, 512, [2, 1], 1], ["RE", 4, [0, 5, 10, 1, 6, 11, 2, 7, 12, 15, 16, 3, 8, 13, 17, 4, 9, 14]], ["FSP", 5, 0, 1, 3], ["FSP", 5, 4, 2, 3], ["FSP", 5, 8, 3, 3], ["RE", 5, [0, 4, 8, 1, 5, 9, 2, 6, 10, 3, 7, 11]], ["CA", 4, 5, 8], ["CHR", 3, "shared", [4]], ["CA", 4, 5, 9], ["CHR", 2, "shared", [5]], ["CA", 3, 6, 9], ["CI", 2], ["FU", 7, [0, 1, 2]], ["AN", 7, 0, 5], ["FU", 7, [1, 2, 3]], ["AN", 7, 1, 4], ["FU", 7, [2, 3, 4]], ["AN", 7, 2, 6], ["FU", 5, [0, 1, 2]], ["SP", 5, 0, 4, [2], 1], ["AN", 5, 1, 2], ["FFSP", 5, 0, [3, 2, 1], 1, 1], ["AN", 5, 1, 6], ["FU", 3, [0, 1, 2]], ["SP", 3, 0, 8, [1], 1], ["AN", 3, 1, 2], ["FFSP", 3, 0, [3, 2, 1], 1, 1], ["AN", 3, 1, 6], ["PR", 6, 0, "auto_unroll_max_step$64"]]]], "r": [[0.000311837], 0, 1.11487, 1678474311], "v": "v0.6"}
{"i": [["[\"tw_kernel\", 1024, 1024, 512, 8, 128, \"float32\"]", "cuda -keys=cuda,gpu -arch=sm_70 -max_num_threads=1024 -model=unknown -thread_warp_size=32", [-1, 16, 64, 49152, 2147483647, 1024, 8, 32], "", 0, ["mask_k"]], [[], [["CHW", 4, "local"], ["SP", 4, 0, 128, [1, 32, 1, 4], 1], ["SP", 4, 5, 8, [1, 1, 2, 2], 1], ["SP", 4, 10, 1024, [8, 1, 1, 1], 1], ["SP", 4, 15, 512, [1, 4], 1], ["RE", 4, [0, 5, 10, 1, 6, 11, 2, 7, 12, 15, 16, 3, 8, 13, 17, 4, 9, 14]], ["FSP", 5, 0, 1, 3], ["FSP", 5, 4, 2, 3], ["FSP", 5, 8, 3, 3], ["RE", 5, [0, 4, 8, 1, 5, 9, 2, 6, 10, 3, 7, 11]], ["CA", 4, 5, 8], ["CHR", 3, "shared", [4]], ["CA", 4, 5, 9], ["CHR", 2, "shared", [5]], ["CA", 3, 6, 9], ["CI", 2], ["FU", 7, [0, 1, 2]], ["AN", 7, 0, 5], ["FU", 7, [1, 2, 3]], ["AN", 7, 1, 4], ["FU", 7, [2, 3, 4]], ["AN", 7, 2, 6], ["FU", 5, [0, 1, 2]], ["SP", 5, 0, 64, [4], 1], ["AN", 5, 1, 2], ["FFSP", 5, 0, [3, 2, 1], 1, 1], ["AN", 5, 1, 6], ["FU", 3, [0, 1, 2]], ["SP", 3, 0, 16, [1], 1], ["AN", 3, 1, 2], ["FFSP", 3, 0, [3, 2, 1], 1, 1], ["AN", 3, 1, 6], ["PR", 6, 0, "auto_unroll_max_step$512"]]]], "r": [[0.0012526], 0, 2.64267, 1678474312], "v": "v0.6"}
{"i": [["[\"tw_kernel\", 1024, 1024, 512, 8, 128, \"float32\"]", "cuda -keys=cuda,gpu -arch=sm_70 -max_num_threads=1024 -model=unknown -thread_warp_size=32", [-1, 16, 64, 49152, 2147483647, 1024, 8, 32], "", 0, ["mask_k"]], [[], [["CHW", 4, "local"], ["SP", 4, 0, 128, [2, 4, 1, 1], 1], ["SP", 4, 5, 8, [1, 4, 1, 2], 1], ["SP", 4, 10, 1024, [2, 2, 8, 8], 1], ["SP", 4, 15, 512, [1, 1], 1], ["RE", 4, [0, 5, 10, 1, 6, 11, 2, 7, 12, 15, 16, 3, 8, 13, 17, 4, 9, 14]], ["FSP", 5, 0, 1, 3], ["FSP", 5, 4, 2, 3], ["FSP", 5, 8, 3, 3], ["RE", 5, [0, 4, 8, 1, 5, 9, 2, 6, 10, 3, 7, 11]], ["CA", 4, 5, 8], ["CHR", 3, "shared", [4]], ["CA", 4, 5, 9], ["CHR", 2, "shared", [5]], ["CA", 3, 6, 9], ["CI", 2], ["FU", 7, [0, 1, 2]], ["AN", 7, 0, 5], ["FU", 7, [1, 2, 3]], ["AN", 7, 1, 4], ["FU", 7, [2, 3, 4]], ["AN", 7, 2, 6], ["FU", 5, [0, 1, 2]], ["SP", 5, 0, 8, [1], 1], ["AN", 5, 1, 2], ["FFSP", 5, 0, [3, 2, 1], 1, 1], ["AN", 5, 1, 6], ["FU", 3, [0, 1, 2]], ["SP", 3, 0, 256, [1], 1], ["AN", 3, 1, 2], ["FFSP", 3, 0, [3, 2, 1], 1, 1], ["AN", 3, 1, 6], ["PR", 6, 0, "auto_unroll_max_step$1024"]]]], "r": [[0.0115215], 0, 4.08007, 1678474312], "v": "v0.6"}
{"i": [["[\"tw_kernel\", 1024, 1024, 512, 8, 128, \"float32\"]", "cuda -keys=cuda,gpu -arch=sm_70 -max_num_threads=1024 -model=unknown -thread_warp_size=32", [-1, 16, 64, 49152, 2147483647, 1024, 8, 32], "", 0, ["mask_k"]], [[], [["CHW", 4, "local"], ["SP", 4, 0, 128, [1, 2, 8, 1], 1], ["SP", 4, 5, 8, [1, 2, 2, 1], 1], ["SP", 4, 10, 1024, [2, 1, 8, 2], 1], ["SP", 4, 15, 512, [1, 16], 1], ["RE", 4, [0, 5, 10, 1, 6, 11, 2, 7, 12, 15, 16, 3, 8, 13, 17, 4, 9, 14]], ["FSP", 5, 0, 1, 3], ["FSP", 5, 4, 2, 3], ["FSP", 5, 8, 3, 3], ["RE", 5, [0, 4, 8, 1, 5, 9, 2, 6, 10, 3, 7, 11]], ["CA", 4, 5, 8], ["CHR", 3, "shared", [4]], ["CA", 4, 5, 9], ["CHR", 2, "shared", [5]], ["CA", 3, 6, 9], ["CI", 2], ["FU", 7, [0, 1, 2]], ["AN", 7, 0, 5], ["FU", 7, [1, 2, 3]], ["AN", 7, 1, 4], ["FU", 7, [2, 3, 4]], ["AN", 7, 2, 6], ["FU", 5, [0, 1, 2]], ["SP", 5, 0, 64, [1], 1], ["AN", 5, 1, 2], ["FFSP", 5, 0, [3, 2, 1], 1, 1], ["AN", 5, 1, 6], ["FU", 3, [0, 1, 2]], ["SP", 3, 0, 256, [1], 1], ["AN", 3, 1, 2], ["FFSP", 3, 0, [3, 2, 1], 1, 1], ["AN", 3, 1, 6], ["PR", 6, 0, "auto_unroll_max_step$64"]]]], "r": [[0.015028], 0, 1.88339, 1678474312], "v": "v0.6"}
{"i": [["[\"tw_kernel\", 1024, 1024, 512, 8, 128, \"float32\"]", "cuda -keys=cuda,gpu -arch=sm_70 -max_num_threads=1024 -model=unknown -thread_warp_size=32", [-1, 16, 64, 49152, 2147483647, 1024, 8, 32], "", 0, ["mask_k"]], [[], [["CHW", 4, "local"], ["SP", 4, 0, 128, [1, 1, 1, 1], 1], ["SP", 4, 5, 8, [1, 2, 1, 2], 1], ["SP", 4, 10, 1024, [2, 8, 1, 64], 1], ["SP", 4, 15, 512, [1, 1], 1], ["RE", 4, [0, 5, 10, 1, 6, 11, 2, 7, 12, 15, 16, 3, 8, 13, 17, 4, 9, 14]], ["FSP", 5, 0, 1, 3], ["FSP", 5, 4, 2, 3], ["FSP", 5, 8, 3, 3], ["RE", 5, [0, 4, 8, 1, 5, 9, 2, 6, 10, 3, 7, 11]], ["CA", 4, 5, 8], ["CHR", 3, "shared", [4]], ["CA", 4, 5, 9], ["CHR", 2, "shared", [5]], ["CA", 3, 6, 9], ["CI", 2], ["FU", 7, [0, 1, 2]], ["AN", 7, 0, 5], ["FU", 7, [1, 2, 3]], ["AN", 7, 1, 4], ["FU", 7, [2, 3, 4]], ["AN", 7, 2, 6], ["FU", 5, [0, 1, 2]], ["SP", 5, 0, 2, [1], 1], ["AN", 5, 1, 2], ["FFSP", 5, 0, [3, 2, 1], 1, 1], ["AN", 5, 1, 6], ["FU", 3, [0, 1, 2]], ["SP", 3, 0, 16, [4], 1], ["AN", 3, 1, 2], ["FFSP", 3, 0, [3, 2, 1], 1, 1], ["AN", 3, 1, 6], ["PR", 6, 0, "auto_unroll_max_step$1024"]]]], "r": [[0.00129698], 0, 1.86327, 1678474312], "v": "v0.6"}
{"i": [["[\"tw_kernel\", 1024, 1024, 512, 8, 128, \"float32\"]", "cuda -keys=cuda,gpu -arch=sm_70 -max_num_threads=1024 -model=unknown -thread_warp_size=32", [-1, 16, 64, 49152, 2147483647, 1024, 8, 32], "", 0, ["mask_k"]], [[], [["CHW", 4, "local"], ["SP", 4, 0, 128, [2, 4, 1, 4], 1], ["SP", 4, 5, 8, [2, 1, 4, 1], 1], ["SP", 4, 10, 1024, [1, 16, 1, 1], 1], ["SP", 4, 15, 512, [1, 1], 1], ["RE", 4, [0, 5, 10, 1, 6, 11, 2, 7, 12, 15, 16, 3, 8, 13, 17, 4, 9, 14]], ["FSP", 5, 0, 1, 3], ["FSP", 5, 4, 2, 3], ["FSP", 5, 8, 3, 3], ["RE", 5, [0, 4, 8, 1, 5, 9, 2, 6, 10, 3, 7, 11]], ["CA", 4, 5, 8], ["CHR", 3, "shared", [4]], ["CA", 4, 5, 9], ["CHR", 2, "shared", [5]], ["CA", 3, 6, 9], ["CI", 2], ["FU", 7, [0, 1, 2]], ["AN", 7, 0, 5], ["FU", 7, [1, 2, 3]], ["AN", 7, 1, 4], ["FU", 7, [2, 3, 4]], ["AN", 7, 2, 6], ["FU", 5, [0, 1, 2]], ["SP", 5, 0, 16, [1], 1], ["AN", 5, 1, 2], ["FFSP", 5, 0, [3, 2, 1], 1, 1], ["AN", 5, 1, 6], ["FU", 3, [0, 1, 2]], ["SP", 3, 0, 4, [1], 1], ["AN", 3, 1, 2], ["FFSP", 3, 0, [3, 2, 1], 1, 1], ["AN", 3, 1, 6], ["PR", 6, 0, "auto_unroll_max_step$1024"]]]], "r": [[0.000839079], 0, 1.05072, 1678474313], "v": "v0.6"}
{"i": [["[\"tw_kernel\", 1024, 1024, 512, 8, 128, \"float32\"]", "cuda -keys=cuda,gpu -arch=sm_70 -max_num_threads=1024 -model=unknown -thread_warp_size=32", [-1, 16, 64, 49152, 2147483647, 1024, 8, 32], "", 0, ["mask_k"]], [[], [["CHW", 4, "local"], ["SP", 4, 0, 128, [1, 1, 16, 1], 1], ["SP", 4, 5, 8, [2, 1, 2, 1], 1], ["SP", 4, 10, 1024, [1, 1, 2, 4], 1], ["SP", 4, 15, 512, [32, 1], 1], ["RE", 4, [0, 5, 10, 1, 6, 11, 2, 7, 12, 15, 16, 3, 8, 13, 17, 4, 9, 14]], ["FSP", 5, 0, 1, 3], ["FSP", 5, 4, 2, 3], ["FSP", 5, 8, 3, 3], ["RE", 5, [0, 4, 8, 1, 5, 9, 2, 6, 10, 3, 7, 11]], ["CA", 4, 5, 8], ["CHR", 3, "shared", [4]], ["CA", 4, 5, 9], ["CHR", 2, "shared", [5]], ["CA", 3, 6, 9], ["CI", 2], ["FU", 7, [0, 1, 2]], ["AN", 7, 0, 5], ["FU", 7, [1, 2, 3]], ["AN", 7, 1, 4], ["FU", 7, [2, 3, 4]], ["AN", 7, 2, 6], ["FU", 5, [0, 1, 2]], ["SP", 5, 0, 32, [1], 1], ["AN", 5, 1, 2], ["FFSP", 5, 0, [3, 2, 1], 1, 1], ["AN", 5, 1, 6], ["FU", 3, [0, 1, 2]], ["SP", 3, 0, 256, [1], 1], ["AN", 3, 1, 2], ["FFSP", 3, 0, [3, 2, 1], 1, 1], ["AN", 3, 1, 6], ["PR", 6, 0, "auto_unroll_max_step$1024"]]]], "r": [[0.0856699], 0, 4.2637, 1678474313], "v": "v0.6"}
{"i": [["[\"tw_kernel\", 1024, 1024, 512, 8, 128, \"float32\"]", "cuda -keys=cuda,gpu -arch=sm_70 -max_num_threads=1024 -model=unknown -thread_warp_size=32", [-1, 16, 64, 49152, 2147483647, 1024, 8, 32], "", 0, ["mask_k"]], [[], [["CHW", 4, "local"], ["SP", 4, 0, 128, [2, 1, 1, 1], 1], ["SP", 4, 5, 8, [1, 1, 8, 1], 1], ["SP", 4, 10, 1024, [1, 32, 2, 8], 1], ["SP", 4, 15, 512, [8, 1], 1], ["RE", 4, [0, 5, 10, 1, 6, 11, 2, 7, 12, 15, 16, 3, 8, 13, 17, 4, 9, 14]], ["FSP", 5, 0, 1, 3], ["FSP", 5, 4, 2, 3], ["FSP", 5, 8, 3, 3], ["RE", 5, [0, 4, 8, 1, 5, 9, 2, 6, 10, 3, 7, 11]], ["CA", 4, 5, 8], ["CHR", 3, "shared", [4]], ["CA", 4, 5, 9], ["CHR", 2, "shared", [5]], ["CA", 3, 6, 9], ["CI", 2], ["FU", 7, [0, 1, 2]], ["AN", 7, 0, 5], ["FU", 7, [1, 2, 3]], ["AN", 7, 1, 4], ["FU", 7, [2, 3, 4]], ["AN", 7, 2, 6], ["FU", 5, [0, 1, 2]], ["SP", 5, 0, 32, [1], 1], ["AN", 5, 1, 2], ["FFSP", 5, 0, [3, 2, 1], 1, 1], ["AN", 5, 1, 6], ["FU", 3, [0, 1, 2]], ["SP", 3, 0, 128, [1], 1], ["AN", 3, 1, 2], ["FFSP", 3, 0, [3, 2, 1], 1, 1], ["AN", 3, 1, 6], ["PR", 6, 0, "auto_unroll_max_step$1024"]]]], "r": [[0.00101437], 0, 2.85293, 1678474313], "v": "v0.6"}
{"i": [["[\"tw_kernel\", 1024, 1024, 512, 8, 128, \"float32\"]", "cuda -keys=cuda,gpu -arch=sm_70 -max_num_threads=1024 -model=unknown -thread_warp_size=32", [-1, 16, 64, 49152, 2147483647, 1024, 8, 32], "", 0, ["mask_k"]], [[], [["CHW", 4, "local"], ["SP", 4, 0, 128, [2, 1, 1, 1], 1], ["SP", 4, 5, 8, [1, 2, 4, 1], 1], ["SP", 4, 10, 1024, [1, 32, 2, 8], 1], ["SP", 4, 15, 512, [2, 1], 1], ["RE", 4, [0, 5, 10, 1, 6, 11, 2, 7, 12, 15, 16, 3, 8, 13, 17, 4, 9, 14]], ["FSP", 5, 0, 1, 3], ["FSP", 5, 4, 2, 3], ["FSP", 5, 8, 3, 3], ["RE", 5, [0, 4, 8, 1, 5, 9, 2, 6, 10, 3, 7, 11]], ["CA", 4, 5, 8], ["CHR", 3, "shared", [4]], ["CA", 4, 5, 9], ["CHR", 2, "shared", [5]], ["CA", 3, 6, 9], ["CI", 2], ["FU", 7, [0, 1, 2]], ["AN", 7, 0, 5], ["FU", 7, [1, 2, 3]], ["AN", 7, 1, 4], ["FU", 7, [2, 3, 4]], ["AN", 7, 2, 6], ["FU", 5, [0, 1, 2]], ["SP", 5, 0, 32, [1], 1], ["AN", 5, 1, 2], ["FFSP", 5, 0, [3, 2, 1], 1, 1], ["AN", 5, 1, 6], ["FU", 3, [0, 1, 2]], ["SP", 3, 0, 128, [1], 1], ["AN", 3, 1, 2], ["FFSP", 3, 0, [3, 2, 1], 1, 1], ["AN", 3, 1, 6], ["PR", 6, 0, "auto_unroll_max_step$1024"]]]], "r": [[0.000383146], 0, 1.46064, 1678474314], "v": "v0.6"}
{"i": [["[\"tw_kernel\", 1024, 1024, 512, 8, 128, \"float32\"]", "cuda -keys=cuda,gpu -arch=sm_70 -max_num_threads=1024 -model=unknown -thread_warp_size=32", [-1, 16, 64, 49152, 2147483647, 1024, 8, 32], "", 0, ["mask_k"]], [[], [["CHW", 4, "local"], ["SP", 4, 0, 128, [1, 2, 4, 2], 1], ["SP", 4, 5, 8, [1, 1, 2, 1], 1], ["SP", 4, 10, 1024, [1, 4, 1, 2], 1], ["SP", 4, 15, 512, [1, 32], 1], ["RE", 4, [0, 5, 10, 1, 6, 11, 2, 7, 12, 15, 16, 3, 8, 13, 17, 4, 9, 14]], ["FSP", 5, 0, 1, 3], ["FSP", 5, 4, 2, 3], ["FSP", 5, 8, 3, 3], ["RE", 5, [0, 4, 8, 1, 5, 9, 2, 6, 10, 3, 7, 11]], ["CA", 4, 5, 8], ["CHR", 3, "shared", [4]], ["CA", 4, 5, 9], ["CHR", 2, "shared", [5]], ["CA", 3, 6, 9], ["CI", 2], ["FU", 7, [0, 1, 2]], ["AN", 7, 0, 5], ["FU", 7, [1, 2, 3]], ["AN", 7, 1, 4], ["FU", 7, [2, 3, 4]], ["AN", 7, 2, 6], ["FU", 5, [0, 1, 2]], ["SP", 5, 0, 512, [1], 1], ["AN", 5, 1, 2], ["FFSP", 5, 0, [3, 2, 1], 1, 1], ["AN", 5, 1, 6], ["FU", 3, [0, 1, 2]], ["SP", 3, 0, 512, [1], 1], ["AN", 3, 1, 2], ["FFSP", 3, 0, [3, 2, 1], 1, 1], ["AN", 3, 1, 6], ["PR", 6, 0, "auto_unroll_max_step$512"]]]], "r": [[0.00234618], 0, 7.07684, 1678474314], "v": "v0.6"}
{"i": [["[\"tw_kernel\", 1024, 1024, 512, 8, 128, \"float32\"]", "cuda -keys=cuda,gpu -arch=sm_70 -max_num_threads=1024 -model=unknown -thread_warp_size=32", [-1, 16, 64, 49152, 2147483647, 1024, 8, 32], "", 0, ["mask_k"]], [[], [["CHW", 4, "local"], ["SP", 4, 0, 128, [1, 16, 1, 1], 1], ["SP", 4, 5, 8, [2, 1, 2, 1], 1], ["SP", 4, 10, 1024, [1, 16, 1, 1], 1], ["SP", 4, 15, 512, [8, 4], 1], ["RE", 4, [0, 5, 10, 1, 6, 11, 2, 7, 12, 15, 16, 3, 8, 13, 17, 4, 9, 14]], ["FSP", 5, 0, 1, 3], ["FSP", 5, 4, 2, 3], ["FSP", 5, 8, 3, 3], ["RE", 5, [0, 4, 8, 1, 5, 9, 2, 6, 10, 3, 7, 11]], ["CA", 4, 5, 8], ["CHR", 3, "shared", [4]], ["CA", 4, 5, 9], ["CHR", 2, "shared", [5]], ["CA", 3, 6, 9], ["CI", 2], ["FU", 7, [0, 1, 2]], ["AN", 7, 0, 5], ["FU", 7, [1, 2, 3]], ["AN", 7, 1, 4], ["FU", 7, [2, 3, 4]], ["AN", 7, 2, 6], ["FU", 5, [0, 1, 2]], ["SP", 5, 0, 64, [2], 1], ["AN", 5, 1, 2], ["FFSP", 5, 0, [3, 2, 1], 1, 1], ["AN", 5, 1, 6], ["FU", 3, [0, 1, 2]], ["SP", 3, 0, 32, [2], 1], ["AN", 3, 1, 2], ["FFSP", 3, 0, [3, 2, 1], 1, 1], ["AN", 3, 1, 6], ["PR", 6, 0, "auto_unroll_max_step$512"]]]], "r": [[0.000358039], 0, 1.29336, 1678474314], "v": "v0.6"}
{"i": [["[\"tw_kernel\", 1024, 1024, 512, 8, 128, \"float32\"]", "cuda -keys=cuda,gpu -arch=sm_70 -max_num_threads=1024 -model=unknown -thread_warp_size=32", [-1, 16, 64, 49152, 2147483647, 1024, 8, 32], "", 0, ["mask_k"]], [[], [["CHW", 4, "local"], ["SP", 4, 0, 128, [2, 4, 1, 2], 1], ["SP", 4, 5, 8, [4, 2, 1, 1], 1], ["SP", 4, 10, 1024, [1, 32, 1, 2], 1], ["SP", 4, 15, 512, [2, 1], 1], ["RE", 4, [0, 5, 10, 1, 6, 11, 2, 7, 12, 15, 16, 3, 8, 13, 17, 4, 9, 14]], ["FSP", 5, 0, 1, 3], ["FSP", 5, 4, 2, 3], ["FSP", 5, 8, 3, 3], ["RE", 5, [0, 4, 8, 1, 5, 9, 2, 6, 10, 3, 7, 11]], ["CA", 4, 5, 8], ["CHR", 3, "shared", [4]], ["CA", 4, 5, 9], ["CHR", 2, "shared", [5]], ["CA", 3, 6, 9], ["CI", 2], ["FU", 7, [0, 1, 2]], ["AN", 7, 0, 5], ["FU", 7, [1, 2, 3]], ["AN", 7, 1, 4], ["FU", 7, [2, 3, 4]], ["AN", 7, 2, 6], ["FU", 5, [0, 1, 2]], ["SP", 5, 0, 4, [4], 1], ["AN", 5, 1, 2], ["FFSP", 5, 0, [3, 2, 1], 1, 1], ["AN", 5, 1, 6], ["FU", 3, [0, 1, 2]], ["SP", 3, 0, 8, [1], 1], ["AN", 3, 1, 2], ["FFSP", 3, 0, [3, 2, 1], 1, 1], ["AN", 3, 1, 6], ["PR", 6, 0, "auto_unroll_max_step$64"]]]], "r": [[0.000384897], 0, 1.01042, 1678474315], "v": "v0.6"}
{"i": [["[\"tw_kernel\", 1024, 1024, 512, 8, 128, \"float32\"]", "cuda -keys=cuda,gpu -arch=sm_70 -max_num_threads=1024 -model=unknown -thread_warp_size=32", [-1, 16, 64, 49152, 2147483647, 1024, 8, 32], "", 0, ["mask_k"]], [[], [["CHW", 4, "local"], ["SP", 4, 0, 128, [1, 1, 2, 1], 1], ["SP", 4, 5, 8, [1, 4, 1, 1], 1], ["SP", 4, 10, 1024, [1, 32, 2, 1], 1], ["SP", 4, 15, 512, [2, 32], 1], ["RE", 4, [0, 5, 10, 1, 6, 11, 2, 7, 12, 15, 16, 3, 8, 13, 17, 4, 9, 14]], ["FSP", 5, 0, 1, 3], ["FSP", 5, 4, 2, 3], ["FSP", 5, 8, 3, 3], ["RE", 5, [0, 4, 8, 1, 5, 9, 2, 6, 10, 3, 7, 11]], ["CA", 4, 5, 8], ["CHR", 3, "shared", [4]], ["CA", 4, 5, 9], ["CHR", 2, "shared", [5]], ["CA", 3, 6, 9], ["CI", 2], ["FU", 7, [0, 1, 2]], ["AN", 7, 0, 5], ["FU", 7, [1, 2, 3]], ["AN", 7, 1, 4], ["FU", 7, [2, 3, 4]], ["AN", 7, 2, 6], ["FU", 5, [0, 1, 2]], ["SP", 5, 0, 128, [1], 1], ["AN", 5, 1, 2], ["FFSP", 5, 0, [3, 2, 1], 1, 1], ["AN", 5, 1, 6], ["FU", 3, [0, 1, 2]], ["SP", 3, 0, 512, [1], 1], ["AN", 3, 1, 2], ["FFSP", 3, 0, [3, 2, 1], 1, 1], ["AN", 3, 1, 6], ["PR", 6, 0, "auto_unroll_max_step$16"]]]], "r": [[0.00045251], 0, 1.39575, 1678474324], "v": "v0.6"}
{"i": [["[\"tw_kernel\", 1024, 1024, 512, 8, 128, \"float32\"]", "cuda -keys=cuda,gpu -arch=sm_70 -max_num_threads=1024 -model=unknown -thread_warp_size=32", [-1, 16, 64, 49152, 2147483647, 1024, 8, 32], "", 0, ["mask_k"]], [[], [["CHW", 4, "local"], ["SP", 4, 0, 128, [1, 64, 1, 1], 1], ["SP", 4, 5, 8, [1, 4, 1, 1], 1], ["SP", 4, 10, 1024, [1, 1, 1, 8], 1], ["SP", 4, 15, 512, [2, 1], 1], ["RE", 4, [0, 5, 10, 1, 6, 11, 2, 7, 12, 15, 16, 3, 8, 13, 17, 4, 9, 14]], ["FSP", 5, 0, 1, 3], ["FSP", 5, 4, 2, 3], ["FSP", 5, 8, 3, 3], ["RE", 5, [0, 4, 8, 1, 5, 9, 2, 6, 10, 3, 7, 11]], ["CA", 4, 5, 8], ["CHR", 3, "shared", [4]], ["CA", 4, 5, 9], ["CHR", 2, "shared", [5]], ["CA", 3, 6, 9], ["CI", 2], ["FU", 7, [0, 1, 2]], ["AN", 7, 0, 5], ["FU", 7, [1, 2, 3]], ["AN", 7, 1, 4], ["FU", 7, [2, 3, 4]], ["AN", 7, 2, 6], ["FU", 5, [0, 1, 2]], ["SP", 5, 0, 2, [1], 1], ["AN", 5, 1, 2], ["FFSP", 5, 0, [3, 2, 1], 1, 1], ["AN", 5, 1, 6], ["FU", 3, [0, 1, 2]], ["SP", 3, 0, 16, [1], 1], ["AN", 3, 1, 2], ["FFSP", 3, 0, [3, 2, 1], 1, 1], ["AN", 3, 1, 6], ["PR", 6, 0, "auto_unroll_max_step$0"]]]], "r": [[0.00117651], 0, 1.22224, 1678474324], "v": "v0.6"}
{"i": [["[\"tw_kernel\", 1024, 1024, 512, 8, 128, \"float32\"]", "cuda -keys=cuda,gpu -arch=sm_70 -max_num_threads=1024 -model=unknown -thread_warp_size=32", [-1, 16, 64, 49152, 2147483647, 1024, 8, 32], "", 0, ["mask_k"]], [[], [["CHW", 4, "local"], ["SP", 4, 0, 128, [1, 16, 1, 1], 1], ["SP", 4, 5, 8, [1, 2, 2, 1], 1], ["SP", 4, 10, 1024, [4, 1, 8, 1], 1], ["SP", 4, 15, 512, [1, 16], 1], ["RE", 4, [0, 5, 10, 1, 6, 11, 2, 7, 12, 15, 16, 3, 8, 13, 17, 4, 9, 14]], ["FSP", 5, 0, 1, 3], ["FSP", 5, 4, 2, 3], ["FSP", 5, 8, 3, 3], ["RE", 5, [0, 4, 8, 1, 5, 9, 2, 6, 10, 3, 7, 11]], ["CA", 4, 5, 8], ["CHR", 3, "shared", [4]], ["CA", 4, 5, 9], ["CHR", 2, "shared", [5]], ["CA", 3, 6, 9], ["CI", 2], ["FU", 7, [0, 1, 2]], ["AN", 7, 0, 5], ["FU", 7, [1, 2, 3]], ["AN", 7, 1, 4], ["FU", 7, [2, 3, 4]], ["AN", 7, 2, 6], ["FU", 5, [0, 1, 2]], ["SP", 5, 0, 64, [1], 1], ["AN", 5, 1, 2], ["FFSP", 5, 0, [3, 2, 1], 1, 1], ["AN", 5, 1, 6], ["FU", 3, [0, 1, 2]], ["SP", 3, 0, 256, [2], 1], ["AN", 3, 1, 2], ["FFSP", 3, 0, [3, 2, 1], 1, 1], ["AN", 3, 1, 6], ["PR", 6, 0, "auto_unroll_max_step$1024"]]]], "r": [[0.000893887], 0, 4.42274, 1678474324], "v": "v0.6"}
{"i": [["[\"tw_kernel\", 1024, 1024, 512, 8, 128, \"float32\"]", "cuda -keys=cuda,gpu -arch=sm_70 -max_num_threads=1024 -model=unknown -thread_warp_size=32", [-1, 16, 64, 49152, 2147483647, 1024, 8, 32], "", 0, ["mask_k"]], [[], [["CHW", 4, "local"], ["SP", 4, 0, 128, [2, 2, 1, 4], 1], ["SP", 4, 5, 8, [2, 1, 4, 1], 1], ["SP", 4, 10, 1024, [1, 16, 1, 1], 1], ["SP", 4, 15, 512, [1, 1], 1], ["RE", 4, [0, 5, 10, 1, 6, 11, 2, 7, 12, 15, 16, 3, 8, 13, 17, 4, 9, 14]], ["FSP", 5, 0, 1, 3], ["FSP", 5, 4, 2, 3], ["FSP", 5, 8, 3, 3], ["RE", 5, [0, 4, 8, 1, 5, 9, 2, 6, 10, 3, 7, 11]], ["CA", 4, 5, 8], ["CHR", 3, "shared", [4]], ["CA", 4, 5, 9], ["CHR", 2, "shared", [5]], ["CA", 3, 6, 9], ["CI", 2], ["FU", 7, [0, 1, 2]], ["AN", 7, 0, 5], ["FU", 7, [1, 2, 3]], ["AN", 7, 1, 4], ["FU", 7, [2, 3, 4]], ["AN", 7, 2, 6], ["FU", 5, [0, 1, 2]], ["SP", 5, 0, 16, [1], 1], ["AN", 5, 1, 2], ["FFSP", 5, 0, [3, 2, 1], 1, 1], ["AN", 5, 1, 6], ["FU", 3, [0, 1, 2]], ["SP", 3, 0, 4, [1], 1], ["AN", 3, 1, 2], ["FFSP", 3, 0, [3, 2, 1], 1, 1], ["AN", 3, 1, 6], ["PR", 6, 0, "auto_unroll_max_step$16"]]]], "r": [[0.000729125], 0, 1.35108, 1678474325], "v": "v0.6"}
{"i": [["[\"tw_kernel\", 1024, 1024, 512, 8, 128, \"float32\"]", "cuda -keys=cuda,gpu -arch=sm_70 -max_num_threads=1024 -model=unknown -thread_warp_size=32", [-1, 16, 64, 49152, 2147483647, 1024, 8, 32], "", 0, ["mask_k"]], [[], [["CHW", 4, "local"], ["SP", 4, 0, 128, [1, 4, 4, 4], 1], ["SP", 4, 5, 8, [1, 2, 4, 1], 1], ["SP", 4, 10, 1024, [1, 1, 1, 2], 1], ["SP", 4, 15, 512, [4, 2], 1], ["RE", 4, [0, 5, 10, 1, 6, 11, 2, 7, 12, 15, 16, 3, 8, 13, 17, 4, 9, 14]], ["FSP", 5, 0, 1, 3], ["FSP", 5, 4, 2, 3], ["FSP", 5, 8, 3, 3], ["RE", 5, [0, 4, 8, 1, 5, 9, 2, 6, 10, 3, 7, 11]], ["CA", 4, 5, 8], ["CHR", 3, "shared", [4]], ["CA", 4, 5, 9], ["CHR", 2, "shared", [5]], ["CA", 3, 6, 9], ["CI", 2], ["FU", 7, [0, 1, 2]], ["AN", 7, 0, 5], ["FU", 7, [1, 2, 3]], ["AN", 7, 1, 4], ["FU", 7, [2, 3, 4]], ["AN", 7, 2, 6], ["FU", 5, [0, 1, 2]], ["SP", 5, 0, 32, [1], 1], ["AN", 5, 1, 2], ["FFSP", 5, 0, [3, 2, 1], 1, 1], ["AN", 5, 1, 6], ["FU", 3, [0, 1, 2]], ["SP", 3, 0, 64, [4], 1], ["AN", 3, 1, 2], ["FFSP", 3, 0, [3, 2, 1], 1, 1], ["AN", 3, 1, 6], ["PR", 6, 0, "auto_unroll_max_step$16"]]]], "r": [[0.00551915], 0, 1.61567, 1678474325], "v": "v0.6"}
{"i": [["[\"tw_kernel\", 1024, 1024, 512, 8, 128, \"float32\"]", "cuda -keys=cuda,gpu -arch=sm_70 -max_num_threads=1024 -model=unknown -thread_warp_size=32", [-1, 16, 64, 49152, 2147483647, 1024, 8, 32], "", 0, ["mask_k"]], [[], [["CHW", 4, "local"], ["SP", 4, 0, 128, [1, 16, 1, 1], 1], ["SP", 4, 5, 8, [1, 1, 1, 2], 1], ["SP", 4, 10, 1024, [1, 4, 1, 1], 1], ["SP", 4, 15, 512, [1, 64], 1], ["RE", 4, [0, 5, 10, 1, 6, 11, 2, 7, 12, 15, 16, 3, 8, 13, 17, 4, 9, 14]], ["FSP", 5, 0, 1, 3], ["FSP", 5, 4, 2, 3], ["FSP", 5, 8, 3, 3], ["RE", 5, [0, 4, 8, 1, 5, 9, 2, 6, 10, 3, 7, 11]], ["CA", 4, 5, 8], ["CHR", 3, "shared", [4]], ["CA", 4, 5, 9], ["CHR", 2, "shared", [5]], ["CA", 3, 6, 9], ["CI", 2], ["FU", 7, [0, 1, 2]], ["AN", 7, 0, 5], ["FU", 7, [1, 2, 3]], ["AN", 7, 1, 4], ["FU", 7, [2, 3, 4]], ["AN", 7, 2, 6], ["FU", 5, [0, 1, 2]], ["SP", 5, 0, 256, [1], 1], ["AN", 5, 1, 2], ["FFSP", 5, 0, [3, 2, 1], 1, 1], ["AN", 5, 1, 6], ["FU", 3, [0, 1, 2]], ["SP", 3, 0, 128, [4], 1], ["AN", 3, 1, 2], ["FFSP", 3, 0, [3, 2, 1], 1, 1], ["AN", 3, 1, 6], ["PR", 6, 0, "auto_unroll_max_step$512"]]]], "r": [[0.00177372], 0, 1.39384, 1678474325], "v": "v0.6"}
{"i": [["[\"tw_kernel\", 1024, 1024, 512, 8, 128, \"float32\"]", "cuda -keys=cuda,gpu -arch=sm_70 -max_num_threads=1024 -model=unknown -thread_warp_size=32", [-1, 16, 64, 49152, 2147483647, 1024, 8, 32], "", 0, ["mask_k"]], [[], [["CHW", 4, "local"], ["SP", 4, 0, 128, [1, 4, 1, 2], 1], ["SP", 4, 5, 8, [2, 1, 1, 2], 1], ["SP", 4, 10, 1024, [4, 8, 2, 2], 1], ["SP", 4, 15, 512, [8, 1], 1], ["RE", 4, [0, 5, 10, 1, 6, 11, 2, 7, 12, 15, 16, 3, 8, 13, 17, 4, 9, 14]], ["FSP", 5, 0, 1, 3], ["FSP", 5, 4, 2, 3], ["FSP", 5, 8, 3, 3], ["RE", 5, [0, 4, 8, 1, 5, 9, 2, 6, 10, 3, 7, 11]], ["CA", 4, 5, 8], ["CHR", 3, "shared", [4]], ["CA", 4, 5, 9], ["CHR", 2, "shared", [5]], ["CA", 3, 6, 9], ["CI", 2], ["FU", 7, [0, 1, 2]], ["AN", 7, 0, 5], ["FU", 7, [1, 2, 3]], ["AN", 7, 1, 4], ["FU", 7, [2, 3, 4]], ["AN", 7, 2, 6], ["FU", 5, [0, 1, 2]], ["SP", 5, 0, 16, [1], 1], ["AN", 5, 1, 2], ["FFSP", 5, 0, [3, 2, 1], 1, 1], ["AN", 5, 1, 6], ["FU", 3, [0, 1, 2]], ["SP", 3, 0, 64, [1], 1], ["AN", 3, 1, 2], ["FFSP", 3, 0, [3, 2, 1], 1, 1], ["AN", 3, 1, 6], ["PR", 6, 0, "auto_unroll_max_step$16"]]]], "r": [[0.00165749], 0, 1.2854, 1678474326], "v": "v0.6"}
{"i": [["[\"tw_kernel\", 1024, 1024, 512, 8, 128, \"float32\"]", "cuda -keys=cuda,gpu -arch=sm_70 -max_num_threads=1024 -model=unknown -thread_warp_size=32", [-1, 16, 64, 49152, 2147483647, 1024, 8, 32], "", 0, ["mask_k"]], [[], [["CHW", 4, "local"], ["SP", 4, 0, 128, [2, 16, 4, 1], 1], ["SP", 4, 5, 8, [1, 1, 8, 1], 1], ["SP", 4, 10, 1024, [2, 2, 1, 2], 1], ["SP", 4, 15, 512, [1, 1], 1], ["RE", 4, [0, 5, 10, 1, 6, 11, 2, 7, 12, 15, 16, 3, 8, 13, 17, 4, 9, 14]], ["FSP", 5, 0, 1, 3], ["FSP", 5, 4, 2, 3], ["FSP", 5, 8, 3, 3], ["RE", 5, [0, 4, 8, 1, 5, 9, 2, 6, 10, 3, 7, 11]], ["CA", 4, 5, 8], ["CHR", 3, "shared", [4]], ["CA", 4, 5, 9], ["CHR", 2, "shared", [5]], ["CA", 3, 6, 9], ["CI", 2], ["FU", 7, [0, 1, 2]], ["AN", 7, 0, 5], ["FU", 7, [1, 2, 3]], ["AN", 7, 1, 4], ["FU", 7, [2, 3, 4]], ["AN", 7, 2, 6], ["FU", 5, [0, 1, 2]], ["SP", 5, 0, 8, [1], 1], ["AN", 5, 1, 2], ["FFSP", 5, 0, [3, 2, 1], 1, 1], ["AN", 5, 1, 6], ["FU", 3, [0, 1, 2]], ["SP", 3, 0, 8, [1], 1], ["AN", 3, 1, 2], ["FFSP", 3, 0, [3, 2, 1], 1, 1], ["AN", 3, 1, 6], ["PR", 6, 0, "auto_unroll_max_step$0"]]]], "r": [[0.00288012], 0, 1.47955, 1678474326], "v": "v0.6"}
{"i": [["[\"tw_kernel\", 1024, 1024, 512, 8, 128, \"float32\"]", "cuda -keys=cuda,gpu -arch=sm_70 -max_num_threads=1024 -model=unknown -thread_warp_size=32", [-1, 16, 64, 49152, 2147483647, 1024, 8, 32], "", 0, ["mask_k"]], [[], [["CHW", 4, "local"], ["SP", 4, 0, 128, [1, 16, 1, 2], 1], ["SP", 4, 5, 8, [2, 2, 1, 2], 1], ["SP", 4, 10, 1024, [4, 1, 2, 4], 1], ["SP", 4, 15, 512, [1, 2], 1], ["RE", 4, [0, 5, 10, 1, 6, 11, 2, 7, 12, 15, 16, 3, 8, 13, 17, 4, 9, 14]], ["FSP", 5, 0, 1, 3], ["FSP", 5, 4, 2, 3], ["FSP", 5, 8, 3, 3], ["RE", 5, [0, 4, 8, 1, 5, 9, 2, 6, 10, 3, 7, 11]], ["CA", 4, 5, 8], ["CHR", 3, "shared", [4]], ["CA", 4, 5, 9], ["CHR", 2, "shared", [5]], ["CA", 3, 6, 9], ["CI", 2], ["FU", 7, [0, 1, 2]], ["AN", 7, 0, 5], ["FU", 7, [1, 2, 3]], ["AN", 7, 1, 4], ["FU", 7, [2, 3, 4]], ["AN", 7, 2, 6], ["FU", 5, [0, 1, 2]], ["SP", 5, 0, 8, [1], 1], ["AN", 5, 1, 2], ["FFSP", 5, 0, [3, 2, 1], 1, 1], ["AN", 5, 1, 6], ["FU", 3, [0, 1, 2]], ["SP", 3, 0, 32, [1], 1], ["AN", 3, 1, 2], ["FFSP", 3, 0, [3, 2, 1], 1, 1], ["AN", 3, 1, 6], ["PR", 6, 0, "auto_unroll_max_step$16"]]]], "r": [[0.00212715], 0, 2.1111, 1678474326], "v": "v0.6"}
{"i": [["[\"tw_kernel\", 1024, 1024, 512, 8, 128, \"float32\"]", "cuda -keys=cuda,gpu -arch=sm_70 -max_num_threads=1024 -model=unknown -thread_warp_size=32", [-1, 16, 64, 49152, 2147483647, 1024, 8, 32], "", 0, ["mask_k"]], [[], [["CHW", 4, "local"], ["SP", 4, 0, 128, [1, 8, 1, 1], 1], ["SP", 4, 5, 8, [1, 1, 2, 4], 1], ["SP", 4, 10, 1024, [8, 2, 2, 4], 1], ["SP", 4, 15, 512, [2, 1], 1], ["RE", 4, [0, 5, 10, 1, 6, 11, 2, 7, 12, 15, 16, 3, 8, 13, 17, 4, 9, 14]], ["FSP", 5, 0, 1, 3], ["FSP", 5, 4, 2, 3], ["FSP", 5, 8, 3, 3], ["RE", 5, [0, 4, 8, 1, 5, 9, 2, 6, 10, 3, 7, 11]], ["CA", 4, 5, 8], ["CHR", 3, "shared", [4]], ["CA", 4, 5, 9], ["CHR", 2, "shared", [5]], ["CA", 3, 6, 9], ["CI", 2], ["FU", 7, [0, 1, 2]], ["AN", 7, 0, 5], ["FU", 7, [1, 2, 3]], ["AN", 7, 1, 4], ["FU", 7, [2, 3, 4]], ["AN", 7, 2, 6], ["FU", 5, [0, 1, 2]], ["SP", 5, 0, 16, [1], 1], ["AN", 5, 1, 2], ["FFSP", 5, 0, [3, 2, 1], 1, 1], ["AN", 5, 1, 6], ["FU", 3, [0, 1, 2]], ["SP", 3, 0, 16, [4], 1], ["AN", 3, 1, 2], ["FFSP", 3, 0, [3, 2, 1], 1, 1], ["AN", 3, 1, 6], ["PR", 6, 0, "auto_unroll_max_step$64"]]]], "r": [[0.00640154], 0, 2.31974, 1678474327], "v": "v0.6"}
{"i": [["[\"tw_kernel\", 1024, 1024, 512, 8, 128, \"float32\"]", "cuda -keys=cuda,gpu -arch=sm_70 -max_num_threads=1024 -model=unknown -thread_warp_size=32", [-1, 16, 64, 49152, 2147483647, 1024, 8, 32], "", 0, ["mask_k"]], [[], [["CHW", 4, "local"], ["SP", 4, 0, 128, [1, 32, 1, 1], 1], ["SP", 4, 5, 8, [1, 1, 1, 1], 1], ["SP", 4, 10, 1024, [1, 1, 2, 4], 1], ["SP", 4, 15, 512, [32, 1], 1], ["RE", 4, [0, 5, 10, 1, 6, 11, 2, 7, 12, 15, 16, 3, 8, 13, 17, 4, 9, 14]], ["FSP", 5, 0, 1, 3], ["FSP", 5, 4, 2, 3], ["FSP", 5, 8, 3, 3], ["RE", 5, [0, 4, 8, 1, 5, 9, 2, 6, 10, 3, 7, 11]], ["CA", 4, 5, 8], ["CHR", 3, "shared", [4]], ["CA", 4, 5, 9], ["CHR", 2, "shared", [5]], ["CA", 3, 6, 9], ["CI", 2], ["FU", 7, [0, 1, 2]], ["AN", 7, 0, 5], ["FU", 7, [1, 2, 3]], ["AN", 7, 1, 4], ["FU", 7, [2, 3, 4]], ["AN", 7, 2, 6], ["FU", 5, [0, 1, 2]], ["SP", 5, 0, 32, [2], 1], ["AN", 5, 1, 2], ["FFSP", 5, 0, [3, 2, 1], 1, 1], ["AN", 5, 1, 6], ["FU", 3, [0, 1, 2]], ["SP", 3, 0, 256, [1], 1], ["AN", 3, 1, 2], ["FFSP", 3, 0, [3, 2, 1], 1, 1], ["AN", 3, 1, 6], ["PR", 6, 0, "auto_unroll_max_step$1024"]]]], "r": [[0.00335623], 0, 3.21493, 1678474327], "v": "v0.6"}
{"i": [["[\"tw_kernel\", 1024, 1024, 512, 8, 128, \"float32\"]", "cuda -keys=cuda,gpu -arch=sm_70 -max_num_threads=1024 -model=unknown -thread_warp_size=32", [-1, 16, 64, 49152, 2147483647, 1024, 8, 32], "", 0, ["mask_k"]], [[], [["CHW", 4, "local"], ["SP", 4, 0, 128, [1, 2, 2, 4], 1], ["SP", 4, 5, 8, [2, 1, 1, 1], 1], ["SP", 4, 10, 1024, [1, 4, 8, 1], 1], ["SP", 4, 15, 512, [1, 4], 1], ["RE", 4, [0, 5, 10, 1, 6, 11, 2, 7, 12, 15, 16, 3, 8, 13, 17, 4, 9, 14]], ["FSP", 5, 0, 1, 3], ["FSP", 5, 4, 2, 3], ["FSP", 5, 8, 3, 3], ["RE", 5, [0, 4, 8, 1, 5, 9, 2, 6, 10, 3, 7, 11]], ["CA", 4, 5, 8], ["CHR", 3, "shared", [4]], ["CA", 4, 5, 9], ["CHR", 2, "shared", [5]], ["CA", 3, 6, 9], ["CI", 2], ["FU", 7, [0, 1, 2]], ["AN", 7, 0, 5], ["FU", 7, [1, 2, 3]], ["AN", 7, 1, 4], ["FU", 7, [2, 3, 4]], ["AN", 7, 2, 6], ["FU", 5, [0, 1, 2]], ["SP", 5, 0, 64, [4], 1], ["AN", 5, 1, 2], ["FFSP", 5, 0, [3, 2, 1], 1, 1], ["AN", 5, 1, 6], ["FU", 3, [0, 1, 2]], ["SP", 3, 0, 256, [1], 1], ["AN", 3, 1, 2], ["FFSP", 3, 0, [3, 2, 1], 1, 1], ["AN", 3, 1, 6], ["PR", 6, 0, "auto_unroll_max_step$16"]]]], "r": [[0.0053798], 0, 1.58092, 1678474327], "v": "v0.6"}
{"i": [["[\"tw_kernel\", 1024, 1024, 512, 8, 128, \"float32\"]", "cuda -keys=cuda,gpu -arch=sm_70 -max_num_threads=1024 -model=unknown -thread_warp_size=32", [-1, 16, 64, 49152, 2147483647, 1024, 8, 32], "", 0, ["mask_k"]], [[], [["CHW", 4, "local"], ["SP", 4, 0, 128, [1, 16, 1, 1], 1], ["SP", 4, 5, 8, [1, 2, 2, 2], 1], ["SP", 4, 10, 1024, [2, 1, 4, 2], 1], ["SP", 4, 15, 512, [1, 16], 1], ["RE", 4, [0, 5, 10, 1, 6, 11, 2, 7, 12, 15, 16, 3, 8, 13, 17, 4, 9, 14]], ["FSP", 5, 0, 1, 3], ["FSP", 5, 4, 2, 3], ["FSP", 5, 8, 3, 3], ["RE", 5, [0, 4, 8, 1, 5, 9, 2, 6, 10, 3, 7, 11]], ["CA", 4, 5, 8], ["CHR", 3, "shared", [4]], ["CA", 4, 5, 9], ["CHR", 2, "shared", [5]], ["CA", 3, 6, 9], ["CI", 2], ["FU", 7, [0, 1, 2]], ["AN", 7, 0, 5], ["FU", 7, [1, 2, 3]], ["AN", 7, 1, 4], ["FU", 7, [2, 3, 4]], ["AN", 7, 2, 6], ["FU", 5, [0, 1, 2]], ["SP", 5, 0, 64, [1], 1], ["AN", 5, 1, 2], ["FFSP", 5, 0, [3, 2, 1], 1, 1], ["AN", 5, 1, 6], ["FU", 3, [0, 1, 2]], ["SP", 3, 0, 256, [1], 1], ["AN", 3, 1, 2], ["FFSP", 3, 0, [3, 2, 1], 1, 1], ["AN", 3, 1, 6], ["PR", 6, 0, "auto_unroll_max_step$64"]]]], "r": [[0.000688847], 0, 1.5298, 1678474327], "v": "v0.6"}
{"i": [["[\"tw_kernel\", 1024, 1024, 512, 8, 128, \"float32\"]", "cuda -keys=cuda,gpu -arch=sm_70 -max_num_threads=1024 -model=unknown -thread_warp_size=32", [-1, 16, 64, 49152, 2147483647, 1024, 8, 32], "", 0, ["mask_k"]], [[], [["CHW", 4, "local"], ["SP", 4, 0, 128, [1, 16, 1, 2], 1], ["SP", 4, 5, 8, [2, 2, 1, 2], 1], ["SP", 4, 10, 1024, [4, 1, 1, 2], 1], ["SP", 4, 15, 512, [1, 2], 1], ["RE", 4, [0, 5, 10, 1, 6, 11, 2, 7, 12, 15, 16, 3, 8, 13, 17, 4, 9, 14]], ["FSP", 5, 0, 1, 3], ["FSP", 5, 4, 2, 3], ["FSP", 5, 8, 3, 3], ["RE", 5, [0, 4, 8, 1, 5, 9, 2, 6, 10, 3, 7, 11]], ["CA", 4, 5, 8], ["CHR", 3, "shared", [4]], ["CA", 4, 5, 9], ["CHR", 2, "shared", [5]], ["CA", 3, 6, 9], ["CI", 2], ["FU", 7, [0, 1, 2]], ["AN", 7, 0, 5], ["FU", 7, [1, 2, 3]], ["AN", 7, 1, 4], ["FU", 7, [2, 3, 4]], ["AN", 7, 2, 6], ["FU", 5, [0, 1, 2]], ["SP", 5, 0, 8, [2], 1], ["AN", 5, 1, 2], ["FFSP", 5, 0, [3, 2, 1], 1, 1], ["AN", 5, 1, 6], ["FU", 3, [0, 1, 2]], ["SP", 3, 0, 32, [1], 1], ["AN", 3, 1, 2], ["FFSP", 3, 0, [3, 2, 1], 1, 1], ["AN", 3, 1, 6], ["PR", 6, 0, "auto_unroll_max_step$64"]]]], "r": [[0.000890766], 0, 1.24991, 1678474328], "v": "v0.6"}
{"i": [["[\"tw_kernel\", 1024, 1024, 512, 8, 128, \"float32\"]", "cuda -keys=cuda,gpu -arch=sm_70 -max_num_threads=1024 -model=unknown -thread_warp_size=32", [-1, 16, 64, 49152, 2147483647, 1024, 8, 32], "", 0, ["mask_k"]], [[], [["CHW", 4, "local"], ["SP", 4, 0, 128, [1, 1, 1, 1], 1], ["SP", 4, 5, 8, [2, 1, 1, 2], 1], ["SP", 4, 10, 1024, [1, 1, 2, 4], 1], ["SP", 4, 15, 512, [32, 1], 1], ["RE", 4, [0, 5, 10, 1, 6, 11, 2, 7, 12, 15, 16, 3, 8, 13, 17, 4, 9, 14]], ["FSP", 5, 0, 1, 3], ["FSP", 5, 4, 2, 3], ["FSP", 5, 8, 3, 3], ["RE", 5, [0, 4, 8, 1, 5, 9, 2, 6, 10, 3, 7, 11]], ["CA", 4, 5, 8], ["CHR", 3, "shared", [4]], ["CA", 4, 5, 9], ["CHR", 2, "shared", [5]], ["CA", 3, 6, 9], ["CI", 2], ["FU", 7, [0, 1, 2]], ["AN", 7, 0, 5], ["FU", 7, [1, 2, 3]], ["AN", 7, 1, 4], ["FU", 7, [2, 3, 4]], ["AN", 7, 2, 6], ["FU", 5, [0, 1, 2]], ["SP", 5, 0, 32, [1], 1], ["AN", 5, 1, 2], ["FFSP", 5, 0, [3, 2, 1], 1, 1], ["AN", 5, 1, 6], ["FU", 3, [0, 1, 2]], ["SP", 3, 0, 256, [1], 1], ["AN", 3, 1, 2], ["FFSP", 3, 0, [3, 2, 1], 1, 1], ["AN", 3, 1, 6], ["PR", 6, 0, "auto_unroll_max_step$1024"]]]], "r": [[0.00478942], 0, 2.91831, 1678474328], "v": "v0.6"}
{"i": [["[\"tw_kernel\", 1024, 1024, 512, 8, 128, \"float32\"]", "cuda -keys=cuda,gpu -arch=sm_70 -max_num_threads=1024 -model=unknown -thread_warp_size=32", [-1, 16, 64, 49152, 2147483647, 1024, 8, 32], "", 0, ["mask_k"]], [[], [["CHW", 4, "local"], ["SP", 4, 0, 128, [1, 16, 1, 1], 1], ["SP", 4, 5, 8, [2, 2, 2, 1], 1], ["SP", 4, 10, 1024, [1, 16, 1, 1], 1], ["SP", 4, 15, 512, [4, 2], 1], ["RE", 4, [0, 5, 10, 1, 6, 11, 2, 7, 12, 15, 16, 3, 8, 13, 17, 4, 9, 14]], ["FSP", 5, 0, 1, 3], ["FSP", 5, 4, 2, 3], ["FSP", 5, 8, 3, 3], ["RE", 5, [0, 4, 8, 1, 5, 9, 2, 6, 10, 3, 7, 11]], ["CA", 4, 5, 8], ["CHR", 3, "shared", [4]], ["CA", 4, 5, 9], ["CHR", 2, "shared", [5]], ["CA", 3, 6, 9], ["CI", 2], ["FU", 7, [0, 1, 2]], ["AN", 7, 0, 5], ["FU", 7, [1, 2, 3]], ["AN", 7, 1, 4], ["FU", 7, [2, 3, 4]], ["AN", 7, 2, 6], ["FU", 5, [0, 1, 2]], ["SP", 5, 0, 16, [1], 1], ["AN", 5, 1, 2], ["FFSP", 5, 0, [3, 2, 1], 1, 1], ["AN", 5, 1, 6], ["FU", 3, [0, 1, 2]], ["SP", 3, 0, 32, [2], 1], ["AN", 3, 1, 2], ["FFSP", 3, 0, [3, 2, 1], 1, 1], ["AN", 3, 1, 6], ["PR", 6, 0, "auto_unroll_max_step$512"]]]], "r": [[0.000305977], 0, 1.05199, 1678474329], "v": "v0.6"}
