AutoSchedule/Outputs/Ansor/tw_1024_1024_1024_ts16_spar70_1024_float32_gpu_trails2000.json
{"i": [["[\"tw_kernel\", 1024, 1024, 307, 16, 64, \"float32\"]", "cuda -keys=cuda,gpu -arch=sm_70 -max_num_threads=1024 -model=unknown -thread_warp_size=32", [-1, 16, 64, 49152, 2147483647, 1024, 8, 32], "", 0, ["mask_k"]], [[], [["CHW", 4, "local"], ["SP", 4, 0, 64, [1, 4, 4, 2], 1], ["SP", 4, 5, 16, [1, 1, 16, 1], 1], ["SP", 4, 10, 1024, [1, 32, 8, 1], 1], ["SP", 4, 15, 307, [1, 1], 1], ["RE", 4, [0, 5, 10, 1, 6, 11, 2, 7, 12, 15, 16, 3, 8, 13, 17, 4, 9, 14]], ["FSP", 5, 0, 1, 3], ["FSP", 5, 4, 2, 3], ["FSP", 5, 8, 3, 3], ["RE", 5, [0, 4, 8, 1, 5, 9, 2, 6, 10, 3, 7, 11]], ["CA", 4, 5, 8], ["CHR", 3, "shared", [4]], ["CA", 4, 5, 9], ["CHR", 2, "shared", [5]], ["CA", 3, 6, 9], ["CI", 2], ["FU", 7, [0, 1, 2]], ["AN", 7, 0, 5], ["FU", 7, [1, 2, 3]], ["AN", 7, 1, 4], ["FU", 7, [2, 3, 4]], ["AN", 7, 2, 6], ["FU", 5, [0, 1, 2]], ["SP", 5, 0, 128, [4], 1], ["AN", 5, 1, 2], ["FFSP", 5, 0, [3, 2, 1], 1, 1], ["AN", 5, 1, 6], ["FU", 3, [0, 1, 2]], ["SP", 3, 0, 64, [1], 1], ["AN", 3, 1, 2], ["FFSP", 3, 0, [3, 2, 1], 1, 1], ["AN", 3, 1, 6], ["PR", 6, 0, "auto_unroll_max_step$64"]]]], "r": [[0.00757769], 0, 3.78236, 1678515301], "v": "v0.6"}
{"i": [["[\"tw_kernel\", 1024, 1024, 307, 16, 64, \"float32\"]", "cuda -keys=cuda,gpu -arch=sm_70 -max_num_threads=1024 -model=unknown -thread_warp_size=32", [-1, 16, 64, 49152, 2147483647, 1024, 8, 32], "", 0, ["mask_k"]], [[], [["CHW", 4, "local"], ["SP", 4, 0, 64, [1, 2, 1, 8], 1], ["SP", 4, 5, 16, [1, 1, 1, 2], 1], ["SP", 4, 10, 1024, [2, 128, 1, 2], 1], ["SP", 4, 15, 307, [1, 1], 1], ["RE", 4, [0, 5, 10, 1, 6, 11, 2, 7, 12, 15, 16, 3, 8, 13, 17, 4, 9, 14]], ["FSP", 5, 0, 1, 3], ["FSP", 5, 4, 2, 3], ["FSP", 5, 8, 3, 3], ["RE", 5, [0, 4, 8, 1, 5, 9, 2, 6, 10, 3, 7, 11]], ["CA", 4, 5, 8], ["CHR", 3, "shared", [4]], ["CA", 4, 5, 9], ["CHR", 2, "shared", [5]], ["CA", 3, 6, 9], ["CI", 2], ["FU", 7, [0, 1, 2]], ["AN", 7, 0, 5], ["FU", 7, [1, 2, 3]], ["AN", 7, 1, 4], ["FU", 7, [2, 3, 4]], ["AN", 7, 2, 6], ["FU", 5, [0, 1, 2]], ["SP", 5, 0, 16, [16], 1], ["AN", 5, 1, 2], ["FFSP", 5, 0, [3, 2, 1], 1, 1], ["AN", 5, 1, 6], ["FU", 3, [0, 1, 2]], ["SP", 3, 0, 16, [1], 1], ["AN", 3, 1, 2], ["FFSP", 3, 0, [3, 2, 1], 1, 1], ["AN", 3, 1, 6], ["PR", 6, 0, "auto_unroll_max_step$0"]]]], "r": [[0.0006354], 0, 1.48757, 1678515301], "v": "v0.6"}
{"i": [["[\"tw_kernel\", 1024, 1024, 307, 16, 64, \"float32\"]", "cuda -keys=cuda,gpu -arch=sm_70 -max_num_threads=1024 -model=unknown -thread_warp_size=32", [-1, 16, 64, 49152, 2147483647, 1024, 8, 32], "", 0, ["mask_k"]], [[], [["CHW", 4, "local"], ["SP", 4, 0, 64, [1, 2, 8, 1], 1], ["SP", 4, 5, 16, [1, 1, 8, 2], 1], ["SP", 4, 10, 1024, [1, 128, 4, 1], 1], ["SP", 4, 15, 307, [1, 1], 1], ["RE", 4, [0, 5, 10, 1, 6, 11, 2, 7, 12, 15, 16, 3, 8, 13, 17, 4, 9, 14]], ["FSP", 5, 0, 1, 3], ["FSP", 5, 4, 2, 3], ["FSP", 5, 8, 3, 3], ["RE", 5, [0, 4, 8, 1, 5, 9, 2, 6, 10, 3, 7, 11]], ["CA", 4, 5, 8], ["CHR", 3, "shared", [4]], ["CA", 4, 5, 9], ["CHR", 2, "shared", [5]], ["CA", 3, 6, 9], ["CI", 2], ["FU", 7, [0, 1, 2]], ["AN", 7, 0, 5], ["FU", 7, [1, 2, 3]], ["AN", 7, 1, 4], ["FU", 7, [2, 3, 4]], ["AN", 7, 2, 6], ["FU", 5, [0, 1, 2]], ["SP", 5, 0, 64, [1], 1], ["AN", 5, 1, 2], ["FFSP", 5, 0, [3, 2, 1], 1, 1], ["AN", 5, 1, 6], ["FU", 3, [0, 1, 2]], ["SP", 3, 0, 32, [2], 1], ["AN", 3, 1, 2], ["FFSP", 3, 0, [3, 2, 1], 1, 1], ["AN", 3, 1, 6], ["PR", 6, 0, "auto_unroll_max_step$1024"]]]], "r": [[0.00541141], 0, 3.98531, 1678515301], "v": "v0.6"}
{"i": [["[\"tw_kernel\", 1024, 1024, 307, 16, 64, \"float32\"]", "cuda -keys=cuda,gpu -arch=sm_70 -max_num_threads=1024 -model=unknown -thread_warp_size=32", [-1, 16, 64, 49152, 2147483647, 1024, 8, 32], "", 0, ["mask_k"]], [[], [["CHW", 4, "local"], ["SP", 4, 0, 64, [1, 8, 1, 1], 1], ["SP", 4, 5, 16, [1, 2, 1, 8], 1], ["SP", 4, 10, 1024, [1, 32, 4, 1], 1], ["SP", 4, 15, 307, [1, 1], 1], ["RE", 4, [0, 5, 10, 1, 6, 11, 2, 7, 12, 15, 16, 3, 8, 13, 17, 4, 9, 14]], ["FSP", 5, 0, 1, 3], ["FSP", 5, 4, 2, 3], ["FSP", 5, 8, 3, 3], ["RE", 5, [0, 4, 8, 1, 5, 9, 2, 6, 10, 3, 7, 11]], ["CA", 4, 5, 8], ["CHR", 3, "shared", [4]], ["CA", 4, 5, 9], ["CHR", 2, "shared", [5]], ["CA", 3, 6, 9], ["CI", 2], ["FU", 7, [0, 1, 2]], ["AN", 7, 0, 5], ["FU", 7, [1, 2, 3]], ["AN", 7, 1, 4], ["FU", 7, [2, 3, 4]], ["AN", 7, 2, 6], ["FU", 5, [0, 1, 2]], ["SP", 5, 0, 8, [1], 1], ["AN", 5, 1, 2], ["FFSP", 5, 0, [3, 2, 1], 1, 1], ["AN", 5, 1, 6], ["FU", 3, [0, 1, 2]], ["SP", 3, 0, 2, [1], 1], ["AN", 3, 1, 2], ["FFSP", 3, 0, [3, 2, 1], 1, 1], ["AN", 3, 1, 6], ["PR", 6, 0, "auto_unroll_max_step$0"]]]], "r": [[0.000263371], 0, 1.32854, 1678515302], "v": "v0.6"}
{"i": [["[\"tw_kernel\", 1024, 1024, 307, 16, 64, \"float32\"]", "cuda -keys=cuda,gpu -arch=sm_70 -max_num_threads=1024 -model=unknown -thread_warp_size=32", [-1, 16, 64, 49152, 2147483647, 1024, 8, 32], "", 0, ["mask_k"]], [[], [["CHW", 4, "local"], ["SP", 4, 0, 64, [1, 2, 8, 1], 1], ["SP", 4, 5, 16, [1, 4, 1, 2], 1], ["SP", 4, 10, 1024, [1, 64, 4, 1], 1], ["SP", 4, 15, 307, [1, 1], 1], ["RE", 4, [0, 5, 10, 1, 6, 11, 2, 7, 12, 15, 16, 3, 8, 13, 17, 4, 9, 14]], ["FSP", 5, 0, 1, 3], ["FSP", 5, 4, 2, 3], ["FSP", 5, 8, 3, 3], ["RE", 5, [0, 4, 8, 1, 5, 9, 2, 6, 10, 3, 7, 11]], ["CA", 4, 5, 8], ["CHR", 3, "shared", [4]], ["CA", 4, 5, 9], ["CHR", 2, "shared", [5]], ["CA", 3, 6, 9], ["CI", 2], ["FU", 7, [0, 1, 2]], ["AN", 7, 0, 5], ["FU", 7, [1, 2, 3]], ["AN", 7, 1, 4], ["FU", 7, [2, 3, 4]], ["AN", 7, 2, 6], ["FU", 5, [0, 1, 2]], ["SP", 5, 0, 8, [2], 1], ["AN", 5, 1, 2], ["FFSP", 5, 0, [3, 2, 1], 1, 1], ["AN", 5, 1, 6], ["FU", 3, [0, 1, 2]], ["SP", 3, 0, 32, [1], 1], ["AN", 3, 1, 2], ["FFSP", 3, 0, [3, 2, 1], 1, 1], ["AN", 3, 1, 6], ["PR", 6, 0, "auto_unroll_max_step$16"]]]], "r": [[0.00046912], 0, 1.37366, 1678515302], "v": "v0.6"}
{"i": [["[\"tw_kernel\", 1024, 1024, 307, 16, 64, \"float32\"]", "cuda -keys=cuda,gpu -arch=sm_70 -max_num_threads=1024 -model=unknown -thread_warp_size=32", [-1, 16, 64, 49152, 2147483647, 1024, 8, 32], "", 0, ["mask_k"]], [[], [["CHW", 4, "local"], ["SP", 4, 0, 64, [4, 2, 1, 1], 1], ["SP", 4, 5, 16, [1, 1, 1, 16], 1], ["SP", 4, 10, 1024, [1, 16, 2, 1], 1], ["SP", 4, 15, 307, [1, 1], 1], ["RE", 4, [0, 5, 10, 1, 6, 11, 2, 7, 12, 15, 16, 3, 8, 13, 17, 4, 9, 14]], ["FSP", 5, 0, 1, 3], ["FSP", 5, 4, 2, 3], ["FSP", 5, 8, 3, 3], ["RE", 5, [0, 4, 8, 1, 5, 9, 2, 6, 10, 3, 7, 11]], ["CA", 4, 5, 8], ["CHR", 3, "shared", [4]], ["CA", 4, 5, 9], ["CHR", 2, "shared", [5]], ["CA", 3, 6, 9], ["CI", 2], ["FU", 7, [0, 1, 2]], ["AN", 7, 0, 5], ["FU", 7, [1, 2, 3]], ["AN", 7, 1, 4], ["FU", 7, [2, 3, 4]], ["AN", 7, 2, 6], ["FU", 5, [0, 1, 2]], ["SP", 5, 0, 1, [1], 1], ["AN", 5, 1, 2], ["FFSP", 5, 0, [3, 2, 1], 1, 1], ["AN", 5, 1, 6], ["FU", 3, [0, 1, 2]], ["SP", 3, 0, 2, [1], 1], ["AN", 3, 1, 2], ["FFSP", 3, 0, [3, 2, 1], 1, 1], ["AN", 3, 1, 6], ["PR", 6, 0, "auto_unroll_max_step$64"]]]], "r": [[0.000340281], 0, 1.93964, 1678515302], "v": "v0.6"}
{"i": [["[\"tw_kernel\", 1024, 1024, 307, 16, 64, \"float32\"]", "cuda -keys=cuda,gpu -arch=sm_70 -max_num_threads=1024 -model=unknown -thread_warp_size=32", [-1, 16, 64, 49152, 2147483647, 1024, 8, 32], "", 0, ["mask_k"]], [[], [["CHW", 4, "local"], ["SP", 4, 0, 64, [1, 1, 4, 1], 1], ["SP", 4, 5, 16, [1, 4, 4, 1], 1], ["SP", 4, 10, 1024, [2, 64, 1, 8], 1], ["SP", 4, 15, 307, [1, 1], 1], ["RE", 4, [0, 5, 10, 1, 6, 11, 2, 7, 12, 15, 16, 3, 8, 13, 17, 4, 9, 14]], ["FSP", 5, 0, 1, 3], ["FSP", 5, 4, 2, 3], ["FSP", 5, 8, 3, 3], ["RE", 5, [0, 4, 8, 1, 5, 9, 2, 6, 10, 3, 7, 11]], ["CA", 4, 5, 8], ["CHR", 3, "shared", [4]], ["CA", 4, 5, 9], ["CHR", 2, "shared", [5]], ["CA", 3, 6, 9], ["CI", 2], ["FU", 7, [0, 1, 2]], ["AN", 7, 0, 5], ["FU", 7, [1, 2, 3]], ["AN", 7, 1, 4], ["FU", 7, [2, 3, 4]], ["AN", 7, 2, 6], ["FU", 5, [0, 1, 2]], ["SP", 5, 0, 16, [2], 1], ["AN", 5, 1, 2], ["FFSP", 5, 0, [3, 2, 1], 1, 1], ["AN", 5, 1, 6], ["FU", 3, [0, 1, 2]], ["SP", 3, 0, 64, [1], 1], ["AN", 3, 1, 2], ["FFSP", 3, 0, [3, 2, 1], 1, 1], ["AN", 3, 1, 6], ["PR", 6, 0, "auto_unroll_max_step$512"]]]], "r": [[0.000778881], 0, 2.09028, 1678515303], "v": "v0.6"}
{"i": [["[\"tw_kernel\", 1024, 1024, 307, 16, 64, \"float32\"]", "cuda -keys=cuda,gpu -arch=sm_70 -max_num_threads=1024 -model=unknown -thread_warp_size=32", [-1, 16, 64, 49152, 2147483647, 1024, 8, 32], "", 0, ["mask_k"]], [[], [["CHW", 4, "local"], ["SP", 4, 0, 64, [1, 1, 1, 1], 1], ["SP", 4, 5, 16, [1, 4, 4, 1], 1], ["SP", 4, 10, 1024, [2, 8, 4, 1], 1], ["SP", 4, 15, 307, [1, 1], 1], ["RE", 4, [0, 5, 10, 1, 6, 11, 2, 7, 12, 15, 16, 3, 8, 13, 17, 4, 9, 14]], ["FSP", 5, 0, 1, 3], ["FSP", 5, 4, 2, 3], ["FSP", 5, 8, 3, 3], ["RE", 5, [0, 4, 8, 1, 5, 9, 2, 6, 10, 3, 7, 11]], ["CA", 4, 5, 8], ["CHR", 3, "shared", [4]], ["CA", 4, 5, 9], ["CHR", 2, "shared", [5]], ["CA", 3, 6, 9], ["CI", 2], ["FU", 7, [0, 1, 2]], ["AN", 7, 0, 5], ["FU", 7, [1, 2, 3]], ["AN", 7, 1, 4], ["FU", 7, [2, 3, 4]], ["AN", 7, 2, 6], ["FU", 5, [0, 1, 2]], ["SP", 5, 0, 4, [4], 1], ["AN", 5, 1, 2], ["FFSP", 5, 0, [3, 2, 1], 1, 1], ["AN", 5, 1, 6], ["FU", 3, [0, 1, 2]], ["SP", 3, 0, 4, [4], 1], ["AN", 3, 1, 2], ["FFSP", 3, 0, [3, 2, 1], 1, 1], ["AN", 3, 1, 6], ["PR", 6, 0, "auto_unroll_max_step$0"]]]], "r": [[0.000178185], 0, 1.14699, 1678515303], "v": "v0.6"}
{"i": [["[\"tw_kernel\", 1024, 1024, 307, 16, 64, \"float32\"]", "cuda -keys=cuda,gpu -arch=sm_70 -max_num_threads=1024 -model=unknown -thread_warp_size=32", [-1, 16, 64, 49152, 2147483647, 1024, 8, 32], "", 0, ["mask_k"]], [[], [["CHW", 4, "local"], ["SP", 4, 0, 64, [2, 4, 1, 2], 1], ["SP", 4, 5, 16, [2, 8, 1, 1], 1], ["SP", 4, 10, 1024, [2, 2, 8, 1], 1], ["SP", 4, 15, 307, [1, 1], 1], ["RE", 4, [0, 5, 10, 1, 6, 11, 2, 7, 12, 15, 16, 3, 8, 13, 17, 4, 9, 14]], ["FSP", 5, 0, 1, 3], ["FSP", 5, 4, 2, 3], ["FSP", 5, 8, 3, 3], ["RE", 5, [0, 4, 8, 1, 5, 9, 2, 6, 10, 3, 7, 11]], ["CA", 4, 5, 8], ["CHR", 3, "shared", [4]], ["CA", 4, 5, 9], ["CHR", 2, "shared", [5]], ["CA", 3, 6, 9], ["CI", 2], ["FU", 7, [0, 1, 2]], ["AN", 7, 0, 5], ["FU", 7, [1, 2, 3]], ["AN", 7, 1, 4], ["FU", 7, [2, 3, 4]], ["AN", 7, 2, 6], ["FU", 5, [0, 1, 2]], ["SP", 5, 0, 4, [1], 1], ["AN", 5, 1, 2], ["FFSP", 5, 0, [3, 2, 1], 1, 1], ["AN", 5, 1, 6], ["FU", 3, [0, 1, 2]], ["SP", 3, 0, 2, [1], 1], ["AN", 3, 1, 2], ["FFSP", 3, 0, [3, 2, 1], 1, 1], ["AN", 3, 1, 6], ["PR", 6, 0, "auto_unroll_max_step$64"]]]], "r": [[0.000387005], 0, 1.40605, 1678515303], "v": "v0.6"}
{"i": [["[\"tw_kernel\", 1024, 1024, 307, 16, 64, \"float32\"]", "cuda -keys=cuda,gpu -arch=sm_70 -max_num_threads=1024 -model=unknown -thread_warp_size=32", [-1, 16, 64, 49152, 2147483647, 1024, 8, 32], "", 0, ["mask_k"]], [[], [["CHW", 4, "local"], ["SP", 4, 0, 64, [1, 1, 4, 1], 1], ["SP", 4, 5, 16, [1, 1, 16, 1], 1], ["SP", 4, 10, 1024, [2, 32, 4, 2], 1], ["SP", 4, 15, 307, [1, 1], 1], ["RE", 4, [0, 5, 10, 1, 6, 11, 2, 7, 12, 15, 16, 3, 8, 13, 17, 4, 9, 14]], ["FSP", 5, 0, 1, 3], ["FSP", 5, 4, 2, 3], ["FSP", 5, 8, 3, 3], ["RE", 5, [0, 4, 8, 1, 5, 9, 2, 6, 10, 3, 7, 11]], ["CA", 4, 5, 8], ["CHR", 3, "shared", [4]], ["CA", 4, 5, 9], ["CHR", 2, "shared", [5]], ["CA", 3, 6, 9], ["CI", 2], ["FU", 7, [0, 1, 2]], ["AN", 7, 0, 5], ["FU", 7, [1, 2, 3]], ["AN", 7, 1, 4], ["FU", 7, [2, 3, 4]], ["AN", 7, 2, 6], ["FU", 5, [0, 1, 2]], ["SP", 5, 0, 256, [32], 1], ["AN", 5, 1, 2], ["FFSP", 5, 0, [3, 2, 1], 1, 1], ["AN", 5, 1, 6], ["FU", 3, [0, 1, 2]], ["SP", 3, 0, 128, [1], 1], ["AN", 3, 1, 2], ["FFSP", 3, 0, [3, 2, 1], 1, 1], ["AN", 3, 1, 6], ["PR", 6, 0, "auto_unroll_max_step$64"]]]], "r": [[0.00308961], 0, 3.08147, 1678515304], "v": "v0.6"}
{"i": [["[\"tw_kernel\", 1024, 1024, 307, 16, 64, \"float32\"]", "cuda -keys=cuda,gpu -arch=sm_70 -max_num_threads=1024 -model=unknown -thread_warp_size=32", [-1, 16, 64, 49152, 2147483647, 1024, 8, 32], "", 0, ["mask_k"]], [[], [["CHW", 4, "local"], ["SP", 4, 0, 64, [1, 1, 4, 1], 1], ["SP", 4, 5, 16, [1, 1, 1, 4], 1], ["SP", 4, 10, 1024, [4, 32, 1, 8], 1], ["SP", 4, 15, 307, [1, 1], 1], ["RE", 4, [0, 5, 10, 1, 6, 11, 2, 7, 12, 15, 16, 3, 8, 13, 17, 4, 9, 14]], ["FSP", 5, 0, 1, 3], ["FSP", 5, 4, 2, 3], ["FSP", 5, 8, 3, 3], ["RE", 5, [0, 4, 8, 1, 5, 9, 2, 6, 10, 3, 7, 11]], ["CA", 4, 5, 8], ["CHR", 3, "shared", [4]], ["CA", 4, 5, 9], ["CHR", 2, "shared", [5]], ["CA", 3, 6, 9], ["CI", 2], ["FU", 7, [0, 1, 2]], ["AN", 7, 0, 5], ["FU", 7, [1, 2, 3]], ["AN", 7, 1, 4], ["FU", 7, [2, 3, 4]], ["AN", 7, 2, 6], ["FU", 5, [0, 1, 2]], ["SP", 5, 0, 16, [16], 1], ["AN", 5, 1, 2], ["FFSP", 5, 0, [3, 2, 1], 1, 1], ["AN", 5, 1, 6], ["FU", 3, [0, 1, 2]], ["SP", 3, 0, 64, [1], 1], ["AN", 3, 1, 2], ["FFSP", 3, 0, [3, 2, 1], 1, 1], ["AN", 3, 1, 6], ["PR", 6, 0, "auto_unroll_max_step$512"]]]], "r": [[0.00736819], 0, 4.12475, 1678515304], "v": "v0.6"}
{"i": [["[\"tw_kernel\", 1024, 1024, 307, 16, 64, \"float32\"]", "cuda -keys=cuda,gpu -arch=sm_70 -max_num_threads=1024 -model=unknown -thread_warp_size=32", [-1, 16, 64, 49152, 2147483647, 1024, 8, 32], "", 0, ["mask_k"]], [[], [["CHW", 4, "local"], ["SP", 4, 0, 64, [1, 2, 32, 1], 1], ["SP", 4, 5, 16, [1, 1, 1, 1], 1], ["SP", 4, 10, 1024, [4, 8, 2, 1], 1], ["SP", 4, 15, 307, [1, 1], 1], ["RE", 4, [0, 5, 10, 1, 6, 11, 2, 7, 12, 15, 16, 3, 8, 13, 17, 4, 9, 14]], ["FSP", 5, 0, 1, 3], ["FSP", 5, 4, 2, 3], ["FSP", 5, 8, 3, 3], ["RE", 5, [0, 4, 8, 1, 5, 9, 2, 6, 10, 3, 7, 11]], ["CA", 4, 5, 8], ["CHR", 3, "shared", [4]], ["CA", 4, 5, 9], ["CHR", 2, "shared", [5]], ["CA", 3, 6, 9], ["CI", 2], ["FU", 7, [0, 1, 2]], ["AN", 7, 0, 5], ["FU", 7, [1, 2, 3]], ["AN", 7, 1, 4], ["FU", 7, [2, 3, 4]], ["AN", 7, 2, 6], ["FU", 5, [0, 1, 2]], ["SP", 5, 0, 2, [2], 1], ["AN", 5, 1, 2], ["FFSP", 5, 0, [3, 2, 1], 1, 1], ["AN", 5, 1, 6], ["FU", 3, [0, 1, 2]], ["SP", 3, 0, 4, [1], 1], ["AN", 3, 1, 2], ["FFSP", 3, 0, [3, 2, 1], 1, 1], ["AN", 3, 1, 6], ["PR", 6, 0, "auto_unroll_max_step$16"]]]], "r": [[0.00614156], 0, 1.41894, 1678515304], "v": "v0.6"}
{"i": [["[\"tw_kernel\", 1024, 1024, 307, 16, 64, \"float32\"]", "cuda -keys=cuda,gpu -arch=sm_70 -max_num_threads=1024 -model=unknown -thread_warp_size=32", [-1, 16, 64, 49152, 2147483647, 1024, 8, 32], "", 0, ["mask_k"]], [[], [["CHW", 4, "local"], ["SP", 4, 0, 64, [1, 4, 1, 1], 1], ["SP", 4, 5, 16, [1, 4, 2, 2], 1], ["SP", 4, 10, 1024, [2, 2, 1, 1], 1], ["SP", 4, 15, 307, [1, 1], 1], ["RE", 4, [0, 5, 10, 1, 6, 11, 2, 7, 12, 15, 16, 3, 8, 13, 17, 4, 9, 14]], ["FSP", 5, 0, 1, 3], ["FSP", 5, 4, 2, 3], ["FSP", 5, 8, 3, 3], ["RE", 5, [0, 4, 8, 1, 5, 9, 2, 6, 10, 3, 7, 11]], ["CA", 4, 5, 8], ["CHR", 3, "shared", [4]], ["CA", 4, 5, 9], ["CHR", 2, "shared", [5]], ["CA", 3, 6, 9], ["CI", 2], ["FU", 7, [0, 1, 2]], ["AN", 7, 0, 5], ["FU", 7, [1, 2, 3]], ["AN", 7, 1, 4], ["FU", 7, [2, 3, 4]], ["AN", 7, 2, 6], ["FU", 5, [0, 1, 2]], ["SP", 5, 0, 4, [4], 1], ["AN", 5, 1, 2], ["FFSP", 5, 0, [3, 2, 1], 1, 1], ["AN", 5, 1, 6], ["FU", 3, [0, 1, 2]], ["SP", 3, 0, 1, [1], 1], ["AN", 3, 1, 2], ["FFSP", 3, 0, [3, 2, 1], 1, 1], ["AN", 3, 1, 6], ["PR", 6, 0, "auto_unroll_max_step$1024"]]]], "r": [[0.000824105], 0, 0.988652, 1678515305], "v": "v0.6"}
{"i": [["[\"tw_kernel\", 1024, 1024, 307, 16, 64, \"float32\"]", "cuda -keys=cuda,gpu -arch=sm_70 -max_num_threads=1024 -model=unknown -thread_warp_size=32", [-1, 16, 64, 49152, 2147483647, 1024, 8, 32], "", 0, ["mask_k"]], [[], [["CHW", 4, "local"], ["SP", 4, 0, 64, [2, 16, 1, 1], 1], ["SP", 4, 5, 16, [1, 2, 1, 1], 1], ["SP", 4, 10, 1024, [1, 8, 1, 2], 1], ["SP", 4, 15, 307, [1, 1], 1], ["RE", 4, [0, 5, 10, 1, 6, 11, 2, 7, 12, 15, 16, 3, 8, 13, 17, 4, 9, 14]], ["FSP", 5, 0, 1, 3], ["FSP", 5, 4, 2, 3], ["FSP", 5, 8, 3, 3], ["RE", 5, [0, 4, 8, 1, 5, 9, 2, 6, 10, 3, 7, 11]], ["CA", 4, 5, 8], ["CHR", 3, "shared", [4]], ["CA", 4, 5, 9], ["CHR", 2, "shared", [5]], ["CA", 3, 6, 9], ["CI", 2], ["FU", 7, [0, 1, 2]], ["AN", 7, 0, 5], ["FU", 7, [1, 2, 3]], ["AN", 7, 1, 4], ["FU", 7, [2, 3, 4]], ["AN", 7, 2, 6], ["FU", 5, [0, 1, 2]], ["SP", 5, 0, 1, [1], 1], ["AN", 5, 1, 2], ["FFSP", 5, 0, [3, 2, 1], 1, 1], ["AN", 5, 1, 6], ["FU", 3, [0, 1, 2]], ["SP", 3, 0, 4, [1], 1], ["AN", 3, 1, 2], ["FFSP", 3, 0, [3, 2, 1], 1, 1], ["AN", 3, 1, 6], ["PR", 6, 0, "auto_unroll_max_step$1024"]]]], "r": [[0.000614634], 0, 1.00946, 1678515305], "v": "v0.6"}
{"i": [["[\"tw_kernel\", 1024, 1024, 307, 16, 64, \"float32\"]", "cuda -keys=cuda,gpu -arch=sm_70 -max_num_threads=1024 -model=unknown -thread_warp_size=32", [-1, 16, 64, 49152, 2147483647, 1024, 8, 32], "", 0, ["mask_k"]], [[], [["CHW", 4, "local"], ["SP", 4, 0, 64, [2, 2, 2, 4], 1], ["SP", 4, 5, 16, [4, 4, 1, 1], 1], ["SP", 4, 10, 1024, [1, 8, 4, 8], 1], ["SP", 4, 15, 307, [1, 1], 1], ["RE", 4, [0, 5, 10, 1, 6, 11, 2, 7, 12, 15, 16, 3, 8, 13, 17, 4, 9, 14]], ["FSP", 5, 0, 1, 3], ["FSP", 5, 4, 2, 3], ["FSP", 5, 8, 3, 3], ["RE", 5, [0, 4, 8, 1, 5, 9, 2, 6, 10, 3, 7, 11]], ["CA", 4, 5, 8], ["CHR", 3, "shared", [4]], ["CA", 4, 5, 9], ["CHR", 2, "shared", [5]], ["CA", 3, 6, 9], ["CI", 2], ["FU", 7, [0, 1, 2]], ["AN", 7, 0, 5], ["FU", 7, [1, 2, 3]], ["AN", 7, 1, 4], ["FU", 7, [2, 3, 4]], ["AN", 7, 2, 6], ["FU", 5, [0, 1, 2]], ["SP", 5, 0, 8, [1], 1], ["AN", 5, 1, 2], ["FFSP", 5, 0, [3, 2, 1], 1, 1], ["AN", 5, 1, 6], ["FU", 3, [0, 1, 2]], ["SP", 3, 0, 128, [1], 1], ["AN", 3, 1, 2], ["FFSP", 3, 0, [3, 2, 1], 1, 1], ["AN", 3, 1, 6], ["PR", 6, 0, "auto_unroll_max_step$512"]]]], "r": [[0.00715728], 0, 11.4066, 1678515305], "v": "v0.6"}
{"i": [["[\"tw_kernel\", 1024, 1024, 307, 16, 64, \"float32\"]", "cuda -keys=cuda,gpu -arch=sm_70 -max_num_threads=1024 -model=unknown -thread_warp_size=32", [-1, 16, 64, 49152, 2147483647, 1024, 8, 32], "", 0, ["mask_k"]], [[], [["CHW", 4, "local"], ["SP", 4, 0, 64, [1, 4, 1, 8], 1], ["SP", 4, 5, 16, [1, 2, 8, 1], 1], ["SP", 4, 10, 1024, [1, 4, 1, 4], 1], ["SP", 4, 15, 307, [1, 1], 1], ["RE", 4, [0, 5, 10, 1, 6, 11, 2, 7, 12, 15, 16, 3, 8, 13, 17, 4, 9, 14]], ["FSP", 5, 0, 1, 3], ["FSP", 5, 4, 2, 3], ["FSP", 5, 8, 3, 3], ["RE", 5, [0, 4, 8, 1, 5, 9, 2, 6, 10, 3, 7, 11]], ["CA", 4, 5, 8], ["CHR", 3, "shared", [4]], ["CA", 4, 5, 9], ["CHR", 2, "shared", [5]], ["CA", 3, 6, 9], ["CI", 2], ["FU", 7, [0, 1, 2]], ["AN", 7, 0, 5], ["FU", 7, [1, 2, 3]], ["AN", 7, 1, 4], ["FU", 7, [2, 3, 4]], ["AN", 7, 2, 6], ["FU", 5, [0, 1, 2]], ["SP", 5, 0, 64, [1], 1], ["AN", 5, 1, 2], ["FFSP", 5, 0, [3, 2, 1], 1, 1], ["AN", 5, 1, 6], ["FU", 3, [0, 1, 2]], ["SP", 3, 0, 8, [2], 1], ["AN", 3, 1, 2], ["FFSP", 3, 0, [3, 2, 1], 1, 1], ["AN", 3, 1, 6], ["PR", 6, 0, "auto_unroll_max_step$0"]]]], "r": [[0.00101623], 0, 1.5461, 1678515306], "v": "v0.6"}
{"i": [["[\"tw_kernel\", 1024, 1024, 307, 16, 64, \"float32\"]", "cuda -keys=cuda,gpu -arch=sm_70 -max_num_threads=1024 -model=unknown -thread_warp_size=32", [-1, 16, 64, 49152, 2147483647, 1024, 8, 32], "", 0, ["mask_k"]], [[], [["CHW", 4, "local"], ["SP", 4, 0, 64, [1, 2, 8, 1], 1], ["SP", 4, 5, 16, [1, 1, 2, 4], 1], ["SP", 4, 10, 1024, [1, 128, 4, 1], 1], ["SP", 4, 15, 307, [1, 1], 1], ["RE", 4, [0, 5, 10, 1, 6, 11, 2, 7, 12, 15, 16, 3, 8, 13, 17, 4, 9, 14]], ["FSP", 5, 0, 1, 3], ["FSP", 5, 4, 2, 3], ["FSP", 5, 8, 3, 3], ["RE", 5, [0, 4, 8, 1, 5, 9, 2, 6, 10, 3, 7, 11]], ["CA", 4, 5, 8], ["CHR", 3, "shared", [4]], ["CA", 4, 5, 9], ["CHR", 2, "shared", [5]], ["CA", 3, 6, 9], ["CI", 2], ["FU", 7, [0, 1, 2]], ["AN", 7, 0, 5], ["FU", 7, [1, 2, 3]], ["AN", 7, 1, 4], ["FU", 7, [2, 3, 4]], ["AN", 7, 2, 6], ["FU", 5, [0, 1, 2]], ["SP", 5, 0, 64, [1], 1], ["AN", 5, 1, 2], ["FFSP", 5, 0, [3, 2, 1], 1, 1], ["AN", 5, 1, 6], ["FU", 3, [0, 1, 2]], ["SP", 3, 0, 32, [1], 1], ["AN", 3, 1, 2], ["FFSP", 3, 0, [3, 2, 1], 1, 1], ["AN", 3, 1, 6], ["PR", 6, 0, "auto_unroll_max_step$1024"]]]], "r": [[0.00103942], 0, 1.92151, 1678515306], "v": "v0.6"}
{"i": [["[\"tw_kernel\", 1024, 1024, 307, 16, 64, \"float32\"]", "cuda -keys=cuda,gpu -arch=sm_70 -max_num_threads=1024 -model=unknown -thread_warp_size=32", [-1, 16, 64, 49152, 2147483647, 1024, 8, 32], "", 0, ["mask_k"]], [[], [["CHW", 4, "local"], ["SP", 4, 0, 64, [2, 8, 2, 1], 1], ["SP", 4, 5, 16, [1, 1, 16, 1], 1], ["SP", 4, 10, 1024, [4, 4, 2, 4], 1], ["SP", 4, 15, 307, [1, 1], 1], ["RE", 4, [0, 5, 10, 1, 6, 11, 2, 7, 12, 15, 16, 3, 8, 13, 17, 4, 9, 14]], ["FSP", 5, 0, 1, 3], ["FSP", 5, 4, 2, 3], ["FSP", 5, 8, 3, 3], ["RE", 5, [0, 4, 8, 1, 5, 9, 2, 6, 10, 3, 7, 11]], ["CA", 4, 5, 8], ["CHR", 3, "shared", [4]], ["CA", 4, 5, 9], ["CHR", 2, "shared", [5]], ["CA", 3, 6, 9], ["CI", 2], ["FU", 7, [0, 1, 2]], ["AN", 7, 0, 5], ["FU", 7, [1, 2, 3]], ["AN", 7, 1, 4], ["FU", 7, [2, 3, 4]], ["AN", 7, 2, 6], ["FU", 5, [0, 1, 2]], ["SP", 5, 0, 32, [1], 1], ["AN", 5, 1, 2], ["FFSP", 5, 0, [3, 2, 1], 1, 1], ["AN", 5, 1, 6], ["FU", 3, [0, 1, 2]], ["SP", 3, 0, 16, [1], 1], ["AN", 3, 1, 2], ["FFSP", 3, 0, [3, 2, 1], 1, 1], ["AN", 3, 1, 6], ["PR", 6, 0, "auto_unroll_max_step$64"]]]], "r": [[0.00713416], 0, 2.99257, 1678515306], "v": "v0.6"}
{"i": [["[\"tw_kernel\", 1024, 1024, 307, 16, 64, \"float32\"]", "cuda -keys=cuda,gpu -arch=sm_70 -max_num_threads=1024 -model=unknown -thread_warp_size=32", [-1, 16, 64, 49152, 2147483647, 1024, 8, 32], "", 0, ["mask_k"]], [[], [["CHW", 4, "local"], ["SP", 4, 0, 64, [2, 2, 2, 1], 1], ["SP", 4, 5, 16, [1, 4, 1, 4], 1], ["SP", 4, 10, 1024, [1, 8, 2, 16], 1], ["SP", 4, 15, 307, [1, 1], 1], ["RE", 4, [0, 5, 10, 1, 6, 11, 2, 7, 12, 15, 16, 3, 8, 13, 17, 4, 9, 14]], ["FSP", 5, 0, 1, 3], ["FSP", 5, 4, 2, 3], ["FSP", 5, 8, 3, 3], ["RE", 5, [0, 4, 8, 1, 5, 9, 2, 6, 10, 3, 7, 11]], ["CA", 4, 5, 8], ["CHR", 3, "shared", [4]], ["CA", 4, 5, 9], ["CHR", 2, "shared", [5]], ["CA", 3, 6, 9], ["CI", 2], ["FU", 7, [0, 1, 2]], ["AN", 7, 0, 5], ["FU", 7, [1, 2, 3]], ["AN", 7, 1, 4], ["FU", 7, [2, 3, 4]], ["AN", 7, 2, 6], ["FU", 5, [0, 1, 2]], ["SP", 5, 0, 2, [1], 1], ["AN", 5, 1, 2], ["FFSP", 5, 0, [3, 2, 1], 1, 1], ["AN", 5, 1, 6], ["FU", 3, [0, 1, 2]], ["SP", 3, 0, 64, [1], 1], ["AN", 3, 1, 2], ["FFSP", 3, 0, [3, 2, 1], 1, 1], ["AN", 3, 1, 6], ["PR", 6, 0, "auto_unroll_max_step$64"]]]], "r": [[0.00308552], 0, 3.09433, 1678515307], "v": "v0.6"}
{"i": [["[\"tw_kernel\", 1024, 1024, 307, 16, 64, \"float32\"]", "cuda -keys=cuda,gpu -arch=sm_70 -max_num_threads=1024 -model=unknown -thread_warp_size=32", [-1, 16, 64, 49152, 2147483647, 1024, 8, 32], "", 0, ["mask_k"]], [[], [["CHW", 4, "local"], ["SP", 4, 0, 64, [1, 1, 2, 1], 1], ["SP", 4, 5, 16, [1, 2, 2, 2], 1], ["SP", 4, 10, 1024, [1, 256, 1, 2], 1], ["SP", 4, 15, 307, [1, 1], 1], ["RE", 4, [0, 5, 10, 1, 6, 11, 2, 7, 12, 15, 16, 3, 8, 13, 17, 4, 9, 14]], ["FSP", 5, 0, 1, 3], ["FSP", 5, 4, 2, 3], ["FSP", 5, 8, 3, 3], ["RE", 5, [0, 4, 8, 1, 5, 9, 2, 6, 10, 3, 7, 11]], ["CA", 4, 5, 8], ["CHR", 3, "shared", [4]], ["CA", 4, 5, 9], ["CHR", 2, "shared", [5]], ["CA", 3, 6, 9], ["CI", 2], ["FU", 7, [0, 1, 2]], ["AN", 7, 0, 5], ["FU", 7, [1, 2, 3]], ["AN", 7, 1, 4], ["FU", 7, [2, 3, 4]], ["AN", 7, 2, 6], ["FU", 5, [0, 1, 2]], ["SP", 5, 0, 8, [1], 1], ["AN", 5, 1, 2], ["FFSP", 5, 0, [3, 2, 1], 1, 1], ["AN", 5, 1, 6], ["FU", 3, [0, 1, 2]], ["SP", 3, 0, 4, [2], 1], ["AN", 3, 1, 2], ["FFSP", 3, 0, [3, 2, 1], 1, 1], ["AN", 3, 1, 6], ["PR", 6, 0, "auto_unroll_max_step$16"]]]], "r": [[0.000202518], 0, 0.997652, 1678515307], "v": "v0.6"}
{"i": [["[\"tw_kernel\", 1024, 1024, 307, 16, 64, \"float32\"]", "cuda -keys=cuda,gpu -arch=sm_70 -max_num_threads=1024 -model=unknown -thread_warp_size=32", [-1, 16, 64, 49152, 2147483647, 1024, 8, 32], "", 0, ["mask_k"]], [[], [["CHW", 4, "local"], ["SP", 4, 0, 64, [1, 8, 2, 4], 1], ["SP", 4, 5, 16, [4, 2, 1, 2], 1], ["SP", 4, 10, 1024, [2, 2, 1, 2], 1], ["SP", 4, 15, 307, [1, 1], 1], ["RE", 4, [0, 5, 10, 1, 6, 11, 2, 7, 12, 15, 16, 3, 8, 13, 17, 4, 9, 14]], ["FSP", 5, 0, 1, 3], ["FSP", 5, 4, 2, 3], ["FSP", 5, 8, 3, 3], ["RE", 5, [0, 4, 8, 1, 5, 9, 2, 6, 10, 3, 7, 11]], ["CA", 4, 5, 8], ["CHR", 3, "shared", [4]], ["CA", 4, 5, 9], ["CHR", 2, "shared", [5]], ["CA", 3, 6, 9], ["CI", 2], ["FU", 7, [0, 1, 2]], ["AN", 7, 0, 5], ["FU", 7, [1, 2, 3]], ["AN", 7, 1, 4], ["FU", 7, [2, 3, 4]], ["AN", 7, 2, 6], ["FU", 5, [0, 1, 2]], ["SP", 5, 0, 16, [1], 1], ["AN", 5, 1, 2], ["FFSP", 5, 0, [3, 2, 1], 1, 1], ["AN", 5, 1, 6], ["FU", 3, [0, 1, 2]], ["SP", 3, 0, 16, [4], 1], ["AN", 3, 1, 2], ["FFSP", 3, 0, [3, 2, 1], 1, 1], ["AN", 3, 1, 6], ["PR", 6, 0, "auto_unroll_max_step$64"]]]], "r": [[0.00171187], 0, 1.79419, 1678515307], "v": "v0.6"}
{"i": [["[\"tw_kernel\", 1024, 1024, 307, 16, 64, \"float32\"]", "cuda -keys=cuda,gpu -arch=sm_70 -max_num_threads=1024 -model=unknown -thread_warp_size=32", [-1, 16, 64, 49152, 2147483647, 1024, 8, 32], "", 0, ["mask_k"]], [[], [["CHW", 4, "local"], ["SP", 4, 0, 64, [1, 1, 2, 32], 1], ["SP", 4, 5, 16, [1, 1, 1, 1], 1], ["SP", 4, 10, 1024, [4, 8, 2, 1], 1], ["SP", 4, 15, 307, [1, 1], 1], ["RE", 4, [0, 5, 10, 1, 6, 11, 2, 7, 12, 15, 16, 3, 8, 13, 17, 4, 9, 14]], ["FSP", 5, 0, 1, 3], ["FSP", 5, 4, 2, 3], ["FSP", 5, 8, 3, 3], ["RE", 5, [0, 4, 8, 1, 5, 9, 2, 6, 10, 3, 7, 11]], ["CA", 4, 5, 8], ["CHR", 3, "shared", [4]], ["CA", 4, 5, 9], ["CHR", 2, "shared", [5]], ["CA", 3, 6, 9], ["CI", 2], ["FU", 7, [0, 1, 2]], ["AN", 7, 0, 5], ["FU", 7, [1, 2, 3]], ["AN", 7, 1, 4], ["FU", 7, [2, 3, 4]], ["AN", 7, 2, 6], ["FU", 5, [0, 1, 2]], ["SP", 5, 0, 2, [1], 1], ["AN", 5, 1, 2], ["FFSP", 5, 0, [3, 2, 1], 1, 1], ["AN", 5, 1, 6], ["FU", 3, [0, 1, 2]], ["SP", 3, 0, 4, [1], 1], ["AN", 3, 1, 2], ["FFSP", 3, 0, [3, 2, 1], 1, 1], ["AN", 3, 1, 6], ["PR", 6, 0, "auto_unroll_max_step$16"]]]], "r": [[0.0112222], 0, 2.15453, 1678515307], "v": "v0.6"}
{"i": [["[\"tw_kernel\", 1024, 1024, 307, 16, 64, \"float32\"]", "cuda -keys=cuda,gpu -arch=sm_70 -max_num_threads=1024 -model=unknown -thread_warp_size=32", [-1, 16, 64, 49152, 2147483647, 1024, 8, 32], "", 0, ["mask_k"]], [[], [["CHW", 4, "local"], ["SP", 4, 0, 64, [1, 4, 8, 1], 1], ["SP", 4, 5, 16, [1, 1, 1, 8], 1], ["SP", 4, 10, 1024, [8, 16, 1, 1], 1], ["SP", 4, 15, 307, [1, 1], 1], ["RE", 4, [0, 5, 10, 1, 6, 11, 2, 7, 12, 15, 16, 3, 8, 13, 17, 4, 9, 14]], ["FSP", 5, 0, 1, 3], ["FSP", 5, 4, 2, 3], ["FSP", 5, 8, 3, 3], ["RE", 5, [0, 4, 8, 1, 5, 9, 2, 6, 10, 3, 7, 11]], ["CA", 4, 5, 8], ["CHR", 3, "shared", [4]], ["CA", 4, 5, 9], ["CHR", 2, "shared", [5]], ["CA", 3, 6, 9], ["CI", 2], ["FU", 7, [0, 1, 2]], ["AN", 7, 0, 5], ["FU", 7, [1, 2, 3]], ["AN", 7, 1, 4], ["FU", 7, [2, 3, 4]], ["AN", 7, 2, 6], ["FU", 5, [0, 1, 2]], ["SP", 5, 0, 8, [1], 1], ["AN", 5, 1, 2], ["FFSP", 5, 0, [3, 2, 1], 1, 1], ["AN", 5, 1, 6], ["FU", 3, [0, 1, 2]], ["SP", 3, 0, 8, [2], 1], ["AN", 3, 1, 2], ["FFSP", 3, 0, [3, 2, 1], 1, 1], ["AN", 3, 1, 6], ["PR", 6, 0, "auto_unroll_max_step$64"]]]], "r": [[0.00241145], 0, 2.19328, 1678515308], "v": "v0.6"}
{"i": [["[\"tw_kernel\", 1024, 1024, 307, 16, 64, \"float32\"]", "cuda -keys=cuda,gpu -arch=sm_70 -max_num_threads=1024 -model=unknown -thread_warp_size=32", [-1, 16, 64, 49152, 2147483647, 1024, 8, 32], "", 0, ["mask_k"]], [[], [["CHW", 4, "local"], ["SP", 4, 0, 64, [1, 8, 1, 1], 1], ["SP", 4, 5, 16, [2, 8, 1, 1], 1], ["SP", 4, 10, 1024, [1, 16, 2, 16], 1], ["SP", 4, 15, 307, [1, 1], 1], ["RE", 4, [0, 5, 10, 1, 6, 11, 2, 7, 12, 15, 16, 3, 8, 13, 17, 4, 9, 14]], ["FSP", 5, 0, 1, 3], ["FSP", 5, 4, 2, 3], ["FSP", 5, 8, 3, 3], ["RE", 5, [0, 4, 8, 1, 5, 9, 2, 6, 10, 3, 7, 11]], ["CA", 4, 5, 8], ["CHR", 3, "shared", [4]], ["CA", 4, 5, 9], ["CHR", 2, "shared", [5]], ["CA", 3, 6, 9], ["CI", 2], ["FU", 7, [0, 1, 2]], ["AN", 7, 0, 5], ["FU", 7, [1, 2, 3]], ["AN", 7, 1, 4], ["FU", 7, [2, 3, 4]], ["AN", 7, 2, 6], ["FU", 5, [0, 1, 2]], ["SP", 5, 0, 1, [1], 1], ["AN", 5, 1, 2], ["FFSP", 5, 0, [3, 2, 1], 1, 1], ["AN", 5, 1, 6], ["FU", 3, [0, 1, 2]], ["SP", 3, 0, 32, [1], 1], ["AN", 3, 1, 2], ["FFSP", 3, 0, [3, 2, 1], 1, 1], ["AN", 3, 1, 6], ["PR", 6, 0, "auto_unroll_max_step$0"]]]], "r": [[0.00279705], 0, 0.928862, 1678515308], "v": "v0.6"}
{"i": [["[\"tw_kernel\", 1024, 1024, 307, 16, 64, \"float32\"]", "cuda -keys=cuda,gpu -arch=sm_70 -max_num_threads=1024 -model=unknown -thread_warp_size=32", [-1, 16, 64, 49152, 2147483647, 1024, 8, 32], "", 0, ["mask_k"]], [[], [["CHW", 4, "local"], ["SP", 4, 0, 64, [1, 4, 4, 2], 1], ["SP", 4, 5, 16, [4, 1, 2, 2], 1], ["SP", 4, 10, 1024, [1, 32, 1, 1], 1], ["SP", 4, 15, 307, [1, 1], 1], ["RE", 4, [0, 5, 10, 1, 6, 11, 2, 7, 12, 15, 16, 3, 8, 13, 17, 4, 9, 14]], ["FSP", 5, 0, 1, 3], ["FSP", 5, 4, 2, 3], ["FSP", 5, 8, 3, 3], ["RE", 5, [0, 4, 8, 1, 5, 9, 2, 6, 10, 3, 7, 11]], ["CA", 4, 5, 8], ["CHR", 3, "shared", [4]], ["CA", 4, 5, 9], ["CHR", 2, "shared", [5]], ["CA", 3, 6, 9], ["CI", 2], ["FU", 7, [0, 1, 2]], ["AN", 7, 0, 5], ["FU", 7, [1, 2, 3]], ["AN", 7, 1, 4], ["FU", 7, [2, 3, 4]], ["AN", 7, 2, 6], ["FU", 5, [0, 1, 2]], ["SP", 5, 0, 128, [1], 1], ["AN", 5, 1, 2], ["FFSP", 5, 0, [3, 2, 1], 1, 1], ["AN", 5, 1, 6], ["FU", 3, [0, 1, 2]], ["SP", 3, 0, 64, [1], 1], ["AN", 3, 1, 2], ["FFSP", 3, 0, [3, 2, 1], 1, 1], ["AN", 3, 1, 6], ["PR", 6, 0, "auto_unroll_max_step$64"]]]], "r": [[0.00038971], 0, 1.31264, 1678515308], "v": "v0.6"}
{"i": [["[\"tw_kernel\", 1024, 1024, 307, 16, 64, \"float32\"]", "cuda -keys=cuda,gpu -arch=sm_70 -max_num_threads=1024 -model=unknown -thread_warp_size=32", [-1, 16, 64, 49152, 2147483647, 1024, 8, 32], "", 0, ["mask_k"]], [[], [["CHW", 4, "local"], ["SP", 4, 0, 64, [2, 4, 1, 2], 1], ["SP", 4, 5, 16, [1, 1, 1, 16], 1], ["SP", 4, 10, 1024, [2, 16, 1, 1], 1], ["SP", 4, 15, 307, [1, 1], 1], ["RE", 4, [0, 5, 10, 1, 6, 11, 2, 7, 12, 15, 16, 3, 8, 13, 17, 4, 9, 14]], ["FSP", 5, 0, 1, 3], ["FSP", 5, 4, 2, 3], ["FSP", 5, 8, 3, 3], ["RE", 5, [0, 4, 8, 1, 5, 9, 2, 6, 10, 3, 7, 11]], ["CA", 4, 5, 8], ["CHR", 3, "shared", [4]], ["CA", 4, 5, 9], ["CHR", 2, "shared", [5]], ["CA", 3, 6, 9], ["CI", 2], ["FU", 7, [0, 1, 2]], ["AN", 7, 0, 5], ["FU", 7, [1, 2, 3]], ["AN", 7, 1, 4], ["FU", 7, [2, 3, 4]], ["AN", 7, 2, 6], ["FU", 5, [0, 1, 2]], ["SP", 5, 0, 4, [1], 1], ["AN", 5, 1, 2], ["FFSP", 5, 0, [3, 2, 1], 1, 1], ["AN", 5, 1, 6], ["FU", 3, [0, 1, 2]], ["SP", 3, 0, 2, [1], 1], ["AN", 3, 1, 2], ["FFSP", 3, 0, [3, 2, 1], 1, 1], ["AN", 3, 1, 6], ["PR", 6, 0, "auto_unroll_max_step$64"]]]], "r": [[0.00034496], 0, 1.70766, 1678515308], "v": "v0.6"}
{"i": [["[\"tw_kernel\", 1024, 1024, 307, 16, 64, \"float32\"]", "cuda -keys=cuda,gpu -arch=sm_70 -max_num_threads=1024 -model=unknown -thread_warp_size=32", [-1, 16, 64, 49152, 2147483647, 1024, 8, 32], "", 0, ["mask_k"]], [[], [["CHW", 4, "local"], ["SP", 4, 0, 64, [2, 1, 4, 1], 1], ["SP", 4, 5, 16, [1, 4, 2, 1], 1], ["SP", 4, 10, 1024, [1, 32, 2, 16], 1], ["SP", 4, 15, 307, [1, 1], 1], ["RE", 4, [0, 5, 10, 1, 6, 11, 2, 7, 12, 15, 16, 3, 8, 13, 17, 4, 9, 14]], ["FSP", 5, 0, 1, 3], ["FSP", 5, 4, 2, 3], ["FSP", 5, 8, 3, 3], ["RE", 5, [0, 4, 8, 1, 5, 9, 2, 6, 10, 3, 7, 11]], ["CA", 4, 5, 8], ["CHR", 3, "shared", [4]], ["CA", 4, 5, 9], ["CHR", 2, "shared", [5]], ["CA", 3, 6, 9], ["CI", 2], ["FU", 7, [0, 1, 2]], ["AN", 7, 0, 5], ["FU", 7, [1, 2, 3]], ["AN", 7, 1, 4], ["FU", 7, [2, 3, 4]], ["AN", 7, 2, 6], ["FU", 5, [0, 1, 2]], ["SP", 5, 0, 8, [1], 1], ["AN", 5, 1, 2], ["FFSP", 5, 0, [3, 2, 1], 1, 1], ["AN", 5, 1, 6], ["FU", 3, [0, 1, 2]], ["SP", 3, 0, 128, [1], 1], ["AN", 3, 1, 2], ["FFSP", 3, 0, [3, 2, 1], 1, 1], ["AN", 3, 1, 6], ["PR", 6, 0, "auto_unroll_max_step$64"]]]], "r": [[0.00531804], 0, 2.79132, 1678515309], "v": "v0.6"}
{"i": [["[\"tw_kernel\", 1024, 1024, 307, 16, 64, \"float32\"]", "cuda -keys=cuda,gpu -arch=sm_70 -max_num_threads=1024 -model=unknown -thread_warp_size=32", [-1, 16, 64, 49152, 2147483647, 1024, 8, 32], "", 0, ["mask_k"]], [[], [["CHW", 4, "local"], ["SP", 4, 0, 64, [2, 16, 1, 1], 1], ["SP", 4, 5, 16, [1, 2, 1, 1], 1], ["SP", 4, 10, 1024, [2, 1, 2, 4], 1], ["SP", 4, 15, 307, [1, 1], 1], ["RE", 4, [0, 5, 10, 1, 6, 11, 2, 7, 12, 15, 16, 3, 8, 13, 17, 4, 9, 14]], ["FSP", 5, 0, 1, 3], ["FSP", 5, 4, 2, 3], ["FSP", 5, 8, 3, 3], ["RE", 5, [0, 4, 8, 1, 5, 9, 2, 6, 10, 3, 7, 11]], ["CA", 4, 5, 8], ["CHR", 3, "shared", [4]], ["CA", 4, 5, 9], ["CHR", 2, "shared", [5]], ["CA", 3, 6, 9], ["CI", 2], ["FU", 7, [0, 1, 2]], ["AN", 7, 0, 5], ["FU", 7, [1, 2, 3]], ["AN", 7, 1, 4], ["FU", 7, [2, 3, 4]], ["AN", 7, 2, 6], ["FU", 5, [0, 1, 2]], ["SP", 5, 0, 1, [1], 1], ["AN", 5, 1, 2], ["FFSP", 5, 0, [3, 2, 1], 1, 1], ["AN", 5, 1, 6], ["FU", 3, [0, 1, 2]], ["SP", 3, 0, 4, [4], 1], ["AN", 3, 1, 2], ["FFSP", 3, 0, [3, 2, 1], 1, 1], ["AN", 3, 1, 6], ["PR", 6, 0, "auto_unroll_max_step$1024"]]]], "r": [[0.000787278], 0, 0.958045, 1678515309], "v": "v0.6"}
{"i": [["[\"tw_kernel\", 1024, 1024, 307, 16, 64, \"float32\"]", "cuda -keys=cuda,gpu -arch=sm_70 -max_num_threads=1024 -model=unknown -thread_warp_size=32", [-1, 16, 64, 49152, 2147483647, 1024, 8, 32], "", 0, ["mask_k"]], [[], [["CHW", 4, "local"], ["SP", 4, 0, 64, [4, 1, 1, 1], 1], ["SP", 4, 5, 16, [2, 1, 1, 8], 1], ["SP", 4, 10, 1024, [1, 16, 8, 4], 1], ["SP", 4, 15, 307, [1, 1], 1], ["RE", 4, [0, 5, 10, 1, 6, 11, 2, 7, 12, 15, 16, 3, 8, 13, 17, 4, 9, 14]], ["FSP", 5, 0, 1, 3], ["FSP", 5, 4, 2, 3], ["FSP", 5, 8, 3, 3], ["RE", 5, [0, 4, 8, 1, 5, 9, 2, 6, 10, 3, 7, 11]], ["CA", 4, 5, 8], ["CHR", 3, "shared", [4]], ["CA", 4, 5, 9], ["CHR", 2, "shared", [5]], ["CA", 3, 6, 9], ["CI", 2], ["FU", 7, [0, 1, 2]], ["AN", 7, 0, 5], ["FU", 7, [1, 2, 3]], ["AN", 7, 1, 4], ["FU", 7, [2, 3, 4]], ["AN", 7, 2, 6], ["FU", 5, [0, 1, 2]], ["SP", 5, 0, 32, [1], 1], ["AN", 5, 1, 2], ["FFSP", 5, 0, [3, 2, 1], 1, 1], ["AN", 5, 1, 6], ["FU", 3, [0, 1, 2]], ["SP", 3, 0, 64, [1], 1], ["AN", 3, 1, 2], ["FFSP", 3, 0, [3, 2, 1], 1, 1], ["AN", 3, 1, 6], ["PR", 6, 0, "auto_unroll_max_step$16"]]]], "r": [[0.00797869], 0, 2.61729, 1678515309], "v": "v0.6"}
{"i": [["[\"tw_kernel\", 1024, 1024, 307, 16, 64, \"float32\"]", "cuda -keys=cuda,gpu -arch=sm_70 -max_num_threads=1024 -model=unknown -thread_warp_size=32", [-1, 16, 64, 49152, 2147483647, 1024, 8, 32], "", 0, ["mask_k"]], [[], [["CHW", 4, "local"], ["SP", 4, 0, 64, [1, 32, 2, 1], 1], ["SP", 4, 5, 16, [1, 1, 8, 1], 1], ["SP", 4, 10, 1024, [1, 16, 1, 4], 1], ["SP", 4, 15, 307, [1, 1], 1], ["RE", 4, [0, 5, 10, 1, 6, 11, 2, 7, 12, 15, 16, 3, 8, 13, 17, 4, 9, 14]], ["FSP", 5, 0, 1, 3], ["FSP", 5, 4, 2, 3], ["FSP", 5, 8, 3, 3], ["RE", 5, [0, 4, 8, 1, 5, 9, 2, 6, 10, 3, 7, 11]], ["CA", 4, 5, 8], ["CHR", 3, "shared", [4]], ["CA", 4, 5, 9], ["CHR", 2, "shared", [5]], ["CA", 3, 6, 9], ["CI", 2], ["FU", 7, [0, 1, 2]], ["AN", 7, 0, 5], ["FU", 7, [1, 2, 3]], ["AN", 7, 1, 4], ["FU", 7, [2, 3, 4]], ["AN", 7, 2, 6], ["FU", 5, [0, 1, 2]], ["SP", 5, 0, 16, [1], 1], ["AN", 5, 1, 2], ["FFSP", 5, 0, [3, 2, 1], 1, 1], ["AN", 5, 1, 6], ["FU", 3, [0, 1, 2]], ["SP", 3, 0, 4, [2], 1], ["AN", 3, 1, 2], ["FFSP", 3, 0, [3, 2, 1], 1, 1], ["AN", 3, 1, 6], ["PR", 6, 0, "auto_unroll_max_step$0"]]]], "r": [[0.00042681], 0, 1.12962, 1678515310], "v": "v0.6"}
{"i": [["[\"tw_kernel\", 1024, 1024, 307, 16, 64, \"float32\"]", "cuda -keys=cuda,gpu -arch=sm_70 -max_num_threads=1024 -model=unknown -thread_warp_size=32", [-1, 16, 64, 49152, 2147483647, 1024, 8, 32], "", 0, ["mask_k"]], [[], [["CHW", 4, "local"], ["SP", 4, 0, 64, [1, 16, 1, 2], 1], ["SP", 4, 5, 16, [8, 1, 1, 2], 1], ["SP", 4, 10, 1024, [1, 16, 8, 1], 1], ["SP", 4, 15, 307, [1, 1], 1], ["RE", 4, [0, 5, 10, 1, 6, 11, 2, 7, 12, 15, 16, 3, 8, 13, 17, 4, 9, 14]], ["FSP", 5, 0, 1, 3], ["FSP", 5, 4, 2, 3], ["FSP", 5, 8, 3, 3], ["RE", 5, [0, 4, 8, 1, 5, 9, 2, 6, 10, 3, 7, 11]], ["CA", 4, 5, 8], ["CHR", 3, "shared", [4]], ["CA", 4, 5, 9], ["CHR", 2, "shared", [5]], ["CA", 3, 6, 9], ["CI", 2], ["FU", 7, [0, 1, 2]], ["AN", 7, 0, 5], ["FU", 7, [1, 2, 3]], ["AN", 7, 1, 4], ["FU", 7, [2, 3, 4]], ["AN", 7, 2, 6], ["FU", 5, [0, 1, 2]], ["SP", 5, 0, 4, [1], 1], ["AN", 5, 1, 2], ["FFSP", 5, 0, [3, 2, 1], 1, 1], ["AN", 5, 1, 6], ["FU", 3, [0, 1, 2]], ["SP", 3, 0, 16, [1], 1], ["AN", 3, 1, 2], ["FFSP", 3, 0, [3, 2, 1], 1, 1], ["AN", 3, 1, 6], ["PR", 6, 0, "auto_unroll_max_step$64"]]]], "r": [[0.000996105], 0, 1.50811, 1678515310], "v": "v0.6"}
{"i": [["[\"tw_kernel\", 1024, 1024, 307, 16, 64, \"float32\"]", "cuda -keys=cuda,gpu -arch=sm_70 -max_num_threads=1024 -model=unknown -thread_warp_size=32", [-1, 16, 64, 49152, 2147483647, 1024, 8, 32], "", 0, ["mask_k"]], [[], [["CHW", 4, "local"], ["SP", 4, 0, 64, [2, 8, 2, 1], 1], ["SP", 4, 5, 16, [1, 1, 16, 1], 1], ["SP", 4, 10, 1024, [4, 4, 2, 4], 1], ["SP", 4, 15, 307, [1, 1], 1], ["RE", 4, [0, 5, 10, 1, 6, 11, 2, 7, 12, 15, 16, 3, 8, 13, 17, 4, 9, 14]], ["FSP", 5, 0, 1, 3], ["FSP", 5, 4, 2, 3], ["FSP", 5, 8, 3, 3], ["RE", 5, [0, 4, 8, 1, 5, 9, 2, 6, 10, 3, 7, 11]], ["CA", 4, 5, 8], ["CHR", 3, "shared", [4]], ["CA", 4, 5, 9], ["CHR", 2, "shared", [5]], ["CA", 3, 6, 9], ["CI", 2], ["FU", 7, [0, 1, 2]], ["AN", 7, 0, 5], ["FU", 7, [1, 2, 3]], ["AN", 7, 1, 4], ["FU", 7, [2, 3, 4]], ["AN", 7, 2, 6], ["FU", 5, [0, 1, 2]], ["SP", 5, 0, 32, [1], 1], ["AN", 5, 1, 2], ["FFSP", 5, 0, [3, 2, 1], 1, 1], ["AN", 5, 1, 6], ["FU", 3, [0, 1, 2]], ["SP", 3, 0, 16, [4], 1], ["AN", 3, 1, 2], ["FFSP", 3, 0, [3, 2, 1], 1, 1], ["AN", 3, 1, 6], ["PR", 6, 0, "auto_unroll_max_step$16"]]]], "r": [[0.00663052], 0, 1.86256, 1678515310], "v": "v0.6"}
{"i": [["[\"tw_kernel\", 1024, 1024, 307, 16, 64, \"float32\"]", "cuda -keys=cuda,gpu -arch=sm_70 -max_num_threads=1024 -model=unknown -thread_warp_size=32", [-1, 16, 64, 49152, 2147483647, 1024, 8, 32], "", 0, ["mask_k"]], [[], [["CHW", 4, "local"], ["SP", 4, 0, 64, [2, 1, 2, 1], 1], ["SP", 4, 5, 16, [1, 1, 1, 4], 1], ["SP", 4, 10, 1024, [4, 32, 1, 8], 1], ["SP", 4, 15, 307, [1, 1], 1], ["RE", 4, [0, 5, 10, 1, 6, 11, 2, 7, 12, 15, 16, 3, 8, 13, 17, 4, 9, 14]], ["FSP", 5, 0, 1, 3], ["FSP", 5, 4, 2, 3], ["FSP", 5, 8, 3, 3], ["RE", 5, [0, 4, 8, 1, 5, 9, 2, 6, 10, 3, 7, 11]], ["CA", 4, 5, 8], ["CHR", 3, "shared", [4]], ["CA", 4, 5, 9], ["CHR", 2, "shared", [5]], ["CA", 3, 6, 9], ["CI", 2], ["FU", 7, [0, 1, 2]], ["AN", 7, 0, 5], ["FU", 7, [1, 2, 3]], ["AN", 7, 1, 4], ["FU", 7, [2, 3, 4]], ["AN", 7, 2, 6], ["FU", 5, [0, 1, 2]], ["SP", 5, 0, 16, [1], 1], ["AN", 5, 1, 2], ["FFSP", 5, 0, [3, 2, 1], 1, 1], ["AN", 5, 1, 6], ["FU", 3, [0, 1, 2]], ["SP", 3, 0, 64, [1], 1], ["AN", 3, 1, 2], ["FFSP", 3, 0, [3, 2, 1], 1, 1], ["AN", 3, 1, 6], ["PR", 6, 0, "auto_unroll_max_step$512"]]]], "r": [[0.00769396], 0, 3.64808, 1678515310], "v": "v0.6"}
{"i": [["[\"tw_kernel\", 1024, 1024, 307, 16, 64, \"float32\"]", "cuda -keys=cuda,gpu -arch=sm_70 -max_num_threads=1024 -model=unknown -thread_warp_size=32", [-1, 16, 64, 49152, 2147483647, 1024, 8, 32], "", 0, ["mask_k"]], [[], [["CHW", 4, "local"], ["SP", 4, 0, 64, [2, 2, 1, 1], 1], ["SP", 4, 5, 16, [4, 2, 2, 1], 1], ["SP", 4, 10, 1024, [1, 256, 2, 2], 1], ["SP", 4, 15, 307, [1, 1], 1], ["RE", 4, [0, 5, 10, 1, 6, 11, 2, 7, 12, 15, 16, 3, 8, 13, 17, 4, 9, 14]], ["FSP", 5, 0, 1, 3], ["FSP", 5, 4, 2, 3], ["FSP", 5, 8, 3, 3], ["RE", 5, [0, 4, 8, 1, 5, 9, 2, 6, 10, 3, 7, 11]], ["CA", 4, 5, 8], ["CHR", 3, "shared", [4]], ["CA", 4, 5, 9], ["CHR", 2, "shared", [5]], ["CA", 3, 6, 9], ["CI", 2], ["FU", 7, [0, 1, 2]], ["AN", 7, 0, 5], ["FU", 7, [1, 2, 3]], ["AN", 7, 1, 4], ["FU", 7, [2, 3, 4]], ["AN", 7, 2, 6], ["FU", 5, [0, 1, 2]], ["SP", 5, 0, 2, [1], 1], ["AN", 5, 1, 2], ["FFSP", 5, 0, [3, 2, 1], 1, 1], ["AN", 5, 1, 6], ["FU", 3, [0, 1, 2]], ["SP", 3, 0, 4, [1], 1], ["AN", 3, 1, 2], ["FFSP", 3, 0, [3, 2, 1], 1, 1], ["AN", 3, 1, 6], ["PR", 6, 0, "auto_unroll_max_step$512"]]]], "r": [[0.00109869], 0, 1.02693, 1678515311], "v": "v0.6"}
{"i": [["[\"tw_kernel\", 1024, 1024, 307, 16, 64, \"float32\"]", "cuda -keys=cuda,gpu -arch=sm_70 -max_num_threads=1024 -model=unknown -thread_warp_size=32", [-1, 16, 64, 49152, 2147483647, 1024, 8, 32], "", 0, ["mask_k"]], [[], [["CHW", 4, "local"], ["SP", 4, 0, 64, [2, 16, 2, 1], 1], ["SP", 4, 5, 16, [1, 8, 1, 2], 1], ["SP", 4, 10, 1024, [1, 2, 2, 8], 1], ["SP", 4, 15, 307, [1, 1], 1], ["RE", 4, [0, 5, 10, 1, 6, 11, 2, 7, 12, 15, 16, 3, 8, 13, 17, 4, 9, 14]], ["FSP", 5, 0, 1, 3], ["FSP", 5, 4, 2, 3], ["FSP", 5, 8, 3, 3], ["RE", 5, [0, 4, 8, 1, 5, 9, 2, 6, 10, 3, 7, 11]], ["CA", 4, 5, 8], ["CHR", 3, "shared", [4]], ["CA", 4, 5, 9], ["CHR", 2, "shared", [5]], ["CA", 3, 6, 9], ["CI", 2], ["FU", 7, [0, 1, 2]], ["AN", 7, 0, 5], ["FU", 7, [1, 2, 3]], ["AN", 7, 1, 4], ["FU", 7, [2, 3, 4]], ["AN", 7, 2, 6], ["FU", 5, [0, 1, 2]], ["SP", 5, 0, 4, [1], 1], ["AN", 5, 1, 2], ["FFSP", 5, 0, [3, 2, 1], 1, 1], ["AN", 5, 1, 6], ["FU", 3, [0, 1, 2]], ["SP", 3, 0, 64, [1], 1], ["AN", 3, 1, 2], ["FFSP", 3, 0, [3, 2, 1], 1, 1], ["AN", 3, 1, 6], ["PR", 6, 0, "auto_unroll_max_step$16"]]]], "r": [[0.000615517], 0, 1.13246, 1678515311], "v": "v0.6"}
{"i": [["[\"tw_kernel\", 1024, 1024, 307, 16, 64, \"float32\"]", "cuda -keys=cuda,gpu -arch=sm_70 -max_num_threads=1024 -model=unknown -thread_warp_size=32", [-1, 16, 64, 49152, 2147483647, 1024, 8, 32], "", 0, ["mask_k"]], [[], [["CHW", 4, "local"], ["SP", 4, 0, 64, [2, 1, 4, 1], 1], ["SP", 4, 5, 16, [1, 4, 1, 2], 1], ["SP", 4, 10, 1024, [1, 64, 1, 16], 1], ["SP", 4, 15, 307, [1, 1], 1], ["RE", 4, [0, 5, 10, 1, 6, 11, 2, 7, 12, 15, 16, 3, 8, 13, 17, 4, 9, 14]], ["FSP", 5, 0, 1, 3], ["FSP", 5, 4, 2, 3], ["FSP", 5, 8, 3, 3], ["RE", 5, [0, 4, 8, 1, 5, 9, 2, 6, 10, 3, 7, 11]], ["CA", 4, 5, 8], ["CHR", 3, "shared", [4]], ["CA", 4, 5, 9], ["CHR", 2, "shared", [5]], ["CA", 3, 6, 9], ["CI", 2], ["FU", 7, [0, 1, 2]], ["AN", 7, 0, 5], ["FU", 7, [1, 2, 3]], ["AN", 7, 1, 4], ["FU", 7, [2, 3, 4]], ["AN", 7, 2, 6], ["FU", 5, [0, 1, 2]], ["SP", 5, 0, 8, [1], 1], ["AN", 5, 1, 2], ["FFSP", 5, 0, [3, 2, 1], 1, 1], ["AN", 5, 1, 6], ["FU", 3, [0, 1, 2]], ["SP", 3, 0, 128, [1], 1], ["AN", 3, 1, 2], ["FFSP", 3, 0, [3, 2, 1], 1, 1], ["AN", 3, 1, 6], ["PR", 6, 0, "auto_unroll_max_step$1024"]]]], "r": [[0.00166704], 0, 1.59115, 1678515311], "v": "v0.6"}
{"i": [["[\"tw_kernel\", 1024, 1024, 307, 16, 64, \"float32\"]", "cuda -keys=cuda,gpu -arch=sm_70 -max_num_threads=1024 -model=unknown -thread_warp_size=32", [-1, 16, 64, 49152, 2147483647, 1024, 8, 32], "", 0, ["mask_k"]], [[], [["CHW", 4, "local"], ["SP", 4, 0, 64, [2, 2, 2, 1], 1], ["SP", 4, 5, 16, [1, 8, 1, 2], 1], ["SP", 4, 10, 1024, [2, 64, 1, 8], 1], ["SP", 4, 15, 307, [1, 1], 1], ["RE", 4, [0, 5, 10, 1, 6, 11, 2, 7, 12, 15, 16, 3, 8, 13, 17, 4, 9, 14]], ["FSP", 5, 0, 1, 3], ["FSP", 5, 4, 2, 3], ["FSP", 5, 8, 3, 3], ["RE", 5, [0, 4, 8, 1, 5, 9, 2, 6, 10, 3, 7, 11]], ["CA", 4, 5, 8], ["CHR", 3, "shared", [4]], ["CA", 4, 5, 9], ["CHR", 2, "shared", [5]], ["CA", 3, 6, 9], ["CI", 2], ["FU", 7, [0, 1, 2]], ["AN", 7, 0, 5], ["FU", 7, [1, 2, 3]], ["AN", 7, 1, 4], ["FU", 7, [2, 3, 4]], ["AN", 7, 2, 6], ["FU", 5, [0, 1, 2]], ["SP", 5, 0, 4, [2], 1], ["AN", 5, 1, 2], ["FFSP", 5, 0, [3, 2, 1], 1, 1], ["AN", 5, 1, 6], ["FU", 3, [0, 1, 2]], ["SP", 3, 0, 16, [1], 1], ["AN", 3, 1, 2], ["FFSP", 3, 0, [3, 2, 1], 1, 1], ["AN", 3, 1, 6], ["PR", 6, 0, "auto_unroll_max_step$0"]]]], "r": [[0.00643406], 0, 1.08827, 1678515311], "v": "v0.6"}
{"i": [["[\"tw_kernel\", 1024, 1024, 307, 16, 64, \"float32\"]", "cuda -keys=cuda,gpu -arch=sm_70 -max_num_threads=1024 -model=unknown -thread_warp_size=32", [-1, 16, 64, 49152, 2147483647, 1024, 8, 32], "", 0, ["mask_k"]], [[], [["CHW", 4, "local"], ["SP", 4, 0, 64, [2, 2, 1, 1], 1], ["SP", 4, 5, 16, [4, 2, 2, 1], 1], ["SP", 4, 10, 1024, [1, 256, 4, 1], 1], ["SP", 4, 15, 307, [1, 1], 1], ["RE", 4, [0, 5, 10, 1, 6, 11, 2, 7, 12, 15, 16, 3, 8, 13, 17, 4, 9, 14]], ["FSP", 5, 0, 1, 3], ["FSP", 5, 4, 2, 3], ["FSP", 5, 8, 3, 3], ["RE", 5, [0, 4, 8, 1, 5, 9, 2, 6, 10, 3, 7, 11]], ["CA", 4, 5, 8], ["CHR", 3, "shared", [4]], ["CA", 4, 5, 9], ["CHR", 2, "shared", [5]], ["CA", 3, 6, 9], ["CI", 2], ["FU", 7, [0, 1, 2]], ["AN", 7, 0, 5], ["FU", 7, [1, 2, 3]], ["AN", 7, 1, 4], ["FU", 7, [2, 3, 4]], ["AN", 7, 2, 6], ["FU", 5, [0, 1, 2]], ["SP", 5, 0, 2, [1], 1], ["AN", 5, 1, 2], ["FFSP", 5, 0, [3, 2, 1], 1, 1], ["AN", 5, 1, 6], ["FU", 3, [0, 1, 2]], ["SP", 3, 0, 4, [2], 1], ["AN", 3, 1, 2], ["FFSP", 3, 0, [3, 2, 1], 1, 1], ["AN", 3, 1, 6], ["PR", 6, 0, "auto_unroll_max_step$0"]]]], "r": [[0.00095471], 0, 0.920238, 1678515312], "v": "v0.6"}
{"i": [["[\"tw_kernel\", 1024, 1024, 307, 16, 64, \"float32\"]", "cuda -keys=cuda,gpu -arch=sm_70 -max_num_threads=1024 -model=unknown -thread_warp_size=32", [-1, 16, 64, 49152, 2147483647, 1024, 8, 32], "", 0, ["mask_k"]], [[], [["CHW", 4, "local"], ["SP", 4, 0, 64, [2, 8, 1, 2], 1], ["SP", 4, 5, 16, [2, 8, 1, 1], 1], ["SP", 4, 10, 1024, [1, 16, 2, 1], 1], ["SP", 4, 15, 307, [1, 1], 1], ["RE", 4, [0, 5, 10, 1, 6, 11, 2, 7, 12, 15, 16, 3, 8, 13, 17, 4, 9, 14]], ["FSP", 5, 0, 1, 3], ["FSP", 5, 4, 2, 3], ["FSP", 5, 8, 3, 3], ["RE", 5, [0, 4, 8, 1, 5, 9, 2, 6, 10, 3, 7, 11]], ["CA", 4, 5, 8], ["CHR", 3, "shared", [4]], ["CA", 4, 5, 9], ["CHR", 2, "shared", [5]], ["CA", 3, 6, 9], ["CI", 2], ["FU", 7, [0, 1, 2]], ["AN", 7, 0, 5], ["FU", 7, [1, 2, 3]], ["AN", 7, 1, 4], ["FU", 7, [2, 3, 4]], ["AN", 7, 2, 6], ["FU", 5, [0, 1, 2]], ["SP", 5, 0, 4, [1], 1], ["AN", 5, 1, 2], ["FFSP", 5, 0, [3, 2, 1], 1, 1], ["AN", 5, 1, 6], ["FU", 3, [0, 1, 2]], ["SP", 3, 0, 2, [1], 1], ["AN", 3, 1, 2], ["FFSP", 3, 0, [3, 2, 1], 1, 1], ["AN", 3, 1, 6], ["PR", 6, 0, "auto_unroll_max_step$64"]]]], "r": [[0.000359962], 0, 0.991525, 1678515312], "v": "v0.6"}
{"i": [["[\"tw_kernel\", 1024, 1024, 307, 16, 64, \"float32\"]", "cuda -keys=cuda,gpu -arch=sm_70 -max_num_threads=1024 -model=unknown -thread_warp_size=32", [-1, 16, 64, 49152, 2147483647, 1024, 8, 32], "", 0, ["mask_k"]], [[], [["CHW", 4, "local"], ["SP", 4, 0, 64, [1, 4, 1, 4], 1], ["SP", 4, 5, 16, [2, 1, 8, 1], 1], ["SP", 4, 10, 1024, [1, 16, 4, 2], 1], ["SP", 4, 15, 307, [1, 1], 1], ["RE", 4, [0, 5, 10, 1, 6, 11, 2, 7, 12, 15, 16, 3, 8, 13, 17, 4, 9, 14]], ["FSP", 5, 0, 1, 3], ["FSP", 5, 4, 2, 3], ["FSP", 5, 8, 3, 3], ["RE", 5, [0, 4, 8, 1, 5, 9, 2, 6, 10, 3, 7, 11]], ["CA", 4, 5, 8], ["CHR", 3, "shared", [4]], ["CA", 4, 5, 9], ["CHR", 2, "shared", [5]], ["CA", 3, 6, 9], ["CI", 2], ["FU", 7, [0, 1, 2]], ["AN", 7, 0, 5], ["FU", 7, [1, 2, 3]], ["AN", 7, 1, 4], ["FU", 7, [2, 3, 4]], ["AN", 7, 2, 6], ["FU", 5, [0, 1, 2]], ["SP", 5, 0, 32, [1], 1], ["AN", 5, 1, 2], ["FFSP", 5, 0, [3, 2, 1], 1, 1], ["AN", 5, 1, 6], ["FU", 3, [0, 1, 2]], ["SP", 3, 0, 16, [1], 1], ["AN", 3, 1, 2], ["FFSP", 3, 0, [3, 2, 1], 1, 1], ["AN", 3, 1, 6], ["PR", 6, 0, "auto_unroll_max_step$0"]]]], "r": [[0.00325798], 0, 2.64219, 1678515329], "v": "v0.6"}
{"i": [["[\"tw_kernel\", 1024, 1024, 307, 16, 64, \"float32\"]", "cuda -keys=cuda,gpu -arch=sm_70 -max_num_threads=1024 -model=unknown -thread_warp_size=32", [-1, 16, 64, 49152, 2147483647, 1024, 8, 32], "", 0, ["mask_k"]], [[], [["CHW", 4, "local"], ["SP", 4, 0, 64, [1, 1, 16, 2], 1], ["SP", 4, 5, 16, [1, 4, 2, 1], 1], ["SP", 4, 10, 1024, [8, 1, 4, 8], 1], ["SP", 4, 15, 307, [1, 1], 1], ["RE", 4, [0, 5, 10, 1, 6, 11, 2, 7, 12, 15, 16, 3, 8, 13, 17, 4, 9, 14]], ["FSP", 5, 0, 1, 3], ["FSP", 5, 4, 2, 3], ["FSP", 5, 8, 3, 3], ["RE", 5, [0, 4, 8, 1, 5, 9, 2, 6, 10, 3, 7, 11]], ["CA", 4, 5, 8], ["CHR", 3, "shared", [4]], ["CA", 4, 5, 9], ["CHR", 2, "shared", [5]], ["CA", 3, 6, 9], ["CI", 2], ["FU", 7, [0, 1, 2]], ["AN", 7, 0, 5], ["FU", 7, [1, 2, 3]], ["AN", 7, 1, 4], ["FU", 7, [2, 3, 4]], ["AN", 7, 2, 6], ["FU", 5, [0, 1, 2]], ["SP", 5, 0, 8, [1], 1], ["AN", 5, 1, 2], ["FFSP", 5, 0, [3, 2, 1], 1, 1], ["AN", 5, 1, 6], ["FU", 3, [0, 1, 2]], ["SP", 3, 0, 128, [4], 1], ["AN", 3, 1, 2], ["FFSP", 3, 0, [3, 2, 1], 1, 1], ["AN", 3, 1, 6], ["PR", 6, 0, "auto_unroll_max_step$64"]]]], "r": [[0.0527511], 0, 4.48209, 1678515329], "v": "v0.6"}
{"i": [["[\"tw_kernel\", 1024, 1024, 307, 16, 64, \"float32\"]", "cuda -keys=cuda,gpu -arch=sm_70 -max_num_threads=1024 -model=unknown -thread_warp_size=32", [-1, 16, 64, 49152, 2147483647, 1024, 8, 32], "", 0, ["mask_k"]], [[], [["CHW", 4, "local"], ["SP", 4, 0, 64, [1, 8, 1, 8], 1], ["SP", 4, 5, 16, [2, 2, 1, 4], 1], ["SP", 4, 10, 1024, [2, 2, 2, 16], 1], ["SP", 4, 15, 307, [1, 1], 1], ["RE", 4, [0, 5, 10, 1, 6, 11, 2, 7, 12, 15, 16, 3, 8, 13, 17, 4, 9, 14]], ["FSP", 5, 0, 1, 3], ["FSP", 5, 4, 2, 3], ["FSP", 5, 8, 3, 3], ["RE", 5, [0, 4, 8, 1, 5, 9, 2, 6, 10, 3, 7, 11]], ["CA", 4, 5, 8], ["CHR", 3, "shared", [4]], ["CA", 4, 5, 9], ["CHR", 2, "shared", [5]], ["CA", 3, 6, 9], ["CI", 2], ["FU", 7, [0, 1, 2]], ["AN", 7, 0, 5], ["FU", 7, [1, 2, 3]], ["AN", 7, 1, 4], ["FU", 7, [2, 3, 4]], ["AN", 7, 2, 6], ["FU", 5, [0, 1, 2]], ["SP", 5, 0, 32, [1], 1], ["AN", 5, 1, 2], ["FFSP", 5, 0, [3, 2, 1], 1, 1], ["AN", 5, 1, 6], ["FU", 3, [0, 1, 2]], ["SP", 3, 0, 256, [2], 1], ["AN", 3, 1, 2], ["FFSP", 3, 0, [3, 2, 1], 1, 1], ["AN", 3, 1, 6], ["PR", 6, 0, "auto_unroll_max_step$1024"]]]], "r": [[0.0112483], 0, 11.2179, 1678515329], "v": "v0.6"}
{"i": [["[\"tw_kernel\", 1024, 1024, 307, 16, 64, \"float32\"]", "cuda -keys=cuda,gpu -arch=sm_70 -max_num_threads=1024 -model=unknown -thread_warp_size=32", [-1, 16, 64, 49152, 2147483647, 1024, 8, 32], "", 0, ["mask_k"]], [[], [["CHW", 4, "local"], ["SP", 4, 0, 64, [2, 1, 2, 1], 1], ["SP", 4, 5, 16, [2, 2, 2, 2], 1], ["SP", 4, 10, 1024, [1, 256, 1, 2], 1], ["SP", 4, 15, 307, [1, 1], 1], ["RE", 4, [0, 5, 10, 1, 6, 11, 2, 7, 12, 15, 16, 3, 8, 13, 17, 4, 9, 14]], ["FSP", 5, 0, 1, 3], ["FSP", 5, 4, 2, 3], ["FSP", 5, 8, 3, 3], ["RE", 5, [0, 4, 8, 1, 5, 9, 2, 6, 10, 3, 7, 11]], ["CA", 4, 5, 8], ["CHR", 3, "shared", [4]], ["CA", 4, 5, 9], ["CHR", 2, "shared", [5]], ["CA", 3, 6, 9], ["CI", 2], ["FU", 7, [0, 1, 2]], ["AN", 7, 0, 5], ["FU", 7, [1, 2, 3]], ["AN", 7, 1, 4], ["FU", 7, [2, 3, 4]], ["AN", 7, 2, 6], ["FU", 5, [0, 1, 2]], ["SP", 5, 0, 8, [2], 1], ["AN", 5, 1, 2], ["FFSP", 5, 0, [3, 2, 1], 1, 1], ["AN", 5, 1, 6], ["FU", 3, [0, 1, 2]], ["SP", 3, 0, 4, [1], 1], ["AN", 3, 1, 2], ["FFSP", 3, 0, [3, 2, 1], 1, 1], ["AN", 3, 1, 6], ["PR", 6, 0, "auto_unroll_max_step$16"]]]], "r": [[0.000369901], 0, 1.48841, 1678515330], "v": "v0.6"}
{"i": [["[\"tw_kernel\", 1024, 1024, 307, 16, 64, \"float32\"]", "cuda -keys=cuda,gpu -arch=sm_70 -max_num_threads=1024 -model=unknown -thread_warp_size=32", [-1, 16, 64, 49152, 2147483647, 1024, 8, 32], "", 0, ["mask_k"]], [[], [["CHW", 4, "local"], ["SP", 4, 0, 64, [2, 2, 4, 1], 1], ["SP", 4, 5, 16, [1, 16, 1, 1], 1], ["SP", 4, 10, 1024, [1, 32, 2, 1], 1], ["SP", 4, 15, 307, [1, 1], 1], ["RE", 4, [0, 5, 10, 1, 6, 11, 2, 7, 12, 15, 16, 3, 8, 13, 17, 4, 9, 14]], ["FSP", 5, 0, 1, 3], ["FSP", 5, 4, 2, 3], ["FSP", 5, 8, 3, 3], ["RE", 5, [0, 4, 8, 1, 5, 9, 2, 6, 10, 3, 7, 11]], ["CA", 4, 5, 8], ["CHR", 3, "shared", [4]], ["CA", 4, 5, 9], ["CHR", 2, "shared", [5]], ["CA", 3, 6, 9], ["CI", 2], ["FU", 7, [0, 1, 2]], ["AN", 7, 0, 5], ["FU", 7, [1, 2, 3]], ["AN", 7, 1, 4], ["FU", 7, [2, 3, 4]], ["AN", 7, 2, 6], ["FU", 5, [0, 1, 2]], ["SP", 5, 0, 4, [2], 1], ["AN", 5, 1, 2], ["FFSP", 5, 0, [3, 2, 1], 1, 1], ["AN", 5, 1, 6], ["FU", 3, [0, 1, 2]], ["SP", 3, 0, 8, [1], 1], ["AN", 3, 1, 2], ["FFSP", 3, 0, [3, 2, 1], 1, 1], ["AN", 3, 1, 6], ["PR", 6, 0, "auto_unroll_max_step$0"]]]], "r": [[0.000398904], 0, 1.4471, 1678515330], "v": "v0.6"}
{"i": [["[\"tw_kernel\", 1024, 1024, 307, 16, 64, \"float32\"]", "cuda -keys=cuda,gpu -arch=sm_70 -max_num_threads=1024 -model=unknown -thread_warp_size=32", [-1, 16, 64, 49152, 2147483647, 1024, 8, 32], "", 0, ["mask_k"]], [[], [["CHW", 4, "local"], ["SP", 4, 0, 64, [2, 2, 4, 1], 1], ["SP", 4, 5, 16, [1, 2, 4, 2], 1], ["SP", 4, 10, 1024, [4, 8, 4, 1], 1], ["SP", 4, 15, 307, [1, 1], 1], ["RE", 4, [0, 5, 10, 1, 6, 11, 2, 7, 12, 15, 16, 3, 8, 13, 17, 4, 9, 14]], ["FSP", 5, 0, 1, 3], ["FSP", 5, 4, 2, 3], ["FSP", 5, 8, 3, 3], ["RE", 5, [0, 4, 8, 1, 5, 9, 2, 6, 10, 3, 7, 11]], ["CA", 4, 5, 8], ["CHR", 3, "shared", [4]], ["CA", 4, 5, 9], ["CHR", 2, "shared", [5]], ["CA", 3, 6, 9], ["CI", 2], ["FU", 7, [0, 1, 2]], ["AN", 7, 0, 5], ["FU", 7, [1, 2, 3]], ["AN", 7, 1, 4], ["FU", 7, [2, 3, 4]], ["AN", 7, 2, 6], ["FU", 5, [0, 1, 2]], ["SP", 5, 0, 16, [1], 1], ["AN", 5, 1, 2], ["FFSP", 5, 0, [3, 2, 1], 1, 1], ["AN", 5, 1, 6], ["FU", 3, [0, 1, 2]], ["SP", 3, 0, 8, [1], 1], ["AN", 3, 1, 2], ["FFSP", 3, 0, [3, 2, 1], 1, 1], ["AN", 3, 1, 6], ["PR", 6, 0, "auto_unroll_max_step$0"]]]], "r": [[0.00390692], 0, 3.32668, 1678515330], "v": "v0.6"}
{"i": [["[\"tw_kernel\", 1024, 1024, 307, 16, 64, \"float32\"]", "cuda -keys=cuda,gpu -arch=sm_70 -max_num_threads=1024 -model=unknown -thread_warp_size=32", [-1, 16, 64, 49152, 2147483647, 1024, 8, 32], "", 0, ["mask_k"]], [[], [["CHW", 4, "local"], ["SP", 4, 0, 64, [1, 2, 1, 1], 1], ["SP", 4, 5, 16, [1, 8, 2, 1], 1], ["SP", 4, 10, 1024, [1, 4, 1, 1], 1], ["SP", 4, 15, 307, [1, 1], 1], ["RE", 4, [0, 5, 10, 1, 6, 11, 2, 7, 12, 15, 16, 3, 8, 13, 17, 4, 9, 14]], ["FSP", 5, 0, 1, 3], ["FSP", 5, 4, 2, 3], ["FSP", 5, 8, 3, 3], ["RE", 5, [0, 4, 8, 1, 5, 9, 2, 6, 10, 3, 7, 11]], ["CA", 4, 5, 8], ["CHR", 3, "shared", [4]], ["CA", 4, 5, 9], ["CHR", 2, "shared", [5]], ["CA", 3, 6, 9], ["CI", 2], ["FU", 7, [0, 1, 2]], ["AN", 7, 0, 5], ["FU", 7, [1, 2, 3]], ["AN", 7, 1, 4], ["FU", 7, [2, 3, 4]], ["AN", 7, 2, 6], ["FU", 5, [0, 1, 2]], ["SP", 5, 0, 4, [1], 1], ["AN", 5, 1, 2], ["FFSP", 5, 0, [3, 2, 1], 1, 1], ["AN", 5, 1, 6], ["FU", 3, [0, 1, 2]], ["SP", 3, 0, 1, [1], 1], ["AN", 3, 1, 2], ["FFSP", 3, 0, [3, 2, 1], 1, 1], ["AN", 3, 1, 6], ["PR", 6, 0, "auto_unroll_max_step$64"]]]], "r": [[0.000905995], 0, 1.00755, 1678515331], "v": "v0.6"}
{"i": [["[\"tw_kernel\", 1024, 1024, 307, 16, 64, \"float32\"]", "cuda -keys=cuda,gpu -arch=sm_70 -max_num_threads=1024 -model=unknown -thread_warp_size=32", [-1, 16, 64, 49152, 2147483647, 1024, 8, 32], "", 0, ["mask_k"]], [[], [["CHW", 4, "local"], ["SP", 4, 0, 64, [4, 8, 1, 2], 1], ["SP", 4, 5, 16, [1, 1, 4, 4], 1], ["SP", 4, 10, 1024, [2, 16, 2, 1], 1], ["SP", 4, 15, 307, [1, 1], 1], ["RE", 4, [0, 5, 10, 1, 6, 11, 2, 7, 12, 15, 16, 3, 8, 13, 17, 4, 9, 14]], ["FSP", 5, 0, 1, 3], ["FSP", 5, 4, 2, 3], ["FSP", 5, 8, 3, 3], ["RE", 5, [0, 4, 8, 1, 5, 9, 2, 6, 10, 3, 7, 11]], ["CA", 4, 5, 8], ["CHR", 3, "shared", [4]], ["CA", 4, 5, 9], ["CHR", 2, "shared", [5]], ["CA", 3, 6, 9], ["CI", 2], ["FU", 7, [0, 1, 2]], ["AN", 7, 0, 5], ["FU", 7, [1, 2, 3]], ["AN", 7, 1, 4], ["FU", 7, [2, 3, 4]], ["AN", 7, 2, 6], ["FU", 5, [0, 1, 2]], ["SP", 5, 0, 16, [1], 1], ["AN", 5, 1, 2], ["FFSP", 5, 0, [3, 2, 1], 1, 1], ["AN", 5, 1, 6], ["FU", 3, [0, 1, 2]], ["SP", 3, 0, 16, [1], 1], ["AN", 3, 1, 2], ["FFSP", 3, 0, [3, 2, 1], 1, 1], ["AN", 3, 1, 6], ["PR", 6, 0, "auto_unroll_max_step$64"]]]], "r": [[0.00457156], 0, 2.58637, 1678515331], "v": "v0.6"}
{"i": [["[\"tw_kernel\", 1024, 1024, 307, 16, 64, \"float32\"]", "cuda -keys=cuda,gpu -arch=sm_70 -max_num_threads=1024 -model=unknown -thread_warp_size=32", [-1, 16, 64, 49152, 2147483647, 1024, 8, 32], "", 0, ["mask_k"]], [[], [["CHW", 4, "local"], ["SP", 4, 0, 64, [1, 4, 1, 8], 1], ["SP", 4, 5, 16, [8, 1, 2, 1], 1], ["SP", 4, 10, 1024, [1, 16, 8, 2], 1], ["SP", 4, 15, 307, [1, 1], 1], ["RE", 4, [0, 5, 10, 1, 6, 11, 2, 7, 12, 15, 16, 3, 8, 13, 17, 4, 9, 14]], ["FSP", 5, 0, 1, 3], ["FSP", 5, 4, 2, 3], ["FSP", 5, 8, 3, 3], ["RE", 5, [0, 4, 8, 1, 5, 9, 2, 6, 10, 3, 7, 11]], ["CA", 4, 5, 8], ["CHR", 3, "shared", [4]], ["CA", 4, 5, 9], ["CHR", 2, "shared", [5]], ["CA", 3, 6, 9], ["CI", 2], ["FU", 7, [0, 1, 2]], ["AN", 7, 0, 5], ["FU", 7, [1, 2, 3]], ["AN", 7, 1, 4], ["FU", 7, [2, 3, 4]], ["AN", 7, 2, 6], ["FU", 5, [0, 1, 2]], ["SP", 5, 0, 8, [1], 1], ["AN", 5, 1, 2], ["FFSP", 5, 0, [3, 2, 1], 1, 1], ["AN", 5, 1, 6], ["FU", 3, [0, 1, 2]], ["SP", 3, 0, 128, [1], 1], ["AN", 3, 1, 2], ["FFSP", 3, 0, [3, 2, 1], 1, 1], ["AN", 3, 1, 6], ["PR", 6, 0, "auto_unroll_max_step$64"]]]], "r": [[0.0103479], 0, 2.62893, 1678515331], "v": "v0.6"}
{"i": [["[\"tw_kernel\", 1024, 1024, 307, 16, 64, \"float32\"]", "cuda -keys=cuda,gpu -arch=sm_70 -max_num_threads=1024 -model=unknown -thread_warp_size=32", [-1, 16, 64, 49152, 2147483647, 1024, 8, 32], "", 0, ["mask_k"]], [[], [["CHW", 4, "local"], ["SP", 4, 0, 64, [1, 4, 1, 8], 1], ["SP", 4, 5, 16, [1, 2, 8, 1], 1], ["SP", 4, 10, 1024, [1, 16, 1, 1], 1], ["SP", 4, 15, 307, [1, 1], 1], ["RE", 4, [0, 5, 10, 1, 6, 11, 2, 7, 12, 15, 16, 3, 8, 13, 17, 4, 9, 14]], ["FSP", 5, 0, 1, 3], ["FSP", 5, 4, 2, 3], ["FSP", 5, 8, 3, 3], ["RE", 5, [0, 4, 8, 1, 5, 9, 2, 6, 10, 3, 7, 11]], ["CA", 4, 5, 8], ["CHR", 3, "shared", [4]], ["CA", 4, 5, 9], ["CHR", 2, "shared", [5]], ["CA", 3, 6, 9], ["CI", 2], ["FU", 7, [0, 1, 2]], ["AN", 7, 0, 5], ["FU", 7, [1, 2, 3]], ["AN", 7, 1, 4], ["FU", 7, [2, 3, 4]], ["AN", 7, 2, 6], ["FU", 5, [0, 1, 2]], ["SP", 5, 0, 64, [1], 1], ["AN", 5, 1, 2], ["FFSP", 5, 0, [3, 2, 1], 1, 1], ["AN", 5, 1, 6], ["FU", 3, [0, 1, 2]], ["SP", 3, 0, 8, [1], 1], ["AN", 3, 1, 2], ["FFSP", 3, 0, [3, 2, 1], 1, 1], ["AN", 3, 1, 6], ["PR", 6, 0, "auto_unroll_max_step$0"]]]], "r": [[0.000473309], 0, 0.945087, 1678515331], "v": "v0.6"}
{"i": [["[\"tw_kernel\", 1024, 1024, 307, 16, 64, \"float32\"]", "cuda -keys=cuda,gpu -arch=sm_70 -max_num_threads=1024 -model=unknown -thread_warp_size=32", [-1, 16, 64, 49152, 2147483647, 1024, 8, 32], "", 0, ["mask_k"]], [[], [["CHW", 4, "local"], ["SP", 4, 0, 64, [2, 1, 4, 1], 1], ["SP", 4, 5, 16, [1, 2, 1, 8], 1], ["SP", 4, 10, 1024, [2, 16, 1, 16], 1], ["SP", 4, 15, 307, [1, 1], 1], ["RE", 4, [0, 5, 10, 1, 6, 11, 2, 7, 12, 15, 16, 3, 8, 13, 17, 4, 9, 14]], ["FSP", 5, 0, 1, 3], ["FSP", 5, 4, 2, 3], ["FSP", 5, 8, 3, 3], ["RE", 5, [0, 4, 8, 1, 5, 9, 2, 6, 10, 3, 7, 11]], ["CA", 4, 5, 8], ["CHR", 3, "shared", [4]], ["CA", 4, 5, 9], ["CHR", 2, "shared", [5]], ["CA", 3, 6, 9], ["CI", 2], ["FU", 7, [0, 1, 2]], ["AN", 7, 0, 5], ["FU", 7, [1, 2, 3]], ["AN", 7, 1, 4], ["FU", 7, [2, 3, 4]], ["AN", 7, 2, 6], ["FU", 5, [0, 1, 2]], ["SP", 5, 0, 32, [1], 1], ["AN", 5, 1, 2], ["FFSP", 5, 0, [3, 2, 1], 1, 1], ["AN", 5, 1, 6], ["FU", 3, [0, 1, 2]], ["SP", 3, 0, 64, [1], 1], ["AN", 3, 1, 2], ["FFSP", 3, 0, [3, 2, 1], 1, 1], ["AN", 3, 1, 6], ["PR", 6, 0, "auto_unroll_max_step$0"]]]], "r": [[0.00642902], 0, 2.95261, 1678515332], "v": "v0.6"}
{"i": [["[\"tw_kernel\", 1024, 1024, 307, 16, 64, \"float32\"]", "cuda -keys=cuda,gpu -arch=sm_70 -max_num_threads=1024 -model=unknown -thread_warp_size=32", [-1, 16, 64, 49152, 2147483647, 1024, 8, 32], "", 0, ["mask_k"]], [[], [["CHW", 4, "local"], ["SP", 4, 0, 64, [1, 1, 1, 1], 1], ["SP", 4, 5, 16, [1, 4, 4, 1], 1], ["SP", 4, 10, 1024, [2, 8, 4, 1], 1], ["SP", 4, 15, 307, [1, 1], 1], ["RE", 4, [0, 5, 10, 1, 6, 11, 2, 7, 12, 15, 16, 3, 8, 13, 17, 4, 9, 14]], ["FSP", 5, 0, 1, 3], ["FSP", 5, 4, 2, 3], ["FSP", 5, 8, 3, 3], ["RE", 5, [0, 4, 8, 1, 5, 9, 2, 6, 10, 3, 7, 11]], ["CA", 4, 5, 8], ["CHR", 3, "shared", [4]], ["CA", 4, 5, 9], ["CHR", 2, "shared", [5]], ["CA", 3, 6, 9], ["CI", 2], ["FU", 7, [0, 1, 2]], ["AN", 7, 0, 5], ["FU", 7, [1, 2, 3]], ["AN", 7, 1, 4], ["FU", 7, [2, 3, 4]], ["AN", 7, 2, 6], ["FU", 5, [0, 1, 2]], ["SP", 5, 0, 4, [2], 1], ["AN", 5, 1, 2], ["FFSP", 5, 0, [3, 2, 1], 1, 1], ["AN", 5, 1, 6], ["FU", 3, [0, 1, 2]], ["SP", 3, 0, 4, [2], 1], ["AN", 3, 1, 2], ["FFSP", 3, 0, [3, 2, 1], 1, 1], ["AN", 3, 1, 6], ["PR", 6, 0, "auto_unroll_max_step$0"]]]], "r": [[0.000178741], 0, 1.04716, 1678515332], "v": "v0.6"}
{"i": [["[\"tw_kernel\", 1024, 1024, 307, 16, 64, \"float32\"]", "cuda -keys=cuda,gpu -arch=sm_70 -max_num_threads=1024 -model=unknown -thread_warp_size=32", [-1, 16, 64, 49152, 2147483647, 1024, 8, 32], "", 0, ["mask_k"]], [[], [["CHW", 4, "local"], ["SP", 4, 0, 64, [1, 8, 1, 1], 1], ["SP", 4, 5, 16, [1, 2, 8, 1], 1], ["SP", 4, 10, 1024, [8, 1, 128, 1], 1], ["SP", 4, 15, 307, [1, 1], 1], ["RE", 4, [0, 5, 10, 1, 6, 11, 2, 7, 12, 15, 16, 3, 8, 13, 17, 4, 9, 14]], ["FSP", 5, 0, 1, 3], ["FSP", 5, 4, 2, 3], ["FSP", 5, 8, 3, 3], ["RE", 5, [0, 4, 8, 1, 5, 9, 2, 6, 10, 3, 7, 11]], ["CA", 4, 5, 8], ["CHR", 3, "shared", [4]], ["CA", 4, 5, 9], ["CHR", 2, "shared", [5]], ["CA", 3, 6, 9], ["CI", 2], ["FU", 7, [0, 1, 2]], ["AN", 7, 0, 5], ["FU", 7, [1, 2, 3]], ["AN", 7, 1, 4], ["FU", 7, [2, 3, 4]], ["AN", 7, 2, 6], ["FU", 5, [0, 1, 2]], ["SP", 5, 0, 8, [1], 1], ["AN", 5, 1, 2], ["FFSP", 5, 0, [3, 2, 1], 1, 1], ["AN", 5, 1, 6], ["FU", 3, [0, 1, 2]], ["SP", 3, 0, 2, [1], 1], ["AN", 3, 1, 2], ["FFSP", 3, 0, [3, 2, 1], 1, 1], ["AN", 3, 1, 6], ["PR", 6, 0, "auto_unroll_max_step$0"]]]], "r": [[0.083959], 0, 2.11721, 1678515332], "v": "v0.6"}
{"i": [["[\"tw_kernel\", 1024, 1024, 307, 16, 64, \"float32\"]", "cuda -keys=cuda,gpu -arch=sm_70 -max_num_threads=1024 -model=unknown -thread_warp_size=32", [-1, 16, 64, 49152, 2147483647, 1024, 8, 32], "", 0, ["mask_k"]], [[], [["CHW", 4, "local"], ["SP", 4, 0, 64, [1, 16, 2, 2], 1], ["SP", 4, 5, 16, [1, 2, 2, 1], 1], ["SP", 4, 10, 1024, [4, 16, 1, 1], 1], ["SP", 4, 15, 307, [1, 1], 1], ["RE", 4, [0, 5, 10, 1, 6, 11, 2, 7, 12, 15, 16, 3, 8, 13, 17, 4, 9, 14]], ["FSP", 5, 0, 1, 3], ["FSP", 5, 4, 2, 3], ["FSP", 5, 8, 3, 3], ["RE", 5, [0, 4, 8, 1, 5, 9, 2, 6, 10, 3, 7, 11]], ["CA", 4, 5, 8], ["CHR", 3, "shared", [4]], ["CA", 4, 5, 9], ["CHR", 2, "shared", [5]], ["CA", 3, 6, 9], ["CI", 2], ["FU", 7, [0, 1, 2]], ["AN", 7, 0, 5], ["FU", 7, [1, 2, 3]], ["AN", 7, 1, 4], ["FU", 7, [2, 3, 4]], ["AN", 7, 2, 6], ["FU", 5, [0, 1, 2]], ["SP", 5, 0, 8, [2], 1], ["AN", 5, 1, 2], ["FFSP", 5, 0, [3, 2, 1], 1, 1], ["AN", 5, 1, 6], ["FU", 3, [0, 1, 2]], ["SP", 3, 0, 4, [1], 1], ["AN", 3, 1, 2], ["FFSP", 3, 0, [3, 2, 1], 1, 1], ["AN", 3, 1, 6], ["PR", 6, 0, "auto_unroll_max_step$0"]]]], "r": [[0.000401924], 0, 0.906185, 1678515333], "v": "v0.6"}
{"i": [["[\"tw_kernel\", 1024, 1024, 307, 16, 64, \"float32\"]", "cuda -keys=cuda,gpu -arch=sm_70 -max_num_threads=1024 -model=unknown -thread_warp_size=32", [-1, 16, 64, 49152, 2147483647, 1024, 8, 32], "", 0, ["mask_k"]], [[], [["CHW", 4, "local"], ["SP", 4, 0, 64, [2, 2, 1, 8], 1], ["SP", 4, 5, 16, [2, 8, 1, 1], 1], ["SP", 4, 10, 1024, [2, 8, 4, 4], 1], ["SP", 4, 15, 307, [1, 1], 1], ["RE", 4, [0, 5, 10, 1, 6, 11, 2, 7, 12, 15, 16, 3, 8, 13, 17, 4, 9, 14]], ["FSP", 5, 0, 1, 3], ["FSP", 5, 4, 2, 3], ["FSP", 5, 8, 3, 3], ["RE", 5, [0, 4, 8, 1, 5, 9, 2, 6, 10, 3, 7, 11]], ["CA", 4, 5, 8], ["CHR", 3, "shared", [4]], ["CA", 4, 5, 9], ["CHR", 2, "shared", [5]], ["CA", 3, 6, 9], ["CI", 2], ["FU", 7, [0, 1, 2]], ["AN", 7, 0, 5], ["FU", 7, [1, 2, 3]], ["AN", 7, 1, 4], ["FU", 7, [2, 3, 4]], ["AN", 7, 2, 6], ["FU", 5, [0, 1, 2]], ["SP", 5, 0, 8, [1], 1], ["AN", 5, 1, 2], ["FFSP", 5, 0, [3, 2, 1], 1, 1], ["AN", 5, 1, 6], ["FU", 3, [0, 1, 2]], ["SP", 3, 0, 128, [1], 1], ["AN", 3, 1, 2], ["FFSP", 3, 0, [3, 2, 1], 1, 1], ["AN", 3, 1, 6], ["PR", 6, 0, "auto_unroll_max_step$512"]]]], "r": [[0.00705863], 0, 10.2607, 1678515333], "v": "v0.6"}
{"i": [["[\"tw_kernel\", 1024, 1024, 307, 16, 64, \"float32\"]", "cuda -keys=cuda,gpu -arch=sm_70 -max_num_threads=1024 -model=unknown -thread_warp_size=32", [-1, 16, 64, 49152, 2147483647, 1024, 8, 32], "", 0, ["mask_k"]], [[], [["CHW", 4, "local"], ["SP", 4, 0, 64, [1, 1, 2, 1], 1], ["SP", 4, 5, 16, [1, 2, 2, 4], 1], ["SP", 4, 10, 1024, [1, 256, 1, 2], 1], ["SP", 4, 15, 307, [1, 1], 1], ["RE", 4, [0, 5, 10, 1, 6, 11, 2, 7, 12, 15, 16, 3, 8, 13, 17, 4, 9, 14]], ["FSP", 5, 0, 1, 3], ["FSP", 5, 4, 2, 3], ["FSP", 5, 8, 3, 3], ["RE", 5, [0, 4, 8, 1, 5, 9, 2, 6, 10, 3, 7, 11]], ["CA", 4, 5, 8], ["CHR", 3, "shared", [4]], ["CA", 4, 5, 9], ["CHR", 2, "shared", [5]], ["CA", 3, 6, 9], ["CI", 2], ["FU", 7, [0, 1, 2]], ["AN", 7, 0, 5], ["FU", 7, [1, 2, 3]], ["AN", 7, 1, 4], ["FU", 7, [2, 3, 4]], ["AN", 7, 2, 6], ["FU", 5, [0, 1, 2]], ["SP", 5, 0, 8, [1], 1], ["AN", 5, 1, 2], ["FFSP", 5, 0, [3, 2, 1], 1, 1], ["AN", 5, 1, 6], ["FU", 3, [0, 1, 2]], ["SP", 3, 0, 4, [2], 1], ["AN", 3, 1, 2], ["FFSP", 3, 0, [3, 2, 1], 1, 1], ["AN", 3, 1, 6], ["PR", 6, 0, "auto_unroll_max_step$16"]]]], "r": [[0.000243992], 0, 0.955339, 1678515333], "v": "v0.6"}
